db_id,name,rating,reviews_cnt,year,pages_cnt,publisher,genre,author,lang,description,price_from,price_to,unparsed
n673188644,Chrám Matky Boží v Paříži A1/A2 – Konvičková Lucie,0,0,2017,120,,naučná,francouzské</p>,,"Učte se francouzsky s nejznámějším příběhem o lásce a vášni ze samotného srdce Paříže. Přečtěte si příběh o překrásné Esmeraldě a o mužích, kteří propadli jejímu kouzlu....",138,199,"['naučná', '', 'francouzské']"
n544595099,Betrachtung N – Kafka Franz,0,0,2017,80,,naučná,německé</p>,,"Toto pro školu a studium obzvlášť vhodné vydání předkládá nejenom text s kresbami, ale přináší i informativní obrazový příspěvek, který stručně a pregnantně informuje o...",196,225,"['naučná', '', 'německé']"
n522319920,Vida y obra de Juan Bosch en el contexto de la historia de la República Dominicana Ibero-Americana Supplementum 46 - Josef Opatrný,0,0,2017,140,španělské,naučná,Karolinum</p>,,"Španělská monografie je věnována životu a dílu Juana Bosche, výrazné osobnosti dějin nejen Dominikánské republiky, ale i celé Latinské Ameriky. Juan Bosch proslul kvalitou své...",191,240,"['naučná', '', 'španělské, Karolinum']"
n52457059,Carta al padre,0,0,2017,88,,naučná,španělské</p>,,Nikdy neodeslaný „Dopis otci (1919) je považován za klíč k literárnímu dílu Franze Kafky (1883-1924). Toto působivé svědectví dramatického konfliktu mezi otcem a synem lze...,209,225,"['naučná', '', 'španělské']"
n41863939,Cuentos Austríacos (Š),0,0,2017,48,,naučná,španělské</p>,,"„Vozíčku, přilep je!“ zvolá řízný chlapík, který si chce namluvit královskou dceru, a už jsou všichni přilepení k jeho kouzelnému vozíku: umouněný kominík, nezvedený pekařský...",184,198,"['naučná', '', 'španělské']"
n494436913,Medizinrecht – fachübergreifend,0,0,2017,162,,naučná,německé</p>,,"SAMMELBUCH bestehend aus den Beiträgen, die am internationalen wissenschaftlichen Seminar anlässlich des 15. Jubiläums der Verabschiedung von Charta der Patientenrechte in der...",745,779,"['naučná', '', 'německé']"
n673234035,"Klett Maximal interaktiv 1: Pracovný zošit - Julia Katharina Weber, Lidija Šober a kol.",0,0,2017,87,německé,naučná,Klett</p>,,Pracovný zošit Klett Maximal interaktiv 1 pre úroveň A1.1.. Klett Maximal interaktiv ponúka úplne nový prístup k vyučovaniu nemčiny v novom storočí. Sada Klett Maximal...,180,180,"['naučná', '', 'německé, Klett']"
n522929614,Hablamos : manual de conversación para estudiantes de espanol,0,0,2017,106,španělské,naučná,Editorial Circulo Rojo</p>,,"Hablamos je učebnica zameraná na konverzáciu v španielskom jazyku navrhnutá profesormi, určená pre výučbu španielčiny ako cudzieho jazyka, za účelom uľahčiť každodennú výuku....",458,626,"['naučná', '', 'španělské, Editorial Circulo Rojo']"
