db_id,name,rating,reviews_cnt,year,pages_cnt,publisher,genre,author,lang,description,price_from,price_to,unparsed
n41864373,Pražskij Golem,0,0,2018,64,,naučná,ruské</p>,,Již mnoho století patří Praha k nejvýznamnějším městům evropské židovské kultury. Kromě kamenných památek židovského města jsou to zejména pověsti a legendy starého a...,119,153,"['naučná', '', 'ruské']"
n95718953,Mucha (R) Neugebauer Roman,0,0,2018,80,,naučná,ruské</p>,,"Jako malíř svůdně krásných panneau a plakátů je Alfons Mucha světoznámý. Jako dekorativní malíř vtiskl podobu celé jedné epoše: ""Le Style Mucha"" je kolem roku 1900 považován za...",225,225,"['naučná', '', 'ruské']"
n191850355,Elizaveta. Imperatrica Avstrii –,0,0,2018,80,,naučná,ruské</p>,,Rakousko v roce 1854: Mladá bavorská vévodkyně Alžběta podává rakouskému císaři Františku Josefovi ve slavnostně vyzdobeném vídeňském kostele sv. Augustina ruku k manželskému...,185,225,"['naučná', '', 'ruské']"
n620115118,Egon Schiele - Roman Neugebauer,0,0,2018,104,,naučná,ruské</p>,,"Výjimečný talent a génius; senzibilní tvůrce tichých krajin i umělec znázorňující sám sebe bez známek studu, jenž dokázal vytvořit 170 svých autoportrétů; věčné dítě a manický...",209,270,"['naučná', '', 'ruské']"
n617184035,Klimt - ruská verze - Harald Salfellner,0,0,2018,104,,naučná,ruské</p>,,"Je legendárním knížetem malířů art nouveau, zakladatelem vídeňské Secese. Jeho obrazy dosahují na aukcích rekordních cen. Tváře dam z jeho slavných portrétů září z kávových...",209,270,"['naučná', '', 'ruské']"
