db_id,name,rating,reviews_cnt,year,pages_cnt,publisher,genre,author,lang,description,price_from,price_to,unparsed
n265348998,Beseda i ekzámen –,83,3,2015,144,ruské,naučná,Fraus</p>,,"úroveň A2 - B1 / B2 dle SERR

Publikace je vhodná jako rozšiřující vzdělávací materiál k jakékoliv učebnici ruštiny na středních a jazykových školách.

Obsah je vhodně...",230,319,"['naučná', '', 'ruské, Fraus']"
n303916765,Stručné dějiny českých zemí,0,0,2015,104,ruské,naučná,Práh</p>,,Známý český historik a popularizátor historie vybral a poutavě napsal nejzajímavější příběhy z české historie od nejstarších dob po současnost. Kniha určená zahraničním...,171,250,"['naučná', '', 'ruské, Práh']"
n247169806,"Tajemné příběhy o životě a smrti + CD audio, MP3",0,0,2015,160,ruské,naučná,Albatros Media a. s.</p>,,"Publikace představuje tři krátká díla ruských klasiků, která spojuje téma mystiky a tajemství v lidském životě. Je určena mírně pokročilým studentům ruštiny, kteří chtějí...",201,289,"['naučná', '', 'ruské, Albatros Media a. s.']"
n266135999,Práh s.r.o. Pražský orloj / rusky,0,0,2015,72,ruské,naučná,Práh</p>,,Nejnavštěvovanější památka historického centra Prahy – Staroměstský neboli Pražský orloj je právem hodnocen jako nejzachovalejší středověký orloj. Proč tomu tak je? Jaké časy...,183,250,"['naučná', '', 'ruské, Práh']"
n300876552,Mozart - R - 2015 – Salfellner Harald,0,0,2015,80,,naučná,ruské</p>,,"Jednoho chladného lednového večera roku 1756 se v salcburské Getreidegasse narodí dítě, jehož jméno bude jednou známo na celém světě: Wolfgang Amadeus Mozart. Jako malý chlapec...",209,225,"['naučná', '', 'ruské']"
n474683035,Lučšije recepty imperskoj kuchni R – Selfellner Harald,0,0,2015,80,,naučná,ruské</p>,,"Na celé zeměkouli se dnes vaří a pečou speciality, jež mají svůj původ v zemích rakouské monarchie. Velká porce vynalézavosti, okořeněná několika pořádnými špetkami českého a...",218,225,"['naučná', '', 'ruské']"
