db_id,name,rating,reviews_cnt,year,pages_cnt,publisher,genre,author,lang,description,price_from,price_to,unparsed
n537851576,"základy práva pro střední a vyšší odborné školy, 15. vydání - UT16",98,2,2017,440,C.H.Beck,naučná,české</p>,,Učebnice Základy práva pro střední a vyšší odborné školy svým 15. vydání dovršuje již dvacátý rok své existence. Nové vydání se přidržuje tradičního osvědčeného schématu a v...,502,590,"['C.H.Beck, naučná', '', 'české']"
n475902771,"Rodinné právo, 2. vydání - AI20",0,0,2017,400,C.H.Beck,naučná,české</p>,,"Druhé vydání učebnice rodinného práva je aktualizované, v některých částech i podstatně přepracované. V aktualizovaném vydání bylo nutné reagovat na nemnohé legislativní změny,...",722,998,"['C.H.Beck, naučná', '', 'české']"
n557749395,"Odpovědnost za škodu při výkonu veřejné moci. Komentář, 4. vydání - EKZ189",0,0,2017,440,C.H.Beck,naučná,české</p>,,"Již čtvrté vydání úspěšného komentáře k odpovědnosti za škodu způsobené při výkonu veřejné moci znovu shrnuje vývoj, k němuž v aplikaci tohoto zákona v praxi došlo. Publikace...",841,990,"['C.H.Beck, naučná', '', 'české']"
n555295480,"Autorský zákon. Komentář, 5. vydání - BK63",90,1,2017,392,C.H.Beck,naučná,české</p>,,"Páté vydání komentáře reflektuje aktuální legislativní změny a judikaturu. Autorský zákon nově obsahuje například úpravu osiřelých děl, karikatury a parafráze nebo komplexní...",890,990,"['C.H.Beck, naučná', '', 'české']"
n543102606,Advokátní právo - VP7,60,1,2017,360,C.H.Beck,naučná,české</p>,,"Publikace se zabývá předpisy, jež se týkají advokacie, v nejširším slova smyslu. 
Již ze samotné preambule vyplývá, že výklad zahrnuje spektrum od zákonů nejvyšší právní síly...",926,1,"['C.H.Beck, naučná', '', 'české']"
n534342157,"Práva k průmyslovému vlastnictví - Milana, Králíčková Zdeňka, Westphalová Lenka Hrušáková",0,0,2017,384,C.H.Beck,naučná,české</p>,,"Předkládaná publikace je dalším, třetím, vydáním učebnice Práva k průmyslovému vlastnictví dává teoretické i praktické odpovědi na problematiku průmyslového vlastnictví poprvé...",756,890,"['C.H.Beck, naučná', '', 'české']"
n567391812,CISG (Úmluva OSN o smlouvách o mezinárodní koupi zboží). Komentář - EKZ148,0,0,2017,440,C.H.Beck,naučná,české</p>,,Úmluva OSN o smlouvách o mezinárodní koupi zboží (zkráceně CISG – začáteční písmena Convention International Sales of Goods) je právním nástrojem zavazujícím v současné době 85...,841,990,"['C.H.Beck, naučná', '', 'české']"
n445396589,"Zákon o právu shromažďovacím. Komentář, 2. přepracované vydání - BK52",0,0,2017,368,C.H.Beck,naučná,české</p>,,"Komentář reaguje na komplexní novelu zákona o právu shromažďovacím č. 252/2016 Sb., účinnou od 1. 11. 2016. V publikaci je dále zahrnuta dosavadní judikatura všech českých...",842,990,"['C.H.Beck, naučná', '', 'české']"
