db_id,name,rating,reviews_cnt,year,pages_cnt,publisher,genre,author,lang,description,price_from,price_to,unparsed
n143755935,Kočky by kupovaly myši - Hans-Ulrich Grimm,96,11,2013,228,Pragma,naučná,české</p>,,"Pokud někdo věří reklamě, je prý pro naše zvířata dost dobré jen to nejlepší. Realita vypadá jinak: „chutné“ krmivo pro psy a kočky se vyrábí v čarodějné kuchyni z všeho...",130,198,"['Pragma, naučná', '', 'české']"
n137627925,Zlatá aromaterapie - Patel Rocky,90,2,2013,204,Pragma,naučná,české</p>,,"Symfonie barevných energií a aromatických vůní
V knize Zlatá aromaterapie vás autor seznámí se světem aromaterapie, zejména pak s esenciálními oleji a jejich použitím. V této...",144,180,"['Pragma, naučná', '', 'české']"
n111345156,50 nejlepších rad pro úspěšné kouče,0,0,2013,232,Pragma,naučná,české</p>,,"Kompletní poradenství k obohacování lidí.  Jako kouč potřebujete vědět, jak z lidí dostat to nejlepší, jak klást jasné  otázky a také rozeznat, zda je třeba poskytnout výzvu...",210,280,"['Pragma, naučná', '', 'české']"
n83514342,"To, co vám dá výhodu, je, jak k tomu přistoupíte",98,1,2013,176,Pragma,naučná,české</p>,,"To, co vám dá výhodu, je, jak k tomu přistoupíte

Jak mohou dva lidé se stejnými dovednostmi a schopnostmi a ve stejné situaci skončit s naprosto rozdílnými výsledky. John C....",149,220,"['Pragma, naučná', '', 'české']"
n111345148,Květová terapie,100,4,2013,224,Pragma,naučná,české</p>,,"Každá květina má svoji léčivou schopnost, která přispívá k fyzickému a emočnímu zdraví. V rámci této knihy Vám autoři ukážou metody práce s energií květů např. sezení u...",188,188,"['Pragma, naučná', '', 'české']"
n137314561,"Vše, co znamená úspěch, mě naučil Napoleon Hill - Don M. Green",100,1,2013,216,Pragma,naučná,české</p>,,Ve své knize shrnuje autor Don Green zásadní principy filozofie Napoleona Hilla a na příkladu mnoha známých osobností dokazuje univerzální rozměr Hillových myšlenek. Každý z...,171,228,"['Pragma, naučná', '', 'české']"
n96880003,Dělej co máš rád,0,0,2013,190,Pragma,naučná,české</p>,,"Úspěšná kniha o osobním růstu, která pojednává o sepětí mezi seberealizací a úspěchem ve zvolené profesi. Uvádí četné příklady lidí, kteří šli za tím, co měli rádi spíš, než...",82,120,"['Pragma, naučná', '', 'české']"
