db_id,name,rating,reviews_cnt,year,pages_cnt,publisher,genre,author,lang,description,price_from,price_to,unparsed
n310349226,"Iracionálně váš… - Úvahy o ztracených ponožkách, šroubech do dívčích hlav a dalších existenciálních záležitostech",0,0,2015,228,Práh,naučná,české</p>,,"- Jak postupovat nejefektněji při návštěvě restaurace typu „Sněz, co můžeš“?
- Kolik stojí lidská duše?
- Jak mám své ženě odůvodnit, že jsem utratil tisíce dolarů za rolexky?...",201,243,"['Práh, naučná', '', 'české']"
n355332680,"Iracionálně váš… - Úvahy o ztracených ponožkách, šroubech do dívčích - Ariely Dan",83,1,2015,228,Práh,naučná,české</p>,,"- Jak postupovat nejefektněji při návštěvě restaurace typu „Sněz, co můžeš“?
- Kolik stojí lidská duše?
- Jak mám své ženě odůvodnit, že jsem utratil tisíce dolarů za rolexky?...",242,248,"['Práh, naučná', '', 'české']"
n261265631,Jak přežít první - krok,0,0,2015,176,Práh,naučná,české</p>,,"Co znamená být na všechno sama? Dennodenně čelit psychické i fyzické agresi, navíc od toho nejbližšího člověka? Přicházet domů se strachem? Bát se kvůli nezodpovědnému...",132,194,"['Práh, naučná', '', 'české']"
n303916763,Stručné dějiny českých zemí,0,0,2015,193,Práh,naučná,české</p>,,Známý český historik a popularizátor historie vybral a poutavě napsal nejzajímavější příběhy z české historie od nejstarších dob po současnost. Kniha určená zahraničním...,171,299,"['Práh, naučná', '', 'české']"
