db_id,name,rating,reviews_cnt,year,pages_cnt,publisher,genre,author,lang,description,price_from,price_to,unparsed
n169273814,Efektivita vzdělávání Jaroslava Ester Evangelu,0,0,2014,136,KEY Publishing,naučná,české</p>,,"Publikace je bohatým zdrojem inspirace pro pracovníky z oblasti personalistiky, rozvoje lidských zdrojů a managementu. Systematicky a prakticky vede čtenáře:
- aby proces...",155,220,"['KEY Publishing, naučná', '', 'české']"
n516205375,Tradice pěstounské péče v českých zemích - Veronika Smolíková,100,1,2014,78,KEY Publishing,naučná,české</p>,,Tato publikace podává ucelený pohled na vývoj pěstounské péče v českých zemích a nastiňuje vznik tradice pěstounské péče jako jednoho ze způsobů realizace náhradní rodinné...,127,144,"['KEY Publishing, naučná', '', 'české']"
n246529558,"Obchodní korporace a jejich přeměny - Bohumila Salachová, Bohumil Vítek...",100,1,2014,148,KEY Publishing,naučná,české</p>,,"Předkládaná odborná publikace se zabývá jedním ze zásadních témat současnosti, a to vzhledem ke skutečnosti, že k 1. lednu 2014 nabyl účinnosti nový právní předpis – zákon...",173,230,"['KEY Publishing, naučná', '', 'české']"
n181886375,"Manažerská komunikace v multikulturním prostředí - Ester Jaroslava Evangelu, Zalán Gasparics",0,0,2014,115,KEY Publishing,naučná,české</p>,,"Manažerská komunikace v multikulturním prostředí: 
- kariéra českého manažera v zahraniční firmě
- specifika komunikace a řízení v multikulturní firmě
- nástrahy spolupráce...",177,224,"['KEY Publishing, naučná', '', 'české']"
n182535008,Billboard součást outdoorové reklamy aneb Žijeme... Klára Masařová,0,0,2014,154,KEY Publishing,naučná,české</p>,,"První odborná publikace na téma outdoorové reklamy v českém prostředí. Autorka se tématem dlouhodobě zabývá a podařilo se jí shromáždit všechny podstatné informace o historii,...",170,282,"['KEY Publishing, naučná', '', 'české']"
n215965944,"Vhled do právní úpravy českého obchodního práva - 2. díl - Padrnos, Jaroslav",0,0,2014,91,KEY Publishing,naučná,české</p>,,"Publikace je určena každému, kdo je veden přáním se obeznámit se základy současného českého obchodního práva, především však jako pomocná studijní literatura posluchačům...",159,172,"['KEY Publishing, naučná', '', 'české']"
n169273813,Evropeizace českého práva Bohumil Vítek,0,0,2014,154,KEY Publishing,naučná,české</p>,,"Odborná publikace se zabývá jedním ze zásadních problémů, před jehož řešení byla a je postavena česká právní věda v posledních desetiletích. Otázka evropeizace práva je z...",222,250,"['KEY Publishing, naučná', '', 'české']"
n516206591,Diversity Management - Karina Mužáková,0,0,2014,69,KEY Publishing,naučná,české</p>,,"Monografie Diversity Management jeden z klíčových faktorů určující úspěšnost manažerských činností v současném globálním a turbulentně se měnícím prostředí"" od autorky Kariny...",105,164,"['KEY Publishing, naučná', '', 'české']"
