db_id,name,rating,reviews_cnt,year,pages_cnt,publisher,genre,author,lang,description,price_from,price_to,unparsed
n25060175,Uzdrav svá vnitřní zranění - Lise Bourbeau,94,16,2011,224,Eugenika,naučná,české</p>,,"Autor : Lise Bourbeau, Popis : 
 Autorka dokazuje, že všechny problémy mají kořeny v pěti základních zraněních, kterými jsou: odmítnutí, opuštění, ponížení, zrada a křivda....",171,278,"['Eugenika, naučná', '', 'české']"
n22649896,Energie pokojových rostlin,82,3,2011,192,Eugenika,naučná,české</p>,,"Autorka Jelena Mazovová v knize Energie pokojových rostlin velmi hezky i prakticky popisuje, jak působí jednotlivé druhy běžně pěstovaných rostlin na naši psychiku, zdravotní...",146,228,"['Eugenika, naučná', '', 'české']"
n42895114,Hledání dokonalého partnera - Anatolij Někrasov,0,0,2011,216,Eugenika,naučná,české</p>,,"Anatolij Někrasov/ Eugenika, brožovaná, 214 stran.
Téma hledání dokonalého partnera (své druhé polovičky) je velice zajímavé a důležité. Autor se snažil tomuto problému...",159,248,"['Eugenika, naučná', '', 'české']"
n37498177,Moudrost indických mudrců - Tomáš Avramov,0,0,2011,218,Eugenika,naučná,české</p>,,Moudrost indických mistrů kniha od autora Tomáš Avramov. Kniha seznamuje čtenáře čtivou a srozumitelnou formou se životem a myšlenkami tří významných duchovních osobností...,162,205,"['Eugenika, naučná', '', 'české']"
n39913649,Přijmout bohatství života,0,0,2011,184,Eugenika,naučná,české</p>,,"V současnosti se i v duchovní oblasti hodně mluví a píše o bohatství. Na toto téma se vyjadřuje i známý ruský autor Anatolij Někrasov - psycholog, filozof, odborník na...",305,305,"['Eugenika, naučná', '', 'české']"
