db_id,name,rating,reviews_cnt,year,pages_cnt,publisher,genre,author,lang,description,price_from,price_to,unparsed
n486168226,Žít feng šuej v našich podmínkách,85,2,2017,220,Alpress,beletrie,české</p>,,"Feng-šuej klade důraz na prostředí, uspořádání interiéru, napomáhá odstraňovat škodlivé jevy, nepříznivě působící na zdraví a harmonii života. Novelizované vydání ukazuje i...",196,275,"['Alpress, beletrie', '', 'české']"
n457353371,"Guta Habsburská - slabý král, mladá královna a mocný Záviš",100,1,2017,176,Alpress,beletrie,české</p>,,"Guta Habsburská stojí po boku Václava, Přemyslovce, kterým pro jeho strach ze tmy a koček nemálo českých pánů pohrdá, byť se má Václav brzy stát jejich králem. Guta si klade...",152,218,"['Alpress, beletrie', '', 'české']"
n546602677,Královna Žofie a Václav IV. - Láska na vratkém trůnu,100,1,2017,228,Alpress,beletrie,české</p>,,Královna Žofie a Václav IV. -Láska na vratkém trůnu kniha od autora Jaroslava Černá. Mladý Václav IV. se nemůže dočkat sňatku s půvabnou Žofií. Avšak královna brzy po svatbě...,178,269,"['Alpress, beletrie', '', 'české']"
n571164503,Největší skandály a aféry v českých dějinách,0,0,2017,184,Alpress,beletrie,české</p>,,"Některé skandály proniknou na veřejnost, jiné se daří tajit a stanou se později předmětem dohadů, ale vždy mají své hrdiny a oběti. Čtenář nahlédne do pikantního milostného...",167,265,"['Alpress, beletrie', '', 'české']"
n546602676,Smrtící byznys,100,1,2017,208,Alpress,beletrie,české</p>,,"Ellen dorazí do Ugandy, země plné bídy, aby na zdejší klinice pomáhala trpícím dětem. Iluze o léčbě ji brzy přejdou. Děti, které dostaly falešné léky na malárii, totiž umírají....",168,239,"['Alpress, beletrie', '', 'české']"
n478238556,"České, moravské a slezské zámky",100,1,2017,194,Alpress,beletrie,české</p>,,"Zámky jsou jevištěm zašlých časů i života české a moravské aristokracie. Právě tam se odehrály pohnuté události naší historie. Český Krumlov, Lednice, Telč, Buchlovice a další...",119,256,"['Alpress, beletrie', '', 'české']"
n556854137,Střípek malachitu - Hanka Zdeněk,0,0,2017,224,Alpress,beletrie,české</p>,,"Autor : Zdeněk Hanka, Popis : 
 Gina hlasitě vzlykala, cítila tu past, beznaděj a hroznou vinu. Nejenže přejela člověka, ale zničila život i svému manželu Alanovi, úspěšnému...",182,256,"['Alpress, beletrie', '', 'české']"
n469633993,Randit můžeš až od čtyřiceti - Barry Dave,0,0,2017,192,Talpress,beletrie,české</p>,,"Opět sbírka fejetonů od známého a u nás oblíbeného autora. Tato kniha s podtitulem „Dave Barry o rodičovství a jiných tématech, o nichž toho ví jen velmi málo"" čtenáře rozhodně...",149,229,"['Talpress, beletrie', '', 'české']"
n478650667,Zn. Blondýna hledá ...,0,0,2017,192,Alpress,beletrie,české</p>,,"Autor : Blanka Svobodová, Popis : Známe to – klasické randíčko – kytka, káva, oťukávání, další schůzka, polibek, další káva, tokání, milování… Nuda! Dorota si poprvé v životě...",119,253,"['Alpress, beletrie', '', 'české']"
