db_id,name,rating,reviews_cnt,year,pages_cnt,publisher,genre,author,lang,description,price_from,price_to,unparsed
n269077513,Pořád jsem to já - Lisa Genova,99,10,2015,244,Práh,beletrie,české</p>,,"Oscarový film – Oscar Herečka v hlavní roli Julianne More

Strhující příběh profesorky psychologie, která kvůli nevyléčitelné nemoci postupně ztrácí paměť a vzpomínky. Přesto...",254,254,"['Práh, beletrie', '', 'české']"
n307520637,Trhlina v čase. SHAKESPEARE 400 - Jeanette Wintersonová - Práh,0,0,2015,296,Práh,beletrie,české</p>,,"Pozdní hra Williama Shakespeara Zimní pohádka je proslulá mimo jiné umístěním Čech na břeh moře. Líčí chorobnou žárlivost sicilského vladaře Leonta, který choť Hermionu...",261,319,"['Práh, beletrie', '', 'české']"
n269077514,"Vídeňské nokturno. Zpěv, láska a božský Amadeus - Vivien Shotwellová - Práh",0,0,2015,288,Práh,beletrie,české</p>,,"Román Vídeňské nokturno, literární debut americké operní pěvkyně Vivien Shotwellové, je na historické detaily bohatý a skvěle vyprávěný příběh o mimořádném boji ženy snažící se...",247,314,"['Práh, beletrie', '', 'české']"
n276337342,Sedm divů. Napínavý detektivní příběh plný historických záhad - Ben Mezrich - Práh,0,0,2015,304,Práh,beletrie,české</p>,,"Napínavá detektivka plná historických záhad, tajných společenství a intrik, která hledá odpověď na jednu otázku: Má sedm starověkých divů světa něco společného s těmi...",261,332,"['Práh, beletrie', '', 'české']"
n268030633,Carova tajná dcera Jennifer Laamová,0,0,2015,288,Práh,beletrie,české</p>,,"Ve svém strhujícím románovém debutu Carova tajná dcera autorka Jennifer Laamová splétá dohromady příběhy tří žen: Veroniky, Leny a Charlotty. Veronika je ctižádostivá...",223,265,"['Práh, beletrie', '', 'české']"
