db_id,name,rating,reviews_cnt,year,pages_cnt,publisher,genre,author,lang,description,price_from,price_to,unparsed
n601939812,"Jak se učí živě. Rozhovory o inovativních školách - Lucie Kramperová, Jan Kršňák",100,4,2018,336,DharmaGaia,beletrie,české</p>,,"První dokumentární kniha o českých inovativních, alternativních, komunitních a lesních školách.
Rozhovory se zakladateli, řediteli a průvodci – s lidmi, kteří se rozhodli učit...",259,368,"['DharmaGaia, beletrie', '', 'české']"
n601939813,Krajiny japonské duše. Patnáct esejů o moderní japonské literatuře - Antonín Líman,100,1,2018,362,DharmaGaia,beletrie,české</p>,,"Antonín Líman (1932), znalec japonské kultury a literatury,
překladatel a pedagog, jenž třicet let působil na zahraničních
univerzitách, v knize předkládá kritický rozbor...",273,369,"['DharmaGaia, beletrie', '', 'české']"
