db_id,name,rating,reviews_cnt,year,pages_cnt,publisher,genre,author,lang,description,price_from,price_to,unparsed
n8842919,Jak na krizi: 33 okamžitých opatření pro vaši firmu - Simon Hermann,0,0,2009,204,Management Press,naučná,české</p>,,"Aktuální kniha šéfa jedné z nejvýznamnějších mezinárodních poradenských firem předkládá konkrétní aktivní protikrizová opatření, která mohou vlastníci a manažeři podniků...",202,299,"['Management Press, naučná', '', 'české']"
n440144,"Time management, Efektivní hospodaření časem",0,0,2009,232,Management Press,naučná,české</p>,,"Pozdní příchody, přesouvání pracovních schůzek, odkládání či dokonce neplnění pracovních úkolů, vyrušování sebe i druhých, to vše patří v současné době mezi ""nešvary""...",159,319,"['Management Press, naučná', '', 'české']"
n6930533,Vědomí naléhavosti - Kotter P. John,0,0,2009,224,Management Press,naučná,české</p>,,"První a nejdůležitější krok realizace změny
Víte, že se vaše organizace musí změnit. Možná dokonce víte i to, o jakou změnu by ve vašem případě mělo jít: o novou strategii, o...",237,348,"['Management Press, naučná', '', 'české']"
n6938062,"Synergie v moderním managementu - Leo Vodáček, Olga Vodáčková",0,0,2009,172,Management Press,naučná,české</p>,,Nová kniha předních domácích odborníků a zkušených autorů L. Vodáčka a O. Vodáčkové Synergie v moderním managementu předkládá čtenářům jeden z dosud velmi diskusních a ne zcela...,220,290,"['Management Press, naučná', '', 'české']"
n43257839,Konec marketingu,0,0,2009,216,Management Press,naučná,české</p>,,"Marketingový génius, který během pěti let dokázal zvýšit tržní hodnotu firmy Coca-Cola z 56 na 193 mld. dolarů, jak jej již známe i jak jsme jej dosud neznali. Inspirující....",290,410,"['Management Press, naučná', '', 'české']"
