db_id,name,rating,reviews_cnt,year,pages_cnt,publisher,genre,author,lang,description,price_from,price_to,unparsed
n673187975,Strážkyňa krištáľov: Posledný drak - Jess Black,0,0,2018,88,Computer Press,dětské,slovenské</p>,,"Autor : Jess Blacková, Popis : Strážkyňa krištáľov Dobrodružné príbehy plné fantázie, tajomstiev a čarovných svetov, kde ľudia môžu komunikovať s jednorožcami, tigrami, drakmi...",153,156,"['Computer Press, dětské', '', 'slovenské']"
n673237897,Strážkyňa krištáľov: Slzy morských panien - Jess Black,0,0,2018,80,Computer Press,dětské,slovenské</p>,,"Čarovný svet, v ktorom deti môžu hovoriť so zvieratamiEva s Oskarom sa ocitnú v ríši, kde vlnám vládnu zabijackí piráti a jediným jazykom je reč mora. Morské panny nutne...",157,158,"['Computer Press, dětské', '', 'slovenské']"
n673188181,LEGO Disney Princesses: Zoznám sa s princeznami,0,0,2018,32,Computer Press,dětské,slovenské</p>,,"Pripoj sa k svojim obľúbeným princeznám v tejto čarovnej LEGO® Disney Princezná™ knihe aktivít. Postav Popoluškinej kamarátke myške dom, zahraj sa na schovávačku s Aurorou,...",209,209,"['Computer Press, dětské', '', 'slovenské']"
n680686904,LEGO Disney Princezná: Čas na hranie pre princezné,0,0,2018,32,Computer Press,dětské,slovenské</p>,,"Vitaj v čarovnom svete LEGO® Vitaj v čarovnom svete LEGO® Disney Princezná™ – plnom nádherných snov, hradov, večierkov a priateľstiev. Poskladaj Sebastiánovu tajomnú lastúru,...",209,209,"['Computer Press, dětské', '', 'slovenské']"
n673190427,LEGO Disney Princezná: Tajomná záhrada,0,0,2018,0,Computer Press,dětské,slovenské</p>,,Postav minisúpravu priloženú k tejto knihe. Umiestni minisúpravu na trojrozmernú hraciu plochu. Pridaj svoje vlastné hračky lego® na trojrozmernú hraciu plochu. Hraj sa s...,287,287,"['Computer Press, dětské', '', 'slovenské']"
n673663326,Postav to - Lietadlo,0,0,2018,16,Computer Press,dětské,slovenské</p>,,"Žiadne lepidlo, žiadne nožnice, žiadny neporiadok!Postav si vlastný model klasického lietadla. Súbor obsahuje aj brožuru s inštruktážou krok za krokom, plnú úžasných faktov o...",392,392,"['Computer Press, dětské', '', 'slovenské']"
n673196631,LEGO CITY: Naháňačka vo vysokej rýchlosti,0,0,2018,0,Computer Press,dětské,slovenské</p>,,Postav! Postavaj podstavu z kociek priložených k tejto knihe.Skladaj! Poskladaj budovu zo svojich vlastných kociek a umiestni ju na podstavu. Pridaj! Pridaj podstavu s budovou...,404,404,"['Computer Press, dětské', '', 'slovenské']"
