db_id,name,rating,reviews_cnt,year,pages_cnt,publisher,genre,author,lang,description,price_from,price_to,unparsed
n90226408,Lolita - Vladimir Nabokov,100,4,2013,384,Paseka,beletrie,české</p>,,"Lolita, Lola, Lo, Lolitchen, Lottelita...Samotné jméno titulní hrdinky a jeho proměny, vyvolávající hravé i trýznivé asociace, naznačují od prvních řádek Nabokovova...",190,279,"['Paseka, beletrie', '', 'české']"
n259844353,Maurův poslední vzdech Kniha - Rushdie Salman,0,0,2013,400,Paseka,beletrie,české</p>,,"Mnohovrstevným životním příběhem ""Maura"" Moraese Zogoibyho, příslušníka bombajské obchodnické dynastie, potvrzuje světoznámý britský prozaik indického původu znovu svou pověst...",245,349,"['Paseka, beletrie', '', 'české']"
n72272711,Nahoře je ticho,0,0,2013,320,Paseka,beletrie,české</p>,,"Nahoře je ticho, románový debut talentovaného nizozemského prozaika, získal r. 2010 prestižní literární cenu IMPAC Dublin, jen v Nizozemsku se jej prodalo přes 100 000 výtisků...",207,269,"['Paseka, beletrie', '', 'české']"
n131400167,Slasti a neřesti,98,0,2013,412,Paseka,beletrie,české</p>,,"Kniha představuje to nejlepší z rozhovorů autorky s významnými
osobnostmi naší kultury a veřejného života, které vyšly v příloze
Pátek Lidových novin mezi roky 2000–2011....",175,249,"['Paseka, beletrie', '', 'české']"
n274991863,"To jsem já, Edáček",100,1,2013,326,Paseka,beletrie,české</p>,,"ISBN: 978-80-7432-281-5
nakladatel: Paseka, 2013
formát: brožovaná, 326 stran

Kultovní Limonovův román ze sedmdesátých let je autobiografickým obrazem autorova amerického...",243,243,"['Paseka, beletrie', '', 'české']"
