db_id,name,rating,reviews_cnt,year,pages_cnt,publisher,genre,author,lang,description,price_from,price_to,unparsed
n410681261,Účelové pozemní komunikace a jejich právní ochrana - Roman Kočí,0,0,2015,144,Leges,naučná,české</p>,,"Druhé vydání příručky pojednává zevrubně o problematice účelových pozemních komunikací s ohledem na zásadní novelu zákona o pozemních komunikacích zákonem č. 268/2015 Sb.,...",252,350,"['Leges, naučná', '', 'české']"
n321098955,Kompetenční výluky ve správním soudnictví,0,0,2015,128,Leges,naučná,české</p>,,"Monografie zachycuje reprezentativní obraz vývoje správního soudnictví na našem území až do současnosti, do něhož jsou zasazeny kompetenční výluky. 

Monografie je prací...",205,280,"['Leges, naučná', '', 'české']"
n259260661,Kunertová Tereza - Pracovník v Evropské unii,0,0,2015,160,Leges,naučná,české</p>,,"Monografie se zaměřuje na velmi aktuální problematiku volného pohybu osob napříč Evropskou unií.

Autorka se zabývá pozitivním i negativním vymezením unijního pracovníka, tj....",212,290,"['Leges, naučná', '', 'české']"
n358716831,Ochrana finančného spotrebiteľa - Jana Strémy,0,0,2015,136,Leges,naučná,české</p>,,"Monografia sa zaoberá ochranou finančného spotrebiteľa najmä z pohľadu verejného práva. Autorka sa pokúsila o prehľadné a systematické spracovanie témy, ktorá nebola doposiaľ...",212,290,"['Leges, naučná', '', 'české']"
