db_id,name,rating,reviews_cnt,year,pages_cnt,publisher,genre,author,lang,description,price_from,price_to,unparsed
n72845186,Tajuplné dětství,99,7,2012,184,Triton,naučná,české</p>,,"Maria Montessoriová (1870-1952) byla významná italská lékařka, antropoložka a pedagožka. Jako první žena v Itálii byla promována doktorkou medicíny, poté začala pracovat jako...",108,169,"['Triton, naučná', '', 'české']"
n478333363,Nakladatelství Triton s.r.o. Vyšetření hybných funkcí z pohledu neurofyziologie,0,0,2012,224,Triton,naučná,české</p>,,Předkládaná příručka pojednává o vyšetřování pohybových funkcí a terapii poruch pohybového chování. Autor vychází z vlastních praktických zkušeností získaných při klinickém...,176,232,"['Triton, naučná', '', 'české']"
n62441093,Evropa a absolutismus v 17. a 18. století (1648-1789) Jiří Hrbek,100,1,2012,208,Triton,naučná,české</p>,,Období evropských dějin mezi třicetiletou válkou a Francouzskou revolucí se vyznačovalo mimo jiné posílením centrální vlády na úkor samostatnosti jednotlivých regionů. Díky...,149,239,"['Triton, naučná', '', 'české']"
n57505951,Úvod do moderní psychoanalýzy - Jan Poněšický,0,0,2012,216,Triton,naučná,české</p>,,"Úvod do moderní psychoanalýzy. Autor Jan Poněšický v publikaci Úvod do moderní psychoanalýzy představuje psychoanalýzu jako napínavou, stále se vyvíjející a hledající vědu o...",162,249,"['Triton, naučná', '', 'české']"
n58176575,"Neurózy, psychosomatická onemocnění a psychoterapie - Jan Poněšický",0,0,2012,224,Triton,naučná,české</p>,,Jak a proč se tělo dává k dispozici pro neřešitelné či konfliktní situace? Jak se snaží kompenzovat psychologické nedostatky ve výstavbě osobnosti? Proč se tělo používá k...,199,199,"['Triton, naučná', '', 'české']"
n55665095,Internetová kriminalita páchaná na dětech - Lenka Hulanová,0,0,2012,224,Triton,naučná,české</p>,,"Internetová kriminalita páchaná na dětech je knihou, jejíž autorkou je Lenka Hulanová.

 Děti byly odjakživa snadnou kořistí pro pachatele jakékoli trestné činnosti, hlavně pro...",124,199,"['Triton, naučná', '', 'české']"
n45775822,Je zygota lidskou osobou? - Ide Pascal,0,0,2012,216,Triton,naučná,české</p>,,"Je zygota lidskou osobou?. Je lidská zygota (jinak řečeno oplozené vajíčko, výsledek sjednocení vajíčka a spermatozoidu) osobou? Jakkoliv různé mohou být odpovědi, můžeme je...",90,189,"['Triton, naučná', '', 'české']"
