db_id,name,rating,reviews_cnt,year,pages_cnt,publisher,genre,author,lang,description,price_from,price_to,unparsed
n148548477,Smlouva o dílo v novém občanském zákoníku. Komentář . § 2586-2635,68,0,2013,192,C.H.Beck,naučná,české</p>,,"S počátkem roku 2014 nabývá účinnosti nová komplexní úprava občanskoprávních vztahů, která se mimo jiné dotkne i oblasti smlouvy o dílo. Byť nová právní úprava navazuje na tu...",501,590,"['C.H.Beck, naučná', '', 'české']"
n141421245,Strategie řízení nákupu,85,2,2013,176,C.H.Beck,naučná,české</p>,,"Význam nákupu pro podnik se v posledních letech zásadně změnil. V minulosti byl nákup považován za podpůrnou funkci, jejímž úkolem bylo zajistit ve firmě dostatek materiálu,...",416,490,"['C.H.Beck, naučná', '', 'české']"
n85864703,Business strategie. Krok za krokem,100,1,2013,176,C.H.Beck,naučná,české</p>,,"Při vytyčování podnikatelských cílů je nejdůležitější včasné rozpoznání nových příležitostí a uvědomění si hrozeb, které mohou využití podnikatelských příležitostí zhatit. Ty...",265,390,"['C.H.Beck, naučná', '', 'české']"
n105851545,Správní trestání z hlediska praxe a judikatury,0,0,2013,206,C.H.Beck,naučná,české</p>,,"Výraznému fenoménu veřejné správy, kterým je její oprávnění projednávat a rozhodovat ve věcech správních deliktů a ukládat za ně sankce, se věnuje tato publikace.

Absence...",416,575,"['C.H.Beck, naučná', '', 'české']"
n362866014,Databáze ve věku informační společnosti a jejich právní ochrana - Radka Connelly Kohutová,0,0,2013,208,C.H.Beck,naučná,české</p>,,"Cílem publikace je předložit čtenářům teoretické pozadí a vhled do problematiky právní ochrany databází. Za tímto účelem autorka použila metody komparativní a analytickou,...",422,558,"['C.H.Beck, naučná', '', 'české']"
n132976863,Sociální právo,0,0,2013,192,C.H.Beck,naučná,české</p>,,"Druhé vydání úspěšné publikace pracuje s pojmem sociální právo, do kterého je zahrnuto jak právo sociálního zabezpečení, tak některé části pracovního práva, pokud v sobě...",458,704,"['C.H.Beck, naučná', '', 'české']"
n153705562,"Závazky ze smlouvy o účtu, jednorázovém vkladu, akreditivu a inkasu v novém občanském zákoníku. Kome",0,0,2013,228,C.H.Beck,naučná,české</p>,,Komentář k této části NObčZ si vytyčil úkol interpretovat předmětnou část nového kodexu. [Nová právní úprava opouští úpravu smlouvy o běžném účtu a smlouvy o vkladovém účtu a v...,270,630,"['C.H.Beck, naučná', '', 'české']"
n139330591,DPH u nemovitostí,0,0,2013,176,C.H.Beck,naučná,české</p>,,"Vydání publikace s tématikou daně z přidané hodnoty u nemovitostí je reakcí na opakující se problémy v aplikaci DPH v této oblasti. 
 Cílem publikace je podat čtenářům ucelený...",331,390,"['C.H.Beck, naučná', '', 'české']"
