db_id,name,rating,reviews_cnt,year,pages_cnt,publisher,genre,author,lang,description,price_from,price_to,unparsed
n111550572,Nevšední návrh,0,0,2013,256,Oldag,beletrie,české</p>,,"Romantický příběh z prostředí anglické aristokracie z poloviny 19. století.

Otec Abigail Shawové vlastní vydavatelství, které přestává prosperovat. Abigail usoudí, že náklad...",248,248,"['Oldag, beletrie', '', 'české']"
n106953555,Hříšník z Vysočiny,90,3,2013,248,Oldag,beletrie,české</p>,,"Romantický příběh ze skotské Vysočiny.

Známý sukničkář Tormand Murray se jednoho rána probudí vedle mrtvé milenky, kterou někdo před smrtí krutě mučil. Tormandovi je jasné, že...",251,251,"['Oldag, beletrie', '', 'české']"
n149362585,Nečekaný návrat,100,1,2013,248,Oldag,beletrie,české</p>,,"Když kapitán Matthew Leland, jenž údajně zahynul v bitvě, přijede domů do Madingley Courtu, jeho nejbližší nemůžou uvěřit svým očím. Překvapení však čeká i na něho, a to v...",248,265,"['Oldag, beletrie', '', 'české']"
n136616967,Tajné přátelství,0,0,2013,256,Oldag,beletrie,české</p>,,"Milostná historická romance z 19. století.
Slečna Violet Knowltonová ví, že Kit, chlapec, jehož potají pozoruje z okna, je nebezpečný a že by s ním neměla mít nic společného....",88,250,"['Oldag, beletrie', '', 'české']"
n259845178,Tajemství krásné léčitelky,0,0,2013,312,Oldag,beletrie,české</p>,,"Milostná historická romance ze skotského prostředí.

Píše se rok 1141. Rhoenne Guy de Ramhurst patří k nejvýznamnějším šlechticům ve Skotsku, ale své lenní panství si může...",104,248,"['Oldag, beletrie', '', 'české']"
n461315004,Umění svádět,0,0,2013,312,Oldag,beletrie,české</p>,,"Romantický příběh z prostředí pařížského uměleckého světa.

Smyslná a důvtipná romance, odehrávající se v uměleckém světě Paříže roku 1889, líčí příběh dvou postav, jež svede...",34,139,"['Oldag, beletrie', '', 'české']"
n97049690,Posmrtná spravedlnost,0,0,2013,264,Oldag,beletrie,české</p>,,"Thriller z amerického prostředí.

Světově uznávaný patolog a protřelý Newyorčan doktor Jake Rosen, zástupce hlavního koronera, se dává dohromady se svou kontroverzní partnerkou...",51,289,"['Oldag, beletrie', '', 'české']"
n82155430,Čas zázraků,0,0,2013,256,Oldag,beletrie,české</p>,,"Když Abigail Montrossové hrozí, že ji otec provdá za muže dvakrát tak starého, jako je ona, navíc s třinácti dětmi na krku, rozhodne se Abigail uprchnout s neodolatelně...",125,248,"['Oldag, beletrie', '', 'české']"
