db_id,name,rating,reviews_cnt,year,pages_cnt,publisher,genre,author,lang,description,price_from,price_to,unparsed
n521328909,Paris for One and Other Stories Jojo Moyes,0,0,2017,359,Penguin Books,beletrie,anglické</p>,,"Moyes somehow manages to break your heart before restoring your faith in love Sunday Express
A collection of 11 unmissable short stories from the number 1 internationally...",159,286,"['Penguin Books, beletrie', '', 'anglické']"
n497292312,Leaders Eat Last - Simon Sinek,0,0,2017,350,Penguin Books,beletrie,anglické</p>,,"The New York Times bestseller by the acclaimed, bestselling author of Start With Why and Together is Better. Now with a new chapter on millennials in the workplace, based on...",229,327,"['Penguin Books, beletrie', '', 'anglické']"
n485999906,Power,0,0,2017,338,Penguin Books,beletrie,anglické</p>,,"WINNER of the THE 2017 BAILEYS WOMEN'S PRIZE FOR FICTION
What if the power to hurt were in women's hands? Suddenly - tomorrow or the day after - teenage girls find that with a...",178,269,"['Penguin Books, beletrie', '', 'anglické']"
n522715365,Turtles All the Way Down John Green Hardcover,0,0,2017,336,Penguin Books,beletrie,anglické</p>,,"It all begins with a fugitive billionaire and the promise of a cash reward. Turtles All the Way Down is about lifelong friendship, the intimacy of an unexpected reunion, Star...",239,428,"['Penguin Books, beletrie', '', 'anglické']"
n464391394,The Upside of Unrequited (Becky Albertalli),0,0,2017,358,Penguin Books,beletrie,anglické</p>,,"Seventeen-year-old Molly Peskin-Suso knows all about unrequited love-she's lived through it twenty-six times. She crushes hard and crushes often, but always in secret. Because...",155,260,"['Penguin Books, beletrie', '', 'anglické']"
n491415471,Three Daughters of Eve,0,0,2017,368,Penguin Books,beletrie,anglické</p>,,"Set across Istanbul and Oxford, from the 1980s to the present day, Three Daughters of Eve is a sweeping tale of faith and friendship, tradition and modernity, love and an...",175,286,"['Penguin Books, beletrie', '', 'anglické']"
n476762698,Evicted,0,0,2017,432,Penguin Books,beletrie,anglické</p>,,'Essential. A compelling and damning exploration of the abuse of one of our basic human rights: shelter.' Owen Jones Arleen spends nearly all her money on rent but is kicked...,253,378,"['Penguin Books, beletrie', '', 'anglické']"
n465257198,Dear Amy: The Sunday Times Bestselling Psycho... (Helen Callaghan),0,0,2017,347,Penguin Books,beletrie,anglické</p>,,"Would you risk your life to save a stranger? Discover what happens next in the Sunday Times bestselling psychological thriller, Dear Amy ...A local schoolgirl has been missing...",177,286,"['Penguin Books, beletrie', '', 'anglické']"
n466150408,My Sisters Bones - Nuala Ellwood,0,0,2017,388,Penguin Books,beletrie,anglické</p>,,"When I wake, I'm lying in a heap on the living-room floor. The smell of blood lingers in my nostrils. Then, as I come back to consciousness, I hear it: thud, thud. There's...",287,443,"['Penguin Books, beletrie', '', 'anglické']"
n454279352,My Sweet Revenge (Jane Fallon),0,0,2017,412,Penguin Books,beletrie,anglické</p>,,"The bestselling author of Getting Rid of Matthew and Strictly Between Us tells a bitter-sweet tale of high passions, infidelity and revenge. Watch your back ...I want to make...",174,286,"['Penguin Books, beletrie', '', 'anglické']"
n468846701,The Lubetkin Legacy - Marina Lewycka,0,0,2017,360,Penguin Books,beletrie,anglické</p>,,From the bestselling author of A Short History of Tractors in Ukrainian North London in the twenty-first century: a place where a son will swiftly adopt an old lady and take...,197,329,"['Penguin Books, beletrie', '', 'anglické']"
n491415468,Tom Clancy's Duty and Honour,0,0,2017,393,Penguin Books,beletrie,anglické</p>,,Exhilarating. No other novelist is giving so full a picture of modern conflict' Sunday Times** Someone wants Jack Ryan Dead - and fast...Covert operative Jack Ryan Jr is...,170,260,"['Penguin Books, beletrie', '', 'anglické']"
n473337448,"The Kingdom Emmanuel Carrere, John Lambert Hardcover",0,0,2017,416,Penguin Books,beletrie,anglické</p>,,"The sensational international bestseller from one of France\'s most fęted writers - an epic novel telling the story of Christianity as it has never been told before, and one...",485,652,"['Penguin Books, beletrie', '', 'anglické']"
n520670223,Swing Time – Smith Zadie,0,0,2017,454,Penguin Books,beletrie,anglické</p>,,"Two brown girls dream of being dancers - but only one, Tracey, has talent. The other has ideas: about rhythm and time, black bodies and black music, what it means to belong,...",170,286,"['Penguin Books, beletrie', '', 'anglické']"
n466150405,The Tailor of Panama - John le Carré,0,0,2017,359,Penguin Books,beletrie,anglické</p>,,"A work of rare brilliance' The Times Charmer, fabulist and tailor to Panama's rich and powerful, Harry Pendel loves to tell stories. But when the British spy Andrew Osnard - a...",197,312,"['Penguin Books, beletrie', '', 'anglické']"
n533431992,The Secret Diary Of Hendrik Groen,0,0,2017,389,Penguin Books,beletrie,anglické</p>,,"The hilarious international bestselling novel that has had pensioners ditching their sticks and zimmers to follow the age-defying, youth inducing antics inside The Secret Diary...",185,286,"['Penguin Books, beletrie', '', 'anglické']"
n473270285,The Fifth Letter Nicola Moriarty,0,0,2017,368,Penguin Books,beletrie,anglické</p>,,"Four friends. Five Letters. One Secret. The scandalous breakthrough novel from Nicola Moriarty that will leave you asking, how well do I really know my friends? Joni, Trina,...",183,286,"['Penguin Books, beletrie', '', 'anglické']"
n586478631,Close to Home,0,0,2017,386,Penguin Books,beletrie,anglické</p>,,"Someone took Daisy Mason. Someone you know. How can a child vanish without a trace? Last night, 8-year-old Daisy Mason disappeared from a summer party at her home. No one at...",203,257,"['Penguin Books, beletrie', '', 'anglické']"
n673227099,Saturday Requiem - Nicci French,0,0,2017,390,Penguin Books,beletrie,anglické</p>,,Thirteen years ago eighteen-year-old Hannah Docherty was arrested for the brutal murder of her family. It was an open-shut case and Hannah's been incarcerated in a secure...,178,287,"['Penguin Books, beletrie', '', 'anglické']"
n673227101,Every Pretty Thing - Chris Mooney,0,0,2017,378,Penguin Books,beletrie,anglické</p>,,"In Every Pretty Thing serial killer hunter Darby McCormick finds herself in Montana, looking for a friend. Little does she realise that a murderer is waiting for her ...She...",226,329,"['Penguin Books, beletrie', '', 'anglické']"
n474782889,Lubetkin Legacy,0,0,2017,358,Penguin Books,beletrie,anglické</p>,,"North London in the twenty-first century: a place where a son will swiftly adopt an old lady and take her home from hospital to impersonate his dear departed mother, rather...",216,286,"['Penguin Books, beletrie', '', 'anglické']"
n673550679,Hornblower and the Hotspur,0,0,2017,416,Penguin Books,beletrie,anglické</p>,,"April 1803, and the Peace of Amiens is failing as Horatio Hornblower takes a three-master on a vital reconnaissance mission. On the day of his marriage to Maria, Hornblower is...",239,276,"['Penguin Books, beletrie', '', 'anglické']"
n473270298,Modern Lovers (Emma Straub),0,0,2017,400,Penguin Books,beletrie,anglické</p>,,"Ditmas Park, Brooklyn. Summer in the city . . . Elizabeth, Zoe and Andrew met at college, had a band, grew up, settled in New York and somehow twenty years passed by. Still...",203,286,"['Penguin Books, beletrie', '', 'anglické']"
n521328908,Blue Light Yokohama NicolĂˇs ObregĂłn,0,0,2017,400,Penguin Books,beletrie,anglické</p>,,"Inspired by a real-life murder Blue Light Yokohama is set among Tokyo\'s glitteringly busy streets, where a family of four were killed in their own home. The first detective...",224,271,"['Penguin Books, beletrie', '', 'anglické']"
n521328918,War Roald Dahl,0,0,2017,326,Penguin Books,beletrie,anglické</p>,,"There\'s a whole world of Dahl still to discover in a newly collected book of his deliciously dark tales for adults... In war, are we at our heroic best or our cowardly worst?...",229,312,"['Penguin Books, beletrie', '', 'anglické']"
n484389369,Night Ocean,0,0,2017,400,Penguin Books,beletrie,anglické</p>,,"From the award-winning author and New Yorker contributor, a riveting novel about secrets and scandals, psychiatry and pulp fiction, inspired by the lives of H.P. Lovecraft and...",744,744,"['Penguin Books, beletrie', '', 'anglické']"
n514564011,Beguiled,0,0,2017,384,Penguin Books,beletrie,anglické</p>,,"A classic slice of Southern Gothic, shot through with psychological suspense - now the basis for Sofia Coppola\'s highly anticipated new film (winner of Best Director at...",312,313,"['Penguin Books, beletrie', '', 'anglické']"
n584016495,Salt to the Sea - Ruta Sepetys,0,0,2017,418,Penguin Books,beletrie,anglické</p>,,"Winter 1945. WWII. Four refugees. Four stories. Each one born of a different homeland; each one hunted, and haunted, by tragedy, lies, war. As thousands desperately flock to...",247,257,"['Penguin Books, beletrie', '', 'anglické']"
