db_id,name,rating,reviews_cnt,year,pages_cnt,publisher,genre,author,lang,description,price_from,price_to,unparsed
n93320986,"Nabroušené vtipy Šticha Míra, Vostrý Mirek",0,0,2013,60,Computer Media,beletrie,české</p>,,"V0226082
Humorná kniha nabitá barevnými nabroušenými vtipy, u kterých se budete za břicho popadat. Dva zkušení autoři Mirek Vostrý a Míra Šticha si nebrali servítky a pustili...",87,137,"['Computer Media, beletrie', '', 'české']"
n98810073,Pravidla smečky,0,0,2013,142,Computer Media,beletrie,české</p>,,"„Já, vlk srdcem i krví, slavnostně přísahám, že budu dodržovat vždy a za všech okolností tato Pravidla smečky.“

Kniha Pravidla smečky je životním příběhem muže, který je vždy...",121,223,"['Computer Media, beletrie', '', 'české']"
n175022535,Za chlapem a tramvají neběhej - za pět minut je tu další,100,1,2013,128,Computer Media,beletrie,české</p>,,"Konečně pravda o ženách, mužích a sexu, podaná s řízností a otevřeností, jaké u jiných žen zatím nenajdeme.
Eva Hauserová, spisovatelka, publicistka, překladatelka

Vtipná...",120,159,"['Computer Media, beletrie', '', 'české']"
