db_id,name,rating,reviews_cnt,year,pages_cnt,publisher,genre,author,lang,description,price_from,price_to,unparsed
n472995251,Svědomí proti násilí - Stefan Zweig,100,1,2017,272,Prostor,beletrie,české</p>,,"Zweigova kniha, žánrově na pomezí eseje, románu a historické studie, vyšla poprvé ve Vídni v roce 1936, pouhé dva roky před pohlcením autorovy vlasti hitlerovským Německem....",209,297,"['Prostor, beletrie', '', 'české']"
n511382346,Letní lži - Bernhard Schlink,80,2,2017,248,Prostor,beletrie,české</p>,,"Celkem uvěřitelné příběhy, které se mohly stát a nebo stanou. Obyčejné všední starosti i vážnější životní traumata vyprávěná na celé škále postav - manželé, milenecké páry,...",204,287,"['Prostor, beletrie', '', 'české']"
n483293985,Barevný závoj - William Somerset Maugham,100,1,2017,304,Prostor,beletrie,české</p>,,"Již po několikáté má český čtenář možnost seznámit se s tímto krásným románem, který byl v originále uvěřejněn poprvé v roce 1925. Příběh je zasazen do exotického prostředí...",209,267,"['Prostor, beletrie', '', 'české']"
n515262608,Šmeljov Ivan Segejevič: Slunce mrtvých Kniha,0,0,2017,304,Prostor,beletrie,české</p>,,"V roce 1920 probíhala za občanské války v Rusku všeobecná evakuace bílého Krymu. Šmeljov se k ní však nepřipojil a zažil krvavou hrůzovládu maďarského bolševika Bély Kuna,...",209,282,"['Prostor, beletrie', '', 'české']"
n673172619,Poslední půlšilink,0,0,2017,304,Prostor,beletrie,české</p>,,"Román klasika anglické literatury z roku 1919 byl inspirován životem geniálního francouzského malíře Paula Gauguina. 

Jeho osud se odráží v osudech hlavního hrdiny románu...",209,297,"['Prostor, beletrie', '', 'české']"
n468059789,S leopardem v patách,0,0,2017,264,Prostor,beletrie,české</p>,,"Autor Nesmrtelné túry do Compostely se v této knize ohlíží za zákrutami vlastního života a zachycuje je se stejným vtipem, uměním zkratky a neokázalou hloubkou. Nahlédneme do...",166,267,"['Prostor, beletrie', '', 'české']"
n491298392,Kubík Lubomír: Proč Gabčík nestřílel /2.vyd./ha,0,0,2017,296,Prostor,beletrie,české</p>,,Téma atentátu na zastupujícího říšského protektora Reinharda Heydricha zpracovává Lubomír Kubík ve své knize románovými prostředky. Drží se všech dostupných historických faktů...,168,267,"['Prostor, beletrie', '', 'české']"
