db_id,name,rating,reviews_cnt,year,pages_cnt,publisher,genre,author,lang,description,price_from,price_to,unparsed
n106880636,Zápisky odstřelovače - G. Zajcev Vasilij,89,16,2012,216,Mladá fronta,naučná,české</p>,,"První české vydání vzpomínek proslulého sovětského odstřelovače, jehož osudy ztvárnil film Nepřítel před branami.

Když Vasilij Zajcev dorazil v říjnu roku 1942 do Stalingradu,...",179,279,"['Mladá fronta, naučná', '', 'české']"
n43647792,Jídlo jako životní styl II. - Petra Lamschová; Petr Havlíček,90,56,2012,192,Mladá fronta,naučná,české</p>,,"V knize Jídlo jako životní styl II. najdete podobně jako v
I. díle odpovědi na některé vaše otázky a mnoho nových zajímavých receptů.
Každého, kdo se zajímá o zdravý životní...",194,299,"['Mladá fronta, naučná', '', 'české']"
n71103981,Spoluprací k úspěchu,55,2,2012,184,Mladá fronta,naučná,české</p>,,"Rastislav Zachar v současné době působí ve firmě Business Success, která pomáhá firmám zvyšovat prosperitu prostřednictvím seminářů a studijních programů pro manažery i...",129,178,"['Mladá fronta, naučná', '', 'české']"
n46044547,"Tvoje slza, můj déšť - Eva Lustigová",100,1,2012,184,Mladá fronta,naučná,české</p>,,"Kniha rozhovorů s Arnoštem Lustigem, které s ním vedli jeho dcera Eva a
mnozí přátelé - Miloš Forman, Květa Fialová, Ivan Passer, Václav Havel a
další známé osobnosti. 

Jako...",194,299,"['Mladá fronta, naučná', '', 'české']"
n42245468,Asthma bronchiale a chronická obstrukční plicní nemoc,75,1,2012,172,Mladá fronta,naučná,české</p>,,"Možnosti komplexní léčby z pohledu fyzioterapeuta
Edice Aeskulap
Cílem předkládané monografie je pozvednout povědomí o skutečných možnostech dechové rehabilitace jako součásti...",246,350,"['Mladá fronta, naučná', '', 'české']"
n464213317,Londýn – Olympijský průvodce 2012,0,0,2012,200,Mladá fronta,naučná,české</p>,,"Tento lehký průvodce do kapsy bude v průběhu konání LOH v Londýně nepostradatelný nejen pro všechny fanoušky, kteří se do Londýna vypraví, ale užitečný bude i pro příznivce...",38,49,"['Mladá fronta, naučná', '', 'české']"
n49142080,Vybrané kazuistiky nádorů u adolescentů a mladých dospělých,95,2,2012,208,Mladá fronta,naučná,české</p>,,Vybrané kazuistiky nádorů u adolescentů a mladých dospělých. Autoři na konkrétních a velmi zajímavých případech osvětlují problematiku onkologie adolescentů a mladých...,281,400,"['Mladá fronta, naučná', '', 'české']"
n37836841,Těhotná v ordinaci negynekologa,70,1,2012,204,Mladá fronta,naučná,české</p>,,"Prenatální péče v České republice je sice vyhrazena převážně ambulantním gynekologům, těhotná žena se však často obrací na praktické lékaře nebo odborníky jiných oborů v...",246,350,"['Mladá fronta, naučná', '', 'české']"
n43647819,Peníze ve středověku. Esej z historické antropologie - Jacques Le Goff,0,0,2012,184,Mladá fronta,naučná,české</p>,,"Peníze ve středověku

Esej z historické antropologie 

Celosvětově uznávaný medievalista Jacques Le Goff se ve své nové publikaci zaměřuje na úlohu a postavení peněz ve...",242,269,"['Mladá fronta, naučná', '', 'české']"
