db_id,name,rating,reviews_cnt,year,pages_cnt,publisher,genre,author,lang,description,price_from,price_to,unparsed
n236488296,Škola grafického designu,100,1,2015,208,Slovart,beletrie,české</p>,,"Principy a praxe grafiky. Škola grafického designu je základní příručkou pro grafické designéry, kteří pracují s obrázky v oblasti tisku a digitálních médií. Obsahuje užitečné...",324,499,"['Slovart, beletrie', '', 'české']"
n455318159,Průvodce stylem pro ženy - Vorwerková Dagmar,0,0,2015,232,Slovart,beletrie,české</p>,,"Průvodce stylem pro ženy objasňuje základní, všeobecně platné a dlouhodobě uznávané zásady dobrého stylu oblékání pro každou ženu a nabízí praktické tipy pro všechny situace od...",194,299,"['Slovart, beletrie', '', 'české']"
n459944477,Pan Gwyn - Alessandro Baricco,0,0,2015,200,Slovart,beletrie,české</p>,,"Jasper Gwyn, úspěšný spisovatel, uveřejní v novinách článek, kde vyjmenuje padesát dva věcí, které už nemíní nikdy dělat. Poslední v pořadí je psaní. Namísto toho chce dělat...",162,249,"['Slovart, beletrie', '', 'české']"
n260603528,"Svobodný, ženatý, rozvedený, vdovec - Jan Saudek",98,3,2015,192,Slovart,beletrie,české</p>,,"Život jako bestseller - literární zpověď světoznámého českého fotografa. Autorská kniha, ilustrovaná jeho černobílými fotografiemi, podává osobitý pohled na vlastní život a...",162,249,"['Slovart, beletrie', '', 'české']"
n351375108,Fotbalové dovednosti,0,0,2015,176,Slovart,beletrie,české</p>,,"Obrazová příručka nejoblíbenější hry na světě je určena hráčům všech věkových kategorií a úrovní. Začátečníkům vysvětlí pravidla a doporučí jim vhodnou výstroj, zkušenějším...",162,249,"['Slovart, beletrie', '', 'české']"
