db_id,name,rating,reviews_cnt,year,pages_cnt,publisher,genre,author,lang,description,price_from,price_to,unparsed
n351151319,"Doktore, poplach, jde o všecko! - Taylor Patrick",94,6,2015,448,Leda,beletrie,české</p>,,"Vítejte znovu v malebném irském městečku Ballybucklebo mezi jeho bodrými obyvateli, jejichž radosti i trable humorně a s láskou líčí Patrick Taylor. Opět se setkáváme s...",191,299,"['Leda, beletrie', '', 'české']"
n456034610,Pýcha a předsudek - Jane Austenová,100,1,2015,400,Leda,beletrie,české</p>,,"Není pochyb o tom, že hrdinkou románu Pýcha a předsudek, Lízinkou, je sama Jane Austenová (1775-1817). Přestože prožila tak typicky nekonfliktní život (nikdy se neprovdala a...",95,149,"['Leda, beletrie', '', 'české']"
n329743210,Zbabělci - Josef Škvorecký,75,1,2015,432,Leda,beletrie,české</p>,,"Dnes už kultovní a také světově proslulý román Josefa Škvoreckého, jednoho z nejvýraznějších autorů české moderní literatury, zobrazuje osm posledních dnů druhé světové války...",195,298,"['Leda, beletrie', '', 'české']"
n259854545,LEDA spol. s r. o. Hostinec u kamenného stolu,100,1,2015,360,Leda,beletrie,české</p>,,"„Navštivte klimatické lázně Džbery pod Skálou, které se vypínají 703 m nad hladinou mořskou, kde se v nádherném okolí nacházejí překrásné procházky stinnými lesy a ptáčkové...",91,189,"['Leda, beletrie', '', 'české']"
n298477190,To je Život!,0,0,2015,392,Leda,beletrie,české</p>,,"Když studentka pařížské akademie Aurélie vrhne v rámci svého uměleckého projektu mezi spoluobčany kámen, zákon schválnosti se už postará o to, aby zažila týden divotvorných...",191,299,"['Leda, beletrie', '', 'české']"
n319438826,Rozum a cit - Jane Austenová v jednadvacátém století,0,0,2015,366,Leda,beletrie,české</p>,,"Slavný román Jane Austenové přenesla do dnešního světa vynikající současná anglická spisovatelka Joanna Trollopeová. Provedla to s mimořádnou empatií, humorem, pokorou k...",182,279,"['Leda, beletrie', '', 'české']"
n337459921,Hazardérka,0,0,2015,376,Leda,beletrie,české</p>,,"Román Stephanie Cliffordové, novinářky New York Times, nám s fascinujícími detaily umožňuje nahlédnout do „zlaté klece” mladých newyorských finančníků a bankovních makléřů,...",180,348,"['Leda, beletrie', '', 'české']"
