db_id,name,rating,reviews_cnt,year,pages_cnt,publisher,genre,author,lang,description,price_from,price_to,unparsed
n467785140,Ke dnu,0,0,2017,288,Odeon,beletrie,české</p>,,Ke dnu kniha od autora Bolavá Anna. V době prvních mrazů na konci listopadu je v močálech na kraji města nalezeno mrtvé tělo manželky lékaře Marka Diviše. Mezi obyvateli se...,205,246,"['Odeon, beletrie', '', 'české']"
n465132907,Spisovatel jako povolání - Haruki Murakami,100,2,2017,240,Odeon,beletrie,české</p>,,"Haruki Murakami nedává rozhovory, vyhýbá se focení a taky připouští, že poměrně nerad rozebírá to, co napsal. Přesto nyní máme v rukou knihu, v níž se vyjadřuje k tématu...",125,258,"['Odeon, beletrie', '', 'české']"
n666133726,Superpozice,0,0,2017,248,Odeon,beletrie,české</p>,,"Všechny postavy v této knize se vymyslely samy, nebo z nich to, čím jsou, udělali matka, otec, spolužáci, svině a kreténi. Peprné motto románu Superpozice, což je termín z...",39,214,"['Odeon, beletrie', '', 'české']"
n465140507,Nebe nemá dno - Hana Andronikova,0,0,2017,296,Odeon,beletrie,české</p>,,"Hana Andronikova debutovala románem Zvuk slunečních hodin, za nějž získala Literární cenu Knižního klubu a následně ocenění Magnesia Litera – román byl rovněž přeložen do...",222,258,"['Odeon, beletrie', '', 'české']"
n543448251,Bláznovy zápisky - Gogol Nikolaj Vasiljevič,100,2,2017,304,Odeon,beletrie,české</p>,,"Výbor ze čtenářsky oblíbených Gogolových povídek, které patří k tomu nejlepšímu z klasické ruské literatury. Příběhy Gogolových hrdinů jsou vesměs satirou na tupost a hamižnost...",262,349,"['Odeon, beletrie', '', 'české']"
