db_id,name,rating,reviews_cnt,year,pages_cnt,publisher,genre,author,lang,description,price_from,price_to,unparsed
n266811896,Shh! We Have a Plan,0,0,2015,40,Walker books,beletrie,anglické</p>,,"The winner of the 2014 Association of Illustrators Award for Childrens Books, Shh! is the covetable new picture book from Chris Haughton, one of the most exciting new voices in...",151,260,"['Walker books, beletrie', '', 'anglické']"
n263580429,Shaun the Sheep Movie - Shear Madness,0,0,2015,48,Walker books,beletrie,anglické</p>,,"After an accident causes the Farmer to lose his memory, he finds an outrageous new use for his sheep-shearing skills in the city. Heavily illustrated with full-colour scenes...",141,196,"['Walker books, beletrie', '', 'anglické']"
n673220597,Shaun the Sheep Movie: The Great Escape,0,0,2015,48,Walker books,beletrie,anglické</p>,,"When Shaun and Bitzer are captured by the evil animal-control officer in the Big City, the flock tries to break them out of the Animal Containment Centre. Heavily illustrated...",137,196,"['Walker books, beletrie', '', 'anglické']"
n263612888,Shaun the Sheep Movie - Timmy in the City,0,0,2015,24,Walker books,beletrie,anglické</p>,,"When the Flock decides it's time for a day out, Timmy gets to come along to the Big City. Many things, like automatic doors and restaurants, are very different from life on the...",163,222,"['Walker books, beletrie', '', 'anglické']"
n263981945,Shaun the Sheep Movie,0,0,2015,144,Walker books,beletrie,anglické</p>,,"When Shaun decides to take a day off to have some fun, he gets more adventure than he baa-gained for! Shaun's mischief accidentally leads to the Farmer's absence from the farm,...",189,248,"['Walker books, beletrie', '', 'anglické']"
