db_id,name,rating,reviews_cnt,year,pages_cnt,publisher,genre,author,lang,description,price_from,price_to,unparsed
n708555578,Nerozluční přátelé - Przemyslaw Wechterowicz,0,0,2019,32,Host,dětské,české</p>,,Příběh neobyčejného přátelství Králíčka a Sovičky s půvabnými ilustracemi od autorky Roku v lese. V tichém koutku jednoho údolí žijí dvě rodiny. V kořenech stařičkého dubu mají...,193,299,"['Host, dětské', '', 'české']"
n709862047,Moje maminka je nejsilnější na světě - Nicola Kent,0,0,2019,32,Host,dětské,české</p>,,"Věnováno všem maminkám.

Medvídkova maminka má velikou sílu — je ze všech maminek na světě nejsilnější. Představte si, že unese všechny jeho poklady, které méďa venku nasbírá....",172,269,"['Host, dětské', '', 'české']"
n708238152,Rok na trhu,0,0,2019,28,Host,dětské,české</p>,,"Vítejte na trhu v Dobrotíně. Velkoformátové leporelo dětem představí barvitý život prodejců na trhu a jejich zákazníků. Zjistí, jak místní slaví svátky, jak se vypořádávají s...",193,284,"['Host, dětské', '', 'české']"
n708818672,Jak tukoni zachránili strom - Oksana Bula,0,0,2019,40,Host,dětské,české</p>,,"Tukoni. Poznejte blíže kouzelné bytosti lesa v nové knížce Oksany Bula.

Kdo jsou tukoni? Kouzelné bytosti, které se s radostí a láskou starají o les — někteří pečují o stromy,...",172,269,"['Host, dětské', '', 'české']"
