db_id,name,rating,reviews_cnt,year,pages_cnt,publisher,genre,author,lang,description,price_from,price_to,unparsed
n52236035,"To vám byl divný svět. Úvahy o proměnách světa kolem nás - Ján Košturiak, Milan Zelený",0,0,2012,184,Nakladatelství Lidové noviny,naučná,české</p>,,"Nepřestávejte hledat svoji vlastní cestu. Jen takové hledání pomáhá vytvářet, uspořádávat a organizovat nový svět. Jen tak se jedinec může učit od tisíců hledačů, a ne, jak...",167,178,"['Nakladatelství Lidové noviny, naučná', '', 'české']"
n41754787,V zajetí středověkého obrazu,0,0,2012,230,Nakladatelství Lidové noviny,naučná,české</p>,,"Kniha studií 21 autorů tvoří poměrně kompaktní celek-většina textů je totiž věnována knižní malbě (nebo dílům, jež s ní nějakým způsobem souvisí)-hlavnímu ohnisku zájmu Karla...",251,251,"['Nakladatelství Lidové noviny, naučná', '', 'české']"
n42896254,Basilejská kompaktáta,0,0,2012,182,Nakladatelství Lidové noviny,naučná,české</p>,,"V příběhu deseti listin tzv. basilejských kompaktát, jimiž bylo v červenci 1436 na jihlavském náměstí mnohaleté vyjednávání uzavřeno, je dějinné drama osvětleno z dvojího úhlu...",118,169,"['Nakladatelství Lidové noviny, naučná', '', 'české']"
n40500934,Německé bylo srdce monarchie...,0,0,2012,192,Nakladatelství Lidové noviny,naučná,české</p>,,"Německé bylo srdce monarchie...
Rakušanství, němectví a střední Evropa v rakouské historiografii mezi válkami
Konrád Ota
Po rozpadu Habsburské monarchie muselo německojazyčné...",136,199,"['Nakladatelství Lidové noviny, naučná', '', 'české']"
n44417612,Slovanská terminologie z pohledu etymologie,0,0,2012,224,Nakladatelství Lidové noviny,naučná,české</p>,,"V knize je podán etymologický výklad chorvatských, srbských a českých názvů tkalcovského stavu a jeho částí. Předmětem analýzy jsou vedle termínů s předpokládaným praslovanským...",164,197,"['Nakladatelství Lidové noviny, naučná', '', 'české']"
