db_id,name,rating,reviews_cnt,year,pages_cnt,publisher,genre,author,lang,description,price_from,price_to,unparsed
n618329632,"Minerální soli Dr. Schüsslera - Brána k tělesnému a duševnímu zdraví - Richard Kellenberger, Christine Kellenberger",100,3,2018,376,Fontána,naučná,české</p>,,"Léčba Shüsslerovými solemi neboli biochemie je jednoduchou, bezrizikovou a kdykoliv a kýmkoliv použitelnou léčebnou metodou. Podle jejího objevitele, MUDr. Wilhelma Heinricha...",294,458,"['Fontána, naučná', '', 'české']"
n627640641,Buddhistická psychoterapie. Techniky pro uzdravující změny - Matthias Ennenbach,100,1,2018,406,Fontána,naučná,české</p>,,Tato kniha vznikla z praxe. Popisuje léčivé a dnes již dobře odzkoušené spojení buddhistických a psychoterapeutických ošetřujících postupů. Jsou zde představeny jak techniky...,296,448,"['Fontána, naučná', '', 'české']"
n659390051,Jak rozvinout své duchovní schopnosti - Hewitt William,0,0,2018,328,Fontána,naučná,české</p>,,"Máte v sobě tajnou moc, která jen čeká, až si ji osedláte - je to váš přirozený smysl duchovna.
 Tato jedinečná kniha vám přináší rychlé a snadné postupy, které můžete denně...",216,328,"['Fontána, naučná', '', 'české']"
n692455841,Buddhistická moudrost,0,0,2018,396,Fontána,naučná,české</p>,,"Tato malá knížka nabízí soubor myšlenek a reflexí pro každý den v roce. Obsahuje pasáže z Buddhových nauk, které probudí vaše srdce a vtáhnou vaši mysl. Noste ji s sebou, a...",216,328,"['Fontána, naučná', '', 'české']"
n634553192,Čínská holistická medicína v běžném životě - Steven Cardoza,100,1,2018,432,Fontána,naučná,české</p>,,"Kombinace akupresury, bylinných receptur a čchi-kungu v integrovaném přírodním léčitelství

Celostní zdraví s integrovanou čínskou medicínou. Objevte metodu pro léčbu...",303,458,"['Fontána, naučná', '', 'české']"
n711450649,O léčivých bylinách a rostlinných božstvech,0,0,2018,404,Fontána,naučná,české</p>,,"O moudrých ženách a znalcích bylin

Rostliny jako léčitelé, jako zdroj obživy, jako dobrodinci, jako bohové a démoni – tato kniha nás seznamuje se všemi těmito aspekty a učí...",284,438,"['Fontána, naučná', '', 'české']"
