db_id,name,rating,reviews_cnt,year,pages_cnt,publisher,genre,author,lang,description,price_from,price_to,unparsed
n441683598,Božena česká - boj o trůn a lásku,95,1,2016,224,Alpress,beletrie,české</p>,,"Božena Česká - boj o trůn a lásku kniha od autora Hana Whitton. Princeznu Boženu provdali za mnohem staršího braniborského markraběte Otu II., přesto s ním žije v láskyplném...",182,256,"['Alpress, beletrie', '', 'české']"
n437817201,Tohle nevyžehlíš,0,0,2016,232,Alpress,beletrie,české</p>,,"Miluji Tomáše. A Tomáš miluje mě. Vím to, jasná věc! Tak proč se teď válí se svou dcerou a ex někde u moře, zatímco já trčím doma a společnost mi dělá maximálně sedmička...",181,256,"['Alpress, beletrie', '', 'české']"
n441683599,Dopis do ticha,0,0,2016,176,Alpress,beletrie,české</p>,,"Zdravotní sestra Linda, se dostává na operační sál sama jako pacientka. Při operačním výkonu je u ní odhalena jistá vada omezující naději na otěhotnění. Třebaže Linda má svého...",199,224,"['Alpress, beletrie', '', 'české']"
n372491149,Prvorozený - královský úděl budoucího císaře Karla IV.,0,0,2016,216,Alpress,beletrie,české</p>,,"Král Jan Lucemburský se s Karlem opravdu nemazlil. Ve třech letech syna věznil na hradě Lokti, v sedmi ho oženil s Blankou z Valois, v patnácti syn vedle otce bojoval o vládu...",119,249,"['Alpress, beletrie', '', 'české']"
n395002478,Sběratel duší,0,0,2016,224,Alpress,beletrie,české</p>,,"Althea vyrůstala v Egyptě po boku otce, uznávaného archeologa, až do doby, než ho obvinili z falšování starožitností. Krátce nato zemřel a ona nechápala, co se stalo. Po letech...",119,269,"['Alpress, beletrie', '', 'české']"
n429214473,Sázka na mizeru - Viktorie Veselá,0,0,2016,232,Alpress,beletrie,české</p>,,"Elvíra řeší s kamarádkou Simonou její rozpadající se manželství. Netuší, že sama se díky tajnému poměru s perverzním Medardem nezadržitelně řítí ke konci toho svého. Vzhledem k...",195,269,"['Alpress, beletrie', '', 'české']"
