db_id,name,rating,reviews_cnt,year,pages_cnt,publisher,genre,author,lang,description,price_from,price_to,unparsed
n647052320,Hledání společného světa,0,0,2017,416,Malvern,beletrie,české</p>,,Dvacet esejů českého biologa a filozofa Zdeňka Neubauera přináší svěží a neotřelý pohled na přírodu i kulturu. Svět zde není vnímán očima tradiční přírodovědy jako výskytiště...,263,361,"['Malvern, beletrie', '', 'české']"
n544100481,Vize - William Butler Yeats,0,0,2017,392,Malvern,beletrie,české</p>,,"Kniha symbolických próz irského spisovatele a nositele Nobelovy ceny za literaturu z roku 1923 Williama Butlera Yeatse (1865-1939) nachází jednotu historických epoch, hlavních...",249,342,"['Malvern, beletrie', '', 'české']"
n571907805,Vysoká hra,100,1,2017,424,Malvern,beletrie,české</p>,,"Vůbec poprvé vychází v českém překladu kompletní vydání francouzské
revue Le Grand Jeu (Vysoká hra), časopisu stejnojmenné skupiny,
jejíž aktivity od konce roku 1927 do...",416,561,"['Malvern, beletrie', '', 'české']"
n588692900,Nekonečný tyátr - Alejandro Jodorowsky,0,0,2017,434,Malvern,beletrie,české</p>,,"Nekonečný tyátr poprve seznamuje české čtenáře s divadelní tvorbou filmového i divadelního režiséra, literárního a dramatického autora Alejandra Jodorowského. 
Jsou zde...",198,315,"['Malvern, beletrie', '', 'české']"
n470784167,Mesiášská idea v judaismu a další eseje o židovské spiritualitě - Gershom Scholem,0,0,2017,368,Malvern,beletrie,české</p>,,"Na formování pojetí mesiáše a vykoupení v judaismu se podle G. Scholema (1897–1982) podílely zejména restorativní a utopické proudy, které dále přetvářely staré dědictví...",324,418,"['Malvern, beletrie', '', 'české']"
