db_id,name,rating,reviews_cnt,year,pages_cnt,publisher,genre,author,lang,description,price_from,price_to,unparsed
n478335098,Dítě jménem Kuba - Tereza Melišová,100,3,2017,176,Computer Press,beletrie,české</p>,,"Dítě jménem Kuba kniha od autora Tereza Melišová. Nahlédněte do života blogerky, svobodné maminky a neúnavné parťačky jejího malého syna Kuby. 
O tom, že starat se sama o...",149,249,"['Computer Press, beletrie', '', 'české']"
n551752788,Tohle musíš zkusit! - Elise De Rijck,85,2,2017,176,Computer Press,beletrie,české</p>,,"Zábavnější život se spoustou zážitků začíná hned na první stránce!

Znáš to, všední dny se opakují a často je to nehorázná nuda: vstaneš, jdeš do školy, vrátíš se domů, sedneš...",110,180,"['Computer Press, beletrie', '', 'české']"
n478335134,Sekaná s malinama - Jaroslava Černá,0,0,2017,232,Computer Press,beletrie,české</p>,,"Čtenáři milovaná spisovatelka Jaroslava Černá neustále překvapuje fascinujícími příběhy, pro které čerpá inspiraci ve skutečných osudech ze své terapeutické praxe.
Tento lehce...",173,249,"['Computer Press, beletrie', '', 'české']"
n673197220,Andrew McDonald Nejlepší bloger na světě,0,0,2017,192,Computer Press,beletrie,české</p>,,"Aktuální téma blogování v humorném i napínavém příběhu
Charlie míří vysoko: chce se stát Nejlepším blogerem na světě. Jenže to má háček. Začne pochybovat, že líný kačer Čárkód...",173,249,"['Computer Press, beletrie', '', 'české']"
