db_id,name,rating,reviews_cnt,year,pages_cnt,publisher,genre,author,lang,description,price_from,price_to,unparsed
n173337095,"Muž s vůní kávy, žena se špetkou skořice - Lenka Požárová",88,7,2014,304,Motto,beletrie,české</p>,,"Muž s vůní kávy, žena se špetkou skořice je vyprávění o jednom dobrodružném cestování ve společnosti obchodníka s kávou. Napsala ho Lenka Požárová, jež je známá především ze...",173,249,"['Motto, beletrie', '', 'české']"
n211808887,Konečně se rozhodni,80,2,2014,272,Motto,beletrie,české</p>,,"Příběh se odehrává ve svatebním prostředí, přesněji okolo svatebního salonu, kde hlavní hrdinka pracuje... Je to pětatřicetiletá Natália, svobodná matka, která stále hledá toho...",229,229,"['Motto, beletrie', '', 'české']"
n229753488,"Ulovila jsem ho v buši (Halina Pawlowská, Erika Bornová)",95,9,2014,256,Motto,beletrie,české</p>,,"Nová kniha povídek Haliny Pawlowské! O čem je má knížka? O tom, že není nic krásnějšího, než když i slonům dojetím nad vaší láskou padají choboty, a taky o tom, že není nic...",173,249,"['Motto, beletrie', '', 'české']"
n364253021,Čtyři roční období: Rok v Římě - Stefan Ulrich,100,1,2014,288,Motto,beletrie,české</p>,,"„Vy se ale máte,“ říkali všichni přátelé, když se rodině Ulrichových splnilo dávné přání. „Bella Italia! Dolce vita! Strávit celý rok ve Věčném městě, to je splněný sen.“ Jenže...",183,269,"['Motto, beletrie', '', 'české']"
n204854100,Vražda na mexický svátek - Lee Harrisová,95,3,2014,256,Motto,beletrie,české</p>,,"Když je Christine Bennettová pozvána na výlet do Arizony, využije příležitosti a těší se, že prožije nějaké dobrodružství. Cesta v ní ale vyvolá vzpomínky na dávného spolužáka...",59,269,"['Motto, beletrie', '', 'české']"
n220944758,Banánové chybičky Halina Pawlowská,97,0,2014,264,Motto,beletrie,české</p>,,"Banánové chybičky kniha od autora Halina Pawlowská. Další pokračování knižní podoby oblíbené ""banánové"" televizní talkshow. Autorka tentokrát řeší, jak přežít zdravý životní...",137,225,"['Motto, beletrie', '', 'české']"
n200177466,"Pět holek na krku, Trest - Iva Hercíková",100,1,2014,304,Motto,beletrie,české</p>,,"Nataša, Jiřina, Jana, Zdena a Libuše – to je pět kamarádek z jednoho malého města. Jenže Nataša se od zbývajících čtyř přece jen liší, je prostě jiná a dívky jí to dávají...",137,249,"['Motto, beletrie', '', 'české']"
