db_id,name,rating,reviews_cnt,year,pages_cnt,publisher,genre,author,lang,description,price_from,price_to,unparsed
n397285018,"Muži, kteří zašli příliš daleko",100,1,2016,272,Plus,beletrie,české</p>,,"Čeho se bojí muži, kteří zašli příliš daleko? Sedmý svazek edice Pandaemonium po spisech M. R. Jamese nebo antologii sci-fi povídek viktoriánských autorek tentokrát přibližuje...",256,269,"['Plus, beletrie', '', 'české']"
n356235662,Apokalypsa na počkání (Charlie Human),0,0,2016,312,Plus,beletrie,české</p>,,"Jó, Harry Potter byl od pohledu hodnej kluk a Baxter Zevcenko má stejně sladkej kukuč, ovšem zbytek už tak trochu nesedí… Chodí na střední v Kapském městě, kde si slušně...",62,293,"['Plus, beletrie', '', 'české']"
n706929046,Modrá mezi nebem a vodou - Susan Abulhawa,0,0,2016,312,Plus,beletrie,české</p>,,"Píše se rok 1947 a v Beit Darasu, palestinské vesnici obklopené olivovými háji, žije rodina Barakových. Nejstarší dcera Nazmíja pečuje o svou ovdovělou matku, která často trpí...",73,89,"['Plus, beletrie', '', 'české']"
n402971428,V tomto domě straší - John Boyne,80,1,2016,312,Plus,beletrie,české</p>,,"Strhující pocta duchařským příběhům z 19. století Román V tomto domě straší od irského spisovatele Johna Boynea, který proslul celosvětově knížkou pro děti Chlapec v pruhovaném...",208,299,"['Plus, beletrie', '', 'české']"
n349626440,Lidé v nahotě (Andrej Astvacaturov),0,0,2016,272,Plus,beletrie,české</p>,,"Toto není pornografie! Toto je literatura! Ne, kniha Lidé v nahotě nevypráví o nudistech, jak by se mohlo na první pohled zdát. Svérázně napsaný, autobiografický román Andreje...",54,241,"['Plus, beletrie', '', 'české']"
n653635368,Čtenářský klub Jane Austenové - Karen Joy Fowler,0,0,2016,296,Plus,beletrie,české</p>,,"„Světem panuje skálopevné přesvědčení, že svobodný muž, který má slušné jmění, se neobejde bez ženušky.“ Ač tato věta hodnotila stav společnosti před dvě stě lety, Jocelyn se...",204,299,"['Plus, beletrie', '', 'české']"
n409805555,Zpátky do boje - Phil Klay,0,0,2016,304,Plus,beletrie,české</p>,,"Povídková kniha od veterána z Iráku oceněná americkou Národní literární cenou!
Válka. Jak vyjádřit hrůzu, kterou v sobě ukrývá, jak přetlumočit osudy, do nichž zasáhla?...",208,270,"['Plus, beletrie', '', 'české']"
n706871825,Modrá mezi nebem a vodou - Susan Abulhawa,0,0,2016,312,Plus,beletrie,české</p>,,"Píše se rok 1947 a v Beit Darasu, palestinské vesnici obklopené olivovými háji, žije rodina Barakových. Nejstarší dcera Nazmíja pečuje o svou ovdovělou matku, která často trpí...",75,312,"['Plus, beletrie', '', 'české']"
