db_id,name,rating,reviews_cnt,year,pages_cnt,publisher,genre,author,lang,description,price_from,price_to,unparsed
n259850060,Nebeská rieka - Grozdana Olujić,95,1,2014,112,Perfekt,dětské,slovenské</p>,,"Kniha nádherných rozprávok, ktoré skrývajú aj odhaľujú mnohé tajomstvá. Tak sa dozviete napríklad o Červenej žabke, ktorá sa premenila na Červenovlásku, a povráva sa, že dodnes...",198,340,"['Perfekt, dětské', '', 'slovenské']"
n459942995,Kocúr Findus Hurhaj v záhrade - Sven Nordqvist,0,0,2014,24,Perfekt,dětské,slovenské</p>,,"Veselý príbeh nerozlučnej dvojice starého pána Petsona a jeho kocúra Findusa z dielne švédskeho autora potešil deti i dospelých v mnohých krajinách.

Bolo krásne ráno. Lístky...",147,172,"['Perfekt, dětské', '', 'slovenské']"
n233080665,Záhady Raketovej ulice/ - NeVyriešené - Ivana Auxtová,0,0,2014,112,Perfekt,dětské,slovenské</p>,,"Kniha siedmich neuveriteľných sci-fi príbehov ťa zavedie do sveta fantázie na Raketovú ulicu. Katka sa presťahuje do nového domu, v ktorom je každé ráno neporiadok ako po...",85,208,"['Perfekt, dětské', '', 'slovenské']"
n673181097,Ovečky v čerešňovom sade - Kolektív autorov,0,0,2014,168,Perfekt,dětské,slovenské</p>,,Jubilejný 10. ročník antológie pre deti opäť prináša výber tých najlepších diel z Literárnej súťaže o poviedku pre deti. 10. ročník antológie obsahuje 22 poviedok od...,89,136,"['Perfekt, dětské', '', 'slovenské']"
n459943027,Poštár slimák Oliver - Ľuboš Bohunický,0,0,2014,96,Perfekt,dětské,slovenské</p>,,"Tento titul nájdete v našej ponuke aj v kolekcii za skvelú cenu. Oliver od malička túži stať sa poštárom. Keď sa jedného dňa dozvie, že sa otvára poštárska škola, neváha a vydá...",152,206,"['Perfekt, dětské', '', 'slovenské']"
n183018808,"Prečo bývame za mestom - Peter Stamm, Jutta Bauer",0,0,2014,40,Perfekt,dětské,slovenské</p>,,"V osemnástich krátkych kapitolách sa odohráva príbeh sedemčlennej rodiny, ktorá sa sťahuje z miesta na miesto, aby napokon našla v rodinnom dome za mestom to, čo jej chýba -...",106,136,"['Perfekt, dětské', '', 'slovenské']"
n194266490,Dita,0,0,2014,52,Perfekt,dětské,slovenské</p>,,"Malé dievčatko Dita sa nudí len málokedy. V krátkych citlivých príbehoch so zvieratkami i ľuďmi zažíva rôzne dobrodružstvá. Neveríte? Tak sa spýtajte strateného motýľa,...",115,115,"['Perfekt, dětské', '', 'slovenské']"
