db_id,name,rating,reviews_cnt,year,pages_cnt,publisher,genre,author,lang,description,price_from,price_to,unparsed
n406556248,Návrat z nicoty,94,3,2016,312,Práh,beletrie,české</p>,,"Strhující vítězství chlapce, jenž se stal vězněm vlastního těla
Deset let žil ve vegetativním stavu a jen on sám věděl, že je při plném vědomí. Nyní vypráví svůj neuvěřitelný,...",204,299,"['Práh, beletrie', '', 'české']"
n406271845,Práh s.r.o. Holka pro všechno,0,0,2016,248,Práh,beletrie,české</p>,,"Kristýnin život je perfektní. Perfektně nudný, perfektně osamělý.
Něco se musí změnit, musí přijít pomoc. Ta pomoc se jmenuje Marie.
Vypere, uvaří, postará se o dítě, je to...",175,249,"['Práh, beletrie', '', 'české']"
n355186145,"Šajlok, to jsem já",0,0,2016,280,Práh,beletrie,české</p>,,"Druhý román edice Shakespeare 400, ve které v roce 2017 vyjde také román Jo Nesba na motivy Shakespearova Macbetha

Magnát Strulovič, zhrzený otec, manžel i žid, narazí při...",297,337,"['Práh, beletrie', '', 'české']"
