db_id,name,rating,reviews_cnt,year,pages_cnt,publisher,genre,author,lang,description,price_from,price_to,unparsed
n33952585,Mezinárodní marketing a informační technologie,0,0,2011,196,Wolters Kluwer,naučná,české</p>,,"Publikace poskytuje nový globální pohled na marketing a marketingové aktivity v kontextu velmi závažných změn základů ekonomické, sociální a kulturní reality, a to na...",260,329,"['Wolters Kluwer, naučná', '', 'české']"
n51960428,Sociální ekonomika - Marie Dohnalová; Ladislav Průša,0,0,2011,176,Wolters Kluwer,naučná,české</p>,,Kniha definuje sociální ekonomiku a sociální podniky s použitím zahraničních přístupů i se znalostí české reality. Autoři věnují stěžejní pozornost problematice sociálních...,228,305,"['Wolters Kluwer, naučná', '', 'české']"
n25145824,"Veřejné výdajové programy, veřejné projekty a zakázky",0,0,2011,220,Wolters Kluwer,naučná,české</p>,,"Kniha Veřejné výdajové programy, veřejné projekty a zakázky se zabývá procesem tvorby, metodami hodnocení, výběrem a kontrolou veřejných výdajových programů, veřejných projektů...",222,351,"['Wolters Kluwer, naučná', '', 'české']"
n30759465,Zákon o veřejných službách v přepravě cestujících. Komentář,0,0,2011,236,Wolters Kluwer,naučná,české</p>,,Hlavním účelem vydání Komentáře je vysvětlit zcela novou právní úpravu veřejných služeb v přepravě cestujících v drážní a silniční dopravě a přiměřeně i ve vnitrozemské vodní...,287,529,"['Wolters Kluwer, naučná', '', 'české']"
n26434204,Víra a svoboda,0,0,2011,212,Wolters Kluwer,naučná,české</p>,,"Alejandro Chafuen, známý americký filozof argentinského původu, se v knize Víra a svoboda zabývá vznikem a vývojem západní civilizace, přičemž ukazuje na skutečnou roli...",212,313,"['Wolters Kluwer, naučná', '', 'české']"
n29894832,Dokazování v medicínskoprávních sporech,0,0,2011,212,Wolters Kluwer,naučná,české</p>,,"Kniha Dokazování v medicínských sporech se soustředí na problematiku, která je pro spravedlivé řešení sporů vyplývajících z odpovědnosti za poskytovanou zdravotní péči...",328,345,"['Wolters Kluwer, naučná', '', 'české']"
n26088299,Lidské embryo z perspektivy bioetiky,0,0,2011,212,Wolters Kluwer,naučná,české</p>,,Manažerský audit je novým nástrojem hodnocení úrovně procesů a odhalování možností jejich zlepšování v malých a středních podnicích. Základem manažerského auditu je provedení...,169,169,"['Wolters Kluwer, naučná', '', 'české']"
n25145819,Daňový řád 2011,0,0,2011,172,Wolters Kluwer,naučná,české</p>,,"Daňový řád 2011 - Meritum na www.ucebnice.com
Přehledný průvodce problematikou správy daní dle nového zákona č. 280/2009 Sb., daňový řád, který nabyl účinnosti dne 1. 1. 2011,...",329,329,"['Wolters Kluwer, naučná', '', 'české']"
