db_id,name,rating,reviews_cnt,year,pages_cnt,publisher,genre,author,lang,description,price_from,price_to,unparsed
n289989735,Celostní osteopatická léčba,100,1,2015,144,Fontána,naučná,české</p>,,"Udělejte si přehled o přednostech celostní osteopatie GOT jako efektivní terapeutické metody ve všech osteopatických systémech.

Tato kniha nabízí základy principů celostní...",255,398,"['Fontána, naučná', '', 'české']"
n259695315,Autorehabilitační sestava pro děti a rodiče Kombercová Jana,0,0,2015,168,Fontána,naučná,české</p>,,MUDr. Jana Kombercová v knize popisuje zkušenosti ze své více jak čtvrtstoletí trvající praxe v oblasti celostní medicíny. V průběhu let se jí pomalu dařilo spojovat medicínu...,210,328,"['Fontána, naučná', '', 'české']"
n301820269,Léčivé mandaly,0,0,2015,48,Fontána,naučná,české</p>,,"Malování tradičních kruhových obrazců, známých jako mandaly, je meditační technikou, léčebným postupem v obdobích krize a příjemnou tvořivou činností. Mandaly nám jakožto...",223,348,"['Fontána, naučná', '', 'české']"
n20386394,Indiánské mandaly - Malujeme mandaly pro zdraví a pro duši - Klaus Holitzka,0,0,2015,28,Fontána,naučná,české</p>,,"Barvy přicházejí ze země a oslovují nebe svou jasnou naléhavostí. Prosba o déšť, hlas hromu i tanec dešťových kapek jsou jedno. Člověk stojící na hoře i obdělávající pole...",127,248,"['Fontána, naučná', '', 'české']"
n344802343,Mandaly posvátné geometrie - 32 mandal k vybarvení a zklidnění mysli,0,0,2015,32,Fontána,naučná,české</p>,,Tyto omalovánky v sobě spojují centrující účinky mandaly s účinnými univerzálními formami Posvátné geometrie. Tvůrčí práce s těmito zářivými symboly dopomůže člověku k...,159,248,"['Fontána, naučná', '', 'české']"
n278426708,Mandaly síly,0,0,2015,40,Fontána,naučná,české</p>,,"Mandala se svými jedinečnými koncentrickými tvary nabízí jako jedinečná předloha pro meditaci i nezkušeným a nervózním lidem. 

Malování přitom proces meditace i vlastního...",159,248,"['Fontána, naučná', '', 'české']"
n271513168,Bylinářská poradna 2,0,0,2015,160,Fontána,naučná,české</p>,,Kniha zkušeného praktika v oboru fytoterapie Jos. A. Zentricha nabízí dnešnímu člověku osvěžení v dotýkání s voňavým světem bylin. Obrací náš pohled od městského chvatu k roku...,185,288,"['Fontána, naučná', '', 'české']"
n344802341,Mandaly Nanebevzatých mistrů - Švecová Libuše,0,0,2015,28,Fontána,naučná,české</p>,,"Mandaly jsou velmi starou pomůckou při meditaci. Jejich původ sahá do indické a tibetské tradice. V křeťanském okruhu je mohou tvořit kruhové obrazy, které se nacházejí na...",159,248,"['Fontána, naučná', '', 'české']"
