db_id,name,rating,reviews_cnt,year,pages_cnt,publisher,genre,author,lang,description,price_from,price_to,unparsed
n663880256,Skleněný pokoj - Simon Mawer,99,7,2018,408,české,beletrie,Mawer Simon</p>,,Román byl inspirován osudem vily Tugendhat a popisuje dramatické okamžiky odehrávající se za zdmi této brněnské památky. V roce 2009 byl nominován na cenu The Man Booker Prize.,275,389,"['KNIHA ZLÍN, beletrie', '', 'české, Mawer Simon']"
n674078510,Pražské jaro - Simon Mawer,90,9,2018,448,české,beletrie,Simon Mawer</p>,,"Simon Mawer, autor Skleněného pokoje, bestselleru deníku New York Times, se vrací do Československa. Tentokrát během bouřlivých šedesátých let a s napínavým příběhem o sexu,...",285,399,"['KNIHA ZLÍN, beletrie', '', 'české, Simon Mawer']"
n657409984,Zaslepení - Krištůfková Kateřina,0,0,2018,376,české,beletrie,Horst Jorn Lier</p>,,"Detektivka psaná detektivem. Další díl série s komisařem Williamem Wistingem. Wistingova dcera Line čeká dítě, a proto se rozhodne přestěhovat se zpátky do rodného Stavern. Tam...",257,369,"['KNIHA ZLÍN, beletrie', '', 'české, Horst Jorn Lier']"
n607474372,Poustevník - Horst Jorn Lier,0,0,2018,352,české,beletrie,Horst Jorn Lier</p>,,"Ukradená identita, sériový vrah a Wistingova dcera v ohrožení. Další případ komisaře Wistinga od slavného severského spisovatele a bývalého kriminalisty.

Poustevník je...",257,369,"['KNIHA ZLÍN, beletrie', '', 'české, Horst Jorn Lier']"
n649322981,Potopa - Kašparová Martina,0,0,2018,448,české,beletrie,Kristina Ohlssonová</p>,,"V křesle před krbem ve vlastním domě je nalezen postarší muž. V prsou mu zeje díra po kulce, na malíčku má z neznámého důvodu navlečený snubní prsten své dcery. V jiné části...",282,399,"['KNIHA ZLÍN, beletrie', '', 'české, Kristina Ohlssonová']"
n584420830,Dýka - Díaz Jorge Fernández,0,0,2018,456,české,beletrie,Jorge Fernández Díaz</p>,,"„Mám všelijaký jména, ale mezi svejma jsem známej jako Remil. ‚Ty jeden debile remile,‘ říkal mi každý ráno při cvičení seržant. Myslel to jako pochvalu. No a ten Remil už mi...",278,360,"['KNIHA ZLÍN, beletrie', '', 'české, Jorge Fernández Díaz']"
n664347318,Vaše tváře zla - Puskely Martin,0,0,2018,320,české,beletrie,Martin Puskely</p>,,"Román psaný s bezprecedentní odvahou nahlíží do míst, před nimiž česká próza až doposud zavírala oči

Během jednoho dne a noci na začátku roku 1998 se v rakouském Linci...",246,349,"['KNIHA ZLÍN, beletrie', '', 'české, Martin Puskely']"
n663880261,Přepadení ze vzduchu - Bonnier Jonas,0,0,2018,416,české,beletrie,Jonas Bonnier</p>,,"Čtyři muži, jeden společný sen a loupež století. Téměř dokonalý zločin podle skutečné události.

23. září 2009 brzy ráno vypukne poplach – je přepadena centrála bezpečnostní...",232,379,"['KNIHA ZLÍN, beletrie', '', 'české, Jonas Bonnier']"
