db_id,name,rating,reviews_cnt,year,pages_cnt,publisher,genre,author,lang,description,price_from,price_to,unparsed
n591364450,Užitečné tabulky pro praxi nejen v interních oborech,100,2,2018,384,Grada,naučná,české</p>,,"Skvělá příručka, kterou nosí každý začínající lékař v kapse svého pláště. Informace z mnoha převážně interních oborů – algoritmy, hodnocení výsledků, přehledné tabulky, vybrané...",395,499,"['Grada, naučná', '', 'české']"
n602100343,"Kapesní atlas dermatologie - Röcken Martin, Schaller Martin, Sattler Elke, Burgdorf Walter,",100,1,2018,394,Grada,naučná,české</p>,,"Publikace, která slouží zejména dermatologům k opakování, je určena také ostatním lékařům v praxi – praktikům, internistům, pediatrům i lékařům dalších odborností, dále...",791,999,"['Grada, naučná', '', 'české']"
n595253657,"DPH 2018 - výklad s příklady - Galočík Svatopluk, Paikert Oto",100,1,2018,432,Grada,naučná,české</p>,,"Ve 14. vydání této časem a praxí prověřené publikace naleznete výklad všech paragrafů zákona o DPH se zvýrazněním novel, včetně poslední rozsáhlé novely od 1. 7. 2017. Nechybí...",287,339,"['Grada, naučná', '', 'české']"
n601959317,Programování v C++ od základů k profesionálnímu použití - Miroslav Virius,0,0,2018,416,Grada,naučná,české</p>,,"„Jediným způsobem, jak se naučit nějaký programovací jazyk, je psát v něm programy. Zkušený autor se tohoto hesla drží i ve své nejnovější knize, která poslouží jako brána do...",336,399,"['Grada, naučná', '', 'české']"
n688062364,Jan Tegze Jak hledat zaměstnance v 21. století,0,0,2018,328,Grada,naučná,české</p>,,"Hledáte moderní metody pro efektivní hledání nových lidí? Chcete rozumět oblasti náboru a dokázat najít specialisty ve vašem oboru? Pak je tato kniha určena právě vám.
 Ať jste...",395,499,"['Grada, naučná', '', 'české']"
n665016132,Mikroekonomie - Jurečka a kolektiv Václav,0,0,2018,400,Grada,naučná,české</p>,,Publikace je velmi užitečnou pomůckou ke studiu mikroekonomické teorie. Je určena zejména studentům základních kurzů ekonomie na vysokých školách a v MBA studiích. Kniha...,340,429,"['Grada, naučná', '', 'české']"
n623322801,České dějiny 100 památných míst - Jan Kvirenc,100,3,2018,456,Grada,naučná,české</p>,,"100 let od vzniku Československé republiky
100 památních míst českých dějin

Moderní dějiny Čechů jsou nemyslitelné bez návaznosti na dávnější období – a právě těmi se zaobírá...",712,899,"['Grada, naučná', '', 'české']"
n602100341,Zubní lékařství pro studující nestomatologických oborů - Mazánek Jiří a kolektiv,0,0,2018,400,Grada,naučná,české</p>,,"Celobarevná publikace klade hlavní důraz na onemocnění a stavy, se kterými se ve své praxi setkává lékař – nestomatolog. Sepsal ji zkušený autorský kolektiv, který byl veden...",590,699,"['Grada, naučná', '', 'české']"
