db_id,name,rating,reviews_cnt,year,pages_cnt,publisher,genre,author,lang,description,price_from,price_to,unparsed
n287475965,Pracovněprávní spory - PP115,0,0,2015,216,C.H.Beck,naučná,české</p>,,Publikace se primárně věnuje procesnímu právu v pracovněprávních sporech a souvislostem s právem hmotným. Pracuje se stěžejními závěry judikatury a nabízí řešení sporných...,331,458,"['C.H.Beck, naučná', '', 'české']"
n284969995,Spolky a spolkové právo,100,1,2015,176,C.H.Beck,naučná,české</p>,,"Praktický průvodce spolkovým právem pro všední i nevšední situace při fungování spolku.

 Kniha je rozdělena na dvě základní části – část teoretickou, která obsahuje základní...",331,482,"['C.H.Beck, naučná', '', 'české']"
n338192605,Obchodní korporace obecná část,0,0,2015,200,C.H.Beck,naučná,české</p>,,"Publikace představuje učebnici práva obchodních korporací a navazuje na učebnici práva cenných papírů, která v rámci série Základů soukromého práva vyšla v roce 2014. Je...",280,330,"['C.H.Beck, naučná', '', 'české']"
n276409627,Podniková ekonomika. Sbírka příkladů a případových studií - EU63,100,1,2015,172,C.H.Beck,naučná,české</p>,,"Sbírka příkladů a případových studií. Sbírka příkladů a případových studií k učebnici Podniková ekonomika (Miloslav Synek, Eva Kislingerová a kol.) slouží studentům k...",318,390,"['C.H.Beck, naučná', '', 'české']"
n269554405,IS/IT strategie - krok za krokem. Teorie pro praxi - BP2,0,0,2015,208,C.H.Beck,naučná,české</p>,,"IS/IT jsou z pohledu současné praxe managementu rozporuplný fenomén. Pro každou organizaci mohou být příležitostí – strategickou zbraní, prostředkem pro získávání strategických...",417,639,"['C.H.Beck, naučná', '', 'české']"
n410681159,"Rodina a dítě v novém občanském zákoníku - Radvanová, Senta",0,0,2015,216,C.H.Beck,naučná,české</p>,,Občanský zákoník č. 89/2012 Sb. přinesl řadu zásadních změn mimo jiné i v úpravě rodinného práva. Tou nejvíce viditelnou bylo zrušení zákona o rodině a vtělení převážné části...,332,390,"['C.H.Beck, naučná', '', 'české']"
n267181542,"Základy správního práva trestního, 6. vydání - MU38",0,0,2015,204,C.H.Beck,naučná,české</p>,,"Předkládaná učebnice je jedinou prací svého druhu v České republice. Poskytuje komplexní přehled jednoho z významných subsystémů správního práva, tedy správního trestání....",448,550,"['C.H.Beck, naučná', '', 'české']"
