db_id,name,rating,reviews_cnt,year,pages_cnt,publisher,genre,author,lang,description,price_from,price_to,unparsed
n9174551,Kniha 111 tipů jak šetřit svoje peníze - KE0560,87,2,2009,184,BizBooks,naučná,české</p>,,"Domácnost - jídlo - komunikační technika - lidé - nákupy - doprava - dovolená a volný čas - peníze. Kniha 111 tipů, jak šetřit vaše peníze není jen 111 tipů. Tahle kniha...",103,154,"['BizBooks, naučná', '', 'české']"
n459928819,Přesvědčivá komunikace manažera,0,0,2009,208,BizBooks,naučná,české</p>,,Kniha a kurz komunikace na DVD jsou užitečné pro manažery a všechny lidi pohybující se v podnikatelském prostředí. Ovládnutí principů komunikačních dovedností pomáhá manažerům...,348,499,"['BizBooks, naučná', '', 'české']"
n4328441,"30 důvodů, proč zaměstnanci nenávidí své vedoucí Co si myslí vaši zaměstnanci a co s tím můžete udělat Bruce L. Katcher, Adam Snyder",100,1,2009,208,BizBooks,naučná,české</p>,,"Proč vás vaši podřízení nenávidí? Vždyť přece nejste zákeřný a protivný člověk! Nevyhrožujete jim, ani je nezesměšňujete a každý den zvesela zahlaholíte ranní pozdrav. Přesto...",102,149,"['BizBooks, naučná', '', 'české']"
n9492399,Kniha Značka: od vize k vyšším ziskům Strategický proces budování a posilování značky,100,1,2009,176,BizBooks,naučná,české</p>,,"Strategický proces budování a posilování značky
Publikace Značka: od vize k vyšším ziskům prezentuje pracovníkům oddělení marketingu a řízení značky a studentům praktické...",141,407,"['BizBooks, naučná', '', 'české']"
n5761446,"Kniha Outdoor aktivity 50 aktivit pro trénink, školení i zábavu",0,0,2009,184,BizBooks,naučná,české</p>,,"50 aktivit pro trénink, školení i zábavu Žijte aktivně!
Výběr osvědčených her a aktivit důkladně vyzkoušených na školicích kurzech, volnočasových akcích i při výuce. Všechny...",187,279,"['BizBooks, naučná', '', 'české']"
