db_id,name,rating,reviews_cnt,year,pages_cnt,publisher,genre,author,lang,description,price_from,price_to,unparsed
n563044045,Návrat na panství Tyringham - McLoughlin Rosemary,0,0,2017,352,Víkend,beletrie,české</p>,,"Příběh o velkých vášních, sžíravé nenávisti a tajných milostných pletkách připomínající oblíbený seriál Panství Downton.
První část příběhu Kletba panství Tyringham, kde...",160,329,"['Víkend, beletrie', '', 'české']"
n557550089,Někdo tě vidí,85,1,2017,352,Víkend,beletrie,české</p>,,"Jak rychle umíš běhat?
V podpatcích a úzké sukni, když tě do boku bouchá kabelka. Jak rychle?
Když jdeš na vlak na poslední chvíli a chce‰ se co nejdřív dostat domů, máš už jen...",212,329,"['Víkend, beletrie', '', 'české']"
n557550088,Krámek s hedvábím,0,0,2017,352,Víkend,beletrie,české</p>,,"Strhující román Dinah Jefferies je poutavý, nezapomenutelný příběh o dívce, která je rozpolcená mezi dvěma světy.

Rok 1952, Indočína. Osmnáctiletá Nicole žije ve stínu své...",211,329,"['Víkend, beletrie', '', 'české']"
n484006069,"Muž bez srdce - Severský krimiromán - Grebe Camilla, Träff Asa",0,0,2017,368,Víkend,beletrie,české</p>,,"Sestry píšící švédské krimi bestsellery. Knihy Terapeutka a Trpčí než smrt byly nominovány na Nejlepší švédský detektivní román roku.

 Čtvrtý krimiromán s psycholožkou Siri...",207,287,"['Víkend, beletrie', '', 'české']"
n488568221,Oddělení 73,0,0,2017,336,Víkend,beletrie,české</p>,,"Čtvrté pokračování švédské série s kriminální inspektorkou Emou Sköldovou.

Kriminální inspektorka Emma Sköldová se v nemocnici probudí po pěti měsících z komatu. Marně se...",207,319,"['Víkend, beletrie', '', 'české']"
