db_id,name,rating,reviews_cnt,year,pages_cnt,publisher,genre,author,lang,description,price_from,price_to,unparsed
n42400947,Dřevěné stavby,100,1,2012,152,Akcent,naučná,české</p>,,"41 nejkrásnějších dřevěných staveb v České republice očima Pavla J. Hejátka, Petra Nováky, Rostislava Nováka a Jiřího Zemana

OBSAH:
Dřevěné kostely
Antýgl, původní roubený...",187,299,"['Akcent, naučná', '', 'české']"
n67256948,Jan Sokol z Lamberka Jiří Lysák,80,1,2012,80,Akcent,naučná,české</p>,,"V0220456
Zřícenina hradu Lamberka se nachází v katastru obce Březníka u Náměště nad Oslavou. V povodí řeky Oslavy zaujímá zvláštní místo v romantické scenérii skalnatého...",124,199,"['Akcent, naučná', '', 'české']"
n106876614,Zednáři - Od Balsama k Dr. Benešovi - Stibral Jiří,0,0,2012,152,Akcent,naučná,české</p>,,"Zednářství je opředené řadou mýtů. Podle tzv. Chrámové legendy se zednářství odvozuje od Hirama Abiffa, stavitele Šalamounova chrámu, podle jiné hypotézy se Svobodní zednáři...",151,229,"['Akcent, naučná', '', 'české']"
n51385311,Žoldnéřské války,0,0,2012,120,Akcent,naučná,české</p>,,"V romány dneška se mohou proměnit i zcela konkrétní pravdy včerejška. Tak to vidí autor literatury faktu Bořek Homola, který se řadu let pohyboval, jako zpravodaj našich médií,...",139,199,"['Akcent, naučná', '', 'české']"
