db_id,name,rating,reviews_cnt,year,pages_cnt,publisher,genre,author,lang,description,price_from,price_to,unparsed
n99190864,Román o růži - Vlastimil Vondruška,98,8,2013,224,Moba,beletrie,Vlastimil Vondruška</p>,,"Devátá kniha série Hříšní lidé Království českého.
Již devátý díl historických detektivních románů, které se odehrávají v časech panování krále Přemysla II. Otakara. Příběh se...",220,251,"['Moba, beletrie', '', 'české, Vlastimil Vondruška']"
n109719700,Ulička hanby - Letopisy královské komory,97,12,2013,224,Moba,beletrie,Vondruška Vlastimil</p>,,"Nový díl Letopisů královské komory od Vlastimila Vondrušky.  Královský písař Jiří Adam z Dobronína se v době mládí znal s ženou, která se později vypracovala na majitelku...",212,269,"['Moba, beletrie', '', 'české, Vondruška Vlastimil']"
n70017594,Krev na kapradí,89,9,2013,224,Moba,beletrie,Vlastimil Vondruška</p>,,"Kniha navazuje na úspěšnou sbírku povídek Krev na lopuchu a skládá se ze dvou částí. V té první je osm příběhů, v nichž jako hlavní vyšetřovatel vystupuje Oldřich z Chlumu a...",242,242,"['Moba, beletrie', '', 'české, Vlastimil Vondruška']"
n70017603,Zločinci a kavalíři,0,0,2013,200,Moba,beletrie,Petr Šuleř</p>,,"Příběh několika kriminálních činů se odehrává v letech 1611 a 1612, především v Brně.
 
Tehdejší hejtman moravských stavů Karel starší ze Žerotína proslul jako vynikající...",183,183,"['Moba, beletrie', '', 'české, Petr Šuleř']"
n109719684,Zdivočelý tlukot srdce,0,0,2013,224,Moba,beletrie,Roman Cílek</p>,,"V tomto souboru dějem nabitých kriminálních případů známého a uznávaného autora se setkáváme s několika zavrženíhodnými zločiny i s jejich krutými následky, s několika...",191,191,"['Moba, beletrie', '', 'české, Roman Cílek']"
n108863434,Dýchání pod vodou. Román autorky knižního hitu: Netvor Alex Flinn MOBA,60,1,2013,216,Moba,beletrie,Alex Flinn</p>,,"Nick je jedním z vyvolených. Studuje vysokou školu, je inteligentní, oblíbený, bohatý. Lidé si myslí, jak snadný má život. Až na jednu věc. Nick nikdy nikomu neřekl o otcově...",199,199,"['Moba, beletrie', '', 'české, Alex Flinn']"
