db_id,name,rating,reviews_cnt,year,pages_cnt,publisher,genre,author,lang,description,price_from,price_to,unparsed
n639563392,Konflikty v škole - Nora Lauková,0,0,2018,100,Raabe,naučná,slovenské</p>,,"Sprievodca, ktorý pedagógov naučí reagovať na konflikty správne tak, aby ich zvládali a aby ich neovládali. Zoznamuje s problematikou konfliktov v škole na reálnych situáciách...",448,540,"['Raabe, naučná', '', 'slovenské']"
n600787739,"Diabetes mellitus - Ian N Scobie, Katherine Samaras",0,0,2018,136,Raabe,naučná,slovenské</p>,,"Prehľadná plnofarebná publikácia, v ktorej nájdete všetky dôležité informácie pokrývajúce kľúčové aspekty klinických podmienok pod pojmom diabetes mellitus – od základnej...",396,540,"['Raabe, naučná', '', 'slovenské']"
n653952978,"Zopakuj si slovenčinu 6 - Zuzana Bartošová, Libuša Bednáriková, Veronika Burčíková, Veronika Dobrovodská, Stanislava Havettová, Katarína Hincová, Mária Mydlová",0,0,2018,96,Raabe,naučná,slovenské</p>,,"Testy na opakovanie učiva zo slovenského jazyka a literatúry pre 7. ročník základnej školy na upevnenie, preopakovanie a precvičenie učiva zo slovenského jazyka a literatúry....",196,268,"['Raabe, naučná', '', 'slovenské']"
n621978484,Rýchle fakty: Bolesti hlavy,0,0,2018,104,Raabe,naučná,slovenské</p>,,Brožúra Rýchle fakty: Bolesti hlavy poskytuje lekárom primárneho kontaktu potrebné znalosti pre posúdenie a správny manažment primárnej bolesti hlavy. Umožňuje lekárom rozlíšiť...,397,540,"['Raabe, naučná', '', 'slovenské']"
n644806296,Meňavce: Veľký tresk - Jozef Hvorecký,0,0,2018,98,Raabe,naučná,slovenské</p>,,"Sprievodca galaxiou medzi fyzikou a slovenčinou. Beletrizovaný pracovný zošit na rozvoj prírodovednej gramotnosti pre žiakov na 2. stupni ZŠ, ktorý obsahuje aj úlohy na rozvoj...",295,403,"['Raabe, naučná', '', 'slovenské']"
n658771409,Rýchle fakty: Hyperlipidémia,0,0,2018,144,Raabe,naučná,slovenské</p>,,"V brožúre z edičnej rady Rýchle fakty: Hyperlipidémia autori, renomovaní odborníci z Veľkej Británie a USA, interpretujú dôkazy z klinických štúdií v kontexte patogenézy a...",397,540,"['Raabe, naučná', '', 'slovenské']"
n653952977,"Zopakuj si slovenčinu 7 - Zuzana Bartošová, Libuša Bednáriková, Veronika Burčíková, Veronika Dobrovodská, Stanislava Havettová, Katarína Hincová, Mária Mydlová",0,0,2018,96,Raabe,naučná,slovenské</p>,,"Testy na opakovanie učiva zo slovenského jazyka a literatúry pre 7. ročník základnej školy na upevnenie, preopakovanie a precvičenie učiva zo slovenského jazyka a literatúry....",196,268,"['Raabe, naučná', '', 'slovenské']"
n672704896,"Zverejňovanie zmlúv, faktúr a objednávok v praxi",0,0,2018,124,Raabe,naučná,slovenské</p>,,"Odborná brožúra s podtitulom Zverejňovanie povinných údajov na webovom sídle bez porušenia GDPR je zameraná konkrétne na potreby organizácií školstva, samosprávy, štátnej a...",204,222,"['Raabe, naučná', '', 'slovenské']"
