db_id,name,rating,reviews_cnt,year,pages_cnt,publisher,genre,author,lang,description,price_from,price_to,unparsed
n234654476,Smrt odpoledne - Ernest Hemingway,100,1,2015,360,Odeon,beletrie,české</p>,,"Kniha Smrt odpoledne se zrodila z Hemingwayova vášnivého zaujetí pro býčí zápasy, jež se snaží zasvěceně a zároveň poutavě přiblížit ze všech úhlů, do nejmenších podrobností,...",259,349,"['Odeon, beletrie', '', 'české']"
n310037071,Sto roků samoty,99,3,2015,320,Odeon,beletrie,české</p>,,"Román, jedno z nejvýznamnějších děl latinskoamerické i světové prózy, vyšel poprvé r. 1967. V množství reálných i fantaskních epizod líčí osudy šesti generací rodiny Buendíů...",197,249,"['Odeon, beletrie', '', 'české']"
n282135469,Růže od Stalina,78,1,2015,328,Odeon,beletrie,české</p>,,Mé jméno je Světlana Allilujevová. Narodila jsem se 28. února 1926. Můj otec zemřel roku 1953. Jmenoval se Josif Stalin. Jediná dcera sovětského diktátora měla až neuvěřitelný...,199,299,"['Odeon, beletrie', '', 'české']"
n232759877,Strašidla - Román - z povídek - Chuck Palahniuk,100,1,2015,392,Odeon,beletrie,české</p>,,"Svatý Nestřeva, Miss Amerika, Kníže Vandalů, Dohazovač, Chybějící článek, Hajzldáma, agent Donáška, Matka příroda… Pitomá jména pro skutečné lidi. Každý z nich našel stejný...",244,349,"['Odeon, beletrie', '', 'české']"
n291536409,Svobodu medvědům,0,0,2015,352,Odeon,beletrie,české</p>,,"Student vídeňské univerzity a rituální krmič ptactva Siggy Javotnik se poznají v motocyklové dílně na periferii města: narychlo kupují motorku a vyrážejí na trip, kde čas a...",238,299,"['Odeon, beletrie', '', 'české']"
