db_id,name,rating,reviews_cnt,year,pages_cnt,publisher,genre,author,lang,description,price_from,price_to,unparsed
n551934407,The Rooster Bar - John Grisham,0,0,2017,368,Hodder,beletrie,John Grisham</p>,,"'The Best Thriller Writer Alive' Ken Follett
John Grisham's newest legal thriller takes you inside a law firm that shouldn't exist.
Law students Mark, Todd and Zola wanted to...",264,509,"['Hodder, beletrie', '', 'anglické, John Grisham']"
n249890731,Snakehead,0,0,2017,416,Hodder,beletrie,Peter May</p>,,"The Beijing Ripper makes a personal vendetta against Detective Li Yan in the thrilling final episode of the series

GRUESOME MURDERS
His victims are young, beautiful and coldly...",200,299,"['Hodder, beletrie', '', 'anglické, Peter May']"
n561823222,King Stephen - The Dark Tower Collection,0,0,2017,416,Hodder,beletrie,Stephen King</p>,,"Stephen King is the author of more than fifty books, all of them worldwide bestsellers. Among his most recent are the Dark Tower novels, Cell, From a Buick 8, Everythings...",1,1,"['Hodder, beletrie', '', 'anglické, Stephen King']"
n564110174,Whistler Grisham John,0,0,2017,410,Hodder,beletrie,John Grisham</p>,,The most corrupt judge in US history. A young investigator with a secret informant. John Grisham will keep you on the edge of your seat with his electrifying number one...,185,280,"['Hodder, beletrie', '', 'anglické, John Grisham']"
