db_id,name,rating,reviews_cnt,year,pages_cnt,publisher,genre,author,lang,description,price_from,price_to,unparsed
n106877082,Smrtící nevinnost,98,4,2013,384,Metafora,beletrie,české</p>,,"Poručík Eva Dallasová se musí vypořádat nejen se záhadou mrtvého učitele, ale i s dávnou láskou svého manžela…
Oblíbená řada vynikající kriminálních románů z New Yorku nedaleké...",254,299,"['Metafora, beletrie', '', 'české']"
n151374805,Ohnivý anděl,84,3,2013,376,Metafora,beletrie,české</p>,,"Jaké hrůzy se děly za zdmi ústavu pro postižené, který lehl popelem?
Nejlepší příběh od dob Přeletu na kukaččím hnízdem
Islandská odpověď na Stiega Larssona!
Detektivní...",131,279,"['Metafora, beletrie', '', 'české']"
n101339691,Nepřítel. Krycí jméno Tesseract - Tom Wood - Metafora,0,0,2013,432,Metafora,beletrie,české</p>,,"Nájemný vrah, před kterým blednou i jména jako Šakal nebo Viktor Čistič, ve službách CIA!
 Kdo je ale přítel a kdo nepřítel?
 Volné pokračování knihy Krycí jmého Tesseract:...",297,349,"['Metafora, beletrie', '', 'české']"
n122280630,Smrtící stvoření - J.D. Robb,98,2,2013,352,Metafora,beletrie,české</p>,,"Poručík Dallasová návnadou pro sadistického vraha žen!

Další pokračování populární řady Smrtící… napínavých detektivních příběhů z blízké budoucnosti.

Před devíti lety,...",254,299,"['Metafora, beletrie', '', 'české']"
n83427379,Zloději lidí,0,0,2013,352,Metafora,beletrie,české</p>,,"Mladá dvojice rukojmím brutálních banditů… Smrtelně nebezpečný případ Elvise Colea.

Když se dva mladí lidé, Krista a Jack, vydají na noční vyjížďku do pouště, nečekají, že by...",289,289,"['Metafora, beletrie', '', 'české']"
