db_id,name,rating,reviews_cnt,year,pages_cnt,publisher,genre,author,lang,description,price_from,price_to,unparsed
n355137099,Esencialismus. Jak dělat správně správné věci - McKeown Greg,100,2,2015,216,Management Press,naučná,české</p>,,"Kniha, jejíž název Esencialismus – přestože neobvyklý - na první
pohled neslibuje „marketingový trhák“, přesto se za ním skrývá
obsahově zajímavý a velmi poučný text,...",272,399,"['Management Press, naučná', '', 'české']"
n302470000,Jak dosáhnout mimořádné produktivity - prac.... - Pět rozhodnutí,0,0,2015,224,Management Press,naučná,české</p>,,"Zdá se vám, že nestíháte? Chcete lépe nakládat se svým časem, být úspěšnější ve své kariéře, mít více času na své blízké? Připadáte si zavalený horou povinností, zbytečnými a...",278,399,"['Management Press, naučná', '', 'české']"
n400725135,"VEDENÍ PROCESU ZMĚNY - Kotter,John P.",0,0,2015,224,Management Press,naučná,české</p>,,"Kniha jednoho z nejvýznamnějších světových odborníků v oboru rozvoje vůdčích dovedností.

V létě roku 1994 napsal John P. Kotter pro časopis Harvard Business Review článek...",208,299,"['Management Press, naučná', '', 'české']"
n247870784,Vnitřní hra tenisu. Mentální stránka vrcholového výkonu - W. Timothy Gallwey - Kniha,0,0,2015,184,Management Press,naučná,české</p>,,"Nejúspěšnější kniha mezinárodně proslulého trenéra a kouče odhaluje principy vnitřní (""skryté"") hry odehrávající se v ""hlavě"" každého tenisty mezi ""prvním já"" (mysl) a ""druhým...",202,299,"['Management Press, naučná', '', 'české']"
n350797760,77 jednoduchých způsobů jak zvýšit produktivitu a zisk,0,0,2015,200,Management Press,naučná,české</p>,,Autoři knihy Jeremy Eden a Terri Long pracovali s řadou firem patřících do seznamu Fortune 1000 a podnikajících v nejrůznějších oborech. Pomohli jim vyřešit doslova tisíce...,313,449,"['Management Press, naučná', '', 'české']"
n260446124,Adaptivní organizace (Adrián Podskľan),0,0,2015,176,Management Press,naučná,české</p>,,"Je neoddiskutovatelné, že bariéry úspěšnosti podnikání mají své kořeny nejen v selhání trhu, právních nástrojů a v neočekávaných změnách ekosystému, ale také v nízké schopnosti...",59,297,"['Management Press, naučná', '', 'české']"
n251595264,Vnitřní hra tenisu,0,0,2015,184,Management Press,naučná,české</p>,,"Nejúspěšnější kniha mezinárodně proslulého trenéra a kouče odhaluje principy vnitřní (""skryté"") hry odehrávající se v ""hlavě"" každého tenisty mezi ""prvním já"" (mysl) a ""druhým...",217,270,"['Management Press, naučná', '', 'české']"
