db_id,name,rating,reviews_cnt,year,pages_cnt,publisher,genre,author,lang,description,price_from,price_to,unparsed
n166528824,Děláme si to doma sami - Alena Thomas,92,52,2014,248,Jota,naučná,české</p>,,"Doma se dá vyrobit téměř všechno, od luxusní pěsticí kosmetiky přes léčivé extrakty k prevenci běžných neduhů až po čisticí prostředky pro domácnost, které překvapí svým...",256,398,"['Jota, naučná', '', 'české']"
n214484698,Body Book Diaz Cameron - Bark Sandra,92,22,2014,296,Jota,naučná,české</p>,,"Body Book není příručka, která by ženám předepisovala, co mají splnit za týden, za třicet dní či za rok. Je to kniha, která předpokládá dlouhodobou, nejlépe trvalou, změnu...",280,448,"['Jota, naučná', '', 'české']"
n259846425,Mysl je mocný lékař - Lissa Rankinová,94,7,2014,310,Jota,naučná,české</p>,,"Vyrůstali jsme ve víře, že každé onemocnění je způsobeno geneticky. Nebo za ním vězí příslovečná smůla – a klíče k optimálnímu zdraví drží v rukou pouze lékaři. Doktorka Lissa...",191,298,"['Jota, naučná', '', 'české']"
n172273131,V erbu Progres - Petr Gratias; Pavel Váně,86,4,2014,258,Jota,naučná,české</p>,,"V erbu Progres 

Brněnská rocková skupina The Progress Organization, respektive Progres 2 prošla mnoha barvitými fázemi vývoje a etablovala se jako významný hudební útvar,...",256,398,"['Jota, naučná', '', 'české']"
n219871146,Jak se stát Pařížankou - Berest Anne,83,7,2014,272,Jota,naučná,české</p>,,"Pařížanka a Paříž. Synonyma pro specifický životní styl i názory. Pařížanku poznáte všude na světě díky jejímu osobitému šarmu a způsobu, jakým si dokáže vychutnávat život. Je...",217,348,"['Jota, naučná', '', 'české']"
