db_id,name,rating,reviews_cnt,year,pages_cnt,publisher,genre,author,lang,description,price_from,price_to,unparsed
n433466795,Procitnutí Evy. O odstranění emocionální zaslepenosti - Alice Millerová,100,1,2016,136,Malvern,naučná,české</p>,,"Rané emocionální zkušenosti zanechávají v těle stopy, které kódujeme jako informace a které v dospělosti ovlivňují náš způsob myšlení, cítění a jednání, ale naše vědomí je...",174,248,"['Malvern, naučná', '', 'české']"
n349051162,Vnitřní Egypt aneb deset ran duše - Annick de Souzenelle,0,0,2016,144,Malvern,naučná,české</p>,,Autorka v této knize přibližuje a vykládá biblický příběh 2. knihy Mojžíšovy o útěku z Egypta a egyptských ranách jako příběh o povstávání člověka a jeho přerodu z animální...,207,264,"['Malvern, naučná', '', 'české']"
n366316615,"Boschův triptych v zrcadle písma. „Zahrada pozemských rozkoší“, nebo „Třetí den stvoření? - Zdeněk Neubauer - Malvern",100,1,2016,96,Malvern,naučná,české</p>,,"Autor : Zdeněk Neubauer, Popis : 
 Triptych Hieronyma Bosche Zahrada pozemských rozkoší byl po staletí výkladů pevně spojen s výsostným mytickým příběhem evropské civilizace –...",145,247,"['Malvern, naučná', '', 'české']"
n352865011,Principy moderní architektury - Christian Norberg-Schulz,0,0,2016,144,Malvern,naučná,české</p>,,"Významný norský historik a teoretik architektury, známý u nás
především do češtiny přeloženou knihou Genius loci, analyzuje v
tomto díle základní rysy charakteristické pro...",255,409,"['Malvern, naučná', '', 'české']"
n383081466,Nevědomí a básnický objev - Stanislav Dvorský,0,0,2016,103,Malvern,naučná,české</p>,,"Kniha vychází z definice poezie jako ""otázky existence zodpovídané v záchvatu pocitu existence"" (Mikuláš Medek) a zkoumá její noetickou dimenzi pohledem inspirovaným...",147,189,"['Malvern, naučná', '', 'české']"
n429065460,Písně absurdní - Martin C. Putna,0,0,2016,132,Malvern,naučná,české</p>,,"Autor : Martin C. Putna, Popis : 
 Po nahrávkách O smrti i vesele a Písně pro Ježíše vydává MCP třetí CD. Po tématu smrti a tématu modlitby téma písňového smíchu. Drsný...",266,444,"['Malvern, naučná', '', 'české']"
