db_id,name,rating,reviews_cnt,year,pages_cnt,publisher,genre,author,lang,description,price_from,price_to,unparsed
n724960770,Láska po francouzsku - Valpy Fiona,0,0,2016,224,Baronet,beletrie,české</p>,,"Může se štěstí „ztratit v překladu“? Gině se to málem stalo. Nejdřív všechno ztratila, aby pak mohla všechno zase najít: lásku, přátele i rodinu. A ona i čtenáři si přitom...",60,232,"['Baronet, beletrie', '', 'české']"
n335704711,Baronet a. s. Dvojí hra,100,1,2016,232,Baronet,beletrie,české</p>,,"Sovětský svaz, rok 1924. Lenin umírá a mladý komunistický režim je krůček od nového boje o moc, války a krveprolití. Toho se obává britský král, který se rozhodne odtud...",50,279,"['Baronet, beletrie', '', 'české']"
n335746114,T-Force 1 - Velký průlom,90,3,2016,224,Baronet,beletrie,české</p>,,"T-Force je elitní přepadová jednotka. Zasazuje Němcům údery do těch nejchoulostivějších míst.

 Stvořil je generál Patton. Zodpovídají se přímo jemu. Ale v létě 1944 se zdá, že...",166,259,"['Baronet, beletrie', '', 'české']"
n335746101,Mstitelky,65,1,2016,224,Baronet,beletrie,české</p>,,"Příběh pomsty sedmi odhodlaných, rozhořčených žen, které vinou lidské krutosti a lhostejnosti utrpěly bolestnou ztrátu. Všechny se odmítly smířit s nespravedlivostí, s bezmocí...",43,232,"['Baronet, beletrie', '', 'české']"
n455312980,Pomsta - Michaels Fern,100,1,2016,216,Baronet,beletrie,české</p>,,"Před pěti lety se Myřina těhotná dcera stala obětí opilého řidiče, jenž navíc z místa tragédie chladnokrevně odjel. Co hůř, pachatel dokonce unikl trestu, neboť šlo o syna...",44,232,"['Baronet, beletrie', '', 'české']"
n335746100,Oko za oko,0,0,2016,224,Baronet,beletrie,české</p>,,"Příběh pomsty sedmi odhodlaných, rozhořčených žen, které vinou lidské krutosti a lhostejnosti utrpěly bolestnou ztrátu. Všechny se odmítly smířit s nespravedlivostí, s bezmocí...",43,232,"['Baronet, beletrie', '', 'české']"
n387062069,Baronet a. s. Vánoce po francouzsku,80,3,2016,208,Baronet,beletrie,české</p>,,"Evie kdysi Vánoce milovala, ale teď se nemůže dočkat, aby se jich zbavila. Úplně sama odjede na francouzský venkov, aby zapomněla na nejhorší ztrátu, která může ženu potkat....",154,259,"['Baronet, beletrie', '', 'české']"
n383848803,T-Force - Masakr v Métách - Série - T-Force - 2 - Leo Kessler,100,2,2016,200,Baronet,beletrie,české</p>,,Za dva roky bojových zkušeností zadal velitel 3. americké armády George Patton své speciální jednotce T-Force mnoho nesnadných úkolů. Ovšem jeho poslední rozkazy jsou bezesporu...,153,259,"['Baronet, beletrie', '', 'české']"
