db_id,name,rating,reviews_cnt,year,pages_cnt,publisher,genre,author,lang,description,price_from,price_to,unparsed
n48802229,100 způsobů jak rozumět Vaší kočce,93,3,2008,144,české,naučná,Roger Tabor</p>,,"Základní příručka obsahuje všechny důležité informace pro chovatele a milovníky koček
Podivili jste se někdy, proč kočka přede i u veterináře nebo proč vám vytrvale nosí...",226,349,"['Mladá fronta, naučná', '', 'české, Roger Tabor']"
n1689660,Hubnout musíš od hlavy - de Longhe Aliena,0,0,2008,128,české,naučná,de Longhi Aliena</p>,,"Autorka na pozadí svého životního příběhu líčí všechny možné zaručené návody, které v posledních letech vyzkoušela, aby se přiblížila své vysněné hmotnosti. Musela se potýkat s...",224,231,"['Mladá fronta, naučná', '', 'české, de Longhi Aliena']"
n455348217,Křehké vítězství - 28. říjen v paměti Hradu - kolektiv autorů,0,0,2008,168,české,naučná,Kolektiv autorů</p>,,"Publikace, která vychází souběžně se stejnojmennou výstavou na Pražském
hradě, sleduje osudové okamžiky ve vývoji Československa ode dne, kdy 28.
října 1918 proběhl v Praze...",162,258,"['Mladá fronta, naučná', '', 'české, Kolektiv autorů']"
n471754629,Top 12 golfových hřišť - René Teuber; Ilja Ehrenberger,0,0,2008,160,české,naučná,Ilja Ehrenberger</p>,,"Každá kapitola ukazuje mapku, základní charakteristiky a pak se čtenář nechá uchvátit specifickou krásou krajiny, v níž se právě nachází. Samozřejmě nechybějí ani „akční...",179,449,"['Mladá fronta, naučná', '', 'české, René Teuber, Ilja Ehrenberger']"
n897514,Na velikosti záleží - Kompletně nový pohled na úlohu velikosti v biologii (Bonner John Tyler),0,0,2008,128,české,naučná,John Tyler Bonner</p>,,Kompletně nový pohled na úlohu velikosti v biologii. Kniha populárním stylem vysvětluje všeobecné vlivy pravidla „mít tu správnou velikost“. Na příbězích od Alenky v říši divů...,207,279,"['Mladá fronta, naučná', '', 'české, John Tyler Bonner']"
n568091,Jak létají sny - Břetislav Ditrych,0,0,2008,112,české,naučná,Břetislav Ditrych</p>,,"V0098966
Příběhy a osudy pozapomenutých vynálezců, snílků i dobrodruhů, kteří se snažili ovládnout vzdušné moře. Postupně se seznámíme s Václavem Kadeřávkem a jeho Samoletem...",215,289,"['Mladá fronta, naučná', '', 'české, Břetislav Ditrych']"
n16440997,DVD-Peking 2008,0,0,2008,0,české,naučná,Petr Musil</p>,,"Tento disk obsahuje datovou sekci, která představuje českou olympijskou výpravu, nabízí profily všech zúčastněných sportovců a shrnuje výsledky 29. letních olympijských her....",79,89,"['Mladá fronta, naučná', '', 'české, Petr Musil']"
