db_id,name,rating,reviews_cnt,year,pages_cnt,publisher,genre,author,lang,description,price_from,price_to,unparsed
n104938122,Zvuk slunečních hodin - Hana Andronikova,98,3,2013,304,Odeon,beletrie,české</p>,,"Zvuk slunečních hodin kniha od autora Andronikova Hana. Román vynalézavým způsobem spojuje několik rovin a časových pásem - Baťův Zlín, Indii třicátých let, poválečnou Ameriku....",259,259,"['Odeon, beletrie', '', 'české']"
n111616088,Tělo - Paolo Giordano,0,0,2013,304,Odeon,beletrie,české</p>,,"Poušť, vítr a prach. Zažívací potíže, stesk po domově i touha po dobrodružství. Nezkušení nováčci, ostřílení mazáci, cynický lékař. Předsunutá operační základna v Gulistánu,...",262,329,"['Odeon, beletrie', '', 'české']"
n84829559,Panoptikon,87,1,2013,272,Odeon,beletrie,české</p>,,"Patnáctiletá Anais je převážena do Panoptikonu, centra pro
mladistvé delikventy. Tam si okamžitě padne do oka s dalšími
klienty. Galerie je to opravdu pestrá: zloděj, žhář,...",269,299,"['Odeon, beletrie', '', 'české']"
