db_id,name,rating,reviews_cnt,year,pages_cnt,publisher,genre,author,lang,description,price_from,price_to,unparsed
n533214647,Staré řecké báje a pověsti,94,17,2017,192,Ottovo nakladatelstvo,beletrie,české</p>,,"Dávné řecké báje a pověsti zrodila lidová fantazie starověkých řeků v době, kdy lidé ještě neznali ani železný pluh. Vytvořil je génius slavného národa helénů a obstály ve...",151,240,"['Ottovo nakladatelstvo, beletrie', '', 'české']"
n547870128,Ze života Bulíka,96,16,2017,176,Ottovo nakladatelstvo,beletrie,české</p>,,"""Ahoj kamarádi! Jmenuju se Dexter a
jsem anglický bulteriér. Angličák, chápeš… I když tak docela
Angličák nejsem, žiju totiž se svou paničkou a páníčkem v Olomouci.
Mám to tady...",102,134,"['Ottovo nakladatelstvo, beletrie', '', 'české']"
n638422886,"Druhý život začíná ve chvíli, kdy pochopíš, že máš jen jeden",0,0,2017,200,Ottovo nakladatelstvo,beletrie,české</p>,,"Hrdinkou příběhu je Camille, které je 38 let a zdánlivě má vše. Dobrou práci, hodného manžela, zdravého syna a materiální zabezpečení. Přesto není šťastná, nic v jejím životě...",78,224,"['Ottovo nakladatelstvo, beletrie', '', 'české']"
