db_id,name,rating,reviews_cnt,year,pages_cnt,publisher,genre,author,lang,description,price_from,price_to,unparsed
n638728931,Detecting and reducing corruption risk and fraud in the public sector,0,0,2018,138,Karolinum,naučná,anglické</p>,,"Kniha nabízí nový pohled na zkoumání korupce a odhalování podvodů. Autoři ukazují na korupci jako komplexní sociální jev, který je možné zkoumat z různých interdisciplinárních...",125,220,"['Karolinum, naučná', '', 'anglické']"
n734982089,Materializing Identities in Socialist and Post-Socialist Cities,0,0,2018,164,Karolinum,naučná,anglické</p>,,"Kolektivní monografie se zabývá tématem materializace identit v prostoru socialistického a post-socialistického města. Vychází z předpokladu, že městský prostor sehrával...",167,489,"['Karolinum, naučná', '', 'anglické']"
n630898746,Star Wars,0,0,2018,96,Titan Comics,naučná,anglické</p>,,"The latest chapter in the saga is here! Star Wars: The Last Jedi is the epic new movie following the stories of Rey, Finn, Kylo Ren, and Luke Skywalker!
About the Author
Titan...",353,404,"['Titan Comics, naučná', '', 'anglické']"
n517008714,Gentleman 's Look Book,0,0,2018,128,h.f.ullmann,naučná,anglické</p>,,"You’ve often heard the proverb „You don’t get a second chance to make a first impression” 
And why? Because it’s true. Appearance counts! And the appearance of a gentleman is...",390,413,"['h.f.ullmann, naučná', '', 'anglické']"
