db_id,name,rating,reviews_cnt,year,pages_cnt,publisher,genre,author,lang,description,price_from,price_to,unparsed
n38793589,Bohuslav Reynek (1892--1971) Pavel Chalupa,91,7,2011,400,Arbor vitae,naučná,české</p>,,"Autor : Pavel Chalupa,  
 Je pozoruhodné, že vůbec první monografie o díle kultovní postavy české výtvarné kultury a literatury Bohuslava Reynka vychází až dnes. Stalo se tak,...",996,1,"['Arbor vitae, naučná', '', 'české']"
n22730371,Výtvarná tvorba duševně nemocných (Hans Prinzhorn),94,1,2011,392,Arbor vitae,naučná,české</p>,,"Hans Prinzhorn (1886 - 1933) německý psychiatr, hudebník, filosof a kunsthistorik se narodil ve vestfálském Henreru. Studoval dějiny umění a filozofii na univerzitě ve Vídni,...",890,891,"['Arbor vitae, naučná', '', 'české']"
n24797779,Gabriel von Max,0,0,2011,376,Arbor vitae,naučná,české</p>,,Malíř českého původu Gabriel von Max (1840 Praha - 1915 Mnichov) patří k nejvýznamnějším reprezentantům mnichovské malířské školy ve druhé polovině 19. století. Narodil se v...,953,1,"['Arbor vitae, naučná', '', 'české']"
n20767951,Decadence Now! /česky/ -- Za hranicí krajnosti Urban Otto M.,100,1,2011,338,Arbor vitae,naučná,české</p>,,Dlouho očekávaná monografie Decadence Now! Za hranicí krajnosti vychází jako součást stejnojmenné výstavy vy výjimečné grafické úpravě Roberta V. Nováka. Přináší na 338...,1,1,"['Arbor vitae, naučná', '', 'české']"
n26980174,Konec avantgardy - Lucie Zadražilová,100,1,2011,340,Arbor vitae,naučná,české</p>,,Rozsáhlá monografie mapující české umění mezi léty 1938-1948 má neobvyklou koncepci: konfrontuje české výtvarné umění těchto dramatických let s pokleslou kulturní úrovní...,1,1,"['Arbor vitae, naučná', '', 'české']"
