db_id,name,rating,reviews_cnt,year,pages_cnt,publisher,genre,author,lang,description,price_from,price_to,unparsed
n341860299,Žehnání matky. Význam obřadu v Čechách a na Moravě v 16.-21. století,0,0,2015,220,Akropolis,naučná,české</p>,,Studie zkoumá význam obřadu žehnání matky po porodu v Čechách a na Moravě v období 16.–21. století. Obřad žehnání matky po porodu se zde chápe jednak jako úvod šestinedělky –...,140,179,"['Akropolis, naučná', '', 'české']"
n250317972,Fikční světy české realistické prózy - Bohumil Fořt,0,0,2015,204,Akropolis,naučná,české</p>,,"Autor : Bohumil Fořt, Popis : 
 Kniha Fikční světy české realistické prózy organicky propojuje literárněteoretický rámec fikčních světů s tradičním literárněhistorickým...",153,245,"['Akropolis, naučná', '', 'české']"
n331094202,"Filozofie pro duši - Slavica Kroča, Slavko Kroča",0,0,2015,192,Akropolis,naučná,české</p>,,"Filozofie pro duši kniha od autora Slavko Kroča. Soubor filozofických esejí jistě povzbudí k dalšímu zkoumání každého, kdo hledá odpovědi na věčné otázky nejen ve vnějším...",117,175,"['Akropolis, naučná', '', 'české']"
n302059149,Grammatyka Cžeska. mluvnice češtiny v 16. až 19. století (katalog výstavy) - Ondřej Koupil - Akropolis,0,0,2015,176,Akropolis,naučná,české</p>,,"Katalog k výstavě mluvnic češtiny, kterou společně pořádají a (září 2015 až únor 2016), pojatý jako kniha systematicky mapující gramatiky češtiny od první mluvnice češtiny...",169,215,"['Akropolis, naučná', '', 'české']"
