db_id,name,rating,reviews_cnt,year,pages_cnt,publisher,genre,author,lang,description,price_from,price_to,unparsed
n316273060,Mise Afghánistán,94,9,2015,248,Paseka,naučná,české</p>,,"Pět měsíců s Lékaři bez hranic: „Desetiletý Rahmudin přišel s proraženou lebkou. Nevěřil jsem, že se kdy probudí z kómatu. A po operaci ten malej syčák chodí!“
Tomáš Šebek byl...",203,289,"['Paseka, naučná', '', 'české']"
n420559038,"Praha moderní IV. - Zdeněk Lukeš, Pavel Hroch, Petr Kratochvíl",96,2,2015,256,Paseka,naučná,české</p>,,"Pokračování úspěšné řady průvodců Praha moderní pojednává slovem a obrazem architekturu druhé poloviny 20. století, navzdory totalitním desetiletím možná až překvapivě pestrou....",281,399,"['Paseka, naučná', '', 'české']"
n239100048,Vše pro dítě! Kniha - Jiránek Tomáš,90,1,2015,280,Paseka,naučná,české</p>,,"Třebaže se válečné operace let 1914-1918 českých zemí bezprostředně nedotkly, válka zasáhla naše území v té nejméně očekávatelné podobě. Odchod otců a učitelů na frontu, pokles...",241,349,"['Paseka, naučná', '', 'české']"
n268942332,Český mrakodrap Nejzajímavější výškové stavby 20. a 21. st...,0,0,2015,272,Paseka,naučná,české</p>,,Existuje vůbec něco jako „český mrakodrap“? Kniha Petra Vorlíka sleduje na příkladech více než stovky proslulých i méně známých staveb nebo utopických projektů příběh skromného...,281,399,"['Paseka, naučná', '', 'české']"
