db_id,name,rating,reviews_cnt,year,pages_cnt,publisher,genre,author,lang,description,price_from,price_to,unparsed
n60318035,"Ohnivá Venuše, studený Mars. Hormonální rovnováha klíč ke spokojenému(nejen) milostnému životu - John Gray",92,2,2012,272,Práh,naučná,české</p>,,"Četné výzkumy prokazují, že chování mužů a žen má biologický základ - hormony. John Gray na základě těchto nových poznatků vysvětluje, jak ženský hormon oxytocin a mužský...",267,299,"['Práh, naučná', '', 'české']"
n45284283,"Jak přežít na ""intoxikovaném"" pracovišti",80,1,2012,264,Práh,naučná,české</p>,,"Chtěli byste se v práci cítit příjemně, ale chování vašeho kolegy vám to kazí? 

Ruší vás svými historkami, nechodí do zaměstnání včas nebo se v pracovní době věnuje zcela...",39,269,"['Práh, naučná', '', 'české']"
n56947597,Na plovárně s Markem Ebenem - Marek Eben,96,11,2012,264,Práh,naučná,české</p>,,"Autor : Marek Eben,  
 - Portréty všech hostů i fotografie z natáčení 
 - V polovině září velké PR k pětistému dílu pořadu Na plovárně 
 - Marek Eben letos opět moderátorem...",297,349,"['Práh, naučná', '', 'české']"
n60998396,Sledoval jsem Dubčeka. Vzpomínky estébáka - Karol Urban,97,2,2012,240,Práh,naučná,české</p>,,"""Nenápadní"" estébáci na chodníku před Dubčekovou vilou. ""Nenápadní"" estébáci na ostrůvku tramvaje.""Nenápadní"" estébáci všude, kam se Dubček podíval. Hodinu po hodině, den po...",254,299,"['Práh, naučná', '', 'české']"
n61461387,Změňte cokoliv,0,0,2012,270,Práh,naučná,české</p>,,"Všichni si přejeme žít lepší život. A vždy slyšíme, že základem každé osobní změny je silná vůle. Předpokládejme však, že silná vůle není klíčem k vašemu úspěchu, a jediné, co...",219,307,"['Práh, naučná', '', 'české']"
n41330216,Cesta Steva Jobse,100,1,2012,240,Práh,naučná,české</p>,,"Kniha Cesta Steva Jobse přináší živé příklady náročných úkolů a vítězství Jobsova leadershipu od zavedení převratných produktů jako Apple II a Macintosh přes období, kdy Jobs...",254,343,"['Práh, naučná', '', 'české']"
