db_id,name,rating,reviews_cnt,year,pages_cnt,publisher,genre,author,lang,description,price_from,price_to,unparsed
n577212107,Proměna krve - Gustav Meyrink,97,1,2017,128,Malvern,beletrie,české</p>,,"V autobiografické stati z pozůstalosti Proměna krve známý německy píšící autor souvisle popisuje svůj duchovní vývoj a zabývá se okultními otázkami. Jedná se o vzácný text,...",160,217,"['Malvern, beletrie', '', 'české']"
n552731301,"Děti, poslové z neznáma - Karel Funk",0,0,2017,144,Malvern,beletrie,české</p>,,"Kniha známého autora nabourává vžité představy, že děti jsou naším majetkem, příležitostí k naší manipulaci, materiálem k našemu svévolnému tvarování podle svých představ......",168,228,"['Malvern, beletrie', '', 'české']"
n569902841,Parsifal. příběh rytíře Kulatého stolu - Tomáš Vondrovic,0,0,2017,80,Malvern,beletrie,české</p>,,"Legenda o rytíři Parsifalovi a hledání sv. Grálu, která spadá do okruhu pověstí o králi Artušovi, patří k právem k pokladům evropské literatury. Zpracování Tomáše Vondrovice...",135,227,"['Malvern, beletrie', '', 'české']"
n571907803,Pornografia - Jean-Baptiste Del Amo,10,1,2017,106,Malvern,beletrie,české</p>,,"Vypravěč se po letech vrací do nejmenovaného rodného tropického města a vzápětí je pohlcen prostředím, v němž protagonisté příběhu přežívají jen díky almužně za služby...",174,236,"['Malvern, beletrie', '', 'české']"
n458709850,de Chirico Giorgio: Hebdomeros Kniha,0,0,2017,168,Malvern,beletrie,české</p>,,"Není obecně známo, že italský malíř Giorgio De Chirico (1888?1978) je autorem několika próz a řady esejí a programových studií, které se úzce vážou k jeho výtvarnému dílu. V...",195,250,"['Malvern, beletrie', '', 'české']"
n638670642,Tady a tam - Martin Čech,0,0,2017,128,Malvern,beletrie,české</p>,,"Autor knihy povídek Tady a tam vypráví zvláštní příběhy, který zachycují svět i s jeho logikou nerozumění... 
 Na pozadí často záměrně nedopovězených příběhů vstupují na scénu...",154,209,"['Malvern, beletrie', '', 'české']"
