db_id,name,rating,reviews_cnt,year,pages_cnt,publisher,genre,author,lang,description,price_from,price_to,unparsed
n51166203,"Dějiny hmotné kultury II soubor 1., 2. díl",88,2,2009,0,Karolinum,naučná,české</p>,,Poslední svazek rozsáhlého díla dějin kulturní každodennosti ve střední Evropě navazuje na předchozí díl věnovaný dějinám každodennosti raného novověku. V samostatných...,271,410,"['Karolinum, naučná', '', 'české']"
n21150104,Metodologie vědy - František Ochrana,70,1,2009,158,Karolinum,naučná,české</p>,,"Publikace se zabývá klíčovými problémy metodologie vědy. Metodologie vědy je pojímána jako teorie vědeckých metod a vědeckých postupů, jak dané vědecké metody používat ve...",131,170,"['Karolinum, naučná', '', 'české']"
n23926592,Forenzní traumatologie - Beran Michal a kolektiv,0,0,2009,168,Karolinum,naučná,české</p>,,Učební text Forenzní traumatologie je ve své úvodní části věnován jednak právním a kriminalistickým aspektům práce soudního lékaře a jednak obecné charakterizaci mechanických...,135,200,"['Karolinum, naučná', '', 'české']"
n362857191,Farmakologie pro farmaceuty IV. - Jana Pourová a kol.,0,0,2009,75,Karolinum,naučná,české</p>,,"Z obsahu:1. Hormony štítné žlázy, léčba hypotyreózy a hypertyeózy2. Inzulin a jeho analoga3. Perorální antidiabetika4. Glukokortikoidní a mineralokortikoidní hormony5. Ženské...",83,110,"['Karolinum, naučná', '', 'české']"
n11533310,LIDÉ MĚSTA 11/2009,0,0,2009,82,Karolinum,naučná,české</p>,,LIDÉ MĚSTA 11/2009 kniha od autora . Odborný časopis věnovaný antropologickým vědám s důrazem na problematiku města a příbuzným společenskovědním a humanitním...,86,104,"['Karolinum, naučná', '', 'české']"
