db_id,name,rating,reviews_cnt,year,pages_cnt,publisher,genre,author,lang,description,price_from,price_to,unparsed
n352039040,Singletasking - Udělejte víc – jedno po druhém,0,0,2016,176,Ikar,naučná,české</p>,,"Kniha odbourává mýtus, že lidé jsou schopni dělat víc věcí najednou a že by za to měli být dokonce chváleni. Autorka se snaží ukázat, že je to přesně naopak. Soustředění na...",158,199,"['Ikar, naučná', '', 'české']"
n367954733,Trénink mozku - Zlepšení za 60 dnů,80,2,2016,192,Ikar,naučná,české</p>,,Jedinečný šedesátidenní program sestávající z kombinace jednoduchých matematických výpočtů a slovních cvičení aktivuje kůru mozkovou a zlepšuje celkový výkon mozku. Uvedený...,182,229,"['Ikar, naučná', '', 'české']"
n323658142,"Euromedia Group, k.s. Vše o Habsburcích",75,3,2016,176,Ikar,naučná,české</p>,,"Ve kterých zemích světa Habsburkové vládli? 
Kdo založil první rakouskou univerzitu? Je pravda, že se na Vídeňském kongresu jen tancovalo? 
Které ženy z habsburského rodu...",182,229,"['Ikar, naučná', '', 'české']"
n348787264,"Euromedia Group, k.s. Intenzivní intervalový trénink pro ženy",98,7,2016,224,Ikar,naučná,české</p>,,"Spalte více tuku za méně času s cviky, které můžete cvičit kdekoliv. Přinuťte své tělo a mysl pustit se do nejintenzivnějšího cvičení, které kdy bylo sestaveno.

Vysoce...",238,299,"['Ikar, naučná', '', 'české']"
n385648050,Tajemství sedmi závojů - Ruediger Schache,90,1,2016,200,Ikar,naučná,české</p>,,"Kdo hledá pravdu, najde smysl života a lásku! Zažijte fascinující objevnou expedici za tajemstvím svého života. Cesta k pravdě vede skrze sedm iluzí. Jsou jako závoje, jež nám...",197,249,"['Ikar, naučná', '', 'české']"
n397396860,Naverbovaná - Valérie de Boisrolin,90,2,2016,176,Ikar,naučná,české</p>,,"Svědectví matky, jejíž dcera jako nezletilá konvertovala k islámu a utekla do Sýrie. Jak dojde k tomu, že dívka vyrůstající ve spořádané středostavovské rodině, obklopená...",157,199,"['Ikar, naučná', '', 'české']"
n354494494,Slovo je podaná ruka,0,0,2016,224,Ikar,naučná,české</p>,,"Dobře volené slovo, prezentované ve správné intonaci, dokáže získat lidi na svou stranu, pro své myšlenky. Je startem k navázání dialogu, přátelství, partnerství.
A kdo jiný by...",189,224,"['Ikar, naučná', '', 'české']"
