db_id,name,rating,reviews_cnt,year,pages_cnt,publisher,genre,author,lang,description,price_from,price_to,unparsed
n430919171,Otočte Vaši loď! - L. David Marquet,0,0,2016,172,Zoner press,naučná,české</p>,,"Příručka k implementaci vedení založeného na delegování pravomocí do vaší organizace. Praktické rady a nástroje inspirované úspěšnou knihou o vedení Otočte loď!

V knize Otočte...",137,199,"['Zoner press, naučná', '', 'české']"
n359872303,Bohové a bohyně v nás - Zuzana Lukášková Řezáčová,100,1,2016,176,Zoner press,naučná,české</p>,,"Vraťme se do doby, kdy lidé k neznámým věcem přistupovali s bázní, kdy příroda byla plná tajemství a svět lidí se prolínal se světem bohů. Návrat ke starým pravdám totiž může...",217,320,"['Zoner press, naučná', '', 'české']"
n387331868,Malujte každý den - Carol Marine,100,1,2016,192,Zoner press,naučná,české</p>,,"Malujte si pro radost. 

V jedné z mých oblíbených knih říká čínský filozof: Někdo vyletí k nebesům jako drak a někdo se jako žížala prodírá prachem cest. Je určitě dobré mít...",249,359,"['Zoner press, naučná', '', 'české']"
