db_id,name,rating,reviews_cnt,year,pages_cnt,publisher,genre,author,lang,description,price_from,price_to,unparsed
n707610008,Tajemství 14 knížat a jejich křtu v roce 845 - Houška Miroslav,0,0,2016,104,Triton,naučná,české</p>,,"Úvaha o pravdě, odvaze a víře

Leden roku 845. Mnoho let před příchodem Cyrila a Metoděje na Velkou Moravu. Válka s Franky se blíží. Na nebezpečnou cestu do východofranské říše...",104,159,"['Triton, naučná', '', 'české']"
n353663092,Žák s problémovým chováním - Cesta institucionální pomoci,0,0,2016,112,Triton,naučná,české</p>,,"Problémové chování žáků patří ke každodenní realitě škol a školských zařízení. Nelze před ním zavírat oči ani očekávat, že odezní samo nebo že ho vyřeší někdo jiný. Každý...",114,179,"['Triton, naučná', '', 'české']"
n354967164,Individualizace farmakoterapie,0,0,2016,160,Triton,naučná,české</p>,,Optimalizace léčebného účinku může být narušena variabilitou působení léčiv mezi nemocnými a někdy i rozdílným výskytem nežádoucích účinků. Publikace uvádí základní příčiny...,95,149,"['Triton, naučná', '', 'české']"
n430912542,"Dejme mozky dohromady - Skupinová kognitivní rehabilitace a reedukace jazykových funkcí - Poláková Barbora, Brožek Ľuba",0,0,2016,112,Triton,naučná,české</p>,,"Publikace představuje praktickou příručku pro logopedy, psychology, ergoterapeuty, případně další zaměstnance ve zdravotnictví či v sociálních službách, kteří pracují s lidmi s...",160,299,"['Triton, naučná', '', 'české']"
n599383958,Kaleidoskop vzpomínek na 50 let programu transplan - Ondřej Viklický,0,0,2016,160,Triton,naučná,české</p>,,"Kaleidoskop vzpomínek na 50 let programu transplantací ledvin je v pravém smyslu slova nejenom literaturou faktu, ale zároveň svědectvím o půlstoletí fungování úžasného...",169,178,"['Triton, naučná', '', 'české']"
