db_id,name,rating,reviews_cnt,year,pages_cnt,publisher,genre,author,lang,description,price_from,price_to,unparsed
n41950588,Jak správně jíst - Lise Bourbeau,0,0,2012,192,Eugenika,naučná,české</p>,,"Tato kniha vás nenaučí jíst podle pravidel zdravé výživy. Jejím cílem je totiž pomoci vám odhalit jiné věci: například zjistit, jak se kontrolujete; uvědomit si, jak se...",205,205,"['Eugenika, naučná', '', 'české']"
n62801349,Mladý obličej. Jak si jej udržet - Irina Tichomirova,63,4,2012,184,Eugenika,naučná,české</p>,,Mladý obličej kniha od autora Irina Tichomirova. Jedinečné cvičení proti vráskám! Namísto chirurgických zásahů stačí věnovat denně chvíli jednoduché obličejové masáži. Zkušená...,150,205,"['Eugenika, naučná', '', 'české']"
n174966215,Léčivé cvičení Hyperborejcu - Nikolaj Kudrjašov,0,0,2012,216,Eugenika,naučná,české</p>,,"Nikolaj Kudrjašov / Eugenika, brožovaná, 216 stran.
Kniha vychází z  poznatků o starověké tělovýchově Hyperborejců, kteří kdysi žili na  Severním pólu. Gymnastika Hyperborejců...",153,231,"['Eugenika, naučná', '', 'české']"
n362858835,Kódy podvědomí,80,2,2012,184,Eugenika,naučná,české</p>,,"Populární ruský autor nabízí rychlé a efektivní řešení problémů propojením vědomí a podvědomí, čehož se dosahuje pronášením tzv. kódových frází. Kniha obsahuje 54 těchto frází...",146,228,"['Eugenika, naučná', '', 'české']"
n68986762,Původ nemocí - Alexandr Astrogor,0,0,2012,208,Eugenika,naučná,české</p>,,"Alexandr Astrogor / Eugenika, brožovaná, 205 stran.
Autor přináší poučení o tom, jak pracují naše smysly - ve vnitřním  organismu i za jeho hranicemi. Radí, jak chápat, měnit...",223,248,"['Eugenika, naučná', '', 'české']"
n42855704,Energetické působení věcí a jemnohmotný svět,0,0,2012,200,Eugenika,naučná,české</p>,,"Neživé věci žijí vlastním životem. Zachycují podněty a informace z okolního světa a uchovávají je, tak na nás dokážu zpětně působit a ovlivňovat naše životy bez toho, abychom...",153,238,"['Eugenika, naučná', '', 'české']"
n48286635,Jóga a tajemství dlouhověkosti - Gita Suini,0,0,2012,200,Eugenika,naučná,české</p>,,"Tato příručka představuje jógové pozice zvané ásany, rozdělené na soubory pro začátečníky a pokročilé. Kromě toho uvádí i dvě varianty rozcvičky a cvičení speciálně vhodné pro...",170,240,"['Eugenika, naučná', '', 'české']"
n42826517,Karmická setkání,100,1,2012,204,Eugenika,naučná,české</p>,,"Helena Rerichová/ Eugenika, brožovaná, 261 stran.
Významná duchovní učitelka a spisovatelka H. Rerichová promlouvá o  mezilidských vztazích a jejich hlubším významu. Lidé se...",167,277,"['Eugenika, naučná', '', 'české']"
n46051492,Tajemství přírodní léčby 2. - Jelena Svitko,100,1,2012,192,Eugenika,naučná,české</p>,,"Jelena Svitko/ Eugenika, brožovaná, 188 stran.
Léčivé koupele s kameny
Nápoj proti smutku
Koření a byliny - Káva nebo čaj?
Nemoci štítné žlázy
Přírodní léčba neboli...",146,228,"['Eugenika, naučná', '', 'české']"
