db_id,name,rating,reviews_cnt,year,pages_cnt,publisher,genre,author,lang,description,price_from,price_to,unparsed
n47232654,Základy farmakologie - František Perlík,100,1,2011,182,Galén,naučná,české</p>,,"Farmakologický výzkum a vývoj přináší nová léčiva, která působí na širší spektrum terapeutických cílů. Rozšiřují se tím léčebné možnosti, ale zároveň se znesnadňuje orientace...",215,340,"['Galén, naučná', '', 'české']"
n26521099,Po stopách Velkého Mokasína - Vojtěch Lindaur,88,1,2011,215,Galén,naučná,české</p>,,"Memoáry hudebního kritika a českého novináře Jiřího Černého s názvem Po stopách Velkého Mokasína uspořádal Vojtěch Lindaur. Sborník přátel, kolegů i obyčejných fanoušků...",248,315,"['Galén, naučná', '', 'české']"
n362857203,Trendy soudobé oftalmologie 7,0,0,2011,225,Galén,naučná,české</p>,,"Již sedmý svazek publikační řady postgraduálních textů Trendy soudobé oftalmologie přináší informace o nových poznatcích z mnoha oblastí očního lékařství, které jsou jen málo...",483,690,"['Galén, naučná', '', 'české']"
n38781835,Vybrané otázky - Onkologie XV.,0,0,2011,188,Galén,naučná,české</p>,,"Sborník vydaný k příležitosti konání 19. onkologicko-urologického
sympozia a 15. mamologického sympozia, pořádaných v Praze ve dnech
23.-25. listopadu 2011, obsahuje příspěvky...",178,200,"['Galén, naučná', '', 'české']"
