db_id,name,rating,reviews_cnt,year,pages_cnt,publisher,genre,author,lang,description,price_from,price_to,unparsed
n259851749,Nakladatelství Brána a.s. Chyťte druhý dech,100,2,2014,192,české,naučná,Dagmar Kludská</p>,,"Co znamenají naše sny? Proč jsou vztahy tak složité? Co od života očekáváme a jak jej naplnit štěstím? Co dělat, když nejsme spokojeni ve svém osobním životě, v práci, nebo...",160,206,"['Nakladatelství BRÁNA, naučná', '', 'české, Dagmar Kludská']"
n171201068,Bohumil Hrabal,0,0,2014,192,české,naučná,Jan Kaplan</p>,,"Fotografická vzpomínková kniha ke 100. výročí narození Bohumila Hrabala.


Dokumentarista a filmový režisér Jan Kaplan, který už po řadu desetiletí žije a tvoří ve Velké...",34,399,"['Nakladatelství BRÁNA, naučná', '', 'české, Jan Kaplan']"
n259846722,"Jindřich VIII. - Charismatický král, který vytvořil novou Anglii - Elgin Kathy",95,2,2014,208,české,naučná,Kathy Elgin</p>,,Biografie pozoruhodného panovníka líčí bouřlivý život Jindřicha VIII. od útlého dětství až po královu dominantní úlohu jednoho z hlavních hráčů na mezinárodní scéně. Zabývá se...,104,149,"['Nakladatelství BRÁNA, naučná', '', 'české, Kathy Elgin']"
n259846720,Jak být dlouho živ a zdráv - Olga Krumlovská,0,0,2014,208,české,naučná,Olga Krumlovská</p>,,Známá astroložka se ve své nové knize zaměřuje na zdravý životní styl a na metody používané k posílení odolnosti lidského organismus vůči nemocem všeho druhu. Využívá znalosti...,69,99,"['Nakladatelství BRÁNA, naučná', '', 'české, Olga Krumlovská']"
