db_id,name,rating,reviews_cnt,year,pages_cnt,publisher,genre,author,lang,description,price_from,price_to,unparsed
n68403807,Lumbální spinální stenóza - Blanka Mičánková Adamová,0,0,2012,188,Galén,naučná,české</p>,,"Lumbální spinální stenóza je onemocnění, s nímž se setkáváme a budeme setkávat stále častěji. Je to dáno jednak stárnutím populace a jednak zlepšujícími se diagnostickými...",268,400,"['Galén, naučná', '', 'české']"
n34239668,Život a nemoci Vincenta van Gogha,0,0,2012,192,Galén,naučná,české</p>,,"Všechno, co bylo dosud napsáno o Vincentu van Goghovi, by naplnilo mnoho knihoven. Tato kniha chce přinést něco nového - pojednává o historii Vincentovy nemoci. O ní toho bylo...",136,250,"['Galén, naučná', '', 'české']"
n42906822,Dříve projevená přání pacientů Jaromír Matějek,0,0,2012,189,Galén,naučná,české</p>,,"Pro termín „dříve projevené přání“ neexistuje v současnosti stručná, vyčerpávající a hlavně konsensuálně přijatá definice. Obvykle se uvádí, že jde o prohlášení pacienta, v...",130,200,"['Galén, naučná', '', 'české']"
n47435102,Poranění páteře - Ján Kočiš,0,0,2012,172,Galén,naučná,české</p>,,"Publikace přináší soudobý, komplexní pohled na diagnostiku a léčbu poranění páteře a míchy. V oboru páteřní chirurgie, kde je nedostatek doporučení založených na vědeckých...",339,500,"['Galén, naučná', '', 'české']"
n51381740,Základy praktické proktologie,0,0,2012,220,Galén,naučná,české</p>,,"Publikace poskytuje přehledně uspořádaný soubor všech podstatných a aktuálních diagnostických a terapeutických trendů, které se dnes v proktologii uplatňují. Autoři ji...",407,600,"['Galén, naučná', '', 'české']"
n46642129,Multidetektorová výpočetní tomografie srdce - Jan Baxa,0,0,2012,214,Galén,naučná,české</p>,,"Publikace Multidetektorová výpočetní tomografie srdce shrnuje zkušenosti autorů, kteří od roku 2002 provedli více než 5000 CT vyšetření srdce prostřednictvím systémů všech...",339,500,"['Galén, naučná', '', 'české']"
