db_id,name,rating,reviews_cnt,year,pages_cnt,publisher,genre,author,lang,description,price_from,price_to,unparsed
n651192493,"Encyklopedie magických míst - Thomová Soňa, Thoma Zdeněk",88,6,2018,192,Universum,naučná,Thoma Zdeněk</p>,,"Lákají vás dobrodružné cesty do tajuplných končin naší vlasti, kde ožívají mýty a zjevují se nadpřirozené bytosti? Chcete na vlastní kůži pocítit sílu a magičnost posvátných...",316,399,"['Universum, naučná', '', 'české, Thomová Soňa, Thoma Zdeněk']"
n658462217,Lidské tělo v kostce - kolektiv autorů,0,0,2018,208,Universum,naučná,Kolektiv autorů</p>,,"Ohromující fotografie a 3D ilustrace doprovázené přehledným informativním textem umožňují poznat a pochopit mnohá tajemství lidského těla – od jeho fungování přes procesy,...",396,499,"['Universum, naučná', '', 'české, Kolektiv autorů']"
n640792280,RAF 100 - Holland James,0,0,2018,224,Universum,naučná,James Holland</p>,,"Kniha vychází ke stému výročí britského Královského letectva, které pro tuto příležitost otevřelo své unikátní archivy. Zkušený autor James Holland tak představuje nové...",396,499,"['Universum, naučná', '', 'české, James Holland']"
n667013588,"Sto českých knih, které si musíte přečíst - Valden Milan",100,1,2018,224,Universum,naučná,Milan Valden</p>,,"Autor : Milan Valden, Popis : To nejlepší a nejdůležitější z české literatury za posledních 100 let!
Autor vybral sto knih (za každý rok z let 1918–2017 jednu), které v žádném...",276,332,"['Universum, naučná', '', 'české, Milan Valden']"
n612760770,Lesk a bída vzdělávání: vysoké školství jako zrcadlo české společnosti v časech volného trhu,100,2,2018,208,Universum,naučná,Jiří Smrč</p>,,"Vysoké školství se změnilo. Brány vrcholného vzdělávání se otevřely masám studentů a soukromému podnikání. Zrodily se různé patologické jevy, na které nikdo nebyl připravený a...",197,249,"['Universum, naučná', '', 'české, Vladimíra Dvořáková, Jiří Smrč']"
n636854039,Okupace 1968 - Jiří Fidler,0,0,2018,224,Universum,naučná,Jiří Fidler</p>,,"Kniha je věnována jedné z klíčových událostí našich národních dějin, okupaci země vojenskými jednotkami pěti států Varšavské smlouvy v srpnu 1968. Jedná se o první ucelenou...",237,299,"['Universum, naučná', '', 'české, Jiří Fidler']"
n596919532,Hitler – Muž za maskou monstra - Michael Kerrigan,0,0,2018,224,Universum,naučná,Michael Kerrigan</p>,,"Poněkud netradiční biografie o Hitlerovi se zabývá otázkou: Jak se z člověka pocházejícího z běžného, ničím nápadného prostředí stalo monstrum zodpovědné za smrt milionů lidí....",364,459,"['Universum, naučná', '', 'české, Michael Kerrigan']"
n639826576,Osudy moudrých - Halada Jan,0,0,2018,208,Universum,naučná,Jan Halada</p>,,"Publikace představuje čtenářům v populárně podaném výkladu lidské myšlení a zejména filozofii nejen jako lásku k moudrosti, ale nabízí jim zároveň i osudy jedněch z...",205,259,"['Universum, naučná', '', 'české, Jan Halada']"
n644139755,Zrození republiky – Národní revoluce 1918 - Emmert František,100,1,2018,208,Universum,naučná,František Emmert</p>,,Unikátní a graficky nadstandardně zpracovaná publikace vycházející ke stému výroční založení Československé republiky. Přehlednou a srozumitelnou formou provází čtenáře...,258,399,"['Universum, naučná', '', 'české, František Emmert']"
