db_id,name,rating,reviews_cnt,year,pages_cnt,publisher,genre,author,lang,description,price_from,price_to,unparsed
n472989605,Rukověť ke studiu mezinárodního práva 2 Praktikum,0,0,2017,176,Leges,naučná,české</p>,,Praktikum slouží k aktivnímu procvičení probrané látky v rámci studia mezinárodního práva veřejného. Struktura praktika obsahově odráží jednotlivé oblasti mezinárodního práva...,228,320,"['Leges, naučná', '', 'české']"
n561598943,"Finančněprávní nástroje boje proti únikům na dani z přidané hodnoty v prostoru Evropské unie - Sejkora, Tomáš",0,0,2017,224,Leges,naučná,české</p>,,Monografie provádí komplexní analýzu problematiky daňových úniků v oblasti daně z přidané hodnoty. Srovnává českou právní úpravu s právem Evropské unie a vybraných členských...,212,290,"['Leges, naučná', '', 'české']"
n555027591,Veřejná správa v zemích Visegrádské čtyřky,0,0,2017,192,Leges,naučná,české</p>,,"Veřejná správa, její obsah a vývoj je v trvalé pozornosti odborné veřejnosti více vědních disciplín. Značný problém tvoří samotné vymezení pojmu veřejné správy a z tohoto...",200,280,"['Leges, naučná', '', 'české']"
n563700655,Literatura a film jako zrcadlo práva a právníků,0,0,2017,224,Leges,naučná,české</p>,,"Přemýšlíme-li o vztahu práva a literatury, nemůžeme nevnímat právo jako literaturu svého druhu. Sestává přece z textů, ač psaných poněkud specifickým jazykem, často nepříliš...",228,320,"['Leges, naučná', '', 'české']"
n469148560,Jak být úspěšný při výběrovém řízení podle nového zákona o zadávání veřejných zakázek,0,0,2017,208,Leges,naučná,české</p>,,"Praktická příručka je přehledným průvodcem po nejdůležitějších změnách, které přinesl nový zákon č. 134/2016 Sb., o zadávání veřejných zakázek. Je napsána z pohledu dodavatelů,...",284,458,"['Leges, naučná', '', 'české']"
n479896545,Podíl ve společnosti s ručením omezeným,0,0,2017,192,Leges,naučná,české</p>,,"Podíl ve společnosti s ručením omezeným představuje významný institut právní úpravy této nejčastější formy obchodní korporace.

 Publikace rozebírá problematiku podílu na...",269,370,"['Leges, naučná', '', 'české']"
n594482158,Řešení přeshraničních sporů - pravomoc a autonomie vůle - Miluše Hrnčiříková,0,0,2017,192,Leges,naučná,české</p>,,Sborník obsahuje příspěvky přednesené v květnu 2017 na Právnické fakultě Univerzity Palackého v Olomouci v rámci 11. ročníku mezinárodní vědecké konference Olomoucké právnické...,216,290,"['Leges, naučná', '', 'české']"
