db_id,name,rating,reviews_cnt,year,pages_cnt,publisher,genre,author,lang,description,price_from,price_to,unparsed
n321530411,Závislosti - Jak je překonat - Valerij Sineľnikov,0,0,2015,248,Eugenika,naučná,české</p>,,"Tato kniha vám pomůže vystoupit ze začarovaného kruhu závislostí. Naučíte se na sobě pracovat, ale také pomáhat blízkým lidem, kteří se dostali do svízelné životní situace....",197,298,"['Eugenika, naučná', '', 'české']"
n337450562,Z utrpení k radosti,100,1,2015,296,Eugenika,naučná,české</p>,,"Prém Bába – přezdívaný Otec lásky – je guru ze severní Indie, který se narodil a vyrůstal v Brazílii. Vypracoval metodu nazvanou Cesta srdce, jež obsahuje techniky od meditace...",240,368,"['Eugenika, naučná', '', 'české']"
n277793320,Dokonalá očista těla,0,0,2015,256,Eugenika,naučná,české</p>,,"Dokonalá očista těla kniha od autora Malachov G. P.. Dokonalá očista těla

""Publikace popisuje systematické pročištění těla od všech usazenin a zároveň klade velký důraz i na...",217,338,"['Eugenika, naučná', '', 'české']"
n255778650,Fascinující život rostlin - Arzt Volker,0,0,2015,240,Eugenika,naučná,české</p>,,Fascinující život rostlin kniha od autora Volker Arzt. Tato mimořádně zajímavá kniha vychází z nejnovějších věděckých poznatků a četných pokusů. Popisuje svět a život rostlin...,185,288,"['Eugenika, naučná', '', 'české']"
n351411222,Duchovní inteligence v práci - Colin C. Tipping,0,0,2015,256,Eugenika,naučná,české</p>,,"Negativní energie na pracovišti a její náprava

Naše spirituální inteligence vytváří v našem životě okolnosti, jež mohou vést k rozvoji, přičemž právě naše pracoviště se zdá...",204,318,"['Eugenika, naučná', '', 'české']"
