db_id,name,rating,reviews_cnt,year,pages_cnt,publisher,genre,author,lang,description,price_from,price_to,unparsed
n459885774,Práce se dřevem - Mark Griffiths,0,0,2017,192,Metafora,naučná,české</p>,,"Je libo psí boudu? Lehátko, poličku nebo barový pult? Žádný problém. S touhle knihou to bude hračka. Práce se dřevem může být zábava. A vůbec to není tak těžké, jak se možná...",329,499,"['Metafora, naučná', '', 'české']"
n462974459,Encyklopedie vyšívání,93,2,2017,176,Metafora,naučná,české</p>,,"Vyšívání patří snad odjakživa mezi oblíbené techniky ke zkrášlování oděvů i doplňků do domácnosti. V minulosti se jím zabývaly miliony žen, které dokázaly zhotovit překrásná...",230,349,"['Metafora, naučná', '', 'české']"
n479149700,Klid a kde ho najít - Christopher Papadopoulos,0,0,2017,176,Metafora,naučná,české</p>,,Kniha navazuje na učení Eckharta Tolleho a především na jeho Moc přítomného okamžiku. Je podobně jako ona strukturována do podoby otázek a odpovědí a uvádí čtenáře do...,131,223,"['Metafora, naučná', '', 'české']"
n462974455,100 snadných papírových květin,0,0,2017,192,Metafora,naučná,české</p>,,"Květiny vždy potěší. A to nejen ty skutečné, jimž musíte vyměňovat vodu ve váze a nakonec je zvadlé vyhodíte, ale i ty, které nezvadnou nikdy - papírové.

 Kniha nabízí sto...",131,341,"['Metafora, naučná', '', 'české']"
n480265404,Návrat k sobě,95,1,2017,200,Metafora,naučná,české</p>,,"Teal Swan prožila léta zneužívání rodinným známým, členem tajné místní náboženské sekty, než se jí podařilo v devatenácti letech uprchnout a zahájit proces vlastního...",164,249,"['Metafora, naučná', '', 'české']"
