db_id,name,rating,reviews_cnt,year,pages_cnt,publisher,genre,author,lang,description,price_from,price_to,unparsed
n694801910,Svěřenské fondy,0,0,2018,136,C.H.Beck,naučná,české</p>,,"Materie svěřenských fondů je mladá, v českém právním řádu je používána teprve od nabytí účinnosti občanského zákoníku v lednu 2014. Proto se autoři rozhodli zúročit své...",297,350,"['C.H.Beck, naučná', '', 'české']"
n690873143,Kryptoměny,80,1,2018,160,C.H.Beck,naučná,české</p>,,"Kryptoměny jsou decentralizované platební systémy, ve kterých se vlastnictví prokazuje kryptograficky. Patří k největším technologickým inovacím současnosti. Z tisíců kryptoměn...",331,390,"['C.H.Beck, naučná', '', 'české']"
n651600811,GDPR v kostce,0,0,2018,60,C.H.Beck,naučná,české</p>,,Praktický průvodce světem nejdiskutovanějšího evropského předpisu pomáhá prostřednictvím srozumitelného návodu zajistit soulad s požadavky obecného nařízení o ochraně osobních...,247,290,"['C.H.Beck, naučná', '', 'české']"
n684637561,Makroekonomie,0,0,2018,112,C.H.Beck,naučná,české</p>,,Nové vydání Sbírky řešených otázek a příkladů k učebnici Makroekonomie profesora Roberta Holmana slouží studentům k procvičení probírané látky a tím i k jejímu důkladnějšímu...,187,220,"['C.H.Beck, naučná', '', 'české']"
n659325461,Vyvlastnění a ochrana investic,0,0,2018,152,C.H.Beck,naučná,české</p>,,Publikace se zabývá ochranou a podporou zahraničních investic v kontextu vyvlastnění. Aktuálnosti tématu nahrává zejména vzrůstající počet investičních sporů mezi státy a...,331,390,"['C.H.Beck, naučná', '', 'české']"
n628319011,Veřejnoprávní smlouvy koordinační,0,0,2018,152,C.H.Beck,naučná,české</p>,,"Publikace přináší systematické roztřídění veřejnoprávních smluv koordinačních a zhodnocení jejich úpravy jak hmotněprávní, tak procesní. To vše je činěno při současném...",246,290,"['C.H.Beck, naučná', '', 'české']"
