db_id,name,rating,reviews_cnt,year,pages_cnt,publisher,genre,author,lang,description,price_from,price_to,unparsed
n583505869,Mejdan na konečné - Štěpánek Stanislav,100,1,2017,184,Epocha,beletrie,české</p>,,"Vládní zmocněnec pro moře, které nemáme.
Penzionovaný ředitel válčící se svou lékařkou o každou krabičku.
Bývalý novinář se specializací na horoskopy všeho druhu třikrát...",109,169,"['Epocha, beletrie', '', 'české']"
n575286858,"Causa Mortis - Marek Hladký, Jitka Hladká",0,0,2017,208,Epocha,beletrie,české</p>,,"Kriminální příběh s prvky hororu objevuje pro českou literaturu dosud neznámé prostředí. 
Ústav soudního lékařství kdesi v Praze. Ponuře důstojná budova, kam už po celá dlouhá...",125,199,"['Epocha, beletrie', '', 'české']"
n574738117,Pitva a jiné povídky,0,0,2017,200,Epocha,beletrie,české</p>,,"Formát: 12,5x18,5 cm
Počet stran:200
Vazba: pevná

Stejně tak jako šestatřicet klasických karet kosmické numerologie odkazuje na stejný počet kosmických principů, všímá si...",143,220,"['Epocha, beletrie', '', 'české']"
