db_id,name,rating,reviews_cnt,year,pages_cnt,publisher,genre,author,lang,description,price_from,price_to,unparsed
n390879626,"Nikdy neříkej, že se bojíš - Guiseppe Catozzella",100,1,2016,184,Barrister &amp; Principal,beletrie,české</p>,,"Giuseppe Catozzella vypráví skutečný příběh mladé statečné Somálky.
Jejíma očima prožijeme hrůzy fanatického náboženského běsnění,
ztrátu blízkých, zradu, ale také touhu...",131,199,"['Barrister & Principal, beletrie', '', 'české']"
n426143587,Obrana ženských tvarů. a jiné chestertonovské chvály a obrany - František Mikš,0,0,2016,184,Barrister &amp; Principal,beletrie,české</p>,,"Kniha o životě, kráse a zdravém rozumu. Čtivá, překvapivá a politicky nekorektní. G.K. Chesterton jako zasvěcený průvodce.

 OBRANA ZDRAVÉHO ROZUMU 

 Zuřivý tur G. K....",115,175,"['Barrister & Principal, beletrie', '', 'české']"
n433038729,Divocí příbuzní. Co nám zvířecí námluvy a páření zvířat prozrazují o lidských vztazích - Jennifer L. Verdolinová,80,1,2016,228,Barrister &amp; Principal,beletrie,české</p>,,"Stejně jako mnoho jiných živočišných druhů i my musíme přijít na to, jak si najít partnera a úspěšně se množit. Je to sice hodně obtížné, ale mluvit o tom se zdá být ještě...",62,139,"['Barrister & Principal, beletrie', '', 'české']"
