db_id,name,rating,reviews_cnt,year,pages_cnt,publisher,genre,author,lang,description,price_from,price_to,unparsed
n614907187,Etika pro pomáhající profese,0,0,2018,304,Triton,naučná,české</p>,,Etika pro pomáhající profese byla ve svém prvním vydání v r. 2003 určena především studentům připravujícím se na výkon pomáhajících profesí. Oslovila však i osoby v těchto...,172,269,"['Triton, naučná', '', 'české']"
n600704121,Léčba zraněného srdce,100,1,2018,288,Triton,naučná,české</p>,,"Kniha Dana Allendera Zraněné srdce pomohla statisícům lidí vyrovnat se s pohlavním zneužíváním v minulosti.

V této publikaci autor otvírá další dveře do duší obětí znásilnění,...",164,249,"['Triton, naučná', '', 'české']"
n656604114,Doba jedová 10 - Méně medicíny - více zdraví - Gilbert H. Welch,0,0,2018,272,Triton,naučná,české</p>,,Více zdravotní péče rovná se lepší zdraví? Ne! Právě naopak. Tvrdí to a v této knize dokazuje profesor v oboru medicíny H. Gilbert Welch. Podle něj až příliš mnoho lidí...,172,269,"['Triton, naučná', '', 'české']"
n602762037,Paliativní péče v kardiologii - Racionální přístup u pacientů v pokročilé fázi kardiologických onemocnění - Gřiva Martin,0,0,2018,272,Triton,naučná,české</p>,,"Paliativní péče v kardiologii je ojedinělá monografie, která v mnoha ohledech začíná tam, kde ostatní kardiologické publikace končí. Na těžce nemocného člověka s...",184,279,"['Triton, naučná', '', 'české']"
n643537584,V šeré zóně - Mezi životem a smrtí - Owen Adrian,0,0,2018,296,Triton,naučná,české</p>,,"Neurovědec Adrian Owen učinil se svým týmem převratný objev. Prokázal, že vážně poškozený mozek některých nehybných a nereagujících pacientů vykazuje při snímkování funkční...",194,299,"['Triton, naučná', '', 'české']"
