db_id,name,rating,reviews_cnt,year,pages_cnt,publisher,genre,author,lang,description,price_from,price_to,unparsed
n79657162,Jak úspěšně řídit firmu - Brian Tracy,0,0,2013,136,BizBooks,naučná,české</p>,,"Nefunguje vaše podnikání tak, jak jste si představovali? Nebo se dokonce potácíte na okraji propasti. V této knize 21 osvědčených strategií vám pomůže rozjet byznys na ještě...",183,269,"['BizBooks, naučná', '', 'české']"
n112586401,"Prodejte svůj talent. 52 tipů, jak zlepšit své schopnosti - Daniel Coyle - BizBooks",0,0,2013,152,BizBooks,naučná,české</p>,,"Jak se zlepšit ve hraní oblíbené hry? Jak rozeznat skutečný talent od chvilkového zájmu? Jak nejlépe nastartovat motivaci? 
 
 Všichni dnes vedeme rušné a složité životy. Rodič...",117,169,"['BizBooks, naučná', '', 'české']"
n129088505,"NLP pro každého. Jak si vybudovat úspěšný život - Richard Bandler, Alessio Roberti, Owen Fitzpatrick - BizBooks",93,5,2013,144,BizBooks,naučná,české</p>,,"Naprogramujte svou hlavu na úspěch.  Chcete probudit svůj skutečný potenciál a změnit svůj život? Tato publikace vám pomocí jednoduchého příběhu ukáže, jak používat metody NLP....",208,224,"['BizBooks, naučná', '', 'české']"
n104351013,Jak vyzrát na exekuce,0,0,2013,104,BizBooks,naučná,české</p>,,"Říká se, že člověk by měl v životě zkusit všechno. Pravda však je, že o něco vůbec nestojíme a spíše právě naopak bychom se některým věcem či dějům nejraději vyhnuli. Mezi ně...",103,149,"['BizBooks, naučná', '', 'české']"
n90348760,Finanční turbulence v Evropě a Spojených státech. Eseje světového finančníka - George Soros - BizBooks,0,0,2013,144,BizBooks,naučná,české</p>,,"Obtížná hospodářská situace, ve které se nyní nacházíme, není pouze výsledkem hospodářských sil, nýbrž také politiky, kterou zastávají (nebo nezastávají) světoví lídři. V této...",225,269,"['BizBooks, naučná', '', 'české']"
