db_id,name,rating,reviews_cnt,year,pages_cnt,publisher,genre,author,lang,description,price_from,price_to,unparsed
n403808441,Myška Šikuľka Tvary - Mandy Stanleyová,0,0,2016,12,Libri,dětské,slovenské</p>,,"Kreatívne hry sú dôležitou súčasťou vývoja dieťaťa. Vie to aj myška Šikuľka a jej kamaráti.

V tejto interaktívnej knižke myška Šikuľka ukáže deťom, aké zábavné je vytvárať...",256,388,"['Libri, dětské', '', 'slovenské']"
n459947985,Ježko a jeho kamaráti,0,0,2016,16,Libri,dětské,slovenské</p>,,"Zahrajte sa s tieňom a prežite magický večer plný dobrodružstva a zábavy!

Interaktívna knižka, ktorou trénujete pozornosť detí a podporujete ich predstavivosť.

Zažite s...",157,214,"['Libri, dětské', '', 'slovenské']"
n364830696,Myška Šikuľka – Pečiatky - Mendy Stanleyová [SK],0,0,2016,12,Libri,dětské,slovenské</p>,,"Kreatívne hry sú dôležitou súčasťou vývoja dieťaťa. Vie to aj myška Šikuľka a jej kamaráti.

V tejto interaktívnej knižke myška Šikuľka ukáže deťom, aké zábavné je vytvárať...",256,388,"['Libri, dětské', '', 'slovenské']"
n673196919,Elena Rabčanová Ježko na potulkách svetom,0,0,2016,16,Libri,dětské,slovenské</p>,,"Zahrajte sa s tieňom a prežite magický večer plný dobrodružstva a zábavy!

Interaktívna knižka, ktorou trénujete pozornosť detí a podporujete ich predstavivosť.

Vydajte sa s...",157,214,"['Libri, dětské', '', 'slovenské']"
n673172851,Medveď a líška,0,0,2016,12,Libri,dětské,slovenské</p>,,"Milé leporelo pre detičky s ilustráciami Petry Hauptovej Řezníčkovej.

Autor: Emília Hubočanová
Edice: Fortuna Junior
Rok vydání: 2016
Vazba: Prostorové pohádky, leporela
ISBN:...",71,109,"['Libri, dětské', '', 'slovenské']"
n673172852,Mucha na love,0,0,2016,12,Libri,dětské,slovenské</p>,,"Milé leporelo pre detičky s ilustráciami Petry Hauptovej Řezníčkovej.

Autor: Emília Hubočanová
Edice: Fortuna Junior
Rok vydání: 2016
Vazba: Prostorové pohádky, leporela
ISBN:...",71,109,"['Libri, dětské', '', 'slovenské']"
n673196837,"Alžbeta Skalová Spievankovo Spievanka, Zahrajko a zatúlaná píšťalka",0,0,2016,88,Libri,dětské,slovenské</p>,,"Tam, kde každý rád si zaspieva a kde piesňou všetko ožíva, je krajina Spievankovo. Žijeme tam aj my dvaja, nerozluční kamaráti, Spievanka a Zahrajko. Jedného dňa, kedysi dávno,...",236,358,"['Libri, dětské', '', 'slovenské']"
n364830695,Myška Šikuľka – Šablóny - Mendy Stanleyová [SK],0,0,2016,12,Libri,dětské,slovenské</p>,,"Kreatívne hry sú dôležitou súčasťou vývoja dieťaťa. Vie to aj myška Šikuľka a jej kamaráti.

V tejto interaktívnej knižke myška Šikuľka ukáže deťom, aké zábavné je vytvárať...",256,388,"['Libri, dětské', '', 'slovenské']"
n409009444,"Rok v Spievankove - jar, leto, jeseň, zima - Alžbeta Skalová",0,0,2016,48,Libri,dětské,slovenské</p>,,"Ročné obdobia v Spievankove v darčekovom balení. Azda nie je na Slovensku dieťa, ktoré by nepoznalo Spievanku a Zahrajka zo zázračnej krajiny Spievankovo. Tentoraz sa Spievanka...",389,530,"['Libri, dětské', '', 'slovenské']"
n442908153,Farebné rozprávky (Dana Hlavatá) SK,0,0,2016,96,Libri,dětské,slovenské</p>,,"Svet je nádherne pestrofarebný. Rok má 12 mesiacov a 365 dní, ten priestupný o deň viac. Každý deň v roku a všetko okolo nás je plné rôznorodých hýrivých farieb, ktorých...",176,241,"['Libri, dětské', '', 'slovenské']"
n673172552,Ilustrovaná kniha Zvieratá,0,0,2016,80,Libri,dětské,slovenské</p>,,"Táto nádherne ilustrovaná knižka ťa vezme na cestu do divočiny, kde stretneš tie najúchvatnejšie zvieratá.

Nájdeš v nej ohromujúce ilustrácie rôznych druhov cicavcov od...",295,403,"['Libri, dětské', '', 'slovenské']"
n673197028,Tom Jackson Ilustrovaná kniha Morské živočíchy,0,0,2016,80,Libri,dětské,slovenské</p>,,"Táto nádherne ilustrovaná knižka si ťa podmaní množstvom fascinujúcich morských živočíchov.

Prostredníctvom ohromujúcich ilustrácií ťa zoznámi napríklad s ozrutným vráskavcom...",239,403,"['Libri, dětské', '', 'slovenské']"
n673196839,Alžbeta Skalová Leto v Spievankove,0,0,2016,12,Libri,dětské,slovenské</p>,,"Azda nie je na Slovensku dieťa, ktoré by nepoznalo Spievanku a Zahrajka zo zázračnej krajiny Spievankovo. Tentoraz sa Spievanka a Zahrajko predstavia deťom v štyroch...",97,148,"['Libri, dětské', '', 'slovenské']"
n415716718,Rozprávky - Laura Tavazzi,0,0,2016,128,Libri,dětské,slovenské</p>,,"Charles Perrault, Jacob a Wilhelm Grimmovci a Hans Christian Andersen sú spisovatelia francúzskej, nemeckej a dánskej národnosti. Poznajú ich ľudia na celom svete, ich diela...",236,322,"['Libri, dětské', '', 'slovenské']"
n673196838,Alžbeta Skalová Jar v Spievankove,0,0,2016,12,Libri,dětské,slovenské</p>,,"Azda nie je na Slovensku dieťa, ktoré by nepoznalo Spievanku a Zahrajka zo zázračnej krajiny Spievankovo. Tentoraz sa Spievanka a Zahrajko predstavia deťom v štyroch...",97,148,"['Libri, dětské', '', 'slovenské']"
n673196840,Alžbeta Skalová Jeseň v Spievankove,0,0,2016,12,Libri,dětské,slovenské</p>,,"Azda nie je na Slovensku dieťa, ktoré by nepoznalo Spievanku a Zahrajka zo zázračnej krajiny Spievankovo. Tentoraz sa Spievanka a Zahrajko predstavia deťom v štyroch...",97,148,"['Libri, dětské', '', 'slovenské']"
n673172586,Čiary Tvary Domček,0,0,2016,14,Libri,dětské,slovenské</p>,,"Milé deti, aj vy si chcete nakresliť domček? Je to veľmi jednoduché:
Postupujte krok za krokom podľa veršíkov.

Autor: Ela Prajková
Edice: Fortuna Junior
Rok vydání: 2016...",77,106,"['Libri, dětské', '', 'slovenské']"
n673172587,Čiary Tvary Postavička,0,0,2016,14,Libri,dětské,slovenské</p>,,"Milé deti, aj vy si chcete nakresliť nového kamaráta? Je to veľmi jednoduché:
Postupujte krok za krokom podľa veršíkov.

Autor: Ela Prajková
Edice: Fortuna Junior
Rok vydání:...",77,106,"['Libri, dětské', '', 'slovenské']"
n673196841,Alžbeta Skalová Zima v Spievankove,0,0,2016,12,Libri,dětské,slovenské</p>,,"Azda nie je na Slovensku dieťa, ktoré by nepoznalo Spievanku a Zahrajka zo zázračnej krajiny Spievankovo. Tentoraz sa Spievanka a Zahrajko predstavia deťom v štyroch...",97,148,"['Libri, dětské', '', 'slovenské']"
