db_id,name,rating,reviews_cnt,year,pages_cnt,publisher,genre,author,lang,description,price_from,price_to,unparsed
n523024479,Trestní odpovědnost v územní samosprávě. Komentovaná soudní rozhodnutí - EJ118,0,0,2017,200,C.H.Beck,naučná,české</p>,,"Jde o první a jedinou sbírku soudních rozhodnutí tohoto zaměření na českém trhu. Odborné i laické veřejnosti představuje celkem 57 rozhodnutí Nejvyššího soudu, která se týkají...",416,490,"['C.H.Beck, naučná', '', 'české']"
n556662745,Finanční analýza organizace z pohledu zájmových skupin - BP119,0,0,2017,192,C.H.Beck,naučná,české</p>,,Finanční analýza není jen mechanický výpočet soustav finančně analytických ukazatelů z účetní závěrky a komentování trendu jejich vývoje. Je především o hledání vhodné...,331,390,"['C.H.Beck, naučná', '', 'české']"
n485991912,Likvidace obchodních společností - PP129,0,0,2017,208,C.H.Beck,naučná,české</p>,,"Likvidace je proces, který zpravidla nastupuje poté, co je společnost zrušena. Jejím účelem je vypořádat majetek a dluhy společnosti předtím, než zanikne jako právní subjekt. V...",331,484,"['C.H.Beck, naučná', '', 'české']"
n542212568,Sousedská práva - PP134,100,1,2017,216,C.H.Beck,naučná,české</p>,,"Sousedské právo je tradičně charakterizováno jako právo, které reguluje vzájemné právní vztahy vlastníků sousedících nemovitých věcí, a to ať vlastníků nemovitých věcí...",331,390,"['C.H.Beck, naučná', '', 'české']"
n545761460,"Mezinárodní podnikání. Vybrané strategické, manažerské a finanční aspekty - BEK74",0,0,2017,224,C.H.Beck,naučná,české</p>,,"Kniha přináší komplexní pohled na mezinárodní podnikatelské aktivity českých podniků. Jejím cílem je ukázat, jaký vliv má rozhodnutí podniku vstoupit na mezinárodní trh na jeho...",245,490,"['C.H.Beck, naučná', '', 'české']"
n549206251,Autonomie církví - EPI92,0,0,2017,224,C.H.Beck,naučná,české</p>,,"Autonomie náboženských společenství představuje dílčí složku svobody náboženského vyznání, kterou lze považovat za jeden z konstitutivních prvků demokratického právního státu a...",298,350,"['C.H.Beck, naučná', '', 'české']"
