db_id,name,rating,reviews_cnt,year,pages_cnt,publisher,genre,author,lang,description,price_from,price_to,unparsed
n82184897,Kniha filosofie,91,7,2013,352,Universum,naučná,české</p>,,"Kniha filozofie kniha od autora neuveden. Kniha filosofie je první ze série přehledových oborových publikací, určených pro nejširší veřejnost od úplných začátečníků až po...",476,599,"['Universum, naučná', '', 'české']"
n84829558,Houby do kapsy - sada,87,9,2013,384,Universum,naučná,české</p>,,"Sada knížky a nožíku je skvělým průvodcem pro houbaře a vhodným dárkem pro milovníky houbaření. Zahrnuje fotografický kapesní atlas pro rychlé určení hub v terénu.
 Na 160...",289,359,"['Universum, naučná', '', 'české']"
n274415952,Češi v srdci temnoty Petr Zídek,90,1,2013,376,Universum,naučná,české</p>,,Kniha Češi v srdci temnoty přináší nový pohled na československé dějiny od komunistického převratu do počátku normalizace. Ke každému roku v období let 1948–1970 autor...,210,314,"['Universum, naučná', '', 'české']"
n105221790,"Mosad: Velké operace - Michael Bar-Zohar, Nissim Mishal",94,3,2013,376,Universum,naučná,české</p>,,"Mosad: Nejslavnější operace izraelské tajné služby kniha od autora Bar Zohar Michael, Mišal Nisim. Knihy Mosad: Velké operace se v Izraeli prodalo více než 120 000 výtisků a...",399,399,"['Universum, naučná', '', 'české']"
n123272036,Automobily minisérie,0,0,2013,352,Universum,naučná,české</p>,,Automobily - minisérie kniha od autora neuveden. Praktická příručka pro milovníky dějin techniky zachycuje slovem i obrazem nejslavnější značky a modely automobilové historie....,314,314,"['Universum, naučná', '', 'české']"
