db_id,name,rating,reviews_cnt,year,pages_cnt,publisher,genre,author,lang,description,price_from,price_to,unparsed
n673197405,Tomáš Poláček Laco Déczi Totálně vytroubený mozek,88,3,2017,256,BizBooks,beletrie,české</p>,,"Životní rozhovor s legendárním jazzovým trumpetistou. Laco Déczi je sprosťák, hulvát, křikloun, a tak trochu hovado, říká novinář Tomáš Poláček, autor neobvyklého knižního...",278,399,"['BizBooks, beletrie', '', 'české']"
n551752752,Lékárník z Osvětimi - Patricia Posnerová,57,3,2017,272,BizBooks,beletrie,české</p>,,"Nevyřčený příběh Victora Capesia. Odhalte dlouho utajovaný příběh Victora Capesia, hlavního lékárníka největšího nacistického tábora smrti v Osvětimi. Victor Capesius byl...",251,369,"['BizBooks, beletrie', '', 'české']"
n551752787,Tlouštíci hoří rychleji - Adéla Bartlová,100,1,2017,256,BizBooks,beletrie,české</p>,,"Podívat se vlastní smrtelnosti do očí není nic jednoduchého. Abychom se tomu vyhnuli, raději si zavazujeme oči a dobrovolně se straníme reality smrti a umírání. Jenže...",208,299,"['BizBooks, beletrie', '', 'české']"
n556695057,Banánové dítě – Vietnamka v české džungli - Duong Nguyen Jirásková,78,2,2017,240,BizBooks,beletrie,české</p>,,"Výlet do života vietnamské ženy žijící v Česku

Jsem banánové dítě – zvenku žlutá, uvnitř spíše bílá. Na svůj žluto-bílý svět se snažím dívat s nadhledem a psát o něm lehkým...",199,299,"['BizBooks, beletrie', '', 'české']"
n545326337,Znásilněná - Joanna Connors,0,0,2017,240,BizBooks,beletrie,české</p>,,"Novinářka jde po stopách muže, který jí znásilnil

Bála jsem se jít i do kina. Jelikož jsem v té době pracovala v novinách jako filmová kritička, dost mi to komplikovalo život....",229,316,"['BizBooks, beletrie', '', 'české']"
n543824976,Neublížíš - Henry Marsh,100,1,2017,296,BizBooks,beletrie,české</p>,,"Dechberoucí memoár z lékařského prostředí

Často musím krájet mozek a dělám to nerad. Pomocí diatermických kleští koaguluji krásné a jemné cévy, které se vinou po lesklém...",203,369,"['BizBooks, beletrie', '', 'české']"
n542853057,"Juniper – holčička, která se narodila příliš brzy - Kelley French",0,0,2017,288,BizBooks,beletrie,české</p>,,"Pouta mezi matkou a dítětem a mezi mužem a ženou mají neuvěřitelnou mocJuniper přišla na svět o čtyři měsíce dříve, ve 23. týdnu těhotenství. Vážila 570 gramů, měřila 29...",243,349,"['BizBooks, beletrie', '', 'české']"
