db_id,name,rating,reviews_cnt,year,pages_cnt,publisher,genre,author,lang,description,price_from,price_to,unparsed
n439760155,NIKDO TI NEUVĚŘÍ - PŘÍBĚH ŽENY ZNEUŽÍVANÉ KNĚZEM - Schererová Danielle,0,0,2016,185,Karmelitánské nakladatelství,naučná,české</p>,,"Kniha je důkladnou psychologickou sondou do prožívání jedné belgické dívky (dnes už babičky), která se stala obětí letitého sexuálního zneužívání ze strany místního faráře....",177,259,"['Karmelitánské nakladatelství, naučná', '', 'české']"
n413030801,Byl jsem muslimem,60,1,2016,176,Karmelitánské nakladatelství,naučná,české</p>,,"Naeem byl zbožný pákistánský muslim, jemuž se Kristus zjevil tak, že se tomu nemohl vzepřít. Osobně, bezprostředně, silně. Jeho příběh je navzdory veškerému neporozumění, které...",173,259,"['Karmelitánské nakladatelství, naučná', '', 'české']"
n349295320,365 dní s papežem Františkem,90,1,2016,206,Karmelitánské nakladatelství,naučná,české</p>,,"Autor : František Papež, Popis : 
 Už jsme si zvykli na to, že papež František se po zvolení odmítl přestěhovat do papežského apartmánu v Apoštolském paláci, ale ubytoval se v...",166,249,"['Karmelitánské nakladatelství, naučná', '', 'české']"
n366415470,A přesto říci životu ano,100,1,2016,192,Karmelitánské nakladatelství,naučná,české</p>,,"Kniha spojuje dva slavné texty Viktora E. Frankla (1905–1997), psychiatra s českými kořeny a zakladatele logoterapie. Spis Psycholog prožívá koncentrační tábor vznikl během...",259,259,"['Karmelitánské nakladatelství, naučná', '', 'české']"
n378803485,Maria matka Ježíšova – Vella Elias,0,0,2016,184,Karmelitánské nakladatelství,naučná,české</p>,,"Maria je jedním z největších darů, jaké kdy lidstvo od Ježíše dostalo. Proto se nesmíme bát se jí otevřít a přijmout ji do svého života. Ovšem pouze ji zbožně obdivovat a...",159,249,"['Karmelitánské nakladatelství, naučná', '', 'české']"
n421202709,Krása lidskosti,100,1,2016,220,Karmelitánské nakladatelství,naučná,české</p>,,"V roce 2015 probleskla tiskem zpráva, že Templetonovu cenu získal Jean Vanier, zakladatel komunity Archa. V knize předkládáme jeho životopisný portrét, spolu s výběrem těch...",191,299,"['Karmelitánské nakladatelství, naučná', '', 'české']"
n359793241,Křesťan v záběhu,100,1,2016,188,Karmelitánské nakladatelství,naučná,české</p>,,"Když známý televizní producent Thierry Bizot znovu objevil křesťanskou víru, napsal o tom knihu Anonymní katolík. Její nečekaný úspěch ho přiměl, aby v psaní pokračoval a...",168,249,"['Karmelitánské nakladatelství, naučná', '', 'české']"
n438980943,Karmelitánské nakladatelství s. r. o. Nejkrásnější texty Alžběty od Trojice,0,0,2016,198,Karmelitánské nakladatelství,naučná,české</p>,,"Nejkrásnější stránky z díla karmelitky Alžběty od Trojice (1880–1906) vybral P. Conrad de Meester, snad největší žijící znalec její spirituality. Hloubkou, radostností a...",180,259,"['Karmelitánské nakladatelství, naučná', '', 'české']"
