db_id,name,rating,reviews_cnt,year,pages_cnt,publisher,genre,author,lang,description,price_from,price_to,unparsed
n259643539,Pískový vrch - Joanna Batorová,0,0,2015,392,Paseka,beletrie,české</p>,,"Magnesia Litera 2016 za překladovou knihu.
Na sídlišti Pískový vrch ve slezském Valbřichu se všechno točí kolem žen. Když do města přijede ze zapadlé vesnice Jaďa Maślaková,...",212,299,"['Paseka, beletrie', '', 'české']"
n314834370,Pod kůží - Sabine Durrantová,80,1,2015,328,Paseka,beletrie,české</p>,,"Gaby Mortimerové na první pohled nic nechybí - je hvězdou populárního televizního pořadu, matkou osmileté dcerky, s manželem Philipem, úspěšným finančníkem, žijí v luxusním...",170,284,"['Paseka, beletrie', '', 'české']"
n277864498,Život mimo kategorie,0,0,2015,340,Paseka,beletrie,české</p>,,"John Bok je napůl Angličan, který si ušil jeden vatovaný kabát na demonstrace, byl dvakrát odvezen na psychiatrii a třikrát se pokusil o sebevraždu. Má tři nemanželské syny,...",222,350,"['Paseka, beletrie', '', 'české']"
n341871735,Na zabití - Swanson Peter,0,0,2015,320,Paseka,beletrie,české</p>,,"Cizím lidem se nikdy nesvěřujte se svými problémy. Úspěšný podnikatel Ted Severson, který zbohatl na internetových startupech, při čekání na odložený let z Londýna do Bostonu...",223,299,"['Paseka, beletrie', '', 'české']"
n280123597,Lovci vran - Lyndsay Fayeová,0,0,2015,370,Paseka,beletrie,české</p>,,"Píše se počátek roku 1846 a Timothy Wilde je posilou nově vzniklého newyorského policejního sboru, kde se specializuje na řešení zdánlivě nevysvětlitelných případů. Jednoho dne...",210,299,"['Paseka, beletrie', '', 'české']"
n226159217,Zamilovanosti - Javier Marías,100,1,2015,324,Paseka,beletrie,české</p>,,"Mladá redaktorka María Dolzová každé ráno sleduje v kavárně cizí pár. Pozorování dvojice, jež ji fascinuje se pro ni stane posedlostí a rituálem až do okamžiku, kdy se z novin...",232,299,"['Paseka, beletrie', '', 'české']"
n252290941,Láska dobré ženy - Alice Munroová,0,0,2015,320,Paseka,beletrie,české</p>,,"Když se sedmatřicetiletá Enid dozví od umírající pacientky, kterou ošetřuje, že někdejší smrt místního optika doktora Willense, obecně považovanou za důsledek tragické nehody,...",232,299,"['Paseka, beletrie', '', 'české']"
n259905046,Tonutí - Michael Katz Krefeld,100,1,2015,320,Paseka,beletrie,české</p>,,"Tonutí kniha od autora Michael Katz Krefeld. Populární detektiv Havran v novém kriminálním thrilleru bestsellerového dánského autora. 

 Jedenáct nahých mužů utopených ve...",170,299,"['Paseka, beletrie', '', 'české']"
n276867412,Křup!,0,0,2015,336,Paseka,beletrie,české</p>,,"Kluk s neodpustitelně divným jménem, který trpí přeludy, geniální dvojčata se svou podezřele velkou a podezřele chlupatou chůvou, dva tisíce let starý zlodějský skřítek a...",269,269,"['Paseka, beletrie', '', 'české']"
