db_id,name,rating,reviews_cnt,year,pages_cnt,publisher,genre,author,lang,description,price_from,price_to,unparsed
n42879754,Tajemství kvantového života,97,8,2011,264,ANAG,naučná,české</p>,,"Léta jsme čekali na knihu, která může přeměnit sílu vnitřního míru do okamžitých, praktických a konkrétních výsledků. Nyní vám ji přinášíme. Změňte svůj život Naučíte se...",205,269,"['ANAG, naučná', '', 'české']"
n22111460,"Benchmarking Mýty a skutečnost, Model efektivního učení se a zlepšování",0,0,2011,268,Management Press,naučná,české</p>,,"Ojedinělá publikace shrnuje význam, efekty a etické zásady benchmarkingu jako jedné z nejefektivnějších forem učení se a rozvoje organizací i jejich zaměstnanců a zdroje...",278,399,"['Management Press, naučná', '', 'české']"
n38045745,Vztahová inteligence,0,0,2011,256,Management Press,naučná,české</p>,,"Schopnost a umění získat si lidi. Nezáleží na tom, jaké povolání vykonáváte, jaké postavení zaujímáte, jaké máte plány a jaké jsou vaše možnosti uplatnění svého vlivu či moci....",209,379,"['Management Press, naučná', '', 'české']"
n23625325,Dynamická strategie,0,0,2011,264,Management Press,naučná,české</p>,,"Schopnost pohotově měnit strategii vám umožní získat náskok před konkurenty
Úspěšné firmy se často stávají oběťmi vlastního úspěchu – když jejich podnikatelské odvětví dozraje,...",298,439,"['Management Press, naučná', '', 'české']"
n41714615,Roční zúčtování daně z příjmů ze závislé činnosti a funkčních požitků rok 2011,0,0,2011,288,ANAG,naučná,české</p>,,Publikace Roční zúčtování daně z příjmů ze závislé činnosti a funkčních požitků za rok 2011 podává podrobný výklad a přispívá k lepší orientaci při provádění ročního zúčtování...,246,318,"['ANAG, naučná', '', 'české']"
