db_id,name,rating,reviews_cnt,year,pages_cnt,publisher,genre,author,lang,description,price_from,price_to,unparsed
n404312459,Konec prokrastinace. Jak přestat odkládat a začít žít naplno - Petr Ludwig,93,28,2013,272,Jan Melvil Publishing,naučná,české</p>,,"Prokrastinace je až chronická tendence odkládat všechno na později. Nejedná se přitom pouze o pracovní povinnosti, obtížné úkoly či nepříjemné záležitosti. A může vyústit ve...",236,359,"['Jan Melvil Publishing, naučná', '', 'české']"
n120480271,Začněte s PROČ - Simon Sinek,93,15,2013,256,Jan Melvil Publishing,naučná,české</p>,,"Proč děláte to, co děláte? Proč jsou někteří lidé a některé společnosti úspěšnější, vlivnější, inovativnější a bohatší než ostatní? Proč způsob jejich vedení zajišťuje věrné...",195,299,"['Jan Melvil Publishing, naučná', '', 'české']"
n149059522,Prodávat je lidské - Daniel H. Pink,80,6,2013,256,Jan Melvil Publishing,naučná,české</p>,,"O autorovi

Daniel H. Pink je americký autor pěti knih věnujících se obchodní, pracovní a manažerské tématice. Jeho knihy byly přeloženy již do 33 jazyků. Píše články pro The...",208,299,"['Jan Melvil Publishing, naučná', '', 'české']"
n274415951,Startup za pakatel - Chris Guillebeau,83,4,2013,308,Jan Melvil Publishing,naučná,české</p>,,"V knize Startup za pakatel Chris Guillebeau ukazuje, jak je možné vést svobodný, dobrodružný, smysluplný a účelný život – a navíc si i slušně vydělat. Sám je živým příkladem...",208,319,"['Jan Melvil Publishing, naučná', '', 'české']"
