db_id,name,rating,reviews_cnt,year,pages_cnt,publisher,genre,author,lang,description,price_from,price_to,unparsed
n274416861,Rok na statku,0,0,2014,116,Ottovo nakladatelstvo,dětské,české</p>,,"Jak se žije na statku? Děti a zvířátka tam čeká nejen práce, ale i zábava a dobrodružství. Příběhy slepice Adély, krávy Ryšulky, jehňátek Flipa, Flapa a Flopa, ale i lišky...",116,224,"['Ottovo nakladatelstvo, dětské', '', 'české']"
n202487010,Moje první knížka pohádek + CD,93,1,2014,96,Ottovo nakladatelstvo,dětské,české</p>,,"Moje první knížka pohádek vypráví nejznámější příběhy česky i anglicky.

 Malí školáci se s ní snadno naučí číst. Půvabné ilustrace a obrázkový slovníček pomohou zapamatovat si...",78,269,"['Ottovo nakladatelstvo, dětské', '', 'české']"
n259848064,Ottova velká kniha Školák,100,3,2014,160,Ottovo nakladatelstvo,dětské,české</p>,,"Děti v této původní české knize ocení především zajímavé vědomostní hry a nejrůznější praktické úkoly, které jim přinesou zábavu i poučení. V průběhu celého roku budou...",111,269,"['Ottovo nakladatelstvo, dětské', '', 'české']"
n135634447,O princeznách a vílách,60,2,2014,116,Ottovo nakladatelstvo,dětské,české</p>,,"Věřili byste, že i princezna může ztratit úsměv? Nebo že krásné Šeherezádě neměl kdo upéct palačinky? Už vám někdo vyprávěl o dárečku, který dostala malá víla od své sudičky?...",78,249,"['Ottovo nakladatelstvo, dětské', '', 'české']"
n274418031,Život v lese,100,1,2014,48,Ottovo nakladatelstvo,dětské,české</p>,,"Les vás přivítá stínem stromů, měkkou trávou či sladkou vůní.
Je v něm rozmanitý život - houby, zvířata i ptáci.
Knížka s hravými básničkami Pavla Volfa a veselými obrázky...",63,87,"['Ottovo nakladatelstvo, dětské', '', 'české']"
