db_id,name,rating,reviews_cnt,year,pages_cnt,publisher,genre,author,lang,description,price_from,price_to,unparsed
n153300369,Kdo jinému jámu kopá,97,10,2013,128,Práh,dětské,české</p>,,"Náš životní styl se natolik změnil, že čistě obsahově jsou pro nás klasická česká přísloví již nesrozumitelná. A tím spíš jsou nesrozumitelná pro děti. Přitom znalost přísloví...",218,330,"['Práh, dětské', '', 'české']"
n138397746,Strýček Ludvík v sibiřské džungli,95,1,2013,88,Práh,dětské,české</p>,,"Knížky Dobrodružství strýčka Ludvíka sice zatím u nás nedosahují tak závratných prodejů, jako v Izraeli, ale své čtenáře si již našly.

Snad k tomu pomůže i obohacení knižní...",159,199,"['Práh, dětské', '', 'české']"
n96654802,Analfabeta Negramotná,78,3,2013,96,Práh,dětské,české</p>,,"Nejúspěšnější slovenská kniha pro děti roku 2012 vychází nyní i v Čechách. Díky nenásilnému a přitom silnému didaktickému poselství si získala oblibu také na školách.
 
Příběh...",183,272,"['Práh, dětské', '', 'české']"
n144920757,"Překážka, ovečky, človíček a problém",100,1,2013,32,Práh,dětské,české</p>,,"Jak překonat překážku
Podobenství o různých způsobech zdolávání problémů.
Poetický ilustrovaný mini příběh pro děti i dospělé názorně a mile ilustruje rozmanité způsoby, jakými...",169,234,"['Práh, dětské', '', 'české']"
n137630269,Feldstein Petr: Život plný koní - Šedesát let Františka Vítka ve třiceti kapitolách Kniha,0,0,2013,112,Práh,dětské,české</p>,,"Pohádková cesta ke klidu, soustředění a pohodě. 
Navíc základní cviky jógy pro děti.

Kniha je hlavním předmětem televizního seriálu, který se bude už v příštích týdnech...",254,254,"['Práh, dětské', '', 'české']"
