db_id,name,rating,reviews_cnt,year,pages_cnt,publisher,genre,author,lang,description,price_from,price_to,unparsed
n128799400,...ismy Jak chápat moderní umění,92,2,2013,160,Slovart,naučná,české</p>,,"Tato kniha je užitečným a praktickým průvodcem širokou skupinou uměleckých -ismů. Je ideální pomůckou, jak se obeznámit se základy všech důležitých hnutí, která formovala...",224,269,"['Slovart, naučná', '', 'české']"
n90922545,Deník mého děťátka,90,2,2013,160,Slovart,naučná,české</p>,,"Každá žena má s těhotenstvím jinou zkušenost, ale žádná nepopírá, že je to kouzelný čas, kdy se její tělo mění každým dnem. Zaznamenejte tyto proměny a získejte tak památku na...",318,359,"['Slovart, naučná', '', 'české']"
n128799399,Dějiny architektury od antiky po současnost,73,1,2013,120,Slovart,naučná,české</p>,,"Architektura se už od starověku považovala za matku umění a v součinnosti s ní se vyvíjelo i malířství a sochařství. 
Publikace Dějiny architektury nabízí průřez historií a...",140,199,"['Slovart, naučná', '', 'české']"
n405099717,Pražské kostely a chrámy - Vučka Tomáš,90,1,2013,144,Slovart,naučná,české</p>,,Sakrální architektura zaujímá v tisícileté historii Prahy nezastupitelné místo a právem se počítá k nejvýznamnějším turistickým lákadlům. Kniha je však věnována nejen těm...,259,399,"['Slovart, naučná', '', 'české']"
n455350210,V co věříš? - Náboženství a víra v dnešním světě - neuveden,0,0,2013,96,Slovart,naučná,české</p>,,"Život nám předkládá mnoho závažných otázek. Proč tu vlastně jsme? A co se stane, až zemřeme? Proč se dobrým lidem stávají špatné věci? Podívej se, jak se různá náboženství a...",162,249,"['Slovart, naučná', '', 'české']"
n125615590,Maratony,90,0,2013,160,Slovart,naučná,české</p>,,"Nejkomplexnějšího průvodce po 50 nejlepších maratonech na světě.

Tento průvodce vám pomůže s výběrem dokonalé trasy, ať již běháte na dlouhé trati, nebo jste v oblasti...",143,338,"['Slovart, naučná', '', 'české']"
