db_id,name,rating,reviews_cnt,year,pages_cnt,publisher,genre,author,lang,description,price_from,price_to,unparsed
n443054691,Vydavatelství VÍKEND - J. Černý Příběhy z poválečné Šumavy,85,3,2016,192,Víkend,beletrie,české</p>,,"Autor vám předkládá deset příběhů z poválečné Šumavy, kterou důvěrně zná. Přináší svědectví o tragédii „choceňských andělů“, z nichž dva byli při opuštění republiky zastřeleni...",172,269,"['Víkend, beletrie', '', 'české']"
n441594322,Kriminální příběhy ze staré Šumavy 3 - Vladimír Šindelář,100,1,2016,208,Víkend,beletrie,české</p>,,"O Šumavě bylo už mnohé napsáno. Byla by z toho docela slušná knihovna. Skoro by se zdálo, že už nic nového se nemůže z historie Šumavy vynořit, ale opak je pravdou. Dokladem...",167,269,"['Víkend, beletrie', '', 'české']"
n361286070,Kriminální příběhy ze staré Šumavy 2,100,1,2016,208,Víkend,beletrie,české</p>,,"Šumava dnes slouží mnohým z nás hlavně jako místo pro krásnou dovolenou, ale v minulosti zde život nebyl snadný. Dokládají to i staré soudní spisy, dodnes uložené v mnoha...",167,269,"['Víkend, beletrie', '', 'české']"
n443535660,"V pekle mezi ostnatými dráty - Zpověď muže, který přežil hrůzy čtyř koncentračních táborů",100,1,2016,224,Víkend,beletrie,české</p>,,"Když do polské Radomi dorazí němečtí okupanti a začínají zavádět krutá opatření proti Židům, Manny Steinberg žije s otcem, dvěma mladšími bratry a nevlastní matkou v relativním...",178,279,"['Víkend, beletrie', '', 'české']"
n420106169,"Vydavatelství VÍKEND - J. Černý Dívka, kterou nikdo nehledal",100,1,2016,208,Víkend,beletrie,české</p>,,"Když dvě dívky – Monika a Dominika - utečou z dětského domova na severu Čech, nikdo se příliš neznepokojuje. Z domovů prchají ročně stovky dětí a málokdy je pátrání po nich...",93,149,"['Víkend, beletrie', '', 'české']"
