db_id,name,rating,reviews_cnt,year,pages_cnt,publisher,genre,author,lang,description,price_from,price_to,unparsed
n637422181,"Volyň 1943 - Genocidní čistka, fakta, analogie, historická politika - Motyka Grzegorz",0,0,2018,232,Academia,naučná,české</p>,,"Během druhé světové války vyvraždili ukrajinští nacionalisté na Volyni a ve Východní Haliči zhruba sto tisíc Poláků. Grzegorz Motyka, vynikající znalec a oceňovaný...",260,325,"['Academia, naučná', '', 'české']"
n610572679,Silver A - Pavel Šmejkal,93,2,2018,200,Academia,naučná,české</p>,,"Kniha provede zájemce po místech spojených s výsadkem SILVER A, a to jak s činností samotných parašutistů, tak i jejich pomocníků z řad civilního obyvatelstva. Místa jsou...",200,285,"['Academia, naučná', '', 'české']"
n605565776,Odbojová skupina bratří Mašínů - Jiří Padevět,98,5,2018,188,Academia,naučná,české</p>,,"V knize navštívíme místa spojená s životem, odbojovou činností a především útěkem členů odbojové skupiny bratří Mašínů do Západního Berlína. Ať už si myslíme o třetím odboji...",176,250,"['Academia, naučná', '', 'české']"
n636451260,Věda a diplomacie - Nový rozměr mezinárodních vztahů - Pierre Bruno Ruffini,0,0,2018,204,Academia,naučná,české</p>,,"Autor se věnuje různým polohám vzájemného vztahu vědy a diplomacie: diplomacie může vědu podporovat, napomáhat realizaci a uplatnění vědeckých objevů, často naopak věda...",208,320,"['Academia, naučná', '', 'české']"
n663482015,"Jak se žije Čechům v současné Evropě? - Krulichová Eva, Pospíšilová Jaroslava",0,0,2018,176,Academia,naučná,české</p>,,"Globální svět čelí vážným společenským problémům, jejichž dopady můžeme vidět i v Evropě. Evropská unie, jejímž hlavním posláním je udržování míru a prosperity v rámci všech...",175,265,"['Academia, naučná', '', 'české']"
n659638694,Abelova cena - Nejvyšší ocenění za matematiku - Michal Křížek,0,0,2018,220,Academia,naučná,české</p>,,"Matematika bývá po právu nazývána královnou věd. Prakticky žádná moderní věda se bez ní neobejde, a nejen věda. Najdeme ji v našich mobilních telefonech, čárových kódech,...",231,350,"['Academia, naučná', '', 'české']"
n695821229,Internace biskupů - František Kolouch,0,0,2018,224,Academia,naučná,české</p>,,"Kniha se zabývá internací biskupů římskokatolické církve Josefa Hloucha a Karla Skoupého v době komunistického režimu v Československu, v letech 1949–1968. Představuje snahy...",231,350,"['Academia, naučná', '', 'české']"
n634596884,Stabilní izotopy biogenních prvků - Hana Šantrůčková,0,0,2018,176,Academia,naučná,české</p>,,"Již téměř sto let vědci prohlubují své poznatky o tom, že základní biogenní prvky (C, O, H, N) mají více stabilních izotopů (SI) a jejich rozdělení v litosféře, hydrosféře a...",237,365,"['Academia, naučná', '', 'české']"
