db_id,name,rating,reviews_cnt,year,pages_cnt,publisher,genre,author,lang,description,price_from,price_to,unparsed
n32057280,Historie zase trochu jinak,97,2,2011,314,Jota,naučná,české</p>,,"Po Historii trochu jinak (Jota, 2009) tu máme Historii zase trochu jinak – a opět nevážně o vážném. To je autorovi vlastní.

Naše země se nachází ve středu Evropy, souvislosti...",227,295,"['Jota, naučná', '', 'české']"
n34989935,Staré dobré časy,77,1,2011,258,Jota,naučná,české</p>,,"Staré dobré časy jsou další prací české veřejnosti velmi dobře známého britského spisovatele Toma Hodgkinsona, jehož předchozí knihy Líný rodič, Jak být líný a Jak být volný...",99,213,"['Jota, naučná', '', 'české']"
n32161806,Proč vyskočit z rozjetého vlaku,75,2,2011,240,Jota,naučná,české</p>,,"Jak poznat, jestli je čas jít dál?
Unikátní průvodce pro miliony lapené v nešťastných manželstvích, sžírané smutkem, hněvem a strachem, sužované otázkou: „Měl bych se...",240,240,"['Jota, naučná', '', 'české']"
