db_id,name,rating,reviews_cnt,year,pages_cnt,publisher,genre,author,lang,description,price_from,price_to,unparsed
n36499326,"Jak chtěl být Honza peciválem, Kouzelné nůžky",72,11,2011,16,Triton,dětské,české</p>,,"Formát: 102 x 145 mm
Počet stran: 16
Jak chtěl být Honza peciválem
 
Je to lákavé, stát se peciválem! Vyvalovat se na peci, hřát se a cpát se vším, co maminka přinese až pod...",7,28,"['Triton, dětské', '', 'české']"
n39006291,Člověk je usušený vodník,81,5,2011,16,Triton,dětské,české</p>,,"Autor : Miloš Kratochvíl,  Kniha Člověk je usušený vodník je určena dětem předškolního věku. Vodníci v Čechách jsou. Nejenom říční a rybniční, ale také namyšlení hastrmani...",8,14,"['Triton, dětské', '', 'české']"
n36499323,"Nebezpečná přímluva, O dvou obrech",79,11,2011,16,Triton,dětské,české</p>,,"Formát: 102 x 145 mm
Počet stran: 16
Nebezpečná přímluva
 
Přimlouvat se za někoho znamená snažit se někomu někam pootevřít vrátka. Nebo třeba bránu do královského paláce......",7,28,"['Triton, dětské', '', 'české']"
n39006290,Zahlédl jsem Ježíška,61,8,2011,16,Triton,dětské,české</p>,,Zahlédl jsem Ježíška kniha od autora Kratochvíl Miloš.,7,28,"['Triton, dětské', '', 'české']"
n31140116,Pohádky pro dospělé děti a nedospělé dospělé,98,3,2011,64,Triton,dětské,české</p>,,"Vydejte se s námi do světa nekonečné fantazie a jemného humoru, jenž je otevřený nejen dětem, ale i dospělým s duší dítěte. Pohádky pro dospělé děti a nedospělé dospělé, které...",89,149,"['Triton, dětské', '', 'české']"
n26620567,VYJMENOVANÁ ČTENÍ O PŘÍRODĚ - Jan-Michal Mleziva,68,3,2011,96,Triton,dětské,české</p>,,"- Kniha Vyjmenovaná čtení o přírode určená mladším školákům přináší mnohem víc než jen spoustu informací ze světa zvířat a rostlin. 

- Jak napovídá název knihy, souvisí její...",70,99,"['Triton, dětské', '', 'české']"
n22243187,Africké pohádky African tales West O. D.,0,0,2011,120,Triton,dětské,české</p>,,"V0178043
Nové rozšířené vydání bohatě ilustrované knihy, která představuje pohádky z černého kontinentu. Umožňuje náhled do odlišného světa, jenž se nám otevírá v osmi...",145,145,"['Triton, dětské', '', 'české']"
