db_id,name,rating,reviews_cnt,year,pages_cnt,publisher,genre,author,lang,description,price_from,price_to,unparsed
n34239161,Financování akvizic v právním řádu ČR. Příručka pro management,0,0,2009,217,KEY Publishing,naučná,české</p>,,Kniha přispívá k orientaci čtenáře v oblasti právních aspektů akvizičního financování a předkládá komplexní právní příručku pro financování akviziční transakce v ČR. Může být...,331,373,"['KEY Publishing, naučná', '', 'české']"
n41867769,Základy filosofie a psychologie,0,0,2009,184,KEY Publishing,naučná,české</p>,,Čtyřdílná učebnice Základů společenských věd nabízí studentům a široké veřejnosti sebepoznání v duchu evropské filosofické tradice. Každé lidské společenství si vytváří nějaká...,275,383,"['KEY Publishing, naučná', '', 'české']"
n45150650,"Základy práva pro pedagogy II. - Jana Čuhelová, Karel Schelle",0,0,2009,190,KEY Publishing,naučná,české</p>,,"Publikace je určená zejména studentům pedagogických fakult, kteří chtějí získat základní znalosti o českém právním řádu. Obsahuje informace o základech občanského práva...",322,363,"['KEY Publishing, naučná', '', 'české']"
n34239951,Vybrané kapitoly z práva EU,0,0,2009,233,KEY Publishing,naučná,české</p>,,"Právo Evropských společenství a Evropské unie, které již po více než pět let představuje závazný právní rámec rozvoje podstatné části českého právního řádu, doznává v...",334,372,"['KEY Publishing, naučná', '', 'české']"
n45150652,Základy občanského práva - Karel Schelle,0,0,2009,188,KEY Publishing,naučná,české</p>,,"Publikace je určena zejména pro neprávníky, kteří se chtějí seznámit se základními občanskoprávními instituty. Kromě vysvětlení základních občanskoprávních pojmů se čtenář...",340,340,"['KEY Publishing, naučná', '', 'české']"
