db_id,name,rating,reviews_cnt,year,pages_cnt,publisher,genre,author,lang,description,price_from,price_to,unparsed
n119341881,"Co je tvoje, je i moje",0,0,2013,264,Domino,beletrie,české</p>,,"Dvě sestry. Naprosté protiklady. A dohoda, která je spojí – anebo navždy rozdělí.
Grace Hamiltonová je dítě štěstěny. Na co sáhne, to se vydaří. Avšak to, po čem touží ze všeho...",79,231,"['Domino, beletrie', '', 'české']"
n69719203,"Kde jsi, lásko?",83,4,2013,300,Domino,beletrie,české</p>,,"Některých špatných rozhodnutí můžeme už jen litovat. Anebo ne?

 Lucy přetéká štěstím. Je mladá, krásná a šťastně zasnoubená. Jejím chotěm se stane Daniel, bohatý a rozvážný...",109,109,"['Domino, beletrie', '', 'české']"
n69719201,Kdo miluje nejvíc,89,4,2013,296,Domino,beletrie,české</p>,,"Jsou ženy, které zvládnou cokoliv. Až na pár věcí. Těch nejdůležitějších.
Clare Eliasová od začátku těhotenství ani na vteřinu nepochybovala, že bude dobrou matkou. Vždycky...",89,109,"['Domino, beletrie', '', 'české']"
