db_id,name,rating,reviews_cnt,year,pages_cnt,publisher,genre,author,lang,description,price_from,price_to,unparsed
n439431891,Peale Norman Vincent - Pozitivní principy dneška,0,0,2016,248,Omega,naučná,české</p>,,"Pozitivní princip je založen na základním faktu, že vždycky existuje odpověď, správná odpověď, a že pozitivní myšlení při každém procesu může tuto správnou odpověď...",33,56,"['Omega, naučná', '', 'české']"
n302239090,Cesta k charakteru,100,1,2016,248,Omega,naučná,české</p>,,"„Když jsem knihu psal, nebyl jsem si jistý, zdá dokážu jít po cestě k charakteru, ale chtěl jsem alespoň zjistit, jak vypadá a jak ji přede mnou vyšlapali jiní.“ – David...",24,45,"['Omega, naučná', '', 'české']"
n395100228,Duchovní síla empatie,0,0,2016,280,Omega,naučná,české</p>,,"Pro některé lidi je empatie dar a inspirace, v jiných lidech vytváří pocity zmatku a paniky. Duševní síla empatie vám ukáže, jak tuto často podceňovanou lidskou schopnost v...",43,79,"['Omega, naučná', '', 'české']"
n707609676,Zapomenutí sérioví vrazi,100,1,2016,280,Omega,naučná,české</p>,,"Kniha přináší deset pravdivých šokujících případů, které pobouřily celou Ameriku. Některé z nich ležely zapomenuté a nevyřešené celá desetiletí. Patří mezi ně: ""Jack Slugger"",...",204,299,"['Omega, naučná', '', 'české']"
n260446161,Čistý Revoluční program na obnovu těla. Přirozená schopnost léčit sebe sama A Alejandro Junger,100,2,2016,272,Omega,naučná,české</p>,,"Čistý jako clean

Naše životy jsou plné stresu a shonu, což má negativní vliv nejen na psychickou pohodu, ale i na celý náš organismus. Tuto smutnou pravdu na vlastním těle...",33,56,"['Omega, naučná', '', 'české']"
n392108313,Trumpova karta - Trump Ivanka,100,1,2016,256,Omega,naučná,české</p>,,"Obchodní kniha pro mladé ženy, jak dosáhnout úspěchu v jakémkoliv oboru, založená na tom, co se Ivanka Trump naučila od Donalda Trumpa, nynějšího kandidáta na prezidenta USA....",35,39,"['Omega, naučná', '', 'české']"
n407391767,Édith Piaf - Najdi pro mě nový způsob smrti - Dosud nevyprávěný příběh,100,1,2016,248,Omega,naučná,české</p>,,"Édith Piaf byla jednou z nejjasnějších francouzských hvězd dvacátého století, stala se mezinárodní senzací a po smrti v roce 1963 legendou. Její životní příběh je tak působivý,...",204,299,"['Omega, naučná', '', 'české']"
n724757069,Trumpova karta - Ivanka Trump,0,0,2016,246,Omega,naučná,české</p>,,"Obchodní kniha pro mladé ženy, jak dosáhnout úspěchu v jakémkoliv oboru, založená na tom, co se Ivanka Trump naučila od Donalda Trumpa, nynějšího kandidáta na prezidenta USA.",35,35,"['Omega, naučná', '', 'české']"
