db_id,name,rating,reviews_cnt,year,pages_cnt,publisher,genre,author,lang,description,price_from,price_to,unparsed
n684178959,Dopis ze záhrobí - Dominik Dán,100,4,2018,320,Slovart,beletrie,Dominik Dán</p>,,"V roce 1990 začíná nová éra v dějinách našeho státu, staré socialistické struktury se hroutí, nastupuje demokracie se všemi kladnými i zápornými dopady na obyčejné lidi,...",214,329,"['Slovart, beletrie', '', 'české, Dominik Dán']"
n664878423,365 přikázání grafického designu - Sbírka ctností i hříchů pro grafické designéry,0,0,2018,384,Slovart,beletrie,české</p>,,"Zeptejte se jakéhokoli grafického designéra na světě, podle čeho vybírá font a barvu a jak postupuje při tvorbě nového layoutu, a nikdy neuslyšíte stejnou odpověď. Každý tvůrce...",324,499,"['Slovart, beletrie', '', 'české']"
n569073417,Rozum a cit - Jane Austenová,0,0,2018,388,Slovart,beletrie,Austenová Jane</p>,,"Anglie na počátku 19. století vypadá jako krásný rozlehlý park s rodinnými sídly, v nichž žijí šťastní a laskaví lidé. Ale všechno není tak idylické, jak se zprvu jeví. Paní...",194,299,"['Slovart, beletrie', '', 'české, Austenová Jane']"
n655414908,Žiješ jenom dvakrát - Dominik Dán,100,1,2018,352,Slovart,beletrie,Dominik Dán</p>,,"Matematický génius profesor Puskailer se po dlouhých letech věznění konečně dočkal spravedlnosti a byl propuštěn na svobodu. Nikdo mu nevěřil, že není vrah, a popravdě řečeno,...",214,329,"['Slovart, beletrie', '', 'české, Dominik Dán']"
n635116208,Pro klid v duši 365 - Citáty na každý den - Helen Exleyová,0,0,2018,368,Slovart,beletrie,Helen Exley</p>,,"Půvabná sbírka citátů s působivými ilustracemi na každý den roku. Všechny ilustrace byly vybrány tak, aby ladily s citáty největších světových myslitelů.

Zamilujete si pocit...",162,249,"['Slovart, beletrie', '', 'české, Helen Exley']"
n673316597,Na cestě k úspěchu: Motivační citáty na každý den,0,0,2018,368,Slovart,beletrie,Helen Exley</p>,,"Průměrný člověk stráví třicet pět procent času v práci. Tato kniha vznikla, aby pomohla z každé této hodiny udělat něco zvláštního. Díky těmto citátům objevíte radost v...",162,249,"['Slovart, beletrie', '', 'české, Helen Exley']"
n673457503,Svět volných koní - Tomáš Míček,0,0,2018,424,Slovart,beletrie,Tomáš Míček</p>,,"Ve čtvrté knize zamýšlené pentalogie se fotograf Tomáš Míček zaměřuje na kouzlo nespoutaných svobodných koní, kteří jsou ponecháni ve svém přirozeném prostředí. Míček se tématu...",967,1,"['Slovart, beletrie', '', 'české, Tomáš Míček']"
