db_id,name,rating,reviews_cnt,year,pages_cnt,publisher,genre,author,lang,description,price_from,price_to,unparsed
n94659419,"Abeceda povolání. Kdo co umí, dovede František Zacharník CPress",96,3,2013,48,Computer Press,dětské,české</p>,,"Abeceda povolání Kdo co umí, dovede?

Třicet sedm básniček, které představují dětem jednotlivá povolání. Každá jednotlivá básnička přibližuje dětem jednotlivou profesi a...",151,175,"['Computer Press, dětské', '', 'české']"
n79657159,"Digitální fotografie pro děti. Jak fotografovat, ukládat a zábavně upravovat vaše fotky Jenni Bidner",85,1,2013,96,Computer Press,dětské,české</p>,,"Chcete se naučit hezky fotografovat? Toužíte fotit jako táta, máma či nějaký opravdu skvělý fotograf? Tento průvodce světem digitální fotografie je určen pro ty z vás, kteří se...",69,249,"['Computer Press, dětské', '', 'české']"
n127972012,Báječné modely dopravních prostředků,91,3,2013,168,Computer Press,dětské,české</p>,,"Chcete díky jednoduchým návodům krok za krokem, které jsou doplněny podrobnými a přehlednými soupiskami potřebných dílů, stvořit z Lega dokonalé modely taxíku, Ferrari,...",174,249,"['Computer Press, dětské', '', 'české']"
n124057765,O lopenickém Dráčkovi,0,0,2013,64,Computer Press,dětské,české</p>,,"O lopenickém Dráčkovi kniha od autora Alena Bartošíková. V hlubokých listnatých lesích Bílých Karpat, pohoří na pomezí Moravy a Slovenska, přišel na svět náš Dráček. A řeknu...",52,169,"['Computer Press, dětské', '', 'české']"
n91227271,Jednoduché ozdoby pro tvořivé děti,0,0,2013,100,Computer Press,dětské,české</p>,,"Jednoduché ozdoby pro tvořivé děti

Kniha plná inspirace přináší 71 tvořivých nápadů pro všechny, kteří chtějí vyrobit originální ozdoby do svého okolí. Postup výroby každé...",92,179,"['Computer Press, dětské', '', 'české']"
n128587390,České divadelní pohádky,87,0,2013,72,Computer Press,dětské,české</p>,,Vydejte se spolu s námi do úžasného světa divadla! Tato kniha vám představí devět klasických českých her převyprávěných do podoby pohádek. Čekají vás tak rozmanité příběhy jako...,60,79,"['Computer Press, dětské', '', 'české']"
n166526708,Výtvarné nápady na celý rok - Petra Vondrová,80,1,2013,104,Computer Press,dětské,české</p>,,"Opravdový příval inspirace, který ocení děti, rodiče i učitelé výtvarné výchovy. Zbrusu nový titul Výtvarné nápady na celý rok je rozdělen do čtyř kapitol podle jednotlivých...",241,299,"['Computer Press, dětské', '', 'české']"
n132942808,Frankův kouzelný fotbal 2 - Frankie a Římané - Frank Lampard,88,3,2013,112,Computer Press,dětské,české</p>,,"Frankův kouzelný fotbal 2 Frankie a Římané kniha od autora Frank Lampard. Frankie a jeho tým milují fotbal. Na něj si vždy najdou čas. A když mají nyní kouzelný fotbalový míč,...",149,149,"['Computer Press, dětské', '', 'české']"
n32879579,Svět 3D,86,2,2013,80,Computer Press,dětské,české</p>,,"Předložená publikace se snaží vysvětlit čtenáři pojmy, související s naším prostorovým vnímáním světa a zachycením tohoto prostorového vjemu pomocí různých technik. V úvodních...",30,79,"['Computer Press, dětské', '', 'české']"
