db_id,name,rating,reviews_cnt,year,pages_cnt,publisher,genre,author,lang,description,price_from,price_to,unparsed
n106875999,Milton H. Ericson,90,1,2008,160,Triton,naučná,české</p>,,"Kniha Milton H. Erickson poskytuje jedinečný vhled do života a životních zkušeností této legendární osobnosti a podává přehledný výčet osobitých přínosů, kterými Erickson...",222,251,"['Triton, naučná', '', 'české']"
n51131750,Bachova květová terapie pro zvířata Helen Grahamová,84,2,2008,152,Triton,naučná,české</p>,,"Tato kniha na našem trhu dosud chyběla. Padesát veterinářů léta sbíralo své zkušenosti a teď se s námi o ně dělí... Pro každého, kdo naslouchá svému zvířeti, bude vítaným...",199,232,"['Triton, naučná', '', 'české']"
n24797490,Pečovatelství I. - Radana Nováková,80,1,2008,120,Triton,naučná,české</p>,,Učební text poskytuje podstatné informace o pečovatelských úkonech zajišťujících základní životní potřeby. Kniha svým stupněm náročnosti poslouží jak žákům oboru sociální péče-...,114,179,"['Triton, naučná', '', 'české']"
n2956497,Slyšení nezletilého dítěte před opatrovnickým soudem (Eduard Bakalář a kol.),0,0,2008,39,Triton,naučná,české</p>,,"Publikace přináší nové a současně zklidňující poznatky na rozbouřeném moři opatrovnických emocí přináší. Je dílem dvou domácích odborníků a jednoho zahraničního, vskutku...",62,99,"['Triton, naučná', '', 'české']"
n31282258,Benigní hyperplazie prostaty rady pacientům Ladislav Jarolím,0,0,2008,64,Triton,naučná,české</p>,,Benigní hyperplazie prostaty kniha od autora Jarolím Ladislav. S benigní hyperplazií prostaty se vzhledem k její vysoké incidenci setkávají všichni praktičtí lékaři i...,92,119,"['Triton, naučná', '', 'české']"
n34239129,Arteriální hypertenze. Současné klinické trendy. VI. sympozium,0,0,2008,123,Triton,naučná,české</p>,,"Tento sborník vyšel u příležitosti VI. ročníku sympozia Arteriální hypertenze - současné klinické trendy. Akce byla pořádána Centrem pro výzkum, diagnostiku a léčbu hypertenze...",231,249,"['Triton, naučná', '', 'české']"
n3045935,Magie kamenů - Petra Neomillnerová,10,1,2008,152,Triton,naučná,české</p>,,"Potřebujete pomoc? Možná stačí jen dotknout se kamene. Kameny jsou nejen krásné, jsou i mocné a lidstvo provázejí od počátku existence. Potřebujete pomoc? Možná stačí jen...",179,179,"['Triton, naučná', '', 'české']"
