db_id,name,rating,reviews_cnt,year,pages_cnt,publisher,genre,author,lang,description,price_from,price_to,unparsed
n1074282,Rok tisíc - Duby Georges,0,0,2007,152,Argo,naučná,české</p>,,G. Duby v této knize mapuje kolektivní představy a mentalitu v době kolem roku 1000 s důrazem na milenaristické představy o konci světa a na soudobé pojetí zázračna a tajemna....,125,161,"['Argo, naučná', '', 'české']"
n2958637,Déšť a jaguár -- Pohádky brazilských indiánů Donato Hernani,0,0,2007,120,Argo,naučná,české</p>,,"Svěží, zábavné i poučné příběhy brazilských indiánů sepsal Hernani Donato na základě záznamů cestovatelů, etnografů a antropologů, kteří je pořizovali mezi indiánskými kmeny v...",182,233,"['Argo, naučná', '', 'české']"
n569585,Až na konec vesmíru Jak Henrietta Leavittová a Edwin Hubble bilionkrát zvětšili vesmír Johnson George,90,1,2007,168,Argo,naučná,české</p>,,"Úplně běžně dnes uvádíme, kolik světelných let je od nás vzdálena která hvězda či mlhovina. Jak jsem ale na tato čísla přišli? Kniha nás provede od prvních pokusu o určení...",158,217,"['Argo, naučná', '', 'české']"
n2958629,Deset myšlenek o čase (Bodil Jönssonová),0,0,2007,118,Argo,naučná,české</p>,,"Nemáte nikdy čas? Nic nestíháte? Marně se snažíte šetřit časem? Švédská fyzička a spisovatelka Bodil Jönssonová, profesorka na technické univerzitě v Lundu, se zamýšlí nad...",134,161,"['Argo, naučná', '', 'české']"
n21815309,Jindřich Štyrský (průvodce výstavou) - Jindřich Štyrský,0,0,2007,56,Argo,naučná,české</p>,,"Jindřich Štyrský (průvodce výstavou) kniha od autora . Průvodce retrospektivní výstavou, která se koná v Galerii hl. města Prahy. Kniha obsahuje 46 barevných...",141,171,"['Argo, naučná', '', 'české']"
