db_id,name,rating,reviews_cnt,year,pages_cnt,publisher,genre,author,lang,description,price_from,price_to,unparsed
n175059355,Světlo na konci tunelu - Úvahy o životě a umírání,100,1,2012,264,Jota,naučná,české</p>,,"Zasvěcený pohled na zásadní otázky lidského života a umírání od jedné z nejvýznamnějších psychiatriček na světě.

 Kniha Světlo na konci tunelu vychází z přednášek Elisabeth...",191,298,"['Jota, naučná', '', 'české']"
n62331248,"Člověk jako občan a světoobčan, 2. vydání Přemysl Šil, Jana Karolová",0,0,2012,260,Jota,naučná,české</p>,,"Politologie, právo a mezinárodní vztahy pro střední školy.
Publikace navazuje na učebnice ""Člověk jako osobnost (psychologie), Člověk
ve společnosti a v ekonomickém životě...",139,200,"['Jota, naučná', '', 'české']"
