db_id,name,rating,reviews_cnt,year,pages_cnt,publisher,genre,author,lang,description,price_from,price_to,unparsed
n259849370,Molekulární kuchyně - Miroslav Raab,88,3,2014,152,Dauphin,beletrie,české</p>,,"Záhady, tajemno a dobrodružství odehrávající v hrncích, pekáčích, pánvích, sklínkách i sklenicích.
	Martyrium civilních molekul při jejich transmutaci v lahůdku.
	Není to běžná...",174,223,"['Dauphin, beletrie', '', 'české']"
n191251653,S pavoukem na skle - Lukáš Prchal,0,0,2014,168,Dauphin,beletrie,české</p>,,"Ve dvaceti letech nás napadají různě pitomé nápady. Martina ale napadl jeden obzvlášť nebezpečný. Podívat se zpátky do minulosti na dysfunkční rodinu, v níž vyrůstal, a bez...",174,236,"['Dauphin, beletrie', '', 'české']"
n219460819,Větrník - Čapek-Chod Karel Matěj,0,0,2014,136,Dauphin,beletrie,české</p>,,"Větrník kniha od autora Karel Matěj Čapek-Chod. Novela srovnatelná s Vančurovým Rozmarným létem, jeden z prvních postmoderních textů (ještě před tím, než byla postmoderna...",125,169,"['Dauphin, beletrie', '', 'české']"
n152609473,Ostrovy pastýřů. cesta kněze - Petr Rybář - Dauphin,0,0,2014,76,Dauphin,beletrie,české</p>,,"Životní cesta kněze. Civilní zpověď o váze kněžství. 

Zápisky a krásách, úskalích a hlubinách i nekonečných prostorách kterými prochází muž, který se rozhodl pro povolání...",139,198,"['Dauphin, beletrie', '', 'české']"
n200395529,"Marlenina sestra, Teorie hrozby - Botho Strauss",0,0,2014,168,Dauphin,beletrie,české</p>,,"Marlenina sestra, Teorie hrozby kniha od autora Botho Strauss. Ontologický horror a transexuální rozpoznávání v prostoru palimpsestu a prázdého listu. Dvě mistrovská díla...",141,223,"['Dauphin, beletrie', '', 'české']"
n162271903,Kam odlétají básníci - Alois Marhoul,0,0,2014,80,Dauphin,beletrie,české</p>,,"Kam odlétají básníci kniha od autora Alois Marhoul. V první polovině své desáté knížky přichází autor s kratičkými prozaickými útvary, jejich poetičnost a jemný humor si...",174,236,"['Dauphin, beletrie', '', 'české']"
