db_id,name,rating,reviews_cnt,year,pages_cnt,publisher,genre,author,lang,description,price_from,price_to,unparsed
n628929613,Dovolená s moderním fotrem - Landsman Dominik,92,11,2018,168,Ikar,beletrie,české</p>,,"Dominik Landsman se stal velmi populární dík svým Deníčkům moderního fotra, v nichž s nadsázkou a humorem popisuje slasti a strasti muže na mateřské dovolené. Deníčky vyšly...",197,249,"['Ikar, beletrie', '', 'české']"
n585590495,Nepřítel - Erich Maria Remarque,100,1,2018,80,Ikar,beletrie,české</p>,,"Stigma války, stopy dávných utrpení, dlouhá léta po 1. světové válce stále živých, se zjevují lidem válkou vykořeněným mnohdy tiše, jindy zase velmi dramaticky. Tak lze shrnout...",158,199,"['Ikar, beletrie', '', 'české']"
n663880244,Momentky - Nesvadbová Barbara,85,8,2018,160,Ikar,beletrie,české</p>,,"Povídky známé české spisovatelky a novinářky. Momentky zachycují chvíle, kdy se náš život láme; jsou to okamžiky hlubokého štěstí i bolestných ztrát nebo fatálních rozhodnutí....",237,284,"['Ikar, beletrie', '', 'české']"
n644164332,Deník pražského studenta - Kos Pavel,76,1,2018,112,Ikar,beletrie,české</p>,,"„O důležitosti knih mi toho nikdy žádný učitel neřekl tolik, jako student, který se mi je snažil prodat.“ 

Autor úspěšné facebookové stránky Deník pražského studenta vydává...",182,229,"['Ikar, beletrie', '', 'české']"
