db_id,name,rating,reviews_cnt,year,pages_cnt,publisher,genre,author,lang,description,price_from,price_to,unparsed
n131568708,Nula nula nula,85,1,2013,388,Paseka,naučná,české</p>,,"Nula nula nula kniha od autora Roberto Saviano. Napjatě očekávaná nejnovější kniha autora slavné Gomory je pokusem o zmapování mezinárodního obchodu s kokainem, který v...",248,349,"['Paseka, naučná', '', 'české']"
n131400168,Paradoxy české šlechty,87,1,2013,376,Paseka,naučná,české</p>,,"Paradoxy české šlechty kniha od autora Vladimír Votýpka. Nové vydání třetího dílu Votýpkovy ""aristokratické série"" představuje pozoruhodné osudy zástupců české šlechty a...",245,329,"['Paseka, naučná', '', 'české']"
n433103993,"Češi, Němci, Židé? /2.vydání/: Národní identita Židu v Cechách 1918–1938 - Čapková Kateřina",90,1,2013,360,Paseka,naučná,české</p>,,"Jsou Židé národem, osudovým společenstvím či ""pouhým"" vyznáním? Různé odpovědi na tuto otázku rozdělovaly a rozdělují Židy na řadu znesvářených skupin. Autorka podává dlouho...",207,299,"['Paseka, naučná', '', 'české']"
n137314522,Dcera národa?. Tři životy Zdeňky Havlíčkové Milena Lenderová,0,0,2013,326,Paseka,naučná,české</p>,,"Je povinností jedince obětovat své štěstí zájmu národa? Zdeňka Havlíčková (1848-1872) v tomto ohledu zklamala, v jejím osudu se střetávají národní zájmy a právo jedince na...",209,298,"['Paseka, naučná', '', 'české']"
n136010561,Komplikace - Isaac Adamson,0,0,2013,328,Paseka,naučná,české</p>,,"Rolf Hosfeld nabízí nový, nezkreslený a kritický pohled na myslitele, který významně ovlivnil světové dějiny. Nezaměřuje se jen na bouřlivý a dramatický život trevírského...",210,270,"['Paseka, naučná', '', 'české']"
