db_id,name,rating,reviews_cnt,year,pages_cnt,publisher,genre,author,lang,description,price_from,price_to,unparsed
n584517850,Space Ennui - Green Scum,100,1,2017,240,Volvox Globator,beletrie,české</p>,,"Slibují nám, že už brzy se poletí na Mars. A že to bude báječné.
Slibují to soukromníci i národní vesmírné agentury. Světlé zítřky.
Jasně. To Ziky už na Mars doletěl. Jako...",170,284,"['Volvox Globator, beletrie', '', 'české']"
n547563145,Doktor Pilka si kope hrob - Petr Motýl,0,0,2017,240,Volvox Globator,beletrie,české</p>,,"Próza Doktor Pilka si kope hrob je text v nejlepší tradici české grotesky a absurdního humoru, hravá a vtipná, v žádném případě prvoplánová, ale s přesahem, kdy ze zdánlivě...",168,269,"['Volvox Globator, beletrie', '', 'české']"
n479476329,"Ten, kdo šeptá",0,0,2017,272,Volvox Globator,beletrie,české</p>,,"Je po válce a v Beltringeově restauraci se má znovu setkat Klub vražd – spolek amatérských detektivů, kteří společně diskutují nad známými případy nevysvětlených zločinů. A na...",197,269,"['Volvox Globator, beletrie', '', 'české']"
