db_id,name,rating,reviews_cnt,year,pages_cnt,publisher,genre,author,lang,description,price_from,price_to,unparsed
n602771021,Rok v lese - Dziubaková Emilia,95,118,2017,28,Host,dětské,Dziubaková Emilia</p>,,"Víte, které lesní zvířátko celou zimu prospí? Které je čistotné? Stačí otevřít tuto knihu, prohlížet si veselé obrázky jednoho místa v lese a dozvíte se více, než byste čekali.",168,289,"['Host, dětské', '', 'české, Dziubaková Emilia']"
n495274983,"Mizielińska Aleksandra: Pod zemí, pod vodouha",96,41,2017,110,Host,dětské,Mizielińští Aleksandra a Danie</p>,,"Další fascinující kniha autorů bestsellerových Map. Po obrázkovém putování kolem světa přichází čas na pozoruhodnou výpravu do nitra země a hlubin oceánů.
Velkoformátová kniha...",290,499,"['Host, dětské', '', 'české, Mizielińští Aleksandra a Danie']"
n549216327,"Obejmi mě, prosím - Wechterowicz Przemyslaw",92,16,2017,36,Host,dětské,Przemyslaw Wechterowicz</p>,,"Úplně ze všeho nejlepší je někoho obejmout. A svět se hned stane krásnějším. Jednoho rána prozradí táta Medvěd svému synkovi tajemství: nejbáječnější způsob, jak prožít krásný...",157,259,"['Host, dětské', '', 'české, Przemyslaw Wechterowicz']"
n673188664,Každý má svou lajnu – Dvořáková Petra,100,2,2017,144,Host,dětské,Petra Dvořáková</p>,,"Poutavě a čtivě napsaná knížka pro náctileté kluky a holky o florbalu, prvních láskách, přátelství, partě a ceně vítězství. Čtení, které je ze života bude vaše teenagery bavit.",200,269,"['Host, dětské', '', 'české, Petra Dvořáková']"
n547497435,Kdo zabil Snížka? - Petra Soukupová,94,7,2017,140,Host,dětské,Petra Soukupová</p>,,"Kdo zabil Snížka? Když si Martina přála psa, netušila, že se Snížkem budou samé potíže. Z malého bílého štěněte vyrostl pes, kterého skoro nikdo ve vesnici nemá rád. Dokonce i...",207,299,"['Host, dětské', '', 'české, Petra Soukupová']"
n495274985,Bula Oksana: Zubr si hledá hnízdoha,95,7,2017,40,Host,dětské,Oksana Bula</p>,,"Co dělají zvířátka v zimě? Medvěd, veverka nebo zubr?

Některá zvířátka v zimě spí. Jednoduše celou tu nelehkou dobu, kdy všechno pokryje sníh, zaspí. Ó, to by byla krása,...",174,269,"['Host, dětské', '', 'české, Oksana Bula']"
n495274984,Bednareková Justyna: Neobyčejná dobrodružství deseti ponožek (čtyř pravých a šesti levých)ha,100,1,2017,168,Host,dětské,Justyna Bednareková</p>,,"Ach, ty ponožky! Do pračky hodíme dvě a ven vytáhneme jenom jednu. Kam se pořád ztrácejí? 

Je nad slunce jasné, že někam mizet musejí. I doma u malé Bé to tak chodí. A víte...",174,256,"['Host, dětské', '', 'české, Justyna Bednareková']"
n522715354,Co se skrývá v našem těle Aina Bestardová,60,1,2017,24,Host,dětské,Aina Bestardová</p>,,"Zajímá tě, jak vypadá lidské tělo uvnitř? Podívej se přes jednu ze tří barevných lup a uvidíš, co jinak zůstává očím skryto. Každá lupa odhalí jiné tajemství. To je kouzlo!...",190,299,"['Host, dětské', '', 'české, Aina Bestardová']"
n457059376,Zmáťa a Záhada - Všechno dobře dopadne,0,0,2017,48,Host,dětské,Ninka Reittu</p>,,"Zmáťa, žlutočerné pruhované kotě z početné rodiny Čičákových, je snílek, věčně ztracený ve své fantazii. A jednou, cestou na prázdniny k babičce, se ztratí doopravdy! Ocitne se...",161,249,"['Host, dětské', '', 'české, Ninka Reittu']"
