db_id,name,rating,reviews_cnt,year,pages_cnt,publisher,genre,author,lang,description,price_from,price_to,unparsed
n190382772,Návrat k lásce. Zamyšlení nad principy Kurzu zázraků - Marianne Williamson - Synergie,84,2,2014,248,Synergie,naučná,české</p>,,"Nové, rozšířené vydání duchovního bestselleru, v němž Marianne Williamson sdílí své pochopení Kurzu zázraků, a své bohaté zkušenosti s aplikováním lásky na cestě k nalezení...",164,249,"['Synergie, naučná', '', 'české']"
n172858236,Jak se z toho nezbláznit,97,1,2014,246,Synergie,naučná,české</p>,,"Víte, že pro to, abychom se vice těšili ze života, musíme ubrat a ne přidat? Blaire Pascal už dávno napsal, že celá nespokojenost člověka tkví v tom, že nedokáže zůstat v klidu...",39,299,"['Synergie, naučná', '', 'české']"
n165312683,Cíle Brian Tracy,90,0,2014,296,Synergie,naučná,české</p>,,"Objevte sedm klíčových prvků, které jsou nutné pro stanovení cílů a zároveň dvanáct kroků, které potřebujete k tomu, abyste dosáhli jakéhokoli cíle, který si vytyčíte. Jen...",197,299,"['Synergie, naučná', '', 'české']"
n196266387,Odhalení. Sedm posvátných závojů duše - Megan Watterson - Synergie,100,1,2014,248,Synergie,naučná,české</p>,,"Tato kniha je pozvánkou k odhalení sebe samé. Je výzvou k návratu do podstaty našeho bytí, umně protkanou příběhy, při nichž se vám duše bude chvět radostí z opětovného...",54,269,"['Synergie, naučná', '', 'české']"
n232735040,Buddha vchází do baru,78,1,2014,248,Synergie,naučná,české</p>,,"Kdo z nás je úplně spokojený s životem, který žijeme? Všichni známe pocit, kdy toužíme po něčem, co nemáme. Najít spokojenost a rovnováhu uprostřed civilizačního chaosu, práce...",89,299,"['Synergie, naučná', '', 'české']"
n209419522,Když se ženy z Marsu zamilují. Jak skloubit karieru a milostný vztah - Paulette Sherman Kouffman - Synergie,0,0,2014,296,Synergie,naučná,české</p>,,"Žena z Marsu“ je žena, která je úspěšná ve své profesi, je otevřená a velice schopná, hodně vydělává a je inteligentní vůdkyní. Identifikuje se s některými „mužskými“...",41,130,"['Synergie, naučná', '', 'české']"
