db_id,name,rating,reviews_cnt,year,pages_cnt,publisher,genre,author,lang,description,price_from,price_to,unparsed
n25137736,"Ústava ČR vznik, vývoj a perspektivy",0,0,2011,384,Leges,naučná,české</p>,,"V únoru 2010 uspořádal Úřad vlády ČR ve spolupráci s Právnickou fakultou Univerzity Karlovy odborný seminář Ústava ČR – vznik, vývoj a perspektivy. Tímto seminářem měla být...",321,466,"['Leges, naučná', '', 'české']"
n38616777,Zákon o rodině,0,0,2011,456,Leges,naučná,české</p>,,"Publikace Zákon o rodině představuje zevrubný, praxí prověřený komentář k jednotlivým ustanovením zákona o rodině, doplněný použitelnou judikaturou a výběrem z dostupné...",505,690,"['Leges, naučná', '', 'české']"
n34135284,Geometrický plán,100,1,2011,432,Leges,naučná,české</p>,,"Geometrické plány jsou technickou přílohou pro vyhotovení rozhodnutí katastrálních úřadů ke změnám hranic katastrálních území, rozdělení pozemků a jejich změn, vyznačení budovy...",414,646,"['Leges, naučná', '', 'české']"
n30672664,Dědické právo v teorii a praxi,0,0,2011,432,Leges,naučná,české</p>,,"Publikace komplexně zpracovává problematiku dědictví podle hmotného i procesního práva. Část hmotněprávní se zabývá předpoklady dědění, možností odmítnout dědictví, přechodem...",490,490,"['Leges, naučná', '', 'české']"
n32286715,Obhájce v trestním řízení,50,1,2011,416,Leges,naučná,české</p>,,"Monografie, jejímiž spoluautory jsou známý profesor trestního práva a vedoucí katedry trestního práva na Právnické fakultě Univerzity Karlovy a advokátka specializující se na...",441,600,"['Leges, naučná', '', 'české']"
n39676504,Uplatňování nároků z věcných práv a rozhodování o nich,0,0,2011,336,Leges,naučná,české</p>,,"Publikace předkládá shrnutí hmotněprávních a procesních aspektů ve vybraných oblastech věcných práv. Opírá se o aktuální judikaturu Nejvyššího soudu České republiky, zejména...",405,450,"['Leges, naučná', '', 'české']"
n23694778,Alternativní tresty a opatření v nové právní úpravě,0,0,2011,416,Leges,naučná,české</p>,,Předmětem monografie jsou alternativní tresty a další opatření nahrazující nepodmíněný trest odnětí svobody. Autor podrobně analyzuje systém alternativních opatření...,405,405,"['Leges, naučná', '', 'české']"
