db_id,name,rating,reviews_cnt,year,pages_cnt,publisher,genre,author,lang,description,price_from,price_to,unparsed
n110340700,"Polibte tu žábu! - Brian Tracy, Christine Tracy Stein",86,1,2013,160,ANAG,naučná,české</p>,,"Jeden z celosvětově nejúspěšnějších autorů a lektorů v oblasti time- a life-managementu Brian Tracy a jeho dcera Christina, zkušená psychoterapeutka, představují ve své knize...",229,299,"['ANAG, naučná', '', 'české']"
n87718888,Působivé fleurogami,93,1,2013,32,ANAGRAM,naučná,české</p>,,"Popis : 
 Nádherným květům fleurogami poskládaným z vodě odolných papírů neublíží ani sebemenší kapka vody. Výborně se tak hodí na balkon, zahradu i na terasu. Vytvoříte s nimi...",48,89,"['ANAGRAM, naučná', '', 'české']"
n101937410,Rakovinné buňky nemají rády slunce Grant B. William,0,0,2013,115,ANAG,naučná,české</p>,,"Bez slunce by nebylo života na Zemi. Ještě před několika lety se léky využívaly pro svou léčivou moc. Ale pro nás moderní lidi jsou mutací přeměněným ošklivým démonem, který...",72,289,"['ANAG, naučná', '', 'české']"
n110476436,The White Book z lásky a o lásce ivomir,0,0,2013,168,ANAG,naučná,české</p>,,"Už jsme se naučili, co musíme udělat, ale bojíme se, co si o našich činech a o nás budou myslet ostatní, co tomu řeknou.
Láska je lékem a kořením života
Sami jsme si vytvořili...",97,299,"['ANAG, naučná', '', 'české']"
n103982317,Géniové na prahu nové medicíny Filozofie konvenční léčby pod palbou argumentů - Karel Machala,0,0,2013,160,ANAG,naučná,české</p>,,"Kniha Géniové na prahu nové medicíny představuje filozofii konvenční léčby pod palbou argumentů sedmi vědců a lékařů, nabízejících jednoduchá, levná a praktická alternativní...",175,249,"['ANAG, naučná', '', 'české']"
n118075983,Důchodový systém v České republice,0,0,2013,120,ANAG,naučná,české</p>,,Publikace Důchodový systém v ČR 2013 přehledně a srozumitelně provádí čtenáře důchodovým systémem v České republice. U každého ze tří pilířů tohoto systému (důchodové...,269,269,"['ANAG, naučná', '', 'české']"
n79969530,"Zákoník práce 2013 - Z. Schmied,L. Trylč",0,0,2013,168,ANAG,naučná,české</p>,,Praktické sešitové vydání zákoníku práce ve znění účinném k 1. 1. 2013 nabízí čtenářům vedle aktuálního znění jednotlivých ustanovení tohoto základního pracovněprávního předpisu...,116,116,"['ANAG, naučná', '', 'české']"
