db_id,name,rating,reviews_cnt,year,pages_cnt,publisher,genre,author,lang,description,price_from,price_to,unparsed
n582961696,Vůně Francie - Amanda Hampson,0,0,2018,224,Baronet,beletrie,české</p>,,"Angličanka Iris má už dost šedého a nudného Londýna, a tak když její přítelkyně objeví inzerát s nabídkou práce stenografky v jižní Francii, neváhá a vydává se na cestu....",181,279,"['Baronet, beletrie', '', 'české']"
n644496360,Baronet a. s. Dotkni se hvězd,0,0,2018,176,Baronet,beletrie,české</p>,,"Justina Mansellová, nejmladší dcera lorda a lady Mansellových, se vydává na plavbu do daleké a tajemné Indie, aby navštívila svého bratra. Její bohatá teta domluví, že jí po...",146,229,"['Baronet, beletrie', '', 'české']"
n642125899,T-Force 4 - Poslední mise - Kessler Leo,0,0,2018,224,Baronet,beletrie,české</p>,,"„Válka peklo je, však mír tě zabije!“

Generál Patton dobře chápe, o čem se v té staré vojácké písni zpívá. Jatka druhé světové války skončila, slavnostně byl vyhlášen mír,...",181,279,"['Baronet, beletrie', '', 'české']"
n653142002,Pekelní andělé,0,0,2018,216,Baronet,beletrie,české</p>,,"V roce 1929 se Británie, Francie a Spojené státy chystají demilitarizovat západní břeh Rýna. A to je důvod, aby se Smith po dlouhých šesti letech vrátil do Německa. Tamní...",201,243,"['Baronet, beletrie', '', 'české']"
