db_id,name,rating,reviews_cnt,year,pages_cnt,publisher,genre,author,lang,description,price_from,price_to,unparsed
n164403209,Volební právo cizinců v komunálních volbách České republiky a jeho využití,0,0,2014,154,Karolinum,naučná,české</p>,,Publikace přináší nový pohled na problematiku volebního práva cizinců ve volbách do zastupitelstev obcí v České republice. Shrnuje výsledky výzkumu zaměřeného na participaci...,131,170,"['Karolinum, naučná', '', 'české']"
n233277434,Návody k speciálním praktickým cvičením z farmaceutické... - Milan Řehula,0,0,2014,50,Karolinum,naučná,české</p>,,"Druhé vydání speciálního praktika z farmaceutické technologie, které je zaměřeno na praktické ověřování teoretických poznatků. Pozornost je soustředěna na studium zrněných...",64,70,"['Karolinum, naučná', '', 'české']"
n237043527,Školní vzdělání v Estonsku – Ježková Věra,0,0,2014,146,Karolinum,naučná,české</p>,,"Analyticko-srovnávací studie Školní vzdělávání v Estonsku je pátou publikací řady Školní vzdělávání v zahraničí. Titulu předcházely publikace Školní vzdělávání v Německu,...",131,180,"['Karolinum, naučná', '', 'české']"
n233438980,O hranicích dějinných období. Na příkladu středověku a renesance - Jacques Le Goff - Karolinum,0,0,2014,90,Karolinum,naučná,české</p>,,"O hranicích dějinných období kniha od autora Jacques Le Goff. V posledním textu, který ještě stihl sám připravit k vydání, se světoznámý medievalista Jacques Le Goff...",128,170,"['Karolinum, naučná', '', 'české']"
n196369452,Romové a stereotypy - Renata Weinerová,0,0,2014,92,Karolinum,naučná,české</p>,,"Text publikace přináší bližší pohled na složitou interkulturní problematiku, z níž získané stereotypy vycházejí jako kumulativní archivy většinou negativně zpracovaných...",83,110,"['Karolinum, naučná', '', 'české']"
n225516468,"Studijní texty k dějinám farmacie - Dohnal, František",0,0,2014,155,Karolinum,naučná,české</p>,,"Studijní texty k dějinám farmacie jsou výchozím studijním materiálem pro předmět Historie a organizace farmacie. Farmacie je neoddělitelnou součástí zdravotnictví, proto...",143,190,"['Karolinum, naučná', '', 'české']"
n197639420,Důchodová reforma Marek Loužek,0,0,2014,102,Karolinum,naučná,české</p>,,"Mělo by být zajištění ve stáří soukromým, nebo veřejným zájmem? Je výhodnější spíše průběžný, nebo fondový důchodový systém? Mělo by být spoření do penzijních fondů dobrovolné,...",65,120,"['Karolinum, naučná', '', 'české']"
n188775906,Překladatelské miniatury - Milan Hrdlička,70,1,2014,114,Karolinum,naučná,české</p>,,"Víte, jak v uměleckém textu přeložit šifru? Nebo záměrné gramatické a pravopisné chyby? Anebo různojazyčné pasáže? Máte představu o tom, jakým způsobem se mohou v cílovém textu...",107,140,"['Karolinum, naučná', '', 'české']"
n202762292,Komparace názorů a postojů české veřejnosti k životospr... - Petr Jansa,0,0,2014,118,Karolinum,naučná,české</p>,,"Monografie zahrnuje dva dílčí pedagogické výzkumy zaměřené na komparaci názorů a postojů u vybraných skupin české populace, kdy se respondenti vyjadřují k otázkám denního...",115,150,"['Karolinum, naučná', '', 'české']"
n179641841,O komparativní politologii a současné české politice - Michal Kubát,0,0,2014,164,Karolinum,naučná,české</p>,,"V kolektivní monografii ""O komparativní politologii a současné české politice"" se sešli představitelé mladší a střední generace českých politologů. Jednotlivé kapitoly...",116,190,"['Karolinum, naučná', '', 'české']"
n163759592,Průvodce chirurgickými přístupy k cevám,0,0,2014,70,Karolinum,naučná,české</p>,,"Předkládaný Průvodce chirurgickými přístupy k cévám nabízí chirurgům zkušenostmi ověřené optimální přístupy ke všem hlavním cévám lidského těla, a to velmi přehlednou formou,...",219,290,"['Karolinum, naučná', '', 'české']"
n209531448,Tři figury posedlosti - Jean Starobinski,0,0,2014,134,Karolinum,naučná,české</p>,,"Tři figury posedlosti. Tři noční výjevy, trojí šílenství. Jean Starobinski, švýcarský profesor francouzské literatury a dějin medicíny, jeden z nejvýznamnějších literárních...",105,150,"['Karolinum, naučná', '', 'české']"
n227491959,"Základní biochemické dráhy v buňce - Skálová, Lenka; Szotáková, Barbora...",0,0,2014,114,Karolinum,naučná,české</p>,,"Třetí vydání učebního textu pro posluchače Farmaceutické fakulty UK. Text doplňuje přednášku z obecné biochemie. Obsah: metabolismus sacharidů, citrátový cyklus a dýchací...",121,135,"['Karolinum, naučná', '', 'české']"
n162271905,Kant und die biblische Offenbarungsreligion / Kant a biblické zjevené náboženstv,0,0,2014,138,Karolinum,naučná,české</p>,,Kantova metafyzika a filosofie náboženství patří k jedněm z nejvlivnějších v dějinách novověku až po současnost. Kant se snaží nově promyslet vztah rozumu a víry s cílem...,114,170,"['Karolinum, naučná', '', 'české']"
n344242008,Srdeční selhání - Filip Málek,0,0,2014,98,Karolinum,naučná,české</p>,,"Učebnice ""Speciální problémy ve vnitřním lékařství: Srdeční selhání pro studenty lékařských fakult"" je určena nejen pro studenty se zájmem o obor vnitřního lékařství a...",91,104,"['Karolinum, naučná', '', 'české']"
n235883742,Klima a společnost – Stehr Nico,0,0,2014,158,Karolinum,naučná,české</p>,,"Monografie sociologa Nico Stehra a klimatologa Hanse von Storcha se zabývá otázkami přírodního podnebí v politickém, kulturním, ekonomickém a historickém kontextu. Vychází z...",134,190,"['Karolinum, naučná', '', 'české']"
n193693528,Svět očima Samuela P. Huntingtona Mrázek Jaroslav,0,0,2014,128,Karolinum,naučná,české</p>,,"Samuel P. Huntington patřil k nejvlivnějším americkým politologům a intelektuálům druhé poloviny dvacátého století, v prvé řadě díky interdisciplinárnímu badatelskému přístupu,...",114,150,"['Karolinum, naučná', '', 'české']"
n321472142,Atlas ortopedické tuberkulózy - Chocholáč Dalimil,0,0,2014,94,Karolinum,naučná,české</p>,,"V monografii Atlas ortopedické tuberkulózy se její autoři, M. Netval a D. Chocholáč, snaží podat komplexní obraz ortopedické tuberkulózy, a to od dávné historie až po...",69,130,"['Karolinum, naučná', '', 'české']"
n204445955,Perspektivy konce - Olehla Richard,0,0,2014,130,Karolinum,naučná,české</p>,,"Monografie pohlíží na současnou americkou prózu v kontextu společenských a historických změn, které se odehrály po teroristických útocích 11. září 2001 v New Yorku. Autor...",115,150,"['Karolinum, naučná', '', 'české']"
n164256086,Karolinum Geriatrická problematika v pastorální péči Kateřina Brzáková Beksová,0,0,2014,140,Karolinum,naučná,české</p>,,"Geriatrická problematika v pastorální péči se zabývá současnou aktuální tematikou stárnoucí populace z hlediska psychických, zdravotně-sociálních a spirituálně-existenciálních...",106,170,"['Karolinum, naučná', '', 'české']"
n227203893,Od slova k revoluci. Poetický svět raného Majakovského prizmatem lingvistické analýzy - Jana Kitzlerová - Karolinum,0,0,2014,122,Karolinum,naučná,české</p>,,"Kniha je věnována ranému básnickému a částečně i výtvarnému dílu jednoho z nejvýznamnějších ruských básníků 20. století Vladimíra V. Majakovského (1893–1930), které hodnotí...",123,160,"['Karolinum, naučná', '', 'české']"
n173903249,Zažil jsem toho dost - Petr Sgall,0,0,2014,166,Karolinum,naučná,české</p>,,"Zažil jsem toho dost
Petr Sgall
Profesor PhDr. Petr Sgall, DrSc., je široce uznávanou vědeckou osobností v oboru obecné, teoretické i komputační lingvistiky a bohemistiky,...",116,190,"['Karolinum, naučná', '', 'české']"
n188775908,"Genderové aspekty ve slovanské frazeologii (na materiálu běloruštiny, polštiny a češtiny). PHILOLOGICA - MONOGRAPHIA 169. - Kateřina Kedron",0,0,2014,166,Karolinum,naučná,české</p>,,"Monografie se zaměřuje na problematiku genderu v jazyce – zkoumá vliv genderového faktoru na frazeologii tří příbuzných jazyků (běloruštiny, polštiny a češtiny).
	Autorka...",143,190,"['Karolinum, naučná', '', 'české']"
n178640037,Psycholog ve zdravotnictví,55,2,2014,106,Karolinum,naučná,české</p>,,"Učební text Psycholog ve zdravotnictví je určen posluchačům stejnojmenného kurzu, akreditovaného Ministerstvem zdravotnictví ČR. Úspěšné zakončení tohoto kurzu umožňuje...",157,157,"['Karolinum, naučná', '', 'české']"
n682174468,Prolegomena k nové infinitní matematice - Petr Vopěnka,0,0,2014,50,Karolinum,naučná,české</p>,,"Pro matematiku dvacátého století je příznačné, že její hlavní proud nekonečno zkoumající a zároveň aplikující, byť v bizarních ideálních světech, je založen na klasické...",60,67,"['Karolinum, naučná', '', 'české']"
n155002395,Metodologie sociálních věd Ochrana František,0,0,2014,136,Karolinum,naučná,české</p>,,"Kniha se zabývá stěžejními metodologickými problémy sociálních věd. Úvodem vytyčuje základní problém, jímž je otázka tzv. souměřitelnosti a nesouměřitelnosti sociálních věd s...",200,200,"['Karolinum, naučná', '', 'české']"
