db_id,name,rating,reviews_cnt,year,pages_cnt,publisher,genre,author,lang,description,price_from,price_to,unparsed
n508337986,Sova - Bjork Samuel,100,1,2017,400,PLUS,beletrie,Samuel Bjork</p>,,"Druhý detektivní případ od autora bestselleru V lese visí anděl V lese kousek od Osla je v podivném hnízdě ze sovího peří nalezeno tělo sedmnáctileté dívky, jež se před tím...",159,229,"['PLUS, beletrie', '', 'české, Samuel Bjork']"
n556695139,Eleanor se má vážně skvěle - Gail Honeymanová,100,3,2017,352,PLUS,beletrie,Gail Honeymanová</p>,,"Literární senzace pro všechny asociály 

Svérázné Eleanor je jedno, co si o ní kdo myslí. Vystudovala literaturu, ale pracuje jako účetní. Miluje křížovky, po Glasgow chodí s...",238,349,"['PLUS, beletrie', '', 'české, Gail Honeymanová']"
n487528690,Mořský detektiv - Mark Douglas-Home,0,0,2017,344,PLUS,beletrie,Mark Douglas-Home</p>,,"Mořský detektiv kniha od autora Mark Douglas-Home. Cal McGill je oceánograf s obskurní zálibou v mořských proudech a plovoucích tělesech, mrtvoly nevyjímaje. Když natrefí na...",208,299,"['PLUS, beletrie', '', 'české, Mark Douglas-Home']"
n452287341,Kluk z kostek - Keith Stuart,100,2,2017,352,PLUS,beletrie,Keith Stuart</p>,,"Kluk z kostek. Keith Stuart. PLUS

Kniha o autismu, Minecraftu a rodičovství.

Přečtěte si  příběh otce a jeho autistického syna, kteří k sobě našli cestu díky známé počítačové...",224,329,"['PLUS, beletrie', '', 'české, Keith Stuart']"
n673197431,Audur Ava Ólafsdóttir Listopadoví motýli,0,0,2017,360,PLUS,beletrie,Audur Ava Ólafsdóttir</p>,,"Cesta po Islandu nikdy nebyla tak zábavná

Ve druhém románu oceňované islandské autorky poznáváme mladou, nezávislou, čerstvě opuštěnou překladatelku z jedenácti jazyků, která...",208,270,"['PLUS, beletrie', '', 'české, Audur Ava Ólafsdóttir']"
n673197407,Mark Douglas-Home Vešla do moře,0,0,2017,344,PLUS,beletrie,Mark Douglas-Home</p>,,"Detektivka, která vás strhne jako mořský příboj

Je to už dvacet šet let, co Megan Batesová v odlehlé vsi u skotského pobřeží vešla do moře a nadobro zmizela. Její tělo se...",243,349,"['PLUS, beletrie', '', 'české, Mark Douglas-Home']"
n493860289,Kosmonaut z Čech - Jaroslav Kalfař,80,4,2017,320,PLUS,beletrie,Jaroslav Kalfař</p>,,"Jakub Procházka jako malý chlapec osiřel a vyrůstal na venkově u prarodičů. Jeho dětské sny o hrdinství se zcela nečekaně naplnily, když byl vyvolen jako muž, který bude tvořit...",204,270,"['PLUS, beletrie', '', 'české, Jaroslav Kalfař']"
n545326317,Sirény - Joseph Knox,80,2,2017,368,PLUS,beletrie,Joseph Knox</p>,,"Noirovka ostrá jako břitva – naprosto výjimečné čtení. Sex, drogy a Manchester – pro mladého detektiva Aidana Waitse osudová trojice. Potom co na něj praskne drogový prohřešek,...",208,299,"['PLUS, beletrie', '', 'české, Joseph Knox']"
n673187750,Až mi zítra budeš chybět,0,0,2017,336,PLUS,beletrie,Heine Bakkeid</p>,,"Norská detektivka s charismatickým vyšetřovatelem, který přišel o vše, ale musí se zase postavit na nohy.
Thorkild Aske byl elitní policejní důstojník na oddělení interních...",204,299,"['PLUS, beletrie', '', 'české, Heine Bakkeid']"
n466903063,Záhada mrtvých mužů - Robert Ryan,0,0,2017,376,PLUS,beletrie,Robert Ryan</p>,,"Dokáže se dr. Watson dostat ze zajetí a rozluštit záhadu mrtvých mužů?

Píše se rok 1917 a Watsona stále drží v německém zajateckém táboře, kde major pomáhá ošetřovat britské...",257,369,"['PLUS, beletrie', '', 'české, Robert Ryan']"
n532529861,V šem statečným se odpouští - Chris Cleave,0,0,2017,456,PLUS,beletrie,Chris Cleave</p>,,"Ve válce je odvaha laciná a shovívavost nepříliš populární.Píše se rok 1939, Velká Británie vstupuje do války a mladá socialistka Mary se rozhodne, že se jako dobrovolnice...",192,315,"['PLUS, beletrie', '', 'české, Chris Cleave']"
n673188657,Gold za všechny peníze – Heller Joseph,100,1,2017,392,PLUS,beletrie,Joseph Heller</p>,,"Román o stárnutí, který sám vůbec nestárne! Gold za všechny peníze z roku 1979 je třetí knihou amerického prozaika Josepha Hellera (1923–1999), jehož protiválečný román Hlava...",278,399,"['PLUS, beletrie', '', 'české, Joseph Heller']"
n472917770,Gauč - Benjamin Parzybok,0,0,2017,328,PLUS,beletrie,Benjamin Parzybok</p>,,"Tři muži s gaučem zachraňují svět. Náhoda svede dohromady tři mladé muže jako spolubydlící v bytě, jemuž vévodí obrovský oranžový gauč. Thom je skvělý hacker, ale taky pořádný...",204,270,"['PLUS, beletrie', '', 'české, Benjamin Parzybok']"
n504247218,Boží oko - Barry Eisler,0,0,2017,400,PLUS,beletrie,Barry Eisler</p>,,"Theodore Anders, ředitel Národní bezpečnostní agentury (NSA), má jednoduchý cíl: zaznamenat každý telefonní hovor, email a ťuknutí klávesy, které souvisí s činností na...",278,399,"['PLUS, beletrie', '', 'české, Barry Eisler']"
n472473821,Maestro,0,0,2017,328,PLUS,beletrie,Geir Tangen</p>,,"Když novinář Viljar Gudmundsson obdrží e-mail od kohosi, kdo se vydává za soudce a kata jedné místní ženy, považuje to za špatný vtip: zpráva mu připomíná spíš úryvek vytržený...",208,299,"['PLUS, beletrie', '', 'české, Geir Tangen']"
n514063706,Henry + Zoe = Velké trable - Andy Jones,0,0,2017,360,PLUS,beletrie,Andy Jones</p>,,"Někdy se život musí obrátit naruby, než najde ten správný směr. Henry a Zoe toho mají společného víc, než by je samotné napadlo. Pro začátek třeba minulost, ona i on se s ní...",238,315,"['PLUS, beletrie', '', 'české, Andy Jones']"
n478335156,Jeden kluk z milonu - Monica Woodová,0,0,2017,344,PLUS,beletrie,Monica Woodová</p>,,"Kariéru kytaristy Quinna Portera přetrhne náhlé úmrtí syna, se nímž se vídal jen v pauzách mezi koncertními šňůrami. Vrací se zpátky domů plný výčitek, že svého syna...",204,299,"['PLUS, beletrie', '', 'české, Monica Woodová']"
n532529804,Africká mise - Robert Karjel,0,0,2017,392,PLUS,beletrie,Robert Karjel</p>,,"Na střelnici v džibutském hlavním městě je zastřelen švédský poručík. Přímo v Africe má jeho smrt vyšetřit agent švédské tajné služby Ernst Grip. Cítí, že mu o průběhu události...",192,349,"['PLUS, beletrie', '', 'české, Robert Karjel']"
n542143700,V šem statečným se odpouští - Chris Cleave,0,0,2017,456,PLUS,beletrie,Chris Cleave</p>,,"Píše se rok 1939 a Velká Británie vstupuje do války. Když se mladá učitelka Mary seznámí se svým novým nadřízeným Tomem a poté s jeho přítelem Alistairem, důstojníkem...",314,314,"['PLUS, beletrie', '', 'české, Chris Cleave']"
