db_id,name,rating,reviews_cnt,year,pages_cnt,publisher,genre,author,lang,description,price_from,price_to,unparsed
n253624379,Pán protektorátu. K. H. Frank známý a neznámý - Emil Hruška - Epocha,100,1,2015,272,Epocha,naučná,české</p>,,"Kniha o Karlu Hermannu Frankovi, nacistovi, který se nejprve agilně podílel na rozbití Československa a poté výrazně a někdy i zásadním způsobem ovlivňoval dění v Protektorátu...",166,259,"['Epocha, naučná', '', 'české']"
n286860878,V zájmu všeho křesťanstva - Bitva u Lepanta 1571,100,2,2015,272,Epocha,naučná,české</p>,,"Tak jako se Waterloo stalo v obecném povědomí synonymem pro porážku, Lepanto – námořní bitva Osmanů s benátsko-španělsko-papežskou koalicí vystupující jako tak zvaná Svatá liga...",211,269,"['Epocha, naučná', '', 'české']"
n269077508,Aby nemuseli nakonec žebrati. Příběhy z dějin karlínské Invalidovny Pavel Heřmánek Epocha,0,0,2015,272,Epocha,naučná,české</p>,,"Rozlehlá budova karlínské Invalidovny se stane v nejhorším případě ruinou, chátrajícím skvostem barokní architektury, v té lepší variantě luxusním hotelem či se promění v...",172,269,"['Epocha, naučná', '', 'české']"
n299727457,Kati pražského jara - Brežněv a jeho éra v Kremlu - Martin Novák,0,0,2015,256,Epocha,naučná,české</p>,,"Kati Pražského jara

Brežněv a jeho éra v Kremlu

Jméno Leonid Brežněv zná v České republice skoro každý, včetně těch, kteří se narodili nebo vyrůstali po listopadu 1989. Muž,...",152,249,"['Epocha, naučná', '', 'české']"
n286730367,Padre a Rebe. Vojenští duchovní československé zahraniční armády u Tobruku a Dunkerque - Martin Flosman - Epocha,0,0,2015,296,Epocha,naučná,české</p>,,"Publikace přibližuje neznámé osudy dvou z celkem čtrnácti důstojníků vojenské duchovní služby, kteří sloužili v čs. zahraničních jednotkách za druhé světové války. Je založena...",185,289,"['Epocha, naučná', '', 'české']"
