db_id,name,rating,reviews_cnt,year,pages_cnt,publisher,genre,author,lang,description,price_from,price_to,unparsed
n565691730,"Věci, které uvidíte, jen když zpomalíte - Haemin Sunim",93,5,2017,328,Jota,naučná,české</p>,,"Jak si zachovat klid a bdělou pozornost v uspěchaném světě.

Jiný úhel pohledu přináší nové životní cesty. 

Průvodce na cestě k vnitřnímu klidu a rovnováze pro moderního...",202,298,"['Jota, naučná', '', 'české']"
n475857470,"radosti: Jak být trvale štastný v dnešním promenlivém svete - Jeho Svatost Dalajlama, Tutu Desmond",88,4,2017,352,Jota,naučná,české</p>,,"Jeho Svatost Dalajlama a arcibiskup Tutu jsou spirituálními mistry a významnými duchovními vůdci dnešní doby. Jsou také známí svým radostným přístupemk životu, a to navzdory...",226,348,"['Jota, naučná', '', 'české']"
n673230073,Deník koučky - Šárka Vávrová,0,0,2017,352,Jota,naučná,české</p>,,"Zamilujte se do svého života.
Všichni toužíme po spokojeném a naplněném životě, ale zdaleka ne všichni takový život máme. Řešíme problémy s partnerem, trápí nás nedostatek...",206,324,"['Jota, naučná', '', 'české']"
n547423800,Přes krvavé řeky - Karel Richter,0,0,2017,376,Jota,naučná,české</p>,,"Čs. východní odboj bez cenzury a legend

Kniha přináší objevná, často až překvapivě neznámá fakta o československém východním odboji za druhé světové války. Díky názorové...",227,348,"['Jota, naučná', '', 'české']"
