db_id,name,rating,reviews_cnt,year,pages_cnt,publisher,genre,author,lang,description,price_from,price_to,unparsed
n188384120,The Walking Dead - Živí mrtví 3 - Pád Guvernéra 1,100,1,2014,272,Baronet,beletrie,české</p>,,"V románu Pád Guvernéra, třetím pokračování knižního cyklu ze světa živých mrtvých, se vracíme do městečka Woodbury v georgijském okrese Meriwether. Od propuknutí „nákazy“, kdy...",178,299,"['Baronet, beletrie', '', 'české']"
n274416807,Psycho III - Robert Bloch,0,0,2014,264,Baronet,beletrie,české</p>,,"Psycho ll. Doktor Adam Claiborne má dojem, že Norman Bates je na nejlepší cestě k uzdravení. Až do chvíle, kdy Norman zabije mladou jeptišku a uprchne z psychiatrické léčebny v...",89,89,"['Baronet, beletrie', '', 'české']"
n188384122,Dvířka do neznáma,100,1,2014,264,Baronet,beletrie,české</p>,,"Maroušek je obyčejný bankovní úředník, který má nedaleko do penze a který má své tajné sny. Do jeho vzpomínek se vkrádá kniha, jež mu připomíná dětství a inspiruje jeho touhu....",220,233,"['Baronet, beletrie', '', 'české']"
n274416804,Psycho II - Robert Bloch,0,0,2014,280,Baronet,beletrie,české</p>,,"Psycho ll.

Doktor Adam Claiborne má dojem, že Norman Bates je na nejlepší cestě k uzdravení. Až do chvíle, kdy Norman zabije mladou jeptišku a uprchne z psychiatrické léčebny...",89,89,"['Baronet, beletrie', '', 'české']"
n188384101,Láska po mexicku,0,0,2014,296,Baronet,beletrie,české</p>,,"Karolína opouští bezpečí domova a odjíždí do země neomezených možností, aby si splnila sen o finanční nezávislosti. Vypadá to, že v americkém Phoenixu našla skutečnou svobodu,...",268,279,"['Baronet, beletrie', '', 'české']"
n188384106,Hranice světů,0,0,2014,288,Baronet,beletrie,české</p>,,"Philip J. Imbrogno více než třicet let působí jako vědec a odborník na paranormální jevy. Vyšetřoval nebo byl přímo svědkem neuvěřitelných fenoménů, které posunují hranice...",79,289,"['Baronet, beletrie', '', 'české']"
