db_id,name,rating,reviews_cnt,year,pages_cnt,publisher,genre,author,lang,description,price_from,price_to,unparsed
n84097157,Kronika Slovanů - Helmond z Bosau,77,0,2013,300,Argo,naučná,české</p>,,"Autorem kroniky, jež přináší podstatné zprávy o dějinách Polabských Slovanů (Venetů), byl saský kronikář Helmhold, který žil ve 12. století (1120 - po 1177) a byl knězem v...",222,298,"['Argo, naučná', '', 'české']"
n151213158,Vědomí podvědomí - Leonard Mlodinow,90,1,2013,308,Argo,naučná,české</p>,,"Autor knih Feynmanova duha či Život je jen náhoda, spolupracovník Stephena Hawkinga, ve své nové knize zkoumá, jak naše vnímání a prožívání světa ovlivňují nevědomé pochody –...",348,348,"['Argo, naučná', '', 'české']"
n114016794,Velký masakr koček - Robert Darnton,0,0,2013,260,Argo,naučná,české</p>,,"Velký masakr koček amerického historika Roberta Darntona, poprvé vydaný v roce 1984, patří k základním a dnes již klasickým dílům kulturní historie a kulturní antropologie...",280,398,"['Argo, naučná', '', 'české']"
n108844918,Dřevo se stává vodou Gail Reichsteinová,92,2,2013,240,Argo,naučná,české</p>,,"Míváte navečer problémy s bolestí zad ? Nejspíš za to může příliš slabý prvek Vody. Trpíte jarními alergiemi ? Emocionální výlevy ? To bude asi tím, že máte příliš mnoho prvku...",209,298,"['Argo, naučná', '', 'české']"
n119263223,Milevský letopis,0,0,2013,292,Argo,naučná,české</p>,,"Vincenciův letopis a Milevský letopis, který obsahuje letopis Jarlochův a Kroniku tzv. Ansberta o historii třetí křížové výpravy císaře Fridricha, patří mezi nejvýznamnější...",245,348,"['Argo, naučná', '', 'české']"
n149379456,Portréty odvahy - John Fitzgerald Kennedy,0,0,2013,272,Argo,naučná,české</p>,,"„…činů, kvůli nimž jsem trpěl, ani zdaleka nelituji. Všechny bych je vykonal znovu, pokud by to bylo zapotřebí, i za cenu desateronásobného hanobení, nepřízně a ztráty funkce,“...",224,318,"['Argo, naučná', '', 'české']"
n100360266,Francouzský švindl svobody,0,0,2013,318,Argo,naučná,české</p>,,"Monografie deseti českých a slovenských autorů je věnována problematice recepce myšlenek Francouzské revoluce v českém prostředí přelomu 18. a 19. století.
Jednotlivé kapitoly...",280,398,"['Argo, naučná', '', 'české']"
n139581415,"Spánek, sen a dítě - Marie-Josephe Challamelová, Marie Thirionová",0,0,2013,264,Argo,naučná,české</p>,,"Spánek, sen a dítě kniha od autora Marie Thirionová. Některé děti se naučí bez velké námahy spát dostatečně a v přirozeném rytmu záhy. Ale mnoho unavených rodičů, jejichž děti...",245,331,"['Argo, naučná', '', 'české']"
