db_id,name,rating,reviews_cnt,year,pages_cnt,publisher,genre,author,lang,description,price_from,price_to,unparsed
n188990404,Grafologie. více než diagnostika osobnosti - Jan Jeřábek - Argo,100,1,2014,304,Argo,naučná,české</p>,,"Grafologie kniha od autora Jan Jeřábek. PhDr. Jan Jeřábek vystudoval FFUK, obor kulturologie. Jeho Úvod do grafologické diagnostiky představuje široce syntetizující přístup k...",209,298,"['Argo, naučná', '', 'české']"
n367643135,Kniha o očkování. Jak se správně rozhodnout ve prospěch svého dítěte - Robert W. Sears - Argo,0,0,2014,308,Argo,naučná,české</p>,,"Každý rodič stojí před otázkou, kdy, jak a proti jakým nemocem své dítě nechat očkovat. V České republice je řada očkování ze zákona povinná a zároveň je možné očkovací...",252,358,"['Argo, naučná', '', 'české']"
n233774998,"Život svatého Ludvíka , krále francouzského - Jan ze Joinvillu",50,1,2014,256,Argo,naučná,české</p>,,"Autor : Jan ze Joinvillu, Popis : 
 Jan ze Joinvillu, francouzský aristokrat, senešal v Champagni a blízký přítel Ludvíka IX., ve svém vzpomínkovém díle Kniha posvátných slov a...",209,298,"['Argo, naučná', '', 'české']"
n274417588,"Orgasmický porod. Jak bezpečně a příjemně porodit - Elisabeth Davisová, Debra Pascali-Bonarová - Argo",98,4,2014,276,Argo,naučná,české</p>,,"Jak bezpečně a příjemně porodit. Kniha, která vám může otevřít oči a úplně změnit přístup k rození a možná i k vlastnímu životu. Odbornice na slovo vzaté, porodní asistentka a...",208,298,"['Argo, naučná', '', 'české']"
n245651004,"Chalupy v Čechách na historických stavebních plánech - Jiří Škabrada, Martin Ebel",95,3,2014,272,Argo,naučná,české</p>,,Existence původních plánů pro historické vesnické stavby - tedy projektů pro lidovou architekturu - byla donedávna prakticky neznámá. Pro zájemce o studium historické...,447,598,"['Argo, naučná', '', 'české']"
n229353329,Není-li to nemožné. Životní příběh sira Nicolase Wintona - Barbara Winton - Argo,88,5,2014,286,Argo,naučná,české</p>,,"Na světě je dnes přes 6 000 lidí, kteří za svůj život vděčí Nicholasi Wintonovi - jsou to potomci dětí, jež sir Nicholas v roce 1939 zachránil z nacisty okupovaného...",245,348,"['Argo, naučná', '', 'české']"
n362866356,Dobytí Konstantinopole. Dva příběhy o čtvrté křížové výpravě - Geoffroi de Villehardouin - Argo,0,0,2014,272,Argo,naučná,české</p>,,"Autorem, kroniky o dobytí Konstantinopole křižáky v průběhu 4. křížové výpravy a zároveň nejstaršího francouzsky psaného historicko-prozaického textu, který přežil do moderních...",209,298,"['Argo, naučná', '', 'české']"
n274417933,Před Draculou,0,0,2014,268,Argo,naučná,české</p>,,"Před Draculou: Archeologie upíra
Tommaso Braccini
Italský kulturní antropolog Tommaso Braccini zkoumá fenomén vampyrismu v evropských dějinách. Zamýšlí se nad kořeny představ o...",280,398,"['Argo, naučná', '', 'české']"
n217413884,Dějiny královského města Kolína nad Labem 1. Josef Vávra,0,0,2014,288,Argo,naučná,české</p>,,Dějiny královského města Kolína nad Labem je dosud jedinou syntézou dějin města Kolína a dosud nenalezla náhradu v novém zpracování. I pro dnešního badatele a čtenáře je...,174,236,"['Argo, naučná', '', 'české']"
