db_id,name,rating,reviews_cnt,year,pages_cnt,publisher,genre,author,lang,description,price_from,price_to,unparsed
n67097970,Kámasútra,0,0,2010,128,Rebo,naučná,české</p>,,"Publikace je složená ze dvou knih a to: Vášnivý muž, smyslná žena.
 
 
 
Baleno v pevných deskách.
 
 
 
Kámasútra nabízí nejen umění lásky a cesty rozkoše, nýbrž i vzájemné...",99,99,"['Rebo, naučná', '', 'české']"
n936632,Živé ploty - Zahrada plus - 2. vydání - Markley Robert,0,0,2010,96,Rebo,naučná,české</p>,,"Živé ploty jsou mnohem více než možnost, jak s málem místa přitažlivě ohradit pozemek. Jsou nejdůležitějším tvůrcem prostoru našich zahrad a střeží jejich duši jako cenný...",49,106,"['Rebo, naučná', '', 'české']"
n366278,"Posezení na zahradě -- Zřizování, dotváření, rostliny a doplňky - Rosa Wolf",0,0,2010,96,Rebo,naučná,české</p>,,"ejkrásnější zahradní odpočívadla pro různá místa, rychlá realizace vysněného místa k posezení, cesty, úpravy povrchu, zdi, živé ploty, pavilony, výběr vhodných rostlin a...",49,128,"['Rebo, naučná', '', 'české']"
