db_id,name,rating,reviews_cnt,year,pages_cnt,publisher,genre,author,lang,description,price_from,price_to,unparsed
n477645570,Plamenonosič - Bernard Cornwell,90,1,2017,286,BB ART,beletrie,české</p>,,"Od prvního dne, kdy mi byl Bebbanburg zrádně ukraden, jsem snil o tom, že ho znovu získám. Mí předci vybudovali mocnou pevnost na skále nad mořem. Bebbanburg je nedobytný a...",203,269,"['BB ART, beletrie', '', 'české']"
n475304832,Oběť - James Carol,0,0,2017,288,BB ART,beletrie,české</p>,,"Poté co policejní profiler Jefferson Winter spolu se seržantkou Mendozovou v New Yorku odhalil a dopadl sadistického vraha mladých homosexuálů, odpočívá a připravuje se na...",202,299,"['BB ART, beletrie', '', 'české']"
n707610161,Co jsi to za matku? - Paula Daly,100,1,2017,280,BB ART,beletrie,české</p>,,"Co se stane, jestliže zmizí dítě vaší nejlepší kamarádky, právě když jste ho měla na starosti? Co si počnete? 
Přesně tohle řeší Lisa Kallistová jednoho mrazivého prosincového...",159,299,"['BB ART, beletrie', '', 'české']"
n574775601,Úplněk vlka - Child Lincoln,85,2,2017,248,BB ART,beletrie,české</p>,,"Vraždy v odlehlé pustině Adirondackého pohoří, které rozbouřily poklidný život místních lidí, nesou znaky čehosi nelidského. Oběti jsou zmasakrované k nepoznání, roztrhané,...",191,299,"['BB ART, beletrie', '', 'české']"
n477645564,Extrémní oběť - John Sandford,0,0,2017,304,BB ART,beletrie,české</p>,,Kvůli narůstajícím sporům s vedením opustil Lucas Davenport minnesotský Státní kriminalistický úřad a po mnoha letech je náhle bez práce. Pověst špičkového vyšetřovatele mu...,202,299,"['BB ART, beletrie', '', 'české']"
n556710778,BB/art s.r.o. Americký zabiják,98,4,2017,304,BB ART,beletrie,české</p>,,"Mitch Rapp je zvyklý vyhrávat, ale…
 Agent CIA Mitch Rapp míří do Pákistánu, aby čelil smrtelné hrozbě, na kterou možná není připravený. Dokonce se zdá, že konečně narazil na...",203,299,"['BB ART, beletrie', '', 'české']"
n547772923,Kráska a lord Tilly Bagshaweová,0,0,2017,304,BB ART,beletrie,české</p>,,"Henry Saxton-Brae zdánlivě má úplně vše – šlechtický titul, miliony, které si sám vydělal, je zasnoubený se supermodelkou, která je nejen krásná, ale také laskavá a věrná. A...",159,299,"['BB ART, beletrie', '', 'české']"
n556177621,Navždy družičkou - Lindsey Kelk,0,0,2017,312,BB ART,beletrie,české</p>,,"Maddie Fraserová se nikdy nedrala dopředu, spíš se držela v pozadí: mladší sestra oblíbence Dana, pravá ruka šílené Shony, bývalka workoholika Sebastiana a teď také dívka,...",159,299,"['BB ART, beletrie', '', 'české']"
n707610159,Zemři dvakrát - Grant Andrew,0,0,2017,264,BB ART,beletrie,české</p>,,"Agenta Davida Trevellyana, který se chystá po své první misi opustit New York, povolají na britský konzulát v Chicagu. Do téže kanceláře, kde byl jeho nový nadřízený před...",202,299,"['BB ART, beletrie', '', 'české']"
