db_id,name,rating,reviews_cnt,year,pages_cnt,publisher,genre,author,lang,description,price_from,price_to,unparsed
n307673434,Krajiny,0,0,2015,64,české,beletrie,Camille de Montmorillon</p>,,"Krajiny. Camille de Montmorillon. Edika

Vybarvuj podle čísel a objev skryté obrazy!

 V této knize se skrývá přes 30 překrásných scenérií ze všech koutů naší planety. Abyste...",115,169,"['Albatros Media a. s., beletrie', '', 'české, Camille de Montmorillon']"
n290132175,Ďáblova písmena - Martina Drijverová,0,0,2015,120,Albatros,beletrie,Martina Drijverová</p>,,"Ďáblova písmena. Martina Drijverová. Albatros

Napínavé dobrodružství námořního důstojníka za tajemstvím Ďáblových písmen.

 Jean-François de La Pérouse byl francouzský námořní...",170,249,"['Albatros, beletrie', '', 'české, Martina Drijverová']"
n307673442,Zvířata a spol.,0,0,2015,64,české,beletrie,Camille de Montmorillon</p>,,"Zvířata a spol. Camille de Montmorillon. Edika

Vybarvuj podle čísel

Objev skryté obrazy!

 V této knize se skrývá přes 30 živočichů ze všech koutů naší planety. Abyste je...",106,169,"['Albatros Media a. s., beletrie', '', 'české, Camille de Montmorillon']"
n307673499,Města,0,0,2015,64,české,beletrie,Jessie Booth</p>,,"Spojuj tečky podle čísel. Spoj tečky a objev skryté obrazy! V knize na vás čeká více než 30 skrytých obrázků, které spatříte propojením číselné řady. Vyhledejte číslo 1 na...",33,169,"['Albatros Media a. s., beletrie', '', 'české, Jessie Booth']"
n307673496,Cestování,100,2,2015,64,české,beletrie,Karine Nayé</p>,,"Spojuj tečky podle čísel. Spoj tečky a objev skryté obrazy! V knize na vás čeká více než 30 skrytých obrázků, které spatříte propojením číselné řady. Vyhledejte číslo 1 na...",115,169,"['Albatros Media a. s., beletrie', '', 'české, Karine Nayé']"
n312623043,Metro v říši duchů - Thomas Brezina,73,2,2015,136,Albatros,beletrie,Thomas Brezina</p>,,Další pátrání čtveřice malých detektivů! V opuštěné stanici londýnského metra se přímo na Erika vyřítil vlak. Řídila ho kostra s rudě zářícíma očima a z oken vyskakolvali...,151,189,"['Albatros, beletrie', '', 'české, Thomas Brezina']"
