db_id,name,rating,reviews_cnt,year,pages_cnt,publisher,genre,author,lang,description,price_from,price_to,unparsed
n688547382,Výzbroj a výstroj výsadkářů a průzkumníků 1947–2001 - Historie českých speciálních sil - III. díl - David Jirásek,94,6,2018,344,Mladá fronta,naučná,české</p>,,V prvních dvou dílech Historie českých speciálních sil jsme se seznámili s vývojem našich výsadkových jednotek i jednotek hloubkového a speciálního průzkumu od konce 2. světové...,464,649,"['Mladá fronta, naučná', '', 'české']"
n608076048,Pchjongčchang 2018 - XXIII. Zimní olympijské hry,99,6,2018,360,Mladá fronta,naučná,české</p>,,Oficiální publikace Českého olympijského výboru. Posledních deset let vycházejí oficiální publikace k olympijským hrám v nakladatelství Mladá fronta. I tentokrát spolupracujeme...,389,599,"['Mladá fronta, naučná', '', 'české']"
n665011826,N ěmecko mýtus a realita - Aleš Valenta,93,3,2018,408,Mladá fronta,naučná,české</p>,,"Analýza německé politiky vydaná ve spolupráci s Institutem Václava Klause

Publikace se zabývá německou politikou posledních dvaceti let. Vlastnímu tématu předchází obsáhlý...",259,399,"['Mladá fronta, naučná', '', 'české']"
n621763233,Očkování dospělých - Chlíbek Roman,0,0,2018,456,Mladá fronta,naučná,české</p>,,Očkování v dospělém věku je jednou z nejrychleji se rozvíjejících součástí vakcinace. S prodlužujícím se věkem neustále narůstá počet dospělých osob v populaci. Nejvíce je to...,357,550,"['Mladá fronta, naučná', '', 'české']"
n698322346,GDPR snadno a přehledně,0,0,2018,376,Mladá fronta,naučná,české</p>,,"Tato kniha představuje přehledný manuál k zavedení všeho, co musí být provedeno pro soulad s Nařízením GDPR. Jelikož každá firma pracuje s osobními údaji svých zákazníků,...",518,799,"['Mladá fronta, naučná', '', 'české']"
