db_id,name,rating,reviews_cnt,year,pages_cnt,publisher,genre,author,lang,description,price_from,price_to,unparsed
n52353375,Začátek století - Vít Soukup,0,0,2012,183,Arbor vitae,naučná,české</p>,,"Kniha Začátek století je reprezentativním obrazem českého vizuálního umění prvního desetiletí a odkrývá jeho nejpodstatnější prvky, na něž dnes kontinuálně navazuje nejmladší...",325,710,"['Arbor vitae, naučná', '', 'české']"
n75988535,Sochy a projekty/Sculptures and Projects - Stanislav Kolíbal,100,1,2012,188,Arbor vitae,naučná,české</p>,,Stanislav Kolíbal (1925) patří ke klíčovým osobnostem českého umění druhé poloviny 20. a počátku 21. století. Od 50. let se systematicky věnuje sochařství. Zásadní zlom v jeho...,720,891,"['Arbor vitae, naučná', '', 'české']"
n41879896,František Skála,98,3,2012,228,Arbor vitae,naučná,české</p>,,"Monografie jednoho z nejvýznamnějších současných umělců Františka Skály (1956), zakládajícího člena skupiny Tvrdohlaví, člena tajné skupiny B. K. S. (Bude Konec Světa), komtura...",880,1,"['Arbor vitae, naučná', '', 'české']"
n52346324,Zápas o moderní malbu - Miloš Jiránek,0,0,2012,192,Arbor vitae,naučná,české</p>,,"Monografie představuje jednu ze zakladatelských osobností českého moderního umění - malíře, literáta a výtvarného kritika Miloše Jiránka (1875-1911). V roce 1896 vstoupil do...",503,621,"['Arbor vitae, naučná', '', 'české']"
n52459250,Knihovna Karáskovy galerie a její světy,95,1,2012,230,Arbor vitae,naučná,české</p>,,"Básník Jiří Karásek ze Lvovic (1871 - 1951), významný představitel české dekadence, proslul rovněž jako sběratel výtvarného umění. Publikace ho však představuje jako nevšedního...",514,656,"['Arbor vitae, naučná', '', 'české']"
