db_id,name,rating,reviews_cnt,year,pages_cnt,publisher,genre,author,lang,description,price_from,price_to,unparsed
n637855297,"Nenadálá láska - Cartland, Barbara",0,0,2018,136,Baronet,beletrie,Barbara Cartland</p>,,"Ravině Ashleyové leží svět u nohou. Je mladá, krásná a šťastná. Její zámožní rodiče o ni po všech stránkách pečují a v Londýně neexistuje mladík, který by se nesnažil získat...",131,199,"['Baronet, beletrie', '', 'české, Barbara Cartland']"
n654017436,Dokud nás smrt nerozdělí - Ed McBain,0,0,2018,114,Baronet,beletrie,Ed McBain</p>,,"Na svatbu detektiva Klinga si policisté oblékli civilní šaty. Steve Carella z nich byl nejlepší a skoro všichni sloužili v 87. revíru.

Jakmile je Klingova nevěsta unesena z...",164,237,"['Baronet, beletrie', '', 'české, Ed McBain']"
n654017434,Nerozhodnost - Ed McBain,0,0,2018,160,Baronet,beletrie,McBAIN Ed</p>,,"Před 87. okrskem postává ve sněhové vánici cizí muž. Ví, že by měl vstoupit a ohlásit policii, co se přihodilo minulou noc, povědět jim o své bývalé přítelkyni Molly. Ale každá...",164,249,"['Baronet, beletrie', '', 'české, McBAIN Ed']"
n582961695,Láska z Orientu - Barbara Cartland,0,0,2018,152,Baronet,beletrie,Barbara Cartland</p>,,"Život Violy Brookfieldové připomíná procházku růžovou zahradou - ovšem jen do té doby, než její rodiče tragicky zahynou. Zlomená Viola pak v beznaději přijme nabídku své tety,...",125,199,"['Baronet, beletrie', '', 'české, Barbara Cartland']"
n653216390,"Jeho slovo je zákon - McBain, Ed",0,0,2018,152,Baronet,beletrie,Ed McBain</p>,,"„Těla našli v otevřeném příkopu v nejsevernějším cípu 87. revíru. Šest těl leželo jedno přes druhé na zabláceném ledě. Do ledu se ale vsákla i další barva, a tou byla krev....",151,229,"['Baronet, beletrie', '', 'české, Ed McBain']"
n653496811,Slib - Kleypas Lisa,0,0,2018,128,Baronet,beletrie,Lisa Kleypas</p>,,"Andrew, lord Drake, byl vyškrtnut z otcovy poslední vůle pro svůj zhýralý a prostopášný život. Aby si získal zpět otcovu přízeň, Andrew se rozhodne předstírat, že se napravil....",143,179,"['Baronet, beletrie', '', 'české, Lisa Kleypas']"
n648121023,Jeho slovo je zákon - McBain Ed,0,0,2018,152,Baronet,beletrie,Ed McBain</p>,,"„Těla našli v otevřeném příkopu v nejsevernějším cípu 87. revíru. Šest těl leželo jedno přes druhé na zabláceném ledě. Do ledu se ale vsákla i další barva, a tou byla krev....",156,229,"['Baronet, beletrie', '', 'české, Ed McBain']"
