db_id,name,rating,reviews_cnt,year,pages_cnt,publisher,genre,author,lang,description,price_from,price_to,unparsed
n58176572,"Kompetence řídících pracovníků ve školství - Irena Lhotková, Václav Trojan, Jindřich Kitzberger",93,2,2012,104,české,naučná,Jindřich Kitzberger</p>,,"Tato kniha je výsledkem práce týmu autorů, kteří se snažili pojmout problematiku kompetence pracovníků ve školství jak z pohledu teorie, tak na základě praktických zkušeností....",121,171,"['Wolters Kluwer, naučná', '', 'české, Jindřich Kitzberger']"
n390226812,Respekt v zaměstnání,0,0,2012,160,české,naučná,Andrea Lienhartová</p>,,"Autor : Andrea Lienhartová, Popis : 
 Respekt by chtěl mít každý. Není divu! Vždyť jen v atmosféře vzájemné úcty vás může práce bavit a může být zdrojem spokojenosti a štěstí....",247,363,"['Wolters Kluwer, naučná', '', 'české, Andrea Lienhartová']"
n57045965,Odhalte nepsaná pravidla hry v zaměstnání,0,0,2012,152,české,naučná,Isabel Nitzscheová</p>,,"Vedoucí pozice ve firmách jsou stále obsazené převážně muži. Jak je to možné?

 Trenérka manažerů a koučerka Isabel Nitzscheová na základě autentických příkladů a příběhů...",243,363,"['Wolters Kluwer, naučná', '', 'české, Isabel Nitzscheová']"
n67060721,Informační systémy v moderním personálním řízení,95,1,2012,120,české,naučná,Jan Žufan</p>,,Publikace vychází z mnohaletých zkušeností autora s problematikou personálních informačních systémů (PIS). Přehledným způsobem předkládá základní informace o architektuře...,166,212,"['Wolters Kluwer, naučná', '', 'české, Jan Žufan']"
n60204152,"Právní ochrana designu - průmyslové vzory, autorská díla",0,0,2012,156,české,naučná,Pavel Koukal</p>,,"Monografie reaguje na aktuální fenomén „designové revoluce"", se kterým se setkáváme všude kolem nás. Snaží se čtenářům přiblížit cesty, jak design chránit. Je přitom zaměřena...",217,246,"['Wolters Kluwer, naučná', '', 'české, Pavel Koukal']"
n46141881,Tabulky a informace pro daně a podnikání 2012,0,0,2012,0,české,naučná,Kolektiv autorů</p>,,"Již 8. vydání oblíbené příručky!

 

PUBLIKACE JE JEDINEČNÝM TITULEM NA NAŠEM TRHU.

Jedná se o příručku, ve které najdete přehled nejdůležitějších pojmů, sazeb, čísel, postupů...",191,257,"['Wolters Kluwer, naučná', '', 'české, Kolektiv autorů']"
