db_id,name,rating,reviews_cnt,year,pages_cnt,publisher,genre,author,lang,description,price_from,price_to,unparsed
n544594741,Věčná Slavia - Pavel Procházka,97,3,2017,304,Olympia,beletrie,české</p>,,"Čtvrté, dopracované vydání úspěšné publikace zachycuje historii jednoho z našich nejstarších, nejúspěšnějších a nejslavnějších fotbalových klubů. Vypráví o stodvacetipětileté...",326,399,"['Olympia, beletrie', '', 'české']"
n468757184,Černá České televize - Výběr z glos a úvah o České televizi z Parlamentních listů 2012-2016,90,1,2017,304,Olympia,beletrie,české</p>,,"Černá kniha České televize autorů Petra Žantovského a Jiřího Hroníka je ohlédnutím za jejich zhruba pětiletou spoluprací na rubrice Týden v médiích, která vychází na portálu...",191,299,"['Olympia, beletrie', '', 'české']"
n544516318,Nakladatelství Olympia a. s. Skvosty Československé fotbalové historie,0,0,2017,312,Olympia,beletrie,české</p>,,"František Prückner, osvědčený autor fotbalových publikací, sepsal velmi poutavou publikaci zachycující to nejlepší z československého a českého fotbalu od konce války až po rok...",237,479,"['Olympia, beletrie', '', 'české']"
n565760877,Jeřabiny z Hangzhou - Cimický Jan,0,0,2017,300,Olympia,beletrie,české</p>,,"Marek Veselý je manažér v úspěšné kulturní agentuře a jeho cesty vedou často do Číny. Méně úspěšný je ve svých partnerských vztazích a my ho potkáváme právě v okamžiku, kdy...",197,299,"['Olympia, beletrie', '', 'české']"
n546482888,Jak se dělá… aneb co Čapek nenapsal - Jan Žáček,0,0,2017,284,Olympia,beletrie,české</p>,,"Už je to dlouho, co napsal Karel Čapek svoji knihu Jak se co dělá (v Olympii v roce 2010). Sám byl zkušený novinář, spisovatel, dramatik a několikrát se účastnil i natáčení...",183,249,"['Olympia, beletrie', '', 'české']"
