db_id,name,rating,reviews_cnt,year,pages_cnt,publisher,genre,author,lang,description,price_from,price_to,unparsed
n126574093,Sesterstvo,100,1,2013,344,Mladá fronta,beletrie,české</p>,,"Dům rodiny Lundových je na prodej. Poté, co Cecilie odhalila Johnovu nevěru, žijí manželé odloučeně a mají děti ve střídavé péči. Aby Cecilie zahnala stesk po ztraceném...",73,99,"['Mladá fronta, beletrie', '', 'české']"
n126574102,Evropské blues,0,0,2013,344,Mladá fronta,beletrie,české</p>,,"Evropské blues kniha od autora Dahl Arne. Nezměrné utrpení. Nezměrná nenávist. Nezměrná bolest.
Co mají společného mrtvý kandidát na Nobelovu cenu a k nepoznání znetvořená...",99,299,"['Mladá fronta, beletrie', '', 'české']"
n31798486,Válečný vůdce 2. díl,80,1,2013,408,Mladá fronta,beletrie,české</p>,,"Válečný vůdce 2. díl

Vynikající dvousvazkový životopis z pera jednoho z nejlepších vojenských historiků současnosti líčí Winstona Churchilla jako vojáka a válečného vůdce,...",246,379,"['Mladá fronta, beletrie', '', 'české']"
n85208855,První rodina - David Baldacci,100,1,2013,376,Mladá fronta,beletrie,české</p>,,"Únos z prezidentské rezidence je jen začátek.  Začalo to jako obyčejná oslava dětských narozenin. Sešli se kamarádi a rodina. Nafukovaly se balonky, podávaly dorty, hrály se...",252,359,"['Mladá fronta, beletrie', '', 'české']"
n82607354,Nesprávná oběť - Arne Dahl,0,0,2013,352,Mladá fronta,beletrie,české</p>,,"V0222274
Krása není nic jiného než děsivý počátek
Brutální vražda stockholmského návštěvníka restaurace, svědek, který nic nechce nic vidět a slyšet, nevysvětlitelná exploze ve...",194,299,"['Mladá fronta, beletrie', '', 'české']"
n59056737,Mistr,0,0,2013,344,Mladá fronta,beletrie,české</p>,,"Mistr kniha od autora Tóibín Colm. Mistr

Spisovatel Tóibín píše o spisovateli Henry Jamesovi. Nemusíme přesně vědět, kdo James byl, abychom se ponořili do výtečně napsaného...",220,339,"['Mladá fronta, beletrie', '', 'české']"
n259845350,Srdeční záležitost. Pravdivý příběh o hledání vlastního srdce - Charlotte Valandreyová - Mladá fronta,0,0,2013,320,Mladá fronta,beletrie,české</p>,,"Autobiografický příběh hledání pravdy o vlastním srdci
Francouzská herečka a spisovatelka Charlotte Valandreyová podstoupila v roce 2005 transplantaci srdce. Měsíc poté, co se...",223,232,"['Mladá fronta, beletrie', '', 'české']"
n104174085,Děti paranoie Trevor Shane,0,0,2013,320,Mladá fronta,beletrie,české</p>,,"Od svých osmnácti let Joseph vraždil lidi kvůli něčemu, čemu věřil, ale co tak docela nechápal. Tato Válka trvá věky, ukrývá se ve stínech, řídí se přísnými pravidly a bojují v...",179,299,"['Mladá fronta, beletrie', '', 'české']"
n126574100,Soustrojí smrti,0,0,2013,328,Mladá fronta,beletrie,české</p>,,"Při přestřelce v činžáku na Pearl Street, určeném k likvidaci, detektiv John Tallow přijde o svého partnera a vzápětí narazí na byt plný pistolí a revolverů. Jejich prohlídka...",242,243,"['Mladá fronta, beletrie', '', 'české']"
