db_id,name,rating,reviews_cnt,year,pages_cnt,publisher,genre,author,lang,description,price_from,price_to,unparsed
n707609943,Helmut Newton - Work - Heiting Manfred,0,0,2016,280,Slovart,beletrie,české</p>,,"Svět Helmuta Newtona je nanejvýš složitý a mnohovrstevný. Jestliže bylo jeho dílo považováno v 60. letech za šokující a provokativní, dnes se ukazuje, že Helmut Newton...",648,999,"['Slovart, beletrie', '', 'české']"
n368134394,Krev není voda,100,1,2016,304,Slovart,beletrie,české</p>,,"Žádný rok v Krauzově krátké detektivní kariéře nebyl tak těžký jako rok 1992. Bezpečnostní analytici tvrdili, že na vině byla neuvážená porevoluční totální amnestie, protože...",194,299,"['Slovart, beletrie', '', 'české']"
n707609945,Cela číslo 17 - Dominik Dán,0,0,2016,264,Slovart,beletrie,české</p>,,"Nový případ sdílí tentokrát detektiv Richard Krauz se svým mladým parťákem Jozefem Fischerem alias Josém, talentovaným vyšetřovatelem a nenapravitelným sukničkářem v jedné...",194,299,"['Slovart, beletrie', '', 'české']"
n707610011,Něžná fata morgána - Dominik Dán,0,0,2016,288,Slovart,beletrie,české</p>,,"Třetí příběh z období detektivních začátků Richarda Krauze se odehrává v listopadu 1989. Richard Krauz pracuje na oddělení vražd už půldruhého roku, ale starší kolegové na něj...",194,299,"['Slovart, beletrie', '', 'české']"
n376842415,Marco Polo I - Karavana z Benátek,0,0,2016,288,Slovart,beletrie,české</p>,,"První díl dobrodružné trilogie o benátském kupci, jehož snem bylo spatřit konec světa. V tomto díle se mladý Marco, i přes otcův nesouhlas, vydává s jeho karavanou do...",194,299,"['Slovart, beletrie', '', 'české']"
n51141352,Marco Polo: Tygr moří - Romana Muriel,0,0,2016,240,Slovart,beletrie,české</p>,,"Když se Kublajchán dozví o tajném vztahu, který Marco Polo udržuje s mladou mongolskou princeznou, ztrácí Benátčan všechny své výsady a je vypovězen ze země. Jako poslední...",194,299,"['Slovart, beletrie', '', 'české']"
n431465577,Marco Polo II - Za velkou zdí: Za velkou zdí - Romana Muriel,0,0,2016,288,Slovart,beletrie,české</p>,,"Ve druhém díle napínavé románové trilogie se Marco Poloydává do Číny, aby se stal vyslancem na dvoře Kublajchána. Čínský vládce si ho záhy oblíbí. Jako jeho host a diplomat...",194,299,"['Slovart, beletrie', '', 'české']"
