db_id,name,rating,reviews_cnt,year,pages_cnt,publisher,genre,author,lang,description,price_from,price_to,unparsed
n423625840,Plantážníkova žena - Jefferies Dinah,0,0,2016,416,Víkend,beletrie,české</p>,,"Devatenáctiletá Gwendolyn je krátce vdaná. Do svého manžela, téměř o dvacet let staršího vdovce, majitele čajových plantáží na Cejlonu, se zamilovala v Londýně. Teď se nemůže...",217,339,"['Víkend, beletrie', '', 'české']"
n397276716,Krvavý slunovrat,95,2,2016,320,Víkend,beletrie,české</p>,,"Pátý díl ze série kriminálních románů Vraždy na Sandhamnu o kriminálním inspektorovi Thomasi Andreassonovi a právničce Noře Lindeové

Svátek letního slunovratu na Sandhamnu....",186,299,"['Víkend, beletrie', '', 'české']"
n367219059,Bílé stopy,100,1,2016,336,Víkend,beletrie,české</p>,,"Román Emelie Schepp Bílé stopy je pokračováním osudů prokurátorky Jany Berzeliusové ze strhujícího románu s originální zápletkou Bohové smrti.
Norrköping svírá tuhá bílá zima,...",191,299,"['Víkend, beletrie', '', 'české']"
n443054695,Vydavatelství VÍKEND - J. Černý Modrý motýl,0,0,2016,384,Víkend,beletrie,české</p>,,"Působivý příběh vraždy, lásky a zrady, dokonalé čtení pro fanoušky skandinávského dramatu Most.
Mladá žena potká staršího muže a bezmezně se do něho zamiluje. Jesper je vším, o...",211,329,"['Víkend, beletrie', '', 'české']"
n443054690,Vydavatelství VÍKEND - J. Černý Čarodějka z Marstrandu,0,0,2016,352,Víkend,beletrie,české</p>,,"Druhý díl ze série příběhů s kriminální inspektorkou Karin Adlerovou. Na Marstrandském ostrově, poblíž Carlstenské pevnosti, se našlo bezhlavé tělo. Ještě téhož dne dojde ve...",204,287,"['Víkend, beletrie', '', 'české']"
