db_id,name,rating,reviews_cnt,year,pages_cnt,publisher,genre,author,lang,description,price_from,price_to,unparsed
n289167335,Harley Quinn 1 Šílená odměna,100,1,2015,208,české,beletrie,Jimmy Palmiotti</p>,,"Nastal čas vytočit Harley!
Je to příběh starý jako sám svět: Dívka zažije krutý rozchod a přestěhuje se do New Yorku. Snaží se najít novou práci, lásku, život... Jo, a je...",312,499,"['BB ART, beletrie', '', 'české, Jimmy Palmiotti']"
n305740604,Liga spravedlnosti 3 - Trůn Atlantidy,100,1,2015,192,české,beletrie,Reis Ivan,,"Armády Atlantidy se šikují do útoku!

Než se Arthur Curry stal Aquamanem, býval králem Atlantidy. Jenže pověrčiví Atlanťané, nenávidějící obyvatele souše, nemohli chovat lásku...",329,499,"['BB ART, beletrie', '', 'české, Johns Geoff, Reis Ivan']"
n296868087,"100 nábojů 10 - Dekadence - Brian Azzarello, Eduardo Risso",0,0,2015,192,české,beletrie,Eduardo Risso</p>,,"Hlavy rodů sdružených v Trustu, tajné organizaci, která již několik století vládne světu, se sejdou na smuteční hostině po pohřbu jednoho ze svých řad. Ale Augustus Medici,...",329,499,"['BB ART, beletrie', '', 'české, Eduardo Risso']"
n289920317,Batman: Temný rytíř 3: Šílený - John Layman; Jason Fabok; Andy Clarke,0,0,2015,176,české,beletrie,Szymon Kudranski</p>,,"V životě Temného rytíře konečně zazáří světlo.
Bruce Wayne prožívá velkou změnu. Konečně našel ženu, která je nejen krásná, ale i intelektuálně na výši a s Brucem má společné i...",248,399,"['BB ART, beletrie', '', 'české, Szymon Kudranski']"
n259694418,Deset plus jeden Kniha McBain Ed,91,4,2015,208,české,beletrie,Ed McBain</p>,,"Deset plus jeden kniha od autora McBain Ed. Steve Carella a jeho spolupracovníci z 87. revíru řeší případ osmi postupně stejně provedených vražd a dvou zabití, přičemž dosti...",124,249,"['BB ART, beletrie', '', 'české, Ed McBain']"
