db_id,name,rating,reviews_cnt,year,pages_cnt,publisher,genre,author,lang,description,price_from,price_to,unparsed
n155707442,"Naučte se kreslit Zvířata, lidé, rostliny",100,2,2013,144,české,naučná,Kolektiv autorů</p>,,"Kniha Naučte se kreslit: Zvířata, lidé rostliny a další témata krok za krokem obsahuje nejdůležitější informace pro jednoduché osvojení si základů kreslení. Zahrnuje nejen...",231,265,"['Zoner press, naučná', '', 'české, Kolektiv autorů']"
n400724688,Naučte se kreslit a malovat - Portrét - Kolektiv autorů,100,1,2013,144,české,naučná,Kolektiv autorů</p>,,"Kniha bude k dispozici kolem 23. 9. 2013. 

Naučte se ztvárnit realistické portréty pomocí kresby i malby. 

Kniha Naučte se kreslit a malovat: Portrét byla napsána čtyřmi...",208,295,"['Zoner press, naučná', '', 'české, Kolektiv autorů']"
n141398496,Podnikatel na konci role,0,0,2013,164,české,naučná,Mike Michalowicz</p>,,"Kniha bude k dispozici v polovině října. 

Podnikatel na konci role není pro každého. Je určena pouze těm, kteří chtějí uspět. Mike Michalowicz napsal skvělou knihu určenou pro...",78,269,"['Zoner press, naučná', '', 'české, Mike Michalowicz']"
n404312460,Postavičky z korálků - Klára Žejdlová,0,0,2013,152,české,naučná,Klára Žejdlová</p>,,"Vytvořte si originální pohádkové postavičky, krásné šperky a dekorace z korálků. 

Jedna z nejzkušenějších českých „korálkářek"" a autorka knih o výrobcích z korálků Klára...",79,270,"['Zoner press, naučná', '', 'české, Klára Žejdlová']"
n404335736,Umění Embossingu - Sukseree Kannikar,0,0,2013,80,české,naučná,Kannikar Sukseree</p>,,"Kniha ""Umění embossingu"" je věnována technice embossování tj. vytlačování reliéfů do pergamenového/pauzovacího papíru. Je svého druhu učebnicí, kterou vydalo Pergamano® a...",201,260,"['Zoner press, naučná', '', 'české, Kannikar Sukseree']"
