db_id,name,rating,reviews_cnt,year,pages_cnt,publisher,genre,author,lang,description,price_from,price_to,unparsed
n59210294,Tajemná místa Země,0,0,2012,272,Slovart,naučná,české</p>,,"Na naší krásné planetě existují místa, která nám doslova učarují: sledujeme v nich stopy zaniklých dávných civilizací, tajemnství chovaných po staletí, nikdy neobjevených...",519,799,"['Slovart, naučná', '', 'české']"
n259842678,Barevná harmonie 2. vydání Anna Starmer,0,0,2012,256,Slovart,naučná,české</p>,,"Jak kombinovat barvy a dosáhnout požadovaného vzhledu interiéru.
 Inspirujte se v praktické příručce, která návrhářům interiérů či dekoratérům nabízí přes 150 návrhů, jak...",339,339,"['Slovart, naučná', '', 'české']"
n59056608,Eric Clapton Ilustrovaný životopis,97,3,2012,256,Slovart,naučná,české</p>,,Ilustrovaný životopis. Bohatě fotograficky dokumentovaný životopis Erika Claptona přináší průřez půlstoletím hudebního života této rockové a bluesové hvězdy nejvyššího řádu....,491,699,"['Slovart, naučná', '', 'české']"
n59210241,Stasiland - Příběhy ze země za berlínskou zdí,90,1,2012,312,Slovart,naučná,české</p>,,"V roce 1989 padla berlínská zeď a krátce na to se rozdělené Německo znovu sjednotilo.

Přestala existovat Německá demokratická republika. V zemi, kde se nejvyšší velitelství...",174,299,"['Slovart, naučná', '', 'české']"
n75661014,Anderle 2012 nová monografie,0,0,2012,301,Slovart,naučná,české</p>,,"Jiří Anderle se nám svým dosavadním dílem jeví jako uvědomělý člověk 20. století, jako článek řetězu v kulturně historickém vývoji evropského umění. Proto také není obtížné...",748,999,"['Slovart, naučná', '', 'české']"
n44691563,Divoké květiny Nový kapesní atlas,0,0,2012,296,Slovart,naučná,české</p>,,"Díky krásnému fotografickému atlasu lze poznat mnoho kvetoucích bylin a keřů, které se objevují v přírodě velké části Evropy.

Nový kapesní atlas - Divoké květiny se stane...",236,269,"['Slovart, naučná', '', 'české']"
n47433801,Houby,93,1,2012,296,Slovart,naučná,české</p>,,"Tato unikátní fotografická příručka slouží jako klíč k určování širokého okruhu hub v jejich přirozeném prostředí. Bez ohledu na to, zda jste naprostý začátečník nebo zkušený...",194,299,"['Slovart, naučná', '', 'české']"
n44697720,"Krásné mosty Čech, Moravy a Slezska",93,2,2012,240,Slovart,naučná,české</p>,,"Most je stavební konstrukce umožňující převedení horizontální komunikace přes vodní tok nebo jinou hlubokou překážku.

A jak to vidí básník? K čemu jsou mosty přes řeku? Aby...",499,629,"['Slovart, naučná', '', 'české']"
n48777840,Kytara - Phil Capone,95,2,2012,256,Slovart,naučná,české</p>,,"Tento průvodce vás naučí hrát na kytaru během chvilky za pomoci jednoduchých, ilustrovaných lekcí.

Dozvíte se v něm, jak vybrat tu správnou kytaru, číst tabulatury, jak správně...",399,399,"['Slovart, naučná', '', 'české']"
