db_id,name,rating,reviews_cnt,year,pages_cnt,publisher,genre,author,lang,description,price_from,price_to,unparsed
n669962750,Hrad mrtvých: Případy královského soudce Melichara: Bauer Jan,87,7,2018,200,Nakladatelství BRÁNA,beletrie,české</p>,,Šlechtic Raimund z Pušperku doprovázel Elišku Přemyslovnu na její svatbu s Janem Lucemburským ve Špýru. S oběma se také vrátil do Čech a po Janově korunovaci konečně zamířil...,179,249,"['Nakladatelství BRÁNA, beletrie', '', 'české']"
n605275085,O život princezny - Případy královského soudce Melichara,70,1,2018,216,Nakladatelství BRÁNA,beletrie,české</p>,,Známý autor více než 150 titulů (jako třeba Mrtvola v brnění nebo Klášterem obchází ďábel) přichází s novou knihou o případech královského soudce. Melichar se doma na roupovské...,186,259,"['Nakladatelství BRÁNA, beletrie', '', 'české']"
n609257276,Samorostka - Mlynářová Marcela,96,7,2018,208,Nakladatelství BRÁNA,beletrie,české</p>,,"Oblíbená autorka řady knížek (Důchodkyně nestřílejte, Z lodiček do holin aj.) přichází s dalším titulem, který přivítají především ženy ve zralém věku. Líčí své pojetí života,...",218,275,"['Nakladatelství BRÁNA, beletrie', '', 'české']"
n602695359,Zakázané uvolnění - Ludvíková Jitka,0,0,2018,192,Nakladatelství BRÁNA,beletrie,české</p>,,"Zakázané uvolnění je soubor hořkosladkých povídek o lásce, vášni, nenávisti, žárlivosti, bolesti i zklamání. Kniha ukazuje různé pohledy na partnerské vztahy a naše osobní...",186,259,"['Nakladatelství BRÁNA, beletrie', '', 'české']"
n620877205,Sny umírají s králi - Jindra Jaromír,100,1,2018,208,Nakladatelství BRÁNA,beletrie,české</p>,,"Historický román odehrávající se v první polovině 14. století, v neklidných dobách Českého království po vraždě Václava III. Kdo zavraždil posledního přemyslovského krále? Jaké...",188,269,"['Nakladatelství BRÁNA, beletrie', '', 'české']"
n651263908,Gigolo - Štedroň Jiří,0,0,2018,208,Nakladatelství BRÁNA,beletrie,české</p>,,"Dvě povídky napsané s jemným humorem, o dvou hrdinech, z nichž ani jeden není po většinu času tím, zač se vydává. Gigolo je ve skutečnosti talentovaný herec, který zprvu pod...",72,178,"['Nakladatelství BRÁNA, beletrie', '', 'české']"
n605474699,Kindervejce aneb Jak jsem se rozdvojila - Poncarová Petra,0,0,2018,232,Nakladatelství BRÁNA,beletrie,české</p>,,"Hlavní hrdinkou je mladá žena, kterou zajímá móda, hudba, film a další běžné záležitosti. Dokud nezatouží po dítěti. Přes tikající biologické hodiny však odmítá být jednou z...",186,259,"['Nakladatelství BRÁNA, beletrie', '', 'české']"
n612722504,Fatální omyl - Miroslav Jílek,0,0,2018,208,Nakladatelství BRÁNA,beletrie,české</p>,,"Herec, novinář a starý lékař, jenž oběma v časovém odstupu zkříží cestu, jsou hrdiny příběhu, který se odehrává v době, kdy se na vlně revolučních změn po roce 1989 rozbíjí...",71,232,"['Nakladatelství BRÁNA, beletrie', '', 'české']"
n622756154,Lazarův deník aneb Proč já? - Stanislav Brabec,0,0,2018,208,Nakladatelství BRÁNA,beletrie,české</p>,,"Co počít, když vás stále něco bolí, někde píchá, točí se vám hlava, je vám na zvracení, lékařská ordinace je vaším druhým domovem a vše, co se ve vašem okolí semele, nakonec...",181,259,"['Nakladatelství BRÁNA, beletrie', '', 'české']"
