db_id,name,rating,reviews_cnt,year,pages_cnt,publisher,genre,author,lang,description,price_from,price_to,unparsed
n39006288,Úžasný svět dinosaurů,98,5,2012,360,Triton,naučná,české</p>,,"Kniha, kterou právě držíte v ruce, by se neměla stát pouze dalším abecedním přehledem již dlouho známých forem dinosaurů. Vychází především z novějších poznatků, publikovaných...",191,299,"['Triton, naučná', '', 'české']"
n64715532,"Dietologie pro lékaře, farmaceuty Štěpán Svačina",83,1,2012,332,Triton,naučná,české</p>,,"Předkládaná publikace je určena lékařům, farmaceutům, zdravotním sestrám a především nutričním terapeutům, kterým by měla zprostředkovat základní orientaci v léčbě dietou a...",400,400,"['Triton, naučná', '', 'české']"
n57736763,Ostrovy génia - Darold A. Treffert,65,1,2012,392,Triton,naučná,české</p>,,"Co je to savantský syndrom? 
Jedná se o velmi vzácný stav, objevující se u osob postižených jednou či více vývojovými poruchami, včetně poruchy autistického spektra. Tito...",191,300,"['Triton, naučná', '', 'české']"
n54959722,Rodinná terapie - Philip Barker,0,0,2012,328,Triton,naučná,české</p>,,"V0215750
Od prvního vydání knihy Rodinná terapie uplynulo už více než třicet let. Za tu dobu prošla oblast rodinné terapie nezanedbatelným vývojem, cíl knihy však zůstává...",211,329,"['Triton, naučná', '', 'české']"
n62441095,O duši lékaře - Štěpán Svačina,83,2,2012,344,Triton,naučná,české</p>,,"Pociťovali jsme, že vstupujeme do výsostného hájemství, a těšili se, že dostaneme odpovědi na vtíravé a intimní otázky lidského bytí. Poznávání činnosti mozku bylo jednou z...",320,499,"['Triton, naučná', '', 'české']"
