db_id,name,rating,reviews_cnt,year,pages_cnt,publisher,genre,author,lang,description,price_from,price_to,unparsed
n74408294,Jak se píše o soudech a soudcích,0,0,2013,264,Leges,naučná,české</p>,,"Kolektivní monografie téměř dvaceti autorů nabízí různé pohledy na soudce jako rozhodovatele právních sporů i politického aktéra, a to jak na národní, tak i na mezinárodní či...",244,380,"['Leges, naučná', '', 'české']"
n115156553,Islámské rodinné právo se zaměřením na právo manželské - Lenka Bezoušková,0,0,2013,264,Leges,naučná,české</p>,,"Monografie nabízí první ucelený pohled na islámské rodinné právo, kdy středem pozornosti je právo manželské.

Úvodní část se věnuje pramenům islámského práva a právním školám,...",286,400,"['Leges, naučná', '', 'české']"
n91627104,Ochrana spotřebitele v České republice a Evropské unii,0,0,2013,272,Leges,naučná,české</p>,,"Praktická příručka se podrobně věnuje jednotlivým druhům tzv. spotřebitelských smluv, upravených v části první hlavě páté, § 51a a násl. občanského zákoníku, a to obecně...",308,490,"['Leges, naučná', '', 'české']"
n92195172,Zákon o trestní odpovědnosti právnických osob,0,0,2013,256,Leges,naučná,české</p>,,"Zákon č. 418/2011 Sb., o trestní odpovědnosti právnických osob a řízení proti nim přináší právnickým osobám novou, dosud neznámou formu odpovědnost, a to odpovědnost trestní....",314,450,"['Leges, naučná', '', 'české']"
n106466032,Mediální právo v informační společnosti - Ondřej Moravec,0,0,2013,288,Leges,naučná,české</p>,,"Publikace je věnována právní úpravě činnosti hromadných sdělovacích prostředků v době informační společnosti. Masové rozšíření přístupu k rychlému internetu, zvýšený podíl jeho...",314,440,"['Leges, naučná', '', 'české']"
n156240166,Aktuální problémy rodinněprávní regulace Renáta Šínová; Ondřej Šmíd; Marek Juráš,0,0,2013,304,Leges,naučná,české</p>,,"Kolektivní monografie se zaměřuje na problematické otázky právní úpravy rodičovství, výchovy a výživy nezletilého. Autoři upozorňují na stávající i budoucí právní regulaci v...",268,360,"['Leges, naučná', '', 'české']"
