db_id,name,rating,reviews_cnt,year,pages_cnt,publisher,genre,author,lang,description,price_from,price_to,unparsed
n416797313,Jaké prožitky mění náš mozek - Andrew Newberg,96,2,2016,240,Eugenika,naučná,české</p>,,"Dostává se vám do rukou mimořádně zajímavá kniha: její autoři na základě vědeckého výzkumu a skenování mozku vysvětlují, že pokud se věnujeme určitým praktikám, dojde k tomu,...",185,298,"['Eugenika, naučná', '', 'české']"
n382416993,"Bohové starých Slovanů. První kniha, která představuje naše stará božstva a příběhy s nimi spojené - Peter Weleslav Kuzmišín",93,1,2016,296,Eugenika,naučná,české</p>,,"Svarog, Perún, Veles - kdo by neznal tyto staré slovanské božství? To jsem si myslel původně i já předtím, než jsem začal pracovat na této knize. Přišel jsem však na to, že...",245,398,"['Eugenika, naučná', '', 'české']"
n405915525,Valerij Sineľnikov Odstraňování bloků rodové linie,100,3,2016,256,Eugenika,naučná,české</p>,,"Zajímavá kniha o našem původu, rodinných vazbách a podvědomých propojení s našimi předky. Kniha má neobvyklou formu: přepis školního vyučování na daná témata. Co znamená rod?...",191,277,"['Eugenika, naučná', '', 'české']"
n358606651,Psychické manipulace ve vztazích - Barbara E. Hort,63,2,2016,248,Eugenika,naučná,české</p>,,"Autorka pozoruhodně objasňuje, jak v mnoha lidech působí archetyp upíra, jenž není ničím jiným než nezralou osobností, která nezná opravdovou lásku, a proto se chová tak, jak...",198,268,"['Eugenika, naučná', '', 'české']"
n347885707,"Cestování v čase (Velitel X, Swartz Tim R.)",100,1,2016,256,Eugenika,naučná,české</p>,,"Kniha plná fascinujících příbehů o skutečných případech a zážitcích lidí, kteří se dostali do jiného časoprostoru, i dalších záhadných jevech na podobná témata. Co je to čas?...",198,308,"['Eugenika, naučná', '', 'české']"
n391666620,O životní moudrosti aneb Jak žít s lehkostí a vtipem - Josef Hlavička,0,0,2016,296,Eugenika,naučná,české</p>,,"Český autor - právník, který toho už má dost za sebou, dal dohromady praktickou moudrost s ambicí šťastněji žít, lépe se cítit a hlouběji se zamýšlet nad smyslem všeho....",230,358,"['Eugenika, naučná', '', 'české']"
n347891276,"Žít dlouho a dobře (Friedman Howard S., Ph.D., Martin Leslie R., Ph.D.)",0,0,2016,272,Eugenika,naučná,české</p>,,"Kniha plná překvapivých zvratů. Autoři rozebírají výzkum, při kterém se po dlouhou dobu zkoumali životy lidí, kteří se ve zdraví a při síle dožili vysokého věku. Významnými...",216,328,"['Eugenika, naučná', '', 'české']"
