db_id,name,rating,reviews_cnt,year,pages_cnt,publisher,genre,author,lang,description,price_from,price_to,unparsed
n556695141,Finanční účetnictví a výkaznictví podle mezinárodních standardů IFRS - Dana Dvořáková,90,1,2017,368,BizBooks,naučná,české</p>,,Aplikace mezinárodních standardů účetního výkaznictví (IFRS) v praxi není snadnou záležitostí zejména vzhledem k významným odlišnostem mezi tímto systémem a českými účetními...,383,549,"['BizBooks, naučná', '', 'české']"
n551752732,Jak se vyrábí dnešní svět - Václav Smil,0,0,2017,360,BizBooks,naučná,české</p>,,"Jaké úrovně ještě dosáhne spotřeba materiálů, kterou do výše ženou bohaté společnosti? Přináší relativní dematerializace absolutní pokles spotřeby materiálů? Na tyto a mnoho...",340,499,"['BizBooks, naučná', '', 'české']"
n522141707,S íla správného okamžiku - Michael Breus,0,0,2017,336,BizBooks,naučná,české</p>,,"Buďte v pravý čas na správném místě.
Víte, kdy je pro vás nejlepší pít kávu nebo si jít zaběhat?
Je pro vás výhodnější brzy vstávat, nebo pracovat dlouho do noci?
Existuje...",278,399,"['BizBooks, naučná', '', 'české']"
n490635098,Nastartujte mozek za 60 sekund - Michelle Schoffro-Cook,0,0,2017,400,BizBooks,naučná,české</p>,,"Nemyslí vám to? Nic si z toho nedělejte – někdy to takhle máme všichni. Je to logické: náš mozek je v dnešní době vystaven takové zátěži, jakou si naši předkové nedovedli...",243,349,"['BizBooks, naučná', '', 'české']"
n468846607,Blázinec v Silicon Valley - Antonio García Martínez,0,0,2017,432,BizBooks,naučná,české</p>,,"Dlouho utajovaný rukopis bývalého poradce Twitteru, produktového manažera Facebooku a zakladatele vlastního startupu je na světě.

Investoři jsou lidé, kteří mají víc peněz než...",248,449,"['BizBooks, naučná', '', 'české']"
n551752773,Sedmý smysl - Joshua Cooper Ramo,90,1,2017,320,BizBooks,naučná,české</p>,,Nekončící teror. Vlny uprchlíků. Nestabilní globální ekonomika. Překvapivé výsledky voleb. Zázračné pokroky v medicíně. Co když to všechno spolu nějak souvisí? A co když to lze...,278,399,"['BizBooks, naučná', '', 'české']"
