db_id,name,rating,reviews_cnt,year,pages_cnt,publisher,genre,author,lang,description,price_from,price_to,unparsed
n707610042,Adamův pád - Sandra Brown,0,0,2017,160,Ikar,beletrie,české</p>,,"Lila Masonová byla v posledních letech svědkem, jak se její starší sestra zamilovala, vdala a měla děti. Ona sama veškerou energii věnovala své profesi a vypracovala se na...",157,184,"['Ikar, beletrie', '', 'české']"
n563487896,Malá máma - Lenka Sadvarová,98,5,2017,120,Ikar,beletrie,české</p>,,"Být rodičem není jen tak – o tom už Malá máma něco ví. Její syn Lojzíček je pro ni nekonečný zdroj inspirace, kterou přetváří do vtipných komiksů. Jak je možné, že se dítě...",142,161,"['Ikar, beletrie', '', 'české']"
n108373679,Návrat domů,90,7,2017,168,Ikar,beletrie,české</p>,,"Judith Dunbarová se nikdy netěšila bezpečí opravdového rodinného života – postihl ji stejný osud jako mnoho dalších v době, kdy Británie byla koloniální mocností. Narodila se a...",157,199,"['Ikar, beletrie', '', 'české']"
n461438325,"Ranní rosa - al-Ahdalová Nada, al-Salamíová Chadídža",0,0,2017,116,Ikar,beletrie,české</p>,,"Skutečný příběh popisuje osud jemenské dívky, kterou rodiče z finančních důvodů chtěli v jejích čtrnácti letech provdat za staršího zámožného Saúda, aby si pomohli z finanční...",142,179,"['Ikar, beletrie', '', 'české']"
n490171995,Anna zachraňuje svět - Michaela Štěchová,0,0,2017,160,Ikar,beletrie,české</p>,,"Anna zachraňuje svět kniha od autora Štěchová Michaela. Mladá dobrovolnice Anna přijíždí učit angličtinu do lombocké školy v Indonésii, kterou podporuje nezisková organizace z...",157,199,"['Ikar, beletrie', '', 'české']"
n478695833,Černý velbloud - Ash Kateřina,100,1,2017,160,Ikar,beletrie,české</p>,,"Sedmnáctiletá Sára, která po matčině smrti vyrůstá u tety, se dozvídá, že její otec je významný syrský hodnostář. Když v Sýrii vypukne válka, zjistí Sára, že se kolem ní...",157,199,"['Ikar, beletrie', '', 'české']"
n580469317,Narozená v devadesátkách - Denisa Benešová,40,1,2017,160,Ikar,beletrie,české</p>,,"Narozená v devadesátkách Denisy Benešové je sbírkou úvah a životních postřehů prostoupených jak výjimečným obdivem k životu, tak nevyvratitelnou nervozitou z jeho konce....",197,249,"['Ikar, beletrie', '', 'české']"
