db_id,name,rating,reviews_cnt,year,pages_cnt,publisher,genre,author,lang,description,price_from,price_to,unparsed
n306711481,Diktátoři černého kontinentu - Martin Nekola,0,0,2016,191,Libri,naučná,české</p>,,"Diktátoři černého kontinentu

Tématem knihy, poněkud exotickým pro českého čtenáře, jsou nedemokraticky vládnoucí muži ve dvaadvaceti vybraných afrických státech (např....",160,250,"['Libri, naučná', '', 'české']"
n435736785,Environmentální spolupráce jako nástroj transformace konflik...,0,0,2016,192,Libri,naučná,české</p>,,"Šest případových studií, na nichž je testována koexistence environmentální spolupráce s politickým konfliktem (Indie-Pákistán, Korea-Korea, Arménie-Ázerbájdžán, Čína-Taiwan,...",128,180,"['Libri, naučná', '', 'české']"
n456868047,Zahraniční politika Slovinska,0,0,2016,204,Libri,naučná,české</p>,,"Kniha se zaměřuje na etablování Slovinska jako samostatného aktéra mezinárodních vztahů po jeho vystoupení z jugoslávské federace.
Analýza sleduje procesy formulování a...",136,190,"['Libri, naučná', '', 'české']"
