db_id,name,rating,reviews_cnt,year,pages_cnt,publisher,genre,author,lang,description,price_from,price_to,unparsed
n627165128,O chalupách a lidech - České chalupářství v období tzv. normalizace a transformace - Schindler-Wisten Petra,0,0,2017,212,Karolinum,naučná,české</p>,,S chalupařením se přímo či zprostředkovaně setkala většina české populace. Trávení volného času v objektech tzv. druhého bydlení je považováno za přirozenou součást životního...,195,270,"['Karolinum, naučná', '', 'české']"
n493465882,Fučíková Eliška - Praha renesanční,0,0,2017,184,Karolinum,naučná,české</p>,,"Autorka v této publikaci načrtává obraz Prahy z doby, kdy z českého trůnu vládli Jagellonci a první Habsburkové. Od poslední třetiny 15. století a v průběhu století šestnáctého...",259,350,"['Karolinum, naučná', '', 'české']"
n501529344,K teorii vojenského plavání - Karel Sýkora,0,0,2017,174,Karolinum,naučná,české</p>,,Vojenské plavání je jednou ze součástí speciální tělesné přípravy v Armádě České republiky. Jedná se o soubor znalostí a dovedností potřebných k účelnému a efektivnímu...,176,223,"['Karolinum, naučná', '', 'české']"
n474404541,Populismus v časech krize Jiří Kocián,0,0,2017,228,Karolinum,naučná,české</p>,,"Populismus se v posledních letech stal jedním z klíčových konceptů politiky. Zejména volby do Evropského parlamentu v květnu 2014 se staly mezníkem, po kterém se z populismu...",193,260,"['Karolinum, naučná', '', 'české']"
n673227368,Evropská integrace z pohledu teorie veřejné volby - Marek Loužek,0,0,2017,206,Karolinum,naučná,české</p>,,"Evropská integrace není a priori nic dobrého ani špatného. Jde o výsledek střetávání různých zájmů. V posledních letech však nelze nevidět, že se Evropská unie dostala do...",151,293,"['Karolinum, naučná', '', 'české']"
n579716270,Praha secesní - Petr Wittlich,100,1,2017,192,Karolinum,naučná,české</p>,,"Na přelomu 19. a 20. století prochází Praha zásadní proměnou: stává se opět reprezentačním centrem života českého národa a vyrůstá ve velkoměsto s požadavky modernosti, jež se...",267,360,"['Karolinum, naučná', '', 'české']"
n576639413,"Lékařská biologie a genetika II. díl - Kohoutová, Milada; Otová, Berta",0,0,2017,204,Karolinum,naučná,české</p>,,"Učební texty Lékařská biologie a genetika jsou zaměřeny především na genetické problémy, které jsou významné pro studium medicíny; shrnují základní poznatky rozsáhlého a...",204,218,"['Karolinum, naučná', '', 'české']"
n673189556,SOS - Sociologie pro pomáhající profese,0,0,2017,174,Karolinum,naučná,české</p>,,"Publikace je učebnicí sociologie aplikované v oblasti zdravotnictví a sociálních služeb. Je určena všem, kdo pracují v pomáhajících profesích a pomáhajícím prostředí, pro...",185,250,"['Karolinum, naučná', '', 'české']"
n673189557,"Skejuš * Skejušané * Skejušan - Rusíni v Chomutově, původ, historie a současnost + CD",0,0,2017,202,Karolinum,naučná,české</p>,,"Interdisciplinární publikace Skejuš, Skejušané, Skejušan. Rusíni v Chomutově, původ, historie, současnost se věnuje tématu v několika rovinách. Nejprve se autoři vyjadřují ke...",144,260,"['Karolinum, naučná', '', 'české']"
n695113615,Druhá republika: 167 obyčejných dní - Politické a mediální klima a jeho reflexe - Barbara Köpplová,0,0,2017,200,Karolinum,naučná,české</p>,,"Politické a mediální klima a jeho reflexe. Období druhé republiky bývá zpracováváno především v rovině politických dějin, jsou zkoumány příčiny a důsledky mnichovské dohody,...",186,260,"['Karolinum, naučná', '', 'české']"
n579716264,Smrt: Esej o konečnosti - Francoise Dasturová,0,0,2017,196,Karolinum,naučná,české</p>,,"Člověk ví, že musí zemřít, a toto vědomí patří mezi základní charakteristiky lidskosti, náboženství, metafyzika a kultura si však kladou za cíl smrt přemoci. Západní filosofie...",207,280,"['Karolinum, naučná', '', 'české']"
n673188678,Vztahy Československa a Maďarska v letech 1918 - 1939 – Pejša Robert,0,0,2017,180,Karolinum,naučná,české</p>,,Monografie Vztahy Československa a Maďarska v letech 1918-1939 přehodnocuje vnímání hlavních politických a kulturně-společenských tendencí meziválečných vztahů Československa a...,193,260,"['Karolinum, naučná', '', 'české']"
n479304722,Náročné otcovství - Miloň Potměšil,0,0,2017,220,Karolinum,naučná,české</p>,,"Publikace přináší analýzu role a postojů mužů-otců dětí se zdravotním postižením. Parciální výzkumy přinášejí výsledky, které by měly sloužit jako základ pro...",207,280,"['Karolinum, naučná', '', 'české']"
n572073791,Laudabile Carmen část II.,0,0,2017,174,Karolinum,naučná,české</p>,,Druhá část učebního textu (Laudabile Carmen) je pojata jako uvedení do četby římské poezie a první seznámení s myšlením o literatuře a rétorice v antickém Římě; je proto...,180,260,"['Karolinum, naučná', '', 'české']"
n676036642,Kapitoly z dějin klasické anatomie I,0,0,2017,192,Karolinum,naučná,české</p>,,"Anatomické poznatky se tvoří již přes 2000 let, publikace se zabývá antickými počátky oboru, sleduje klíčové osobnosti působící v Egyptě, Řecku a Římě. Zachované anatomické...",123,220,"['Karolinum, naučná', '', 'české']"
n575641117,Golfová hra v proměnách času. Kapitoly z historie a současnosti českého a světového golfu - Andrej Halada,0,0,2017,238,Karolinum,naučná,české</p>,,"Publikace představuje historii a současnost golfu v českém prostoru, zároveň se dotýká jeho minulosti a rozvoje i v evropském kontextu. Jde o jednu z vůbec prvních prací v...",216,276,"['Karolinum, naučná', '', 'české']"
n588288397,Moderní rétorika na univerzitě - Alena Špačková,0,0,2017,192,Karolinum,naučná,české</p>,,"Práce zdůvodňuje zařazení předmětu Moderní rétorika do osnov vysokých škol, osvětluje hlavní cíle a význam předmětu pro budoucí praxi absolventů, ozřejmuje pedagogická...",215,290,"['Karolinum, naučná', '', 'české']"
n470557310,"Vzdělání a dnešek - Martin Strouhal, Stanislav Štech",0,0,2017,226,Karolinum,naučná,české</p>,,"Monografie Vzdělání a dnešek představuje texty českých a slovenských VŠ učitelů a badatelů v oblasti pedagogiky, psychologie, sociologie a filosofie výchovy, kteří se zabývají...",200,317,"['Karolinum, naučná', '', 'české']"
n583618686,Životní styl české mládeže - Pavel Tilinger,0,0,2017,202,Karolinum,naučná,české</p>,,"Předkládaná monografie přináší odpovědi na otázky spojené se studiem životního stylu, pohybové aktivity a motorické výkonnosti české mládeže. Vyhodnocuje aktuální účast české...",199,250,"['Karolinum, naučná', '', 'české']"
n474509434,Populismus v časech krize - Jiří Kocián,0,0,2017,228,Karolinum,naučná,české</p>,,"Populismus se v posledních letech stal jedním z klíčových konceptů politiky. Zejména volby do Evropského parlamentu v květnu 2014 se staly mezníkem, po kterém se z populismu...",225,260,"['Karolinum, naučná', '', 'české']"
n673234050,Medical English 2 - Alena Holá,0,0,2017,184,Karolinum,naučná,české</p>,,Druhý díl rozšířeného a doplněného vydání učebnice Medical English: Medicine and Health Care je primárně zpracován pro volitelný předmět Angličtina pro lékařskou praxi a...,231,260,"['Karolinum, naučná', '', 'české']"
