db_id,name,rating,reviews_cnt,year,pages_cnt,publisher,genre,author,lang,description,price_from,price_to,unparsed
n468513645,Dobří sousedé - A.J. Banner,0,0,2017,248,KNIHA ZLÍN,beletrie,české</p>,,"Psychologický thriller, který navždy změní pohled na lidi, jež jsou vám nejblíže. Shadow Cove je městečko, ve kterém by snad chtěl žít každý – má malebné uličky, obklopují ho...",236,339,"['KNIHA ZLÍN, beletrie', '', 'české']"
n520641736,Pláč Helen FitzGeraldová,0,0,2017,276,KNIHA ZLÍN,beletrie,české</p>,,Pláč kniha od autora Helen Fitzgeraldová. Joanna a Alistair čelí největší noční můře všech rodičů. Vyšetřování únosu jejich malého Noaha se rozbíhá na plné obrátky a mediální...,149,289,"['KNIHA ZLÍN, beletrie', '', 'české']"
n545326335,"Všechno, co si nepamatuju - Jonas Hassen Khemiri",0,0,2017,280,KNIHA ZLÍN,beletrie,české</p>,,"Nejlepší švédský román roku 2015! Úchvatný příběh o lásce, lidské paměti a smyslu naší existence.

Vynalézavě, vtipně a zároveň tajemně splétá fiktivní spisovatel příběh...",208,299,"['KNIHA ZLÍN, beletrie', '', 'české']"
n468119512,Mistrovské dílo náhody (Michael Kimmelman),0,0,2017,290,KNIHA ZLÍN,beletrie,české</p>,,"Kniha představuje soubor deseti samostatných esejů, v nichž se Michael Kimmelman, americký teoretik a kritik umění, zamýšlí nad rolí umění v lidském životě, a to nejen z...",215,370,"['KNIHA ZLÍN, beletrie', '', 'české']"
n514570676,Následky - Nina Weijersová,90,1,2017,272,KNIHA ZLÍN,beletrie,české</p>,,"Minnie Panisová, kdysi maličkatý, sotva životaschopný novorozenec v inkubátoru, je mladá uznávaná konceptuální umělkyně. Jako základní materiál používá vlastní život, ze...",217,270,"['KNIHA ZLÍN, beletrie', '', 'české']"
n476819566,Vraždaplán Karel C. Grig,0,0,2017,246,KNIHA ZLÍN,beletrie,české</p>,,Po surovém nočním útoku na mladou ženu padá na Město tíseň. Dává tím dávno zmizelá hlava podsvětí signál o svém návratu? A musí se nevyřízených účtů obávat i bývalý policejní...,173,225,"['KNIHA ZLÍN, beletrie', '', 'české']"
n476481167,Vraždaplán - Karel C. Grig,0,0,2017,246,KNIHA ZLÍN,beletrie,české</p>,,"Napínavý detektivní příběh, v němž stárnoucí detektiv Eda řeší vraždy svých spolužáků, které prorůstají i do světa českého organizovaného zločinu.

Po surovém nočním útoku na...",212,249,"['KNIHA ZLÍN, beletrie', '', 'české']"
