db_id,name,rating,reviews_cnt,year,pages_cnt,publisher,genre,author,lang,description,price_from,price_to,unparsed
n44536609,Tak nevím,0,0,2011,152,Motto,beletrie,české</p>,,"Tak nevím kniha od autora Jiří Menzel. Kniha světově proslulého filmového a divadelního režiséra a herce je výborem nejlepších fejetonů z knih Tak nevím a Tak nevím podruhé,...",139,258,"['Motto, beletrie', '', 'české']"
n699309705,Čarodějnický slabikář,0,0,2011,152,Motto,beletrie,české</p>,,"Zkuste to! Staňte se čarodějnicí! Základům magie vás naučí opravdová čarodějnice, v jejíž rodině se toto umění dědí z matky na dceru. Čarodějnictví – už jen to pouhé slovo...",84,185,"['Motto, beletrie', '', 'české']"
n30153991,Jak být šťastný,100,1,2011,168,Motto,beletrie,české</p>,,"Jak být šťastný kniha od autora Halina Pawlowská. Knížka plná lehkých poznatků, vyslechnutých osudů a rad, které si dávají kamarádky, kamarádi, rodiče, děti a známí. Neberte...",127,199,"['Motto, beletrie', '', 'české']"
n25982821,Povídání o detektivkách,100,3,2011,160,Motto,beletrie,české</p>,,"Povídání o detektivkách kniha od autora P.D. Jamesová. V této knize nabízí P. D. Jamesová, jedna z nejslavnějších a nejoblíbenějších britských spisovatelek, své osobní dějiny...",19,249,"['Motto, beletrie', '', 'české']"
n25140699,Máslo na hlavě,65,1,2011,160,Motto,beletrie,české</p>,,"Třiatřicetiletá mírně neurotická překladatelka Dana o sobě často pochybuje. Situace, ve kterých se ocitá, se obvykle vyvíjejí úplně jinak, než sama očekávala, a často končí...",84,99,"['Motto, beletrie', '', 'české']"
n29602560,Prostředky zla a jiné povídky,0,0,2011,168,Motto,beletrie,české</p>,,V pěti povídkách musí Wexford se svým týmem vyřešit zcela odlišné záhady a poradit si se zdánlivě nesourodými stopami. Jak souvisí otrava houbami s nepochopitelnou sebevraždou...,151,169,"['Motto, beletrie', '', 'české']"
n459948687,Hroši nepláčou,0,0,2011,160,Motto,beletrie,české</p>,,"Hroši nepláčou kniha od autora Halina Pawlowská. Sbírka známých i neznámých povídek a fejetonů populární spisovatelky, scenáristky a moderátorky. Halina Pawlowská umí být...",178,188,"['Motto, beletrie', '', 'české']"
n25982920,Příliš osobní známost,96,3,2011,160,Motto,beletrie,české</p>,,"Hrdinkou románu je svobodná třicátnice, vyrovnaná a spokojená, s dobrou kariérou a okruhem přátel a známých, které má ráda. Potkává vdovce Marka s malým děvčátkem. Láska na sebe...",199,199,"['Motto, beletrie', '', 'české']"
