db_id,name,rating,reviews_cnt,year,pages_cnt,publisher,genre,author,lang,description,price_from,price_to,unparsed
n432399962,"Slepičí polévka pro duši. Všechny příběhy z prvního slavného vydání + 20 nových - Amy Newmarková, Jack Canfield, Mark Victor Hansen",100,5,2016,408,Práh,naučná,české</p>,,"Jubilejní reedice prvního vydání… s 20 novými příběhy na dalších 20 let! 

Kultovní bestseller, kterým to všechno začalo 

 

První vydání Slepičí polévky pro duši od autorů...",204,299,"['Práh, naučná', '', 'české']"
n673172865,Léčba zemí - Průvodce výchovou zdravých dětí v nezdravém světě,0,0,2016,328,Práh,naučná,české</p>,,"Přelomová kniha, která navždy změní váš pohled na péči o zdraví dítěte. 
V době, kdy se dětem předepisuje stále víc léků, převrací dr. Shetreatová-Kleinová na hlavu lékařská...",231,289,"['Práh, naučná', '', 'české']"
n455349694,"Jak přelstít Alzheimera - Co můžete udělat, abyste snížili riziko této nemoci? - Kosik Kenneth S., Bowmanová Alisa",0,0,2016,400,Práh,naučná,české</p>,,"Co můžete udělat, abyste snížili riziko této nemoci?

MUDr. Kenneth S. Kosik, Alisa Bowmanová

 

Univerzální pomocník pro boj s touto čím dál rozšířenější nemocí.

Přečtěte si...",252,369,"['Práh, naučná', '', 'české']"
n433809794,Práh s.r.o. Jana z Arku - Proměněný život,0,0,2016,368,Práh,naučná,české</p>,,"Nesmrtelný příběh o síle lidské odvahy.

Hluboce inspirativní a plně zdokumentovaný příběh Jany z Arku, kterou roku 1428 „hlasy“ přiměly k tomu, aby sjednotila francouzský...",316,399,"['Práh, naučná', '', 'české']"
n396276506,"Zlaté hroty - Dana Zátopková, Jan Železný, Barbora Špotáková, Vítězslav Veselý - Železný Jan",0,0,2016,360,Práh,naučná,české</p>,,"Hod oštěpem je zlatou českou disciplínou. Jsme v ní světovou velmocí a držíme oba světové rekordy. Teď se českému oštěpu konečně dostává důstojné knižní monografie.

-...",319,359,"['Práh, naučná', '', 'české']"
