db_id,name,rating,reviews_cnt,year,pages_cnt,publisher,genre,author,lang,description,price_from,price_to,unparsed
n259851376,Muž se psem Jirotka Zdeněk,85,1,2014,248,Akcent,beletrie,Zdeněk Jirotka</p>,,"Neprávem opomíjená parodie na detektivní romány z pera českého satirika, autora Saturnina. Amatérský detektiv, civilním povolání strážce majáku, pátrá po finančním...",135,199,"['Akcent, beletrie', '', 'české, Zdeněk Jirotka']"
n201061261,Láska s chutí pelyňku Řeháčková Věra,0,0,2014,248,Akcent,beletrie,Věra Řeháčková</p>,,"Blanka má srdeční vadu a žije samotářsky. V novém bydlišti pak prožívá svou první velkou lásku. Záhy se dočká zklamání a nevěří, že je schopna se znovu zamilovat. Ale protože...",138,245,"['Akcent, beletrie', '', 'české, Věra Řeháčková']"
n479647687,Lovy na Vysočině - Josef Novák,0,0,2014,298,Akcent,beletrie,Josef Novak</p>,,"V0237319
Kniha Lovy na Vysočině vznikala postupně z velké řady zápisků autora, které si vede už od prvních svých vycházek se zbraní do přírody. Podkladem mu jsou proto zcela...",172,269,"['Akcent, beletrie', '', 'české, Josef Novak']"
n259851746,Drahomír Rybníček-Vydavatelství AKCENT Na Vánoce dlouhý noce,75,2,2014,264,Akcent,beletrie,Kolektiv autorů</p>,,"Knížka vánočního čtení - napsaná více než dvěma tucty autorů. Spisovateli a spisovatelkami, kteří žili v dobách Vánoc doprovázených mnoha zvyky a pověrami, koledou, průvody...",168,259,"['Akcent, beletrie', '', 'české, Kolektiv autorů']"
n160456334,Příběhy domu Březinová Taťana,0,0,2014,268,Akcent,beletrie,Březinová Taťána</p>,,"V0235710
Děj knihy se odehrává na pozadí reality našich dnů, do nichž zasáhne stín metylalkoholové aféry.

Do nenápadného domu se nastěhuje student ekonomie Olda. Chce se tak...",166,259,"['Akcent, beletrie', '', 'české, Březinová Taťána']"
n455348773,Nejbohatší žena světa - Kavčiak Vladimír,0,0,2014,248,Akcent,beletrie,Kavčiak Vladimír</p>,,"Nejbohatší žena světa je detektivka, která se odehrává v Monte Carlu, New Yorku a na jednom z Karibských ostrovů. Mediální magnát John Spencer si najme detektiva Gery Monteira,...",159,249,"['Akcent, beletrie', '', 'české, Kavčiak Vladimír']"
