db_id,name,rating,reviews_cnt,year,pages_cnt,publisher,genre,author,lang,description,price_from,price_to,unparsed
n455349961,Batman - Soví tribunál - Snyder Scott,0,0,2013,176,Crew,beletrie,české</p>,,"Batman samozřejmě slyšel příběhy o gothamském Sovím tribunálu. O společenství, které se schází v hlubokých stínech a používá noční dravce jako svou vizitku. Slyšel o tom, že...",298,449,"['Crew, beletrie', '', 'české']"
n460962328,Bleach 8: The Blade and Me,0,0,2013,192,Crew,beletrie,české</p>,,"Zatímco se v Soul Society schyluje k Rukiině popravě, Ičigo se pod Uraharovým dohledem snaží získat schopnosti potřebné k jejímu vysvobození. Trénink však zdaleka nejde tak...",125,189,"['Crew, beletrie', '', 'české']"
n460974701,Usagi Yojimbo - Otcové a synové,0,0,2013,184,Crew,beletrie,české</p>,,V knize Otcové a synové dodává světově proslulý vypravěč Stan Sakai dobrodružstvím Usagiho Yojimba nový palčivý rozměr. Králičí ronin už za svého života podstoupil řadu...,152,229,"['Crew, beletrie', '', 'české']"
n465144958,Bleach 6 - Tite Kubo,0,0,2013,192,Crew,beletrie,české</p>,,"Konkurenční bojovníci se musí spojit, aby zastavili obřího Hollowa. Ičigo musí překonat hranice svých schopností a dostat se na další úroveň... ale bez pomoci bývalého...",125,189,"['Crew, beletrie', '', 'české']"
n477061863,Lucifer 4 - Božská komedie,100,1,2013,192,Crew,beletrie,české</p>,,"Lucifer, bývalý oblíbenec Nebe a vysloužilý vládce Pekla, nebyl nikdy příliš nakloněn kompromisům. A to se ani teď, když si vytvořil vlastní vesmír, příliš nezměnilo. Ve...",391,530,"['Crew, beletrie', '', 'české']"
