db_id,name,rating,reviews_cnt,year,pages_cnt,publisher,genre,author,lang,description,price_from,price_to,unparsed
n550819869,Atlas Kniha,87,4,2017,48,Mladá fronta,dětské,české</p>,,"ATLAS - OMALOVÁNKY, vymaluj si celý svět

	 

	S těmito úžasně barevnými omalovánkami velikosti plakátu se děti doslova promalují celým světem. Krásné mapy jsou plné staveb,...",191,299,"['Mladá fronta, dětské', '', 'české']"
n461289456,Nela a růžová velryba,0,0,2017,120,Mladá fronta,dětské,české</p>,,"Půvabný příběh o přátelství malé holčičky a neobyčejné velrybky. Malá Nela žije s rodiči v krásném domě u moře, ale často je smutná, protože nemá žádného kamaráda. Netuší, že...",149,229,"['Mladá fronta, dětské', '', 'české']"
n461289436,Pan Brambora a jeho kamarádi,80,2,2017,144,Mladá fronta,dětské,české</p>,,"Vydejte se na plavbu s kulaťoučkým panem Bramborou a jeho kumpány - panem Rajčetem, Rošťandou Slunečnicí, paní Kukuřicí a nerozlučnou dvojkou slečnou Vanilkou a Bobem Kakaovým...",194,299,"['Mladá fronta, dětské', '', 'české']"
n461289441,Všechno na světě,77,4,2017,64,Mladá fronta,dětské,české</p>,,"Prohlédněte si ukázku této nádherné obrázkové knížky. Největší a nejvtipnější obrázkový slovník pro děti i dospělé! Tahle kniha vás vezme za srdce, jen jak ji otevřete. Žádnou...",259,399,"['Mladá fronta, dětské', '', 'české']"
n550182111,Snídal drak bramborák - Pohádkové básničky pro kluky i holčičky - Šotolová Alena,0,0,2017,48,Mladá fronta,dětské,české</p>,,"Nejznámější a nejoblíbenější pohádky vypráví autorka ve verších, které svým laděním připomenou klasika české poezie pro děti – Františka Hrubína. V hravých a snadno...",175,242,"['Mladá fronta, dětské', '', 'české']"
n461289438,Na památku pro maminku,0,0,2017,32,Mladá fronta,dětské,české</p>,,"Od srdce vyráběný památníček – dejte mamince najevo, že ji máte rádi

Díky tomuhle bohatě ilustrovanému památníčku určenému k dotvoření se z holčiček a kluků na chvíli stanou...",129,199,"['Mladá fronta, dětské', '', 'české']"
n550819870,Pastelkopedie Kniha,0,0,2017,96,Mladá fronta,dětské,české</p>,,"Poznávej svět, zatímco si vybarvuješ! Omalovánky a encyklopedie v jednom

Tahle knížka je přímo napěchovaná zajímavými fakty a úžasnými obrázky k vymalování a zaručeně zabaví...",162,260,"['Mladá fronta, dětské', '', 'české']"
n461015302,Taneční studio 1.,0,0,2017,48,Mladá fronta,dětské,české</p>,,"V taneční škole se pořád něco děje!
Julie, Lucka i Alia mají v hlavě jen tancování. A taky trochu učitele hip hopu Kadera. A Lucka taky trochu dorty a všechno, co je k jídlu....",129,179,"['Mladá fronta, dětské', '', 'české']"
n556381653,Letiště Kniha,90,1,2017,32,Mladá fronta,dětské,české</p>,,"Jazyk: český
Rok vydání: 2017
Vazba / Podoba: Brožovaná bez přebalu matná
Sortiment: 
Nakladatelství: MLADÁ FRONTA, a.s.",319,449,"['Mladá fronta, dětské', '', 'české']"
n461289440,Velikáni do kapsy,100,1,2017,168,Mladá fronta,dětské,české</p>,,"Tomáš Garrigue Masaryk očima slečny Alice a mistra Viktora
První prezident samostatného Československa působí na všech fotografiích velice vážně. Však také vykonal velice vážné...",129,199,"['Mladá fronta, dětské', '', 'české']"
n461015287,Rok s Lízou a Pupíkem,83,2,2017,56,Mladá fronta,dětské,české</p>,,"Třetí kniha kočky Lízy a psa Pupíka, oblíbených dětských postaviček, je sbírkou všemožných zábavných ilustrovaných příhod, které se jim dějí v průběhu celého roku. Od barvení...",129,199,"['Mladá fronta, dětské', '', 'české']"
n550337783,Malá baletka - Rosa a kouzelný sen - Bussellová Darcey,0,0,2017,96,Mladá fronta,dětské,české</p>,,"Podaří se Rose utéct ze zamčené věže a zabránit Zlé víle, aby se stala královnou?

Rosa se spolu s nejlepší kamarádkou Olivií zúčastní konkurzu do Královské baletní školy v...",123,189,"['Mladá fronta, dětské', '', 'české']"
n550819871,Vesmír ve 30 sekundách Kniha,0,0,2017,96,Mladá fronta,dětské,české</p>,,Perfektní knížka pro zvídavé nadšence a obdivovatele vesmíru Vydejte se s námi za hranice našeho světa a objevujte tajemství vesmíru. Pomocí názorných obrázků a stručných...,181,279,"['Mladá fronta, dětské', '', 'české']"
n550868490,Dárečky od srdce,0,0,2017,80,Mladá fronta,dětské,české</p>,,"Přesvědčte se na vlastní kůži, že vlastnoručně vyrobený dárek zahřeje u srdce nejen obdarovaného, ale i vás. Tahle knížka nabízí přes 50 fantastických tipů na dárky, ozdoby a...",175,224,"['Mladá fronta, dětské', '', 'české']"
n550868493,Lidské tělo,90,1,2017,0,Mladá fronta,dětské,české</p>,,"Jazyk: český
Rok vydání: 2017
Vazba / Podoba: Pevná bez přebalu matná
Sortiment: 
Nakladatelství: MLADÁ FRONTA, a.s.",259,379,"['Mladá fronta, dětské', '', 'české']"
n461289437,Tak chutná duha,100,1,2017,80,Mladá fronta,dětské,české</p>,,"Tak chutná duha - Dětská kuchařka kniha od autora neuveden. Pro malé kuchtíky – více než 20 receptů na dobroty z ovoce a zeleniny
Dopřejte dětem vyzkoušet si, jestli je vaření...",162,249,"['Mladá fronta, dětské', '', 'české']"
n550868487,"Božena Němcová očima kluka, který nechtěl číst Babičku - Velikáni do kapsy - Tomáš Němeček",93,4,2017,144,Mladá fronta,dětské,české</p>,,"Nejslavnější česká spisovatelka je dnes postrachem lecjakého školáka, kterého nebaví povinná četba. Ale věděli jste, že na Boženu Němcovou nasadila rakouská císařská policie...",129,189,"['Mladá fronta, dětské', '', 'české']"
n550905977,Země ve 30 sekundách - Anita Ganeri,0,0,2017,96,Mladá fronta,dětské,české</p>,,"Připravte se na vzrušující výpravu po zázracích naší planety a prozkoumejte každý centimetr Země. Knížka se věnuje 30 zajímavým tématům, která by žádnému mladému pozemšťanovi...",181,279,"['Mladá fronta, dětské', '', 'české']"
n550337781,Špekáčkova psí akademie - Švestka a zloděj klobásek - Lewisová Gill,0,0,2017,128,Mladá fronta,dětské,české</p>,,"V prvním díle fungl nové série se seznámíte s žáčky Špekáčkovy psí akademie – partou kurážných štěňat, která se tu učí, jak se stát pracovním psem a být užitečný. Jako první se...",129,199,"['Mladá fronta, dětské', '', 'české']"
n461015291,Malá baletka Rosa a zvláštní cena,100,1,2017,96,Mladá fronta,dětské,české</p>,,"Dobrodružství Rosy v Zemi kouzel se tentokrát odehrává zčásti ve vodní říši. Králi moří Neptunovi někdo ukradl drahocenné žezlo, které kdysi vyhrál v šermířském souboji nad...",123,189,"['Mladá fronta, dětské', '', 'české']"
n558468203,Doktor Plyšák. Staňte se veterinářem - Deanna F. Cooková,0,0,2017,80,Mladá fronta,dětské,české</p>,,"Otevřete si v pokojíku vlastní veterinární kliniku – zařiďte si čekárnu, ordinaci, zotavovací místnost i lékárnu – a ošetřujte svým plyšovým kamarádům bolístky! Dozvíte se, jak...",162,249,"['Mladá fronta, dětské', '', 'české']"
n461015288,Kája a Oliva Lámou rekordy,90,1,2017,120,Mladá fronta,dětské,české</p>,,"Oliva se zkrátka nudí, až jí jednoho dne paní učitelka přinese knihu světových rekordů a ona se dozví o největších, nejmenších a nejzvláštnějších věcech na světě. Brzo propadne...",129,199,"['Mladá fronta, dětské', '', 'české']"
n475666768,"Dobrou noc, můj hrdino! - Kateřina Závadová",0,0,2017,160,Mladá fronta,dětské,české</p>,,"Tatínku, ještě se mi nechce spát… nakresli mi pohádku! Ale ať je to pořádné dobrodružství!

	Pohádky se před spaním dají nejen vyprávět, ale i kreslit. A může to být veliké...",169,249,"['Mladá fronta, dětské', '', 'české']"
n550182127,Dancing Girls - Šarlota na to kápne - Abidiová Heike,100,1,2017,104,Mladá fronta,dětské,české</p>,,"Šarlota je na vrcholu blaha, když může stepovat, až se otřásá podlaha. A závěrečného tanečního workshopu týden před prázdninami už se nemůže dočkat. Ostatní dívky však stepu...",146,229,"['Mladá fronta, dětské', '', 'české']"
n550337779,Bruno šampionem - Smith Alex T.,0,0,2017,104,Mladá fronta,dětské,české</p>,,"Bruno šampionem kniha od autora Alex T. Smith. Bruno je dnes neposedný jako pytel blech! Už se nemůže dočkat, až se zúčastní veleobřího sportovního dne. Moc rád by si odnesl...",116,179,"['Mladá fronta, dětské', '', 'české']"
n461015290,Zvířecí nemocnice,100,1,2017,144,Mladá fronta,dětské,české</p>,,"Márinka má velký sen. Touží se stát zvěrolékařkou. V tatínkově ordinaci je nepostradatelnou pomocnicí už teď. Dává pít zvířátkům z lahve, měří jim teplotu a přikládá obvazy....",149,229,"['Mladá fronta, dětské', '', 'české']"
n461015286,Bruno před kamerou,0,0,2017,104,Mladá fronta,dětské,české</p>,,"Hravé hopsání na trampolíně se změní v mnohem napínavější zážitek, když pejsek Bruno zjistí, že se v jejich ulici natáčí dobrodružný film s gorilou v hlavní roli. Se svým...",116,179,"['Mladá fronta, dětské', '', 'české']"
n461289439,"Věda, to je brnkačka!",0,0,2017,96,Mladá fronta,dětské,české</p>,,"Desítky experimentů, které vás chytnou a nepustí!. esítky experimentů, které vás chytnou a nepustí!
Chcete-li se stát vědcem, nepotřebujete k tomu zkumavky přetékající...",152,239,"['Mladá fronta, dětské', '', 'české']"
n461289457,ČOKO & KEKS,10,1,2017,136,Mladá fronta,dětské,české</p>,,Čoko a Keks - Hlava plná neplech kniha od autora Kolbová Suza. Nový domov? Shetlandským poníkům Čokovi a Keksovi se to pranic nelíbí. Ale šéfová dostala místo daleko od toho...,168,259,"['Mladá fronta, dětské', '', 'české']"
n546115062,Roztoč to se spinnerem! - 50 super triků a cool aktivit - David King z GeekBite,0,0,2017,88,Mladá fronta,dětské,české</p>,,"Jazyk: český
Počet stran: 88
Rok vydání: 2017
Vazba / Podoba: Brožovaná bez přebalu lesklá
Sortiment: 
Nakladatelství: MLADÁ FRONTA, a.s.",129,199,"['Mladá fronta, dětské', '', 'české']"
