db_id,name,rating,reviews_cnt,year,pages_cnt,publisher,genre,author,lang,description,price_from,price_to,unparsed
n335884774,Umělecká Paříž,95,1,2015,368,Nakladatelství Lidové noviny,naučná,české</p>,,"Druhé přepracované a rozšířené vydání znovu provází čtenáře francouzskou metropolí, místy spojenými s osudy tvůrců uměleckých děl z celého světa i avantgard, které změnily...",221,303,"['Nakladatelství Lidové noviny, naučná', '', 'české']"
n317542860,Zámecké interiéry - Eva Lukášová,90,1,2015,352,Nakladatelství Lidové noviny,naučná,české</p>,,"Velká aristokratická sídla, hrady a zámky se zachovanými původními interiéry mohou ve zvlášť výjimečných případech umožnit do minulosti téměř vstoupit…

 Mezi aristokratickými...",291,439,"['Nakladatelství Lidové noviny, naučná', '', 'české']"
n340475147,Německá vlastní jména v češtině - Jana Matúšová,0,0,2015,320,Nakladatelství Lidové noviny,naučná,české</p>,,"Vlastní jména německého původu jsou pevnou součástí dnešní slovní zásoby češtiny a svědky historických kontaktů Čechů a Němců na našem území.

 Ve třech oddílech knihy jsou...",218,329,"['Nakladatelství Lidové noviny, naučná', '', 'české']"
n247879342,Radost z jazyků,0,0,2015,416,Nakladatelství Lidové noviny,naučná,české</p>,,"Sborník obsahuje příspěvky zabývající se lexikologií, frazeologií, korpusovou lingvistikou, ale také jazykovou kulturou či morfologií, čímž reflektuje košatost vědecké...",214,269,"['Nakladatelství Lidové noviny, naučná', '', 'české']"
