db_id,name,rating,reviews_cnt,year,pages_cnt,publisher,genre,author,lang,description,price_from,price_to,unparsed
n64853792,Vodnické pohádky - Jaromír Sypal,0,0,2012,152,Nakladatelství BRÁNA,dětské,české</p>,,"Líbeznou krajinu nedaleko jihočeské metropole zdobí hladiny mnoha vodních ploch.
Jaromíru Sypalovi učarovala přírodní rezervace Vrbenské rybníky.
Tam, u rybníka Černiše,...",209,299,"['Nakladatelství BRÁNA, dětské', '', 'české']"
n48053296,Pohádky skřítků Medovníčka a Barvínka,94,11,2012,144,Nakladatelství BRÁNA,dětské,české</p>,,"Milé děti, skřítka Medovníčka z chaloupky pod vysokým dubem už dobře znáte z předchozích knížek Pohádky skřítka Medovníčka a Nové pohádky skřítka Medovníčka. Ten má rád všechna...",147,249,"['Nakladatelství BRÁNA, dětské', '', 'české']"
n259843677,"O Hopsálkovi, Jiskřičce a Meluzínce Kniha - Vorlíčková Irena",80,1,2012,112,Nakladatelství BRÁNA,dětské,české</p>,,"Pohádkové postavičky, ohnivý panáček Hopsálek a jeho ohnivá kamarádka Jiskřička mají neobyčejné vlastnosti. Dokážou se jako uhlíček nebo jiskra zmenšovat či zvětšovat až do...",79,79,"['Nakladatelství BRÁNA, dětské', '', 'české']"
n69998540,Čarodějnice Hrubena a tři tajtrdlíci Jindřiška Ptáčková,100,1,2012,144,Nakladatelství BRÁNA,dětské,české</p>,,"Čarodějnice Hrubena těžce nese, že ji ve vesnici, kde žije, nikdo nebere vážně a nevěří jejímu čarodějnictví. Se svým kamarádem čertem se proto rozhodne probudit tři zlé...",104,149,"['Nakladatelství BRÁNA, dětské', '', 'české']"
n64396508,Pohádky z babiččina kufříku,0,0,2012,144,Nakladatelství BRÁNA,dětské,české</p>,,"V domku u lesa bydlí šestiletý Jeremiáš spolu s maminkou, tatínkem, bráškou, sestrou a babičkou. Jednou rodina vyrazí na výlet do zoologické zahrady, ale Jeremiáš musí zůstat...",142,161,"['Nakladatelství BRÁNA, dětské', '', 'české']"
