db_id,name,rating,reviews_cnt,year,pages_cnt,publisher,genre,author,lang,description,price_from,price_to,unparsed
n46399841,Trhlina ve stvoření světa,93,1,2012,304,Argo,naučná,české</p>,,"Tato kniha byla napsána pro každého, koho zajímá, jak podivuhodné vědecké objevy ovlivňují náš pohled na svět a pomáhají utvářet naši kulturu.

 Shrnuje úžasné vědecké poznatky...",238,350,"['Argo, naučná', '', 'české']"
n44553134,Kontaktní rodičovství,89,8,2012,290,Argo,naučná,české</p>,,"Kontaktní rodičovství je výchovná metoda, která navrací děti do náručí (a postelí) rodičů, pomáhá maminkám najít cestu k vlastnímu mateřství a zvládnout s otevřenou myslí...",261,328,"['Argo, naučná', '', 'české']"
n40459099,"Lidé meče, modlitby a práce - Wojcziech Iwanczak",0,0,2012,240,Argo,naučná,české</p>,,"Polský historik, známý v českém prostředí knihou o české šlechtické kultuře pozdního středověku (Po stopách rytířských příběhů) zasvěceným způsobem zkoumá podobu učení o trojím...",209,298,"['Argo, naučná', '', 'české']"
n40459100,"Ráj, peklo a očistec ve středověkých viděních (",0,0,2012,282,Argo,naučná,české</p>,,"vydáno 6.1.2012  Výbor latinských středověkých visiones, tj. vidění, zahrnuje okolo dvaceti nejznámějších textů, mezi nimi např. Thurkillovo, Dryhthelmovo, Fursovo či Barontovo...",290,333,"['Argo, naučná', '', 'české']"
n259843945,Diví lidé v imaginaci pozdního středověku Kniha Šmahel František,0,0,2012,304,Argo,naučná,české</p>,,Tato vizuálně pojatá poublikace předního českého medievisty je věnována imaginárním divým lidem v reálném středověkém světě. Vydání knihy podpořilo hlavní město...,339,598,"['Argo, naučná', '', 'české']"
n47562706,Strom noci a jiné povídky/A Tree of Night and Other Stories - Truman Capote,0,0,2012,276,Argo,naučná,české</p>,,"Strom noci a jiné povídky/A Tree of Night and Other Stories kniha od autora Truman Capote. Bilingvní vydání povídkové knihy známého amerického prozaika a esejisty, jenž se...",169,298,"['Argo, naučná', '', 'české']"
