db_id,name,rating,reviews_cnt,year,pages_cnt,publisher,genre,author,lang,description,price_from,price_to,unparsed
n229753709,Nejdůležitější konkureční VÝHODA - Patrick Lencioni,0,0,2014,204,Libri,naučná,české</p>,,"„Jediné největší výhody, které firma může dosáhnout, je zdraví organizace. A přece ho většina lídrů ignoruje, i když je to tak jednoduché, zadarmo a k dispozici každému, kdo ho...",254,360,"['Libri, naučná', '', 'české']"
n182421474,Podkarpatská Rus,0,0,2014,192,Libri,naučná,české</p>,,"Zakarpatská oblast Ukrajiny - to je dnešní oficiální název tohoto území jež bylo na krátkou dobu i součástí Československa.
Knížka popisuje dějiny této překrásné a zároveň v...",119,195,"['Libri, naučná', '', 'české']"
n217818361,"Encyklopedie českých a moravských pomocných (světících) biskupů Milan Buben, Pavel R. Pokorný",0,0,2014,224,Libri,naučná,české</p>,,"Kniha obsahuje medailonky jednotlivých světících biskupů s jejich životopisem, popisem jejich církevní kariéry a hodnocením jejich významu v oblasti duchovní, kulturní a...",136,190,"['Libri, naučná', '', 'české']"
n207760640,Pražské hřbitovy - Olšanské hřbitovy V. /1. díl - Miloš Szabo,0,0,2014,232,Libri,naučná,české</p>,,"Pražské hřbitovy - Olšanské hřbitovy V. 1. díl

Pátý díl velké řady o pražských hřbitovech mapuje pátý sektor Olšanských hřbitovů. Obsahuje medailonky a osobní údaje známých i...",201,290,"['Libri, naučná', '', 'české']"
n259847542,Novotný Lukáš: Spolková republika Německo Kniha,0,0,2014,200,Libri,naučná,české</p>,,"Kniha se zabývá dějinami státu od jeho založení v roce 1949, přes sjednocení Německa v roce 1990 až do současnosti. 
Autor popisuje jak politický systém a ekonomiku země, tak...",136,190,"['Libri, naučná', '', 'české']"
