db_id,name,rating,reviews_cnt,year,pages_cnt,publisher,genre,author,lang,description,price_from,price_to,unparsed
n221492427,Cesta životem,96,1,2014,392,Portál,naučná,české</p>,,"Průběh lidského života jako celek, od mateřského lůna až po smrt.
Publikace obsahuje dlouhý a složitý příběh lidského života a autor jej vypráví s co největším využitím...",397,497,"['Portál, naučná', '', 'české']"
n176613273,Kvalitativní výzkum v pedagogických vědách,97,4,2014,384,Portál,naučná,české</p>,,"Praktická příručka provází čtenáře výzkumem od prvního nápadu až k sepsání výzkumné zprávy.

 První část věnuje autor základním metodologickým otázkám kvalitativního výzkumu, v...",327,509,"['Portál, naučná', '', 'české']"
n200390081,Vybrané spisy C. G. Junga,98,4,2014,360,Portál,naučná,české</p>,,"V Jungově díle se nachází centrální pojetí tvořivé dimenze, stávání se a rozvoje, jež je vlastní každé existenci. Má-li člověk přístup k této tvořivé dimenzi, může docházet k...",359,449,"['Portál, naučná', '', 'české']"
n176613275,Temné noci duše,88,2,2014,344,Portál,naučná,české</p>,,"Temná noc duše není psychologický syndrom, nýbrž označením hledání smyslu v nejtemnějších hodinách našeho života   při ztrátě milované osoby, v okamžicích rozpadu vztahu, v...",349,437,"['Portál, naučná', '', 'české']"
n210880432,Psychologie ve školní praxi,100,0,2014,384,Portál,naučná,české</p>,,"Přehled poznatků moderní psychologie, které mají vztah k problémům vzdělávání a výchovy. 
Informace jsou předkládány srozumitelně a jsou vždy spojeny s aplikací na praktické...",348,435,"['Portál, naučná', '', 'české']"
n157128074,Prázdná kolébka,0,0,2014,440,Portál,naučná,české</p>,,"Každá druhá až třetí žena v České republice během svého života prodělá potrat. Zármutek, pocit ztráty a prázdnoty, výčitky z nenaplnění ženské role, úzkost a obavy, zda vůbec...",279,349,"['Portál, naučná', '', 'české']"
n351527660,Statistika v aplikacích - Hendl Jan,0,0,2014,440,Portál,naučná,české</p>,,Publikace navazuje na Přehled statistických metod od Jana Hendla a ukazuje na široké využití statistiky a statistických metod v různých oborech a oblastech lidského života....,438,637,"['Portál, naučná', '', 'české']"
