db_id,name,rating,reviews_cnt,year,pages_cnt,publisher,genre,author,lang,description,price_from,price_to,unparsed
n371809276,Veselé tropy Amazonie - Mnislav Zelený-Atapana,100,2,2016,304,Argo,naučná,české</p>,,Velká obrazová publikace známého českého kulturního antropologa vám přiblíží skrytý a tajemný život indiánů největšího pralesa na světě. Prostřednictvím autorova živého...,421,598,"['Argo, naučná', '', 'české']"
n446326045,Chalupy v Čechách na historických stavebních plánech II. - Jiří Škabrada,0,0,2016,248,Argo,naučná,české</p>,,Existence původních plánů pro historické vesnické stavby - tedy projektů pro lidovou architekturu - byla donedávna prakticky neznámá. Pro zájemce o studium historické...,421,598,"['Argo, naučná', '', 'české']"
n494825885,Jóga mysli - André Van Lysebeth,100,1,2016,264,Argo,naučná,české</p>,,"Sedmá kniha André Van Lysebetha se zaměřuje na lidskou mysl. Autor nás v ní seznamuje s takzvanými „mentálními obrazy“, které jsou klíčem k meditaci, umožňující nám lépe čelit...",268,268,"['Argo, naučná', '', 'české']"
n432592502,Soupis staročeských exempel - Karel Dvořák,0,0,2016,296,Argo,naučná,české</p>,,Karel Dvořák vydal svůj soupis exempel - vyprávění mnoha žánrů používaných středověkými kazateli jako názorné ilustrace jejich kázání - již r. 1978. V 80. letech se však ke své...,188,241,"['Argo, naučná', '', 'české']"
n473658782,Číst Václava Havla - David Danaher,0,0,2016,288,Argo,naučná,české</p>,,"David Danaher patří k nejuznávanějším americkým slavistům mladší generace. Jeho monografie o literárním díle Václava Havla, nazvaná Číst Václava Havla (Reading Václav Havel),...",209,298,"['Argo, naučná', '', 'české']"
