db_id,name,rating,reviews_cnt,year,pages_cnt,publisher,genre,author,lang,description,price_from,price_to,unparsed
n179244339,Naše paní z Kibeho - Panna Maria promlouvá ke světu,100,4,2014,192,Triton,beletrie,české</p>,,"Formát: A5
Počet stran: 192

Kniha vypráví fascinující příběh sedmi dívek a chlapce, jimž se v 80. letech v maličké rwandské vesnici Kibeho zjevovala Panna Maria. Objevení se...",153,199,"['Triton, beletrie', '', 'české']"
n274417014,Ďábel nemá matku Nicky Cruz,98,3,2014,216,Triton,beletrie,české</p>,,"„Ten chlápek nemá matku“ je staré španělské rčení, které se říká o klucích, kteří projevují sklony k ničemnostem a destrukci. Dobře si ho pamatuji ze svého dětství na...",124,199,"['Triton, beletrie', '', 'české']"
n259850964,"Pohřbený zaživa - Richard Marsch, Jeff Hudson",0,0,2014,232,Triton,beletrie,české</p>,,"V květnu 2009 postihla Richarda Marshe, policistu z Napa Valley v Kalifornii, cévní mozková příhoda („mrtvice“), po které se stal obětí syndromu uzamčení (locked-in syndrome,...",172,269,"['Triton, beletrie', '', 'české']"
n183029485,"Chlapec, který se setkal s Ježíšem",98,4,2014,208,Triton,beletrie,české</p>,,"Autor : Immaculée Ilibagiza, Steve Erwin, Popis : 
 Immaculée Ilibagiza , rwandská spisovatelka žijící ve Spojených státech, držitelka čestného doktorátu od University of Notre...",159,159,"['Triton, beletrie', '', 'české']"
