db_id,name,rating,reviews_cnt,year,pages_cnt,publisher,genre,author,lang,description,price_from,price_to,unparsed
n93654457,"Pojetí vlastního těla - Ludmila Fialová, František David Krch",0,0,2013,280,Karolinum,naučná,české</p>,,"Tato monografie popisuje teoretická východiska k problematice tělesného sebepojetí a přináší také výsledky výzkumů realizovaných pracovišti obou autorů (tělesné já adolescentů,...",163,310,"['Karolinum, naučná', '', 'české']"
n701114344,Mistr Třeboňského oltáře - Jan Royt,0,0,2013,292,Karolinum,naučná,české</p>,,Mistr Třeboňského oltáře je jednou z nejvýznamnějších uměleckých osobností gotického malířství internacionálního stylu v evropském kontextu. V odborné literatuře české i...,475,620,"['Karolinum, naučná', '', 'české']"
n458811638,Nebojte se češtiny,0,0,2013,318,Karolinum,naučná,české</p>,,"Učebnice Nebojte se češtiny vychází z běžně mluveného jazyka a je určena všem zahraničním studentům, kteří si chtějí nejen zdokonalit svou češtinu, ale zároveň se chtějí...",226,280,"['Karolinum, naučná', '', 'české']"
n106880566,"Historické vědomí obyvatel České republiky perspektivou sociologického výzkumu - Jiří Šubrt, Jiří Vinopal a kolektív",100,1,2013,258,Karolinum,naučná,české</p>,,Kniha otevírá nový pohled na zkoumání vztahu lidí k dějinám a jejich představ o minulosti. Historické vědomí je zde sociologickou perspektivou prezentováno nejen jako látka pro...,173,270,"['Karolinum, naučná', '', 'české']"
n129271629,Počátky avignonského papežství a české země Hledíková Zdeňka,0,0,2013,298,Karolinum,naučná,české</p>,,Na pozadí stavebního růstu papežského paláce i města ve středověkém Avignonu sleduje kniha uspořádání a provoz kuriálního centra a současně vztahy papežství se zeměmi českého...,235,275,"['Karolinum, naučná', '', 'české']"
n91200380,Vývoj českého studia veřejných politik v evropském kontextu - Vilém Novotný,0,0,2013,278,Karolinum,naučná,české</p>,,"Autor považuje studium veřejných politik za specifickou subdisciplínu politických věd, kterou charakterizují všechny přístupy věnující se zkoumání veřejných politik. Jeho...",205,290,"['Karolinum, naučná', '', 'české']"
n83932522,"Krizové řízení v ČR na počátku 21.století Vilášek Josef, Fus Jan",0,0,2013,266,Karolinum,naučná,české</p>,,"Monografie se soustředí na oblast krizového řízení, která je v České republice legislativně ukotvena; vychází z potřeby přípravy obyvatelstva České republiky jak na nevojenské,...",234,260,"['Karolinum, naučná', '', 'české']"
n681118410,"Gordon Matthew, Milroy Lesley - Sociolingvistika -- Metody a interpretace",0,0,2013,270,Karolinum,naučná,české</p>,,Kniha Lesley Milroyové a Matthewa Gordona je úvodem do problematiky variační sociolingvistiky. Její předností oproti jiným úvodovým sociolingvistickým publikacím je umné...,235,305,"['Karolinum, naučná', '', 'české']"
