db_id,name,rating,reviews_cnt,year,pages_cnt,publisher,genre,author,lang,description,price_from,price_to,unparsed
n344802339,Léčivé a kouzelné byliny mezi dveřmi a brankou,100,1,2015,190,Fontána,naučná,české</p>,,"Už odedávna věděli opravdoví znalci léčivých bylin, že i ty nejprostší a nejobyčejnější byliny mají svou cenu a že dlaň naplněná těmito bylinami postačí k vyléčení veškerých...",241,324,"['Fontána, naučná', '', 'české']"
n347920808,Jarmila Riegerová: Učebnice reiki - ANTIKVARIAT,0,0,2015,192,Fontána,naučná,české</p>,,Jarmila Riegrová. Představujeme Vám knihu o novém životním pohledu na učení Reiki. Reiki je japonským výrazem pro univerzální životní energii ve své podstatě představuje plnou...,202,268,"['Fontána, naučná', '', 'české']"
n202423583,Jak odstranit potíže s trávením,65,2,2015,222,Fontána,naučná,české</p>,,"Znáte to: když vám něco nevoní, zvedá se vám žaludek. Když mátebobky, pohrává si s vámi strach a dost možná jste už v nějaké dramatické situaci měli plné kalhoty Lidová rčení...",191,298,"['Fontána, naučná', '', 'české']"
n305782784,Transformační síla půstu,0,0,2015,206,Fontána,naučná,české</p>,,"Seznamte se s metodami půstu, jež vám umožní znovu se spojit s posvátnem, uvědomit si smysl svého života a uzdravit se fyzicky i duševně. Tato kniha

• podrobně uvádí, na co se...",236,368,"['Fontána, naučná', '', 'české']"
n281962085,Síla vnitřního klidu - Diana Cooper,100,1,2015,238,Fontána,naučná,české</p>,,"V této knize nabízí uznávaná duchovní spisovatelka Diana Cooper inspiraci všem, kdo hledají ve svém životě hlubší smysl a pocit štěstí. Díky praktickým radám a konkrétním...",230,358,"['Fontána, naučná', '', 'české']"
n337307395,Dobro a zlo – Bezděk Ctibor,100,2,2015,220,Fontána,naučná,české</p>,,Ctibor Bezděk. O podstatě zla a o boji se zlem. V první části se MUDr. Ctibor Bezděk zabývá relativností zla a jeho podstatu spatřuje v nesprávném poměru člověka k Bohu a k...,210,328,"['Fontána, naučná', '', 'české']"
