db_id,name,rating,reviews_cnt,year,pages_cnt,publisher,genre,author,lang,description,price_from,price_to,unparsed
n334636788,Matné zlato,100,4,2016,352,Moba,beletrie,Andrewsová Virginia C.</p>,,"V poslední části slavné románové ságy se přeneseme na samý počátek dramatických událostí, do doby mládí Gabrielle Landryové – matky Paula a dvojčat Ruby a Gisselle. Život...",203,299,"['Moba, beletrie', '', 'české, Andrewsová Virginia C.']"
n455311410,Falešný třpyt - Andrewsová Virginia Cleo,100,2,2016,360,Moba,beletrie,Andrewsová Virginia Cleo</p>,,"Ruby se nečekaně vrací zpět do jižní Louisiany, do důvěrně známých míst, kde prožila dětství. Porodí dcerku a snaží se ji vychovávat. Touha zajistit malé Pearl šťastné,...",76,299,"['Moba, beletrie', '', 'české, Andrewsová Virginia Cleo']"
n334129636,Utajený drahokam,100,1,2016,336,Moba,beletrie,Andrewsová Virginia Cleo</p>,,"Po absurdních soudních tahanicích, které musela Ruby absolvovat, aby mohla vychovávat svou dcerku, vyrůstá Pearl i se svými dvěma bratry ve šťastné rodině. Střední školu...",76,299,"['Moba, beletrie', '', 'české, Andrewsová Virginia Cleo']"
n402241081,Letopisy královské komory V. - Vlastimil Vondruška,100,6,2016,320,Moba,beletrie,Vlastimil Vondruška</p>,,Dva příběhy písaře královské komory Jiřího Adama z Dobronína se odehrávají v polovině 16. století. Poslední cantilena zavádí královského písaře mezi bratrstvo chrámových...,216,319,"['Moba, beletrie', '', 'české, Vlastimil Vondruška']"
n334604447,Dlouhá cesta,98,4,2016,336,Moba,beletrie,Hana Marie Körnerová</p>,,"V září 1793 ovládli Francii jakobíni a jejich téměř roční soupeření o moc s girondisty vyvolalo novou vlnu poprav. Pod gilotinou skončilo téměř dvacet tisíc lidí.
Horší dobu k...",197,289,"['Moba, beletrie', '', 'české, Hana Marie Körnerová']"
n369180260,Prokletí brněnských řeholníků - Vlastimil Vondruška,100,1,2016,332,Moba,beletrie,Vondruška Vlastimil</p>,,"Jedním z osobních nepřátel Oldřicha z Chlumu byl olomoucký biskup Bruno ze Schauenburku. Proto správce Bezdězu nesmírně překvapí, když biskup požádá krále Přemysla II. Otakara,...",218,319,"['Moba, beletrie', '', 'české, Vondruška Vlastimil']"
n356939126,Apage Satanas!. Hříšní lidé Království českého - Vlastimil Vondruška - MOBA,97,3,2016,336,Moba,beletrie,Vlastimil Vondruška</p>,,"Přítelkyni Ludmily z Vartemberka trápí podivné sny. V pitoreskním reji se jí zjevuje dílna obklopená skálami a démon, který se necudně zmocňuje jejího těla. Její otec povolá...",239,319,"['Moba, beletrie', '', 'české, Vlastimil Vondruška']"
n334636787,Hříšná světice,90,2,2016,336,Moba,beletrie,Bauer Jan</p>,,"O počátcích českého státu toho víme pramálo, naše vědomosti se opírají jen o drobné zmínky ve starých kronikách a útržkovité archeologické nálezy, které připouštějí různý...",204,299,"['Moba, beletrie', '', 'české, Bauer Jan']"
n386428755,"Moravská Bastei MOBA, s. r. o. Střípky ticha",100,1,2016,320,Moba,beletrie,Castillo Linda</p>,,"Slabaughovi jsou přímo vzorová rodina amišských farmářů, tvrdě pracují, mají čtyři děti a se širokým příbuzenstvem skvěle vycházejí. Idylka skončí, když jedno z jejich dětí...",329,330,"['Moba, beletrie', '', 'české, Castillo Linda']"
n408005989,Nezlomná - Lesley Pearse,80,1,2016,456,Moba,beletrie,Lesley Pearse</p>,,"Belle Reillyové je teprve dvacet let, přesto toho má už mnoho za sebou - únos, znásilnění, prodej do nevěstince. Ačkoli se musela stát prostitutkou, nenechala se zlomit a...",254,305,"['Moba, beletrie', '', 'české, Lesley Pearse']"
n334129625,Poslední modlitba,95,2,2016,328,Moba,beletrie,Veronika Černucká</p>,,"Třenovský klášter slaví 900 let svého vzniku. Jeden z pozvaných novinářů je v noci brutálně zavražděn a další vraždy na sebe nenechají dlouho čekat. Tara netuší, kdo je jejím...",177,214,"['Moba, beletrie', '', 'české, Veronika Černucká']"
n464213328,Černooká blondýnka - Benjamin Black,0,0,2016,344,Moba,beletrie,Benjamin Black</p>,,"Autor : Benjamin Black, Popis : 
 „Bylo jedno z těch úterních letních odpolední, kdy si začínáte říkat, jestli se Země nepřestala otáčet. Telefon na stole vypadal jako někdo,...",207,329,"['Moba, beletrie', '', 'české, Benjamin Black']"
n685251145,Černý anděl - Kjell Ola Dahl,0,0,2016,368,Moba,beletrie,Kjell Ola Dahl</p>,,"Detektiv šéfinspektor Gunnarstranda vede vyšetřování případu policisty Ivara Killiho, který byl v civilu zastřelen. Při zběžné obhlídce jeho bytu najde fotoaparát a v něm...",89,271,"['Moba, beletrie', '', 'české, Kjell Ola Dahl']"
n385243015,"Moravská Bastei MOBA, s. r. o. 12.12.",0,0,2016,384,Moba,beletrie,Vítězslav Jareš</p>,,"Kapitán Karel Krol vyšetřuje hromadnou vraždu skupiny mladých rebelantských malířek, které si říkají Wild graffiti. Jak tento masakr souvisí s incidentem, jenž se odehrál na...",204,299,"['Moba, beletrie', '', 'české, Vítězslav Jareš']"
n387877688,Svině - Carl-Johan Vallgren,0,0,2016,368,Moba,beletrie,Carl-Johan Vallgren</p>,,"Zločinec Jorma Hedlund se nechá zlákat na svou poslední akci - tip na transport cenin je příležitostí, kterou si nemůže nechat ujít. Jenže loupež se strašlivě zvrtne a z Jormy...",254,339,"['Moba, beletrie', '', 'české, Carl-Johan Vallgren']"
n387163614,Vor v zákoně,0,0,2016,384,Moba,beletrie,Vítězslav Jareš</p>,,V Praze se schyluje k válce mezi znepřátelenými skupinami ruskojazyčné mafie. Důstojník kapitán Karel Krol z Útvaru pro odhalování organizovaného zločinu přitom přijde o kolegu...,204,299,"['Moba, beletrie', '', 'české, Vítězslav Jareš']"
n334636786,Červený mustang se nevrátil,0,0,2016,320,Moba,beletrie,Jedlička I. M.</p>,,"Kniha nejzajímavějších kriminálních případů z celé republiky, jež známému českému autorovi vyprávěli sami detektivové, kteří jednotlivé kauzy vyšetřovali a pachatele...",183,269,"['Moba, beletrie', '', 'české, Jedlička I. M.']"
n707609970,Sklep - Janoušek Artur,0,0,2016,384,Moba,beletrie,Artur Janoušek</p>,,"Vazební věznice. Rozhovor dvou mužů, vraha a novináře. Vrah líčí, jak mu kdosi unesl dítě a zabil ho, on únosce následně vypátral a pomstil se. Realita je však jiná – smrt syna...",197,289,"['Moba, beletrie', '', 'české, Artur Janoušek']"
n334636783,Dravec,0,0,2016,376,Moba,beletrie,František Uher</p>,,"S nálezem mrtvého těla mladé dívky se krásný den mění v noční můru. Vyšetřování se ujímají tři králové, jak kolegové říkají krimi nálním inspektorům Čemusovi, Plevákovi a...",197,260,"['Moba, beletrie', '', 'české, František Uher']"
